record_id,policy_id,entry_type,update_type,update_level,update_level_var,description,date_announced,date_start,date_end,date_end_spec,country,ISO_A3,ISO_A2,init_country_level,domestic_policy,province,ISO_L2,city,type,type_sub_cat,type_new_admin_coop,type_vac_cat,type_vac_mix,type_vac_reg,type_vac_purchase,type_vac_group,type_vac_group_rank,type_vac_who_pays,type_vac_dist_admin,type_vac_loc,type_vac_cost_num,type_vac_cost_scale,type_vac_cost_unit,type_vac_cost_gov_perc,type_vac_amt_num,type_vac_amt_scale,type_vac_amt_unit,type_vac_amt_gov_perc,type_text,institution_cat,institution_status,institution_conditions,target_init_same,target_country,target_geog_level,target_region,target_province,target_city,target_intl_org,target_other,target_who_what,target_who_gen,target_direction,travel_mechanism,compliance,enforcer,dist_index_high_est,dist_index_med_est,dist_index_low_est,dist_index_country_rank,pdf_link,link,date_updated,recorded_date,confirmed_cases,deaths,recovered,new_tests,total_tests,total_tests_per_thousand,tests_units,total_vaccinations,daily_vaccinations,total_vaccinations_per_hundred,daily_vaccinations_per_million,Rank_FP,Score_FP,muni_IDC,dispersive_IDC,constraining_IDC,sfi_SFI,ti_cpi_TI,pop_WDI_PW,gdp_WDI_PW,growth_WDI_PW,lnpop_WDI_PW,lngdp_WDI_PW,disap_FA,polpris_FA,latentmean_FA,transparencyindex_HR,EmigrantStock_EMS
R_1poigqBURR84cnmNA,408728,new_entry,,,"","In Paraguay, on March 14, 2020, National Liaison Center activates free phone line 154, for attention and consultations to provide information on COVID-19 or to report symptoms, such as dry cough, fever and runny nose.",2020-03-14,2020-03-14,,The policy’s end date is unknown or unreported,Paraguay,PRY,PY,National,1,,,,Anti-Disinformation Measures,,,"",,,,,,"","","","","","","","","","","",,,,"",Yes,Paraguay,"One or more countries, but not all countries",,,,,,All Residents (Citizen Residents + Foreign Residents),No special population targeted,,,Voluntary/Recommended but No Penalties,"National Government,Ministry/Department of Health",,,,,https://tummgmt.eu.qualtrics.com/Q/File.php?F=F_2312iNSzKqZWVzB,https://www.mspbs.gov.py/covid-19-actualizacion.php,2021-07-16,2021-07-16T09:56:32Z,7,0,0,15,54,0.007,,,,,,100,32.9,2,0.961252152919769,0.823284327983856,9,29,6867062,36207104850.3802,4.95805142159847,15.74224691625,24.3125212031055,2,2,0.597955494226369,1.50005723202781,156462
R_30ioYqFfwJexJR1El,5400177El,new_entry,,,"","Paraguay, March 10th, Paraguay suspends educational activities at all levels for 15 days.  
",2020-03-10,2020-03-10,,The policy has a clear end date,Paraguay,PRY,PY,National,1,,,,Closure and Regulation of Schools,Preschool or childcare facilities (generally for children ages 5 and below),,"",,,,,,"","","","","","","","","","","",,,,"",,Paraguay,,,,,,,All Residents (Citizen Residents + Foreign Residents),,,,Mandatory (Unspecified/Implied),National Government,,,,,https://tummgmt.eu.qualtrics.com/Q/File.php?F=F_Q3R3wk9nVdhIIc9 ; https://tummgmt.eu.qualtrics.com/Q/File.php?F=F_ZdRwzkUmkwJ4IkV,NA ; https://www.mspbs.gov.py/que-esta-haciendo-el-ministerio-de-salud-covid19.html,2020-05-19,2020-05-19T21:06:48Z,5,0,0,,9,0.001,,,,,,100,32.9,2,0.961252152919769,0.823284327983856,9,29,6867062,36207104850.3802,4.95805142159847,15.74224691625,24.3125212031055,2,2,0.597955494226369,1.50005723202781,156462
R_30ioYqFfwJexJR1Em,5400177Em,new_entry,,,"","Paraguay, March 10th, Paraguay suspends educational activities at all levels for 15 days.  
",2020-03-10,2020-03-10,,The policy has a clear end date,Paraguay,PRY,PY,National,1,,,,Closure and Regulation of Schools,Primary Schools (generally for children ages 10 and below),,"",,,,,,"","","","","","","","","","","",,,,"",,Paraguay,,,,,,,All Residents (Citizen Residents + Foreign Residents),,,,Mandatory (Unspecified/Implied),National Government,,,,,https://tummgmt.eu.qualtrics.com/Q/File.php?F=F_Q3R3wk9nVdhIIc9 ; https://tummgmt.eu.qualtrics.com/Q/File.php?F=F_ZdRwzkUmkwJ4IkV,NA ; https://www.mspbs.gov.py/que-esta-haciendo-el-ministerio-de-salud-covid19.html,2020-05-19,2020-05-19T21:06:48Z,5,0,0,,9,0.001,,,,,,100,32.9,2,0.961252152919769,0.823284327983856,9,29,6867062,36207104850.3802,4.95805142159847,15.74224691625,24.3125212031055,2,2,0.597955494226369,1.50005723202781,156462
R_30ioYqFfwJexJR1Fw,5400177Fw,new_entry,,,"","Paraguay, March 10th, Paraguay suspends educational activities at all levels for 15 days.  
",2020-03-10,2020-03-10,,The policy has a clear end date,Paraguay,PRY,PY,National,1,,,,Closure and Regulation of Schools,Secondary Schools (generally for children ages 10 to 18),,"",,,,,,"","","","","","","","","","","",,,,"",,Paraguay,,,,,,,All Residents (Citizen Residents + Foreign Residents),,,,Mandatory (Unspecified/Implied),National Government,,,,,https://tummgmt.eu.qualtrics.com/Q/File.php?F=F_Q3R3wk9nVdhIIc9 ; https://tummgmt.eu.qualtrics.com/Q/File.php?F=F_ZdRwzkUmkwJ4IkV,NA ; https://www.mspbs.gov.py/que-esta-haciendo-el-ministerio-de-salud-covid19.html,2020-05-19,2020-05-19T21:06:48Z,5,0,0,,9,0.001,,,,,,100,32.9,2,0.961252152919769,0.823284327983856,9,29,6867062,36207104850.3802,4.95805142159847,15.74224691625,24.3125212031055,2,2,0.597955494226369,1.50005723202781,156462
R_30ioYqFfwJexJR1Ce,5400177Ce,new_entry,,,"","Paraguay, March 10th, Paraguay suspends educational activities at all levels for 15 days.  
",2020-03-10,2020-03-10,,The policy has a clear end date,Paraguay,PRY,PY,National,1,,,,Closure and Regulation of Schools,Higher education institutions (i.e. degree granting institutions),,"",,,,,,"","","","","","","","","","","",,,,"",,Paraguay,,,,,,,All Residents (Citizen Residents + Foreign Residents),,,,Mandatory (Unspecified/Implied),National Government,,,,,https://tummgmt.eu.qualtrics.com/Q/File.php?F=F_Q3R3wk9nVdhIIc9 ; https://tummgmt.eu.qualtrics.com/Q/File.php?F=F_ZdRwzkUmkwJ4IkV,NA ; https://www.mspbs.gov.py/que-esta-haciendo-el-ministerio-de-salud-covid19.html,2020-05-19,2020-05-19T21:06:48Z,5,0,0,,9,0.001,,,,,,100,32.9,2,0.961252152919769,0.823284327983856,9,29,6867062,36207104850.3802,4.95805142159847,15.74224691625,24.3125212031055,2,2,0.597955494226369,1.50005723202781,156462
R_2tyrBKJIOCSAXyrEl,8353867El,new_entry,,,"","On March 24, 2020, the Ministry of Education decided that private and subsidized private educational institutions will have to communicate to them how classes will be conducted during the pandemic.",2020-03-24,2020-03-24,,The policy’s end date is unknown or unreported,Paraguay,PRY,PY,National,1,,,,Closure and Regulation of Schools,Preschool or childcare facilities (generally for children ages 5 and below),,"",,,,,,"","","","","","","","","","","",,,Preschool or childcare facilities allowed to open with conditions,Full remote/distance learning (e.g. All teachers must tele-teach.),Yes,Paraguay,"One or more countries, but not all countries",,,,,,All Residents (Citizen Residents + Foreign Residents),No special population targeted,,,Mandatory (Unspecified/Implied),"National Government,Ministry/Department of Education",,,,,https://tummgmt.eu.qualtrics.com/Q/File.php?F=F_Y3K1qagc8W4LlHH,https://www.mec.gov.py/sigmec/resoluciones/349-2020-PETTA.pdf,2021-07-14,2021-07-14T15:00:31Z,37,3,0,91,525,0.073,,,,,,100,32.9,2,0.961252152919769,0.823284327983856,9,29,6867062,36207104850.3802,4.95805142159847,15.74224691625,24.3125212031055,2,2,0.597955494226369,1.50005723202781,156462
R_2tyrBKJIOCSAXyrEm,8353867Em,new_entry,,,"","On March 24, 2020, the Ministry of Education decided that private and subsidized private educational institutions will have to communicate to them how classes will be conducted during the pandemic.",2020-03-24,2020-03-24,,The policy’s end date is unknown or unreported,Paraguay,PRY,PY,National,1,,,,Closure and Regulation of Schools,Primary Schools (generally for children ages 10 and below),,"",,,,,,"","","","","","","","","","","",,,Primary Schools allowed to open with conditions,Full remote/distance learning (e.g. All teachers must tele-teach.),Yes,Paraguay,"One or more countries, but not all countries",,,,,,All Residents (Citizen Residents + Foreign Residents),No special population targeted,,,Mandatory (Unspecified/Implied),"National Government,Ministry/Department of Education",,,,,https://tummgmt.eu.qualtrics.com/Q/File.php?F=F_Y3K1qagc8W4LlHH,https://www.mec.gov.py/sigmec/resoluciones/349-2020-PETTA.pdf,2021-07-14,2021-07-14T15:00:31Z,37,3,0,91,525,0.073,,,,,,100,32.9,2,0.961252152919769,0.823284327983856,9,29,6867062,36207104850.3802,4.95805142159847,15.74224691625,24.3125212031055,2,2,0.597955494226369,1.50005723202781,156462
R_2tyrBKJIOCSAXyrFw,8353867Fw,new_entry,,,"","On March 24, 2020, the Ministry of Education decided that private and subsidized private educational institutions will have to communicate to them how classes will be conducted during the pandemic.",2020-03-24,2020-03-24,,The policy’s end date is unknown or unreported,Paraguay,PRY,PY,National,1,,,,Closure and Regulation of Schools,Secondary Schools (generally for children ages 10 to 18),,"",,,,,,"","","","","","","","","","","",,,Secondary Schools allowed to open with conditions,Full remote/distance learning (e.g. All teachers must tele-teach.),Yes,Paraguay,"One or more countries, but not all countries",,,,,,All Residents (Citizen Residents + Foreign Residents),No special population targeted,,,Mandatory (Unspecified/Implied),"National Government,Ministry/Department of Education",,,,,https://tummgmt.eu.qualtrics.com/Q/File.php?F=F_Y3K1qagc8W4LlHH,https://www.mec.gov.py/sigmec/resoluciones/349-2020-PETTA.pdf,2021-07-14,2021-07-14T15:00:31Z,37,3,0,91,525,0.073,,,,,,100,32.9,2,0.961252152919769,0.823284327983856,9,29,6867062,36207104850.3802,4.95805142159847,15.74224691625,24.3125212031055,2,2,0.597955494226369,1.50005723202781,156462
R_2tyrBKJIOCSAXyrCe,8353867Ce,new_entry,,,"","On March 24, 2020, the Ministry of Education decided that private and subsidized private educational institutions will have to communicate to them how classes will be conducted during the pandemic.",2020-03-24,2020-03-24,,The policy’s end date is unknown or unreported,Paraguay,PRY,PY,National,1,,,,Closure and Regulation of Schools,Higher education institutions (i.e. degree granting institutions),,"",,,,,,"","","","","","","","","","","",,,Higher education institutions allowed to open with conditions,Full remote/distance learning (e.g. All teachers must tele-teach.),Yes,Paraguay,"One or more countries, but not all countries",,,,,,All Residents (Citizen Residents + Foreign Residents),No special population targeted,,,Mandatory (Unspecified/Implied),"National Government,Ministry/Department of Education",,,,,https://tummgmt.eu.qualtrics.com/Q/File.php?F=F_Y3K1qagc8W4LlHH,https://www.mec.gov.py/sigmec/resoluciones/349-2020-PETTA.pdf,2021-07-14,2021-07-14T15:00:31Z,37,3,0,91,525,0.073,,,,,,100,32.9,2,0.961252152919769,0.823284327983856,9,29,6867062,36207104850.3802,4.95805142159847,15.74224691625,24.3125212031055,2,2,0.597955494226369,1.50005723202781,156462
R_1gGboiJ2CUgAKdeEl,464347El,new_entry,,,"","Private and subsidized private educational institutions starting on March 24, 2020, can implement and apply technological or digital teaching tools as face-to-face school is still suspended.",2020-03-24,2020-03-24,,The policy’s end date is unknown or unreported,Paraguay,PRY,PY,National,1,,,,Closure and Regulation of Schools,Preschool or childcare facilities (generally for children ages 5 and below),,"",,,,,,"","","","","","","","","","","",,,Preschool or childcare facilities allowed to open with conditions,Full remote/distance learning (e.g. All teachers must tele-teach.),Yes,Paraguay,"One or more countries, but not all countries",,,,,,All Residents (Citizen Residents + Foreign Residents),No special population targeted,,,Voluntary/Recommended but No Penalties,"National Government,Ministry/Department of Education",,,,,https://tummgmt.eu.qualtrics.com/Q/File.php?F=F_1dz5chmLkd84qTg,https://www.mec.gov.py/sigmec/resoluciones/349-2020-PETTA.pdf,2021-07-16,2021-07-16T13:43:29Z,37,3,0,91,525,0.073,,,,,,100,32.9,2,0.961252152919769,0.823284327983856,9,29,6867062,36207104850.3802,4.95805142159847,15.74224691625,24.3125212031055,2,2,0.597955494226369,1.50005723202781,156462
R_1gGboiJ2CUgAKdeEm,464347Em,new_entry,,,"","Private and subsidized private educational institutions starting on March 24, 2020, can implement and apply technological or digital teaching tools as face-to-face school is still suspended.",2020-03-24,2020-03-24,,The policy’s end date is unknown or unreported,Paraguay,PRY,PY,National,1,,,,Closure and Regulation of Schools,Primary Schools (generally for children ages 10 and below),,"",,,,,,"","","","","","","","","","","",,,Primary Schools allowed to open with conditions,Full remote/distance learning (e.g. All teachers must tele-teach.),Yes,Paraguay,"One or more countries, but not all countries",,,,,,All Residents (Citizen Residents + Foreign Residents),No special population targeted,,,Voluntary/Recommended but No Penalties,"National Government,Ministry/Department of Education",,,,,https://tummgmt.eu.qualtrics.com/Q/File.php?F=F_1dz5chmLkd84qTg,https://www.mec.gov.py/sigmec/resoluciones/349-2020-PETTA.pdf,2021-07-16,2021-07-16T13:43:29Z,37,3,0,91,525,0.073,,,,,,100,32.9,2,0.961252152919769,0.823284327983856,9,29,6867062,36207104850.3802,4.95805142159847,15.74224691625,24.3125212031055,2,2,0.597955494226369,1.50005723202781,156462
R_1gGboiJ2CUgAKdeFw,464347Fw,new_entry,,,"","Private and subsidized private educational institutions starting on March 24, 2020, can implement and apply technological or digital teaching tools as face-to-face school is still suspended.",2020-03-24,2020-03-24,,The policy’s end date is unknown or unreported,Paraguay,PRY,PY,National,1,,,,Closure and Regulation of Schools,Secondary Schools (generally for children ages 10 to 18),,"",,,,,,"","","","","","","","","","","",,,Secondary Schools allowed to open with conditions,Full remote/distance learning (e.g. All teachers must tele-teach.),Yes,Paraguay,"One or more countries, but not all countries",,,,,,All Residents (Citizen Residents + Foreign Residents),No special population targeted,,,Voluntary/Recommended but No Penalties,"National Government,Ministry/Department of Education",,,,,https://tummgmt.eu.qualtrics.com/Q/File.php?F=F_1dz5chmLkd84qTg,https://www.mec.gov.py/sigmec/resoluciones/349-2020-PETTA.pdf,2021-07-16,2021-07-16T13:43:29Z,37,3,0,91,525,0.073,,,,,,100,32.9,2,0.961252152919769,0.823284327983856,9,29,6867062,36207104850.3802,4.95805142159847,15.74224691625,24.3125212031055,2,2,0.597955494226369,1.50005723202781,156462
R_1gGboiJ2CUgAKdeCe,464347Ce,new_entry,,,"","Private and subsidized private educational institutions starting on March 24, 2020, can implement and apply technological or digital teaching tools as face-to-face school is still suspended.",2020-03-24,2020-03-24,,The policy’s end date is unknown or unreported,Paraguay,PRY,PY,National,1,,,,Closure and Regulation of Schools,Higher education institutions (i.e. degree granting institutions),,"",,,,,,"","","","","","","","","","","",,,Higher education institutions allowed to open with conditions,Full remote/distance learning (e.g. All teachers must tele-teach.),Yes,Paraguay,"One or more countries, but not all countries",,,,,,All Residents (Citizen Residents + Foreign Residents),No special population targeted,,,Voluntary/Recommended but No Penalties,"National Government,Ministry/Department of Education",,,,,https://tummgmt.eu.qualtrics.com/Q/File.php?F=F_1dz5chmLkd84qTg,https://www.mec.gov.py/sigmec/resoluciones/349-2020-PETTA.pdf,2021-07-16,2021-07-16T13:43:29Z,37,3,0,91,525,0.073,,,,,,100,32.9,2,0.961252152919769,0.823284327983856,9,29,6867062,36207104850.3802,4.95805142159847,15.74224691625,24.3125212031055,2,2,0.597955494226369,1.50005723202781,156462
R_QbmdYqeQdnLK9LbEl,464347El,update,End of Policy,,"","Private and subsidized private educational institutions starting on March 24, 2020, can implement and apply technological or digital teaching tools as face-to-face school is still suspended.  This policy ended on March 27, 2020. UPDATE: The Paraguayan government approved on 27/03/2020 the implementation of the digital platform called ""tu escuela en casa"" and it will be used by students from Kindergarten, middle school and high school. So it ends this policy.",2020-03-24,2020-03-24,2020-03-27,The policy has a clear end date,Paraguay,PRY,PY,National,1,,,,Closure and Regulation of Schools,Preschool or childcare facilities (generally for children ages 5 and below),,"",,,,,,"","","","","","","","","","","",,,Preschool or childcare facilities allowed to open with conditions,Full remote/distance learning (e.g. All teachers must tele-teach.),Yes,Paraguay,"One or more countries, but not all countries",,,,,,All Residents (Citizen Residents + Foreign Residents),No special population targeted,,,Voluntary/Recommended but No Penalties,"National Government,Ministry/Department of Education",,,,,https://tummgmt.eu.qualtrics.com/Q/File.php?F=F_1dz5chmLkd84qTg ; https://tummgmt.eu.qualtrics.com/Q/File.php?F=F_2pYmtl2eRHPk5A7,NA ; https://www.mec.gov.py/sigmec/resoluciones/358-2020-PETTA.pdf,2021-07-20,2021-07-20T08:56:06Z,37,3,0,91,525,0.073,,,,,,100,32.9,2,0.961252152919769,0.823284327983856,9,29,6867062,36207104850.3802,4.95805142159847,15.74224691625,24.3125212031055,2,2,0.597955494226369,1.50005723202781,156462
R_QbmdYqeQdnLK9LbEm,464347Em,update,End of Policy,,"","Private and subsidized private educational institutions starting on March 24, 2020, can implement and apply technological or digital teaching tools as face-to-face school is still suspended.  This policy ended on March 27, 2020. UPDATE: The Paraguayan government approved on 27/03/2020 the implementation of the digital platform called ""tu escuela en casa"" and it will be used by students from Kindergarten, middle school and high school. So it ends this policy.",2020-03-24,2020-03-24,2020-03-27,The policy has a clear end date,Paraguay,PRY,PY,National,1,,,,Closure and Regulation of Schools,Primary Schools (generally for children ages 10 and below),,"",,,,,,"","","","","","","","","","","",,,Primary Schools allowed to open with conditions,Full remote/distance learning (e.g. All teachers must tele-teach.),Yes,Paraguay,"One or more countries, but not all countries",,,,,,All Residents (Citizen Residents + Foreign Residents),No special population targeted,,,Voluntary/Recommended but No Penalties,"National Government,Ministry/Department of Education",,,,,https://tummgmt.eu.qualtrics.com/Q/File.php?F=F_1dz5chmLkd84qTg ; https://tummgmt.eu.qualtrics.com/Q/File.php?F=F_2pYmtl2eRHPk5A7,NA ; https://www.mec.gov.py/sigmec/resoluciones/358-2020-PETTA.pdf,2021-07-20,2021-07-20T08:56:06Z,37,3,0,91,525,0.073,,,,,,100,32.9,2,0.961252152919769,0.823284327983856,9,29,6867062,36207104850.3802,4.95805142159847,15.74224691625,24.3125212031055,2,2,0.597955494226369,1.50005723202781,156462
R_QbmdYqeQdnLK9LbFw,464347Fw,update,End of Policy,,"","Private and subsidized private educational institutions starting on March 24, 2020, can implement and apply technological or digital teaching tools as face-to-face school is still suspended.  This policy ended on March 27, 2020. UPDATE: The Paraguayan government approved on 27/03/2020 the implementation of the digital platform called ""tu escuela en casa"" and it will be used by students from Kindergarten, middle school and high school. So it ends this policy.",2020-03-24,2020-03-24,2020-03-27,The policy has a clear end date,Paraguay,PRY,PY,National,1,,,,Closure and Regulation of Schools,Secondary Schools (generally for children ages 10 to 18),,"",,,,,,"","","","","","","","","","","",,,Secondary Schools allowed to open with conditions,Full remote/distance learning (e.g. All teachers must tele-teach.),Yes,Paraguay,"One or more countries, but not all countries",,,,,,All Residents (Citizen Residents + Foreign Residents),No special population targeted,,,Voluntary/Recommended but No Penalties,"National Government,Ministry/Department of Education",,,,,https://tummgmt.eu.qualtrics.com/Q/File.php?F=F_1dz5chmLkd84qTg ; https://tummgmt.eu.qualtrics.com/Q/File.php?F=F_2pYmtl2eRHPk5A7,NA ; https://www.mec.gov.py/sigmec/resoluciones/358-2020-PETTA.pdf,2021-07-20,2021-07-20T08:56:06Z,37,3,0,91,525,0.073,,,,,,100,32.9,2,0.961252152919769,0.823284327983856,9,29,6867062,36207104850.3802,4.95805142159847,15.74224691625,24.3125212031055,2,2,0.597955494226369,1.50005723202781,156462
R_QbmdYqeQdnLK9LbCe,464347Ce,update,End of Policy,,"","Private and subsidized private educational institutions starting on March 24, 2020, can implement and apply technological or digital teaching tools as face-to-face school is still suspended.  This policy ended on March 27, 2020. UPDATE: The Paraguayan government approved on 27/03/2020 the implementation of the digital platform called ""tu escuela en casa"" and it will be used by students from Kindergarten, middle school and high school. So it ends this policy.",2020-03-24,2020-03-24,2020-03-27,The policy has a clear end date,Paraguay,PRY,PY,National,1,,,,Closure and Regulation of Schools,Higher education institutions (i.e. degree granting institutions),,"",,,,,,"","","","","","","","","","","",,,Higher education institutions allowed to open with conditions,Full remote/distance learning (e.g. All teachers must tele-teach.),Yes,Paraguay,"One or more countries, but not all countries",,,,,,All Residents (Citizen Residents + Foreign Residents),No special population targeted,,,Voluntary/Recommended but No Penalties,"National Government,Ministry/Department of Education",,,,,https://tummgmt.eu.qualtrics.com/Q/File.php?F=F_1dz5chmLkd84qTg ; https://tummgmt.eu.qualtrics.com/Q/File.php?F=F_2pYmtl2eRHPk5A7,NA ; https://www.mec.gov.py/sigmec/resoluciones/358-2020-PETTA.pdf,2021-07-20,2021-07-20T08:56:06Z,37,3,0,91,525,0.073,,,,,,100,32.9,2,0.961252152919769,0.823284327983856,9,29,6867062,36207104850.3802,4.95805142159847,15.74224691625,24.3125212031055,2,2,0.597955494226369,1.50005723202781,156462
R_1DIJnkguNZvZVVzEl,8353867El,update,End of Policy,,"","On March 24, 2020, the Ministry of Education decided that private and subsidized private educational institutions will have to communicate to them how classes will be conducted during the pandemic. This policy ended on March 27, 2020. UPDATE: The Paraguayan government approved on 27/03/2020 the implementation of the digital platform called ""tu escuela en casa"" and it will be used by students from Kindergarten, middle school and high school. Therefore, the policy ended on March 27, 2020.",2020-03-24,2020-03-24,2020-03-27,The policy has a clear end date,Paraguay,PRY,PY,National,1,,,,Closure and Regulation of Schools,Preschool or childcare facilities (generally for children ages 5 and below),,"",,,,,,"","","","","","","","","","","",,,Preschool or childcare facilities allowed to open with conditions,Full remote/distance learning (e.g. All teachers must tele-teach.),Yes,Paraguay,"One or more countries, but not all countries",,,,,,All Residents (Citizen Residents + Foreign Residents),No special population targeted,,,Mandatory (Unspecified/Implied),"National Government,Ministry/Department of Education",,,,,https://tummgmt.eu.qualtrics.com/Q/File.php?F=F_Y3K1qagc8W4LlHH ; https://tummgmt.eu.qualtrics.com/Q/File.php?F=F_6GzyVCMQmo4VYLD,NA ; https://www.mec.gov.py/sigmec/resoluciones/358-2020-PETTA.pdf,2021-07-20,2021-07-20T09:01:22Z,37,3,0,91,525,0.073,,,,,,100,32.9,2,0.961252152919769,0.823284327983856,9,29,6867062,36207104850.3802,4.95805142159847,15.74224691625,24.3125212031055,2,2,0.597955494226369,1.50005723202781,156462
R_1DIJnkguNZvZVVzEm,8353867Em,update,End of Policy,,"","On March 24, 2020, the Ministry of Education decided that private and subsidized private educational institutions will have to communicate to them how classes will be conducted during the pandemic. This policy ended on March 27, 2020. UPDATE: The Paraguayan government approved on 27/03/2020 the implementation of the digital platform called ""tu escuela en casa"" and it will be used by students from Kindergarten, middle school and high school. Therefore, the policy ended on March 27, 2020.",2020-03-24,2020-03-24,2020-03-27,The policy has a clear end date,Paraguay,PRY,PY,National,1,,,,Closure and Regulation of Schools,Primary Schools (generally for children ages 10 and below),,"",,,,,,"","","","","","","","","","","",,,Primary Schools allowed to open with conditions,Full remote/distance learning (e.g. All teachers must tele-teach.),Yes,Paraguay,"One or more countries, but not all countries",,,,,,All Residents (Citizen Residents + Foreign Residents),No special population targeted,,,Mandatory (Unspecified/Implied),"National Government,Ministry/Department of Education",,,,,https://tummgmt.eu.qualtrics.com/Q/File.php?F=F_Y3K1qagc8W4LlHH ; https://tummgmt.eu.qualtrics.com/Q/File.php?F=F_6GzyVCMQmo4VYLD,NA ; https://www.mec.gov.py/sigmec/resoluciones/358-2020-PETTA.pdf,2021-07-20,2021-07-20T09:01:22Z,37,3,0,91,525,0.073,,,,,,100,32.9,2,0.961252152919769,0.823284327983856,9,29,6867062,36207104850.3802,4.95805142159847,15.74224691625,24.3125212031055,2,2,0.597955494226369,1.50005723202781,156462
R_1DIJnkguNZvZVVzFw,8353867Fw,update,End of Policy,,"","On March 24, 2020, the Ministry of Education decided that private and subsidized private educational institutions will have to communicate to them how classes will be conducted during the pandemic. This policy ended on March 27, 2020. UPDATE: The Paraguayan government approved on 27/03/2020 the implementation of the digital platform called ""tu escuela en casa"" and it will be used by students from Kindergarten, middle school and high school. Therefore, the policy ended on March 27, 2020.",2020-03-24,2020-03-24,2020-03-27,The policy has a clear end date,Paraguay,PRY,PY,National,1,,,,Closure and Regulation of Schools,Secondary Schools (generally for children ages 10 to 18),,"",,,,,,"","","","","","","","","","","",,,Secondary Schools allowed to open with conditions,Full remote/distance learning (e.g. All teachers must tele-teach.),Yes,Paraguay,"One or more countries, but not all countries",,,,,,All Residents (Citizen Residents + Foreign Residents),No special population targeted,,,Mandatory (Unspecified/Implied),"National Government,Ministry/Department of Education",,,,,https://tummgmt.eu.qualtrics.com/Q/File.php?F=F_Y3K1qagc8W4LlHH ; https://tummgmt.eu.qualtrics.com/Q/File.php?F=F_6GzyVCMQmo4VYLD,NA ; https://www.mec.gov.py/sigmec/resoluciones/358-2020-PETTA.pdf,2021-07-20,2021-07-20T09:01:22Z,37,3,0,91,525,0.073,,,,,,100,32.9,2,0.961252152919769,0.823284327983856,9,29,6867062,36207104850.3802,4.95805142159847,15.74224691625,24.3125212031055,2,2,0.597955494226369,1.50005723202781,156462
R_1DIJnkguNZvZVVzCe,8353867Ce,update,End of Policy,,"","On March 24, 2020, the Ministry of Education decided that private and subsidized private educational institutions will have to communicate to them how classes will be conducted during the pandemic. This policy ended on March 27, 2020. UPDATE: The Paraguayan government approved on 27/03/2020 the implementation of the digital platform called ""tu escuela en casa"" and it will be used by students from Kindergarten, middle school and high school. Therefore, the policy ended on March 27, 2020.",2020-03-24,2020-03-24,2020-03-27,The policy has a clear end date,Paraguay,PRY,PY,National,1,,,,Closure and Regulation of Schools,Higher education institutions (i.e. degree granting institutions),,"",,,,,,"","","","","","","","","","","",,,Higher education institutions allowed to open with conditions,Full remote/distance learning (e.g. All teachers must tele-teach.),Yes,Paraguay,"One or more countries, but not all countries",,,,,,All Residents (Citizen Residents + Foreign Residents),No special population targeted,,,Mandatory (Unspecified/Implied),"National Government,Ministry/Department of Education",,,,,https://tummgmt.eu.qualtrics.com/Q/File.php?F=F_Y3K1qagc8W4LlHH ; https://tummgmt.eu.qualtrics.com/Q/File.php?F=F_6GzyVCMQmo4VYLD,NA ; https://www.mec.gov.py/sigmec/resoluciones/358-2020-PETTA.pdf,2021-07-20,2021-07-20T09:01:22Z,37,3,0,91,525,0.073,,,,,,100,32.9,2,0.961252152919769,0.823284327983856,9,29,6867062,36207104850.3802,4.95805142159847,15.74224691625,24.3125212031055,2,2,0.597955494226369,1.50005723202781,156462
R_2bN5OZl4QSW8GJuEl,3851823El,new_entry,,,"","The Paraguayan government approved on 27/03/2020 the implementation of the digital platform called ""tu escuela en casa"" and it will be used by students from Kindergarten, middle school and high school.",2020-03-27,2020-03-27,,The policy’s end date is unknown or unreported,Paraguay,PRY,PY,National,1,,,,Closure and Regulation of Schools,Preschool or childcare facilities (generally for children ages 5 and below),,"",,,,,,"","","","","","","","","","","",,,Preschool or childcare facilities allowed to open with conditions,Full remote/distance learning (e.g. All teachers must tele-teach.),Yes,Paraguay,"One or more countries, but not all countries",,,,,,All Residents (Citizen Residents + Foreign Residents),No special population targeted,,,Mandatory (Unspecified/Implied),"National Government,Ministry/Department of Education",,,,,https://tummgmt.eu.qualtrics.com/Q/File.php?F=F_VUY2h19qaaJHp5v,https://www.mec.gov.py/sigmec/resoluciones/358-2020-PETTA.pdf,2021-07-16,2021-07-16T13:49:21Z,56,3,1,101,755,0.105,,,,,,100,32.9,2,0.961252152919769,0.823284327983856,9,29,6867062,36207104850.3802,4.95805142159847,15.74224691625,24.3125212031055,2,2,0.597955494226369,1.50005723202781,156462
R_2bN5OZl4QSW8GJuEm,3851823Em,new_entry,,,"","The Paraguayan government approved on 27/03/2020 the implementation of the digital platform called ""tu escuela en casa"" and it will be used by students from Kindergarten, middle school and high school.",2020-03-27,2020-03-27,,The policy’s end date is unknown or unreported,Paraguay,PRY,PY,National,1,,,,Closure and Regulation of Schools,Primary Schools (generally for children ages 10 and below),,"",,,,,,"","","","","","","","","","","",,,Primary Schools allowed to open with conditions,Full remote/distance learning (e.g. All teachers must tele-teach.),Yes,Paraguay,"One or more countries, but not all countries",,,,,,All Residents (Citizen Residents + Foreign Residents),No special population targeted,,,Mandatory (Unspecified/Implied),"National Government,Ministry/Department of Education",,,,,https://tummgmt.eu.qualtrics.com/Q/File.php?F=F_VUY2h19qaaJHp5v,https://www.mec.gov.py/sigmec/resoluciones/358-2020-PETTA.pdf,2021-07-16,2021-07-16T13:49:21Z,56,3,1,101,755,0.105,,,,,,100,32.9,2,0.961252152919769,0.823284327983856,9,29,6867062,36207104850.3802,4.95805142159847,15.74224691625,24.3125212031055,2,2,0.597955494226369,1.50005723202781,156462
R_2bN5OZl4QSW8GJuFw,3851823Fw,new_entry,,,"","The Paraguayan government approved on 27/03/2020 the implementation of the digital platform called ""tu escuela en casa"" and it will be used by students from Kindergarten, middle school and high school.",2020-03-27,2020-03-27,,The policy’s end date is unknown or unreported,Paraguay,PRY,PY,National,1,,,,Closure and Regulation of Schools,Secondary Schools (generally for children ages 10 to 18),,"",,,,,,"","","","","","","","","","","",,,Secondary Schools allowed to open with conditions,Full remote/distance learning (e.g. All teachers must tele-teach.),Yes,Paraguay,"One or more countries, but not all countries",,,,,,All Residents (Citizen Residents + Foreign Residents),No special population targeted,,,Mandatory (Unspecified/Implied),"National Government,Ministry/Department of Education",,,,,https://tummgmt.eu.qualtrics.com/Q/File.php?F=F_VUY2h19qaaJHp5v,https://www.mec.gov.py/sigmec/resoluciones/358-2020-PETTA.pdf,2021-07-16,2021-07-16T13:49:21Z,56,3,1,101,755,0.105,,,,,,100,32.9,2,0.961252152919769,0.823284327983856,9,29,6867062,36207104850.3802,4.95805142159847,15.74224691625,24.3125212031055,2,2,0.597955494226369,1.50005723202781,156462
R_3n2gA5GODIE57siEl,7099939El,new_entry,,,"","On March 27, 2020, the Paraguayan government decided that the departmental directorates of education and educational supervisions must carry out the necessary accompaniment and follow-up so that all educational institutions, teachers and students in their respective locations can access the platform through available technological means. In case of not having access to the digital platform, materials must be provided in printed format to each student.",2020-03-27,2020-03-27,,The policy’s end date is unknown or unreported,Paraguay,PRY,PY,National,1,,,,Closure and Regulation of Schools,Preschool or childcare facilities (generally for children ages 5 and below),,"",,,,,,"","","","","","","","","","","",,,Preschool or childcare facilities allowed to open with conditions,Other conditions not listed above (please provide detail in the text entry),Yes,Paraguay,"One or more countries, but not all countries",,,,,,All Residents (Citizen Residents + Foreign Residents),No special population targeted,,,Mandatory (Unspecified/Implied),"National Government,Ministry/Department of Justice",,,,,https://tummgmt.eu.qualtrics.com/Q/File.php?F=F_pasGUugqBnPEorT,https://www.mec.gov.py/sigmec/resoluciones/358-2020-PETTA.pdf,2021-07-16,2021-07-16T14:31:10Z,56,3,1,101,755,0.105,,,,,,100,32.9,2,0.961252152919769,0.823284327983856,9,29,6867062,36207104850.3802,4.95805142159847,15.74224691625,24.3125212031055,2,2,0.597955494226369,1.50005723202781,156462
R_3n2gA5GODIE57siEm,7099939Em,new_entry,,,"","On March 27, 2020, the Paraguayan government decided that the departmental directorates of education and educational supervisions must carry out the necessary accompaniment and follow-up so that all educational institutions, teachers and students in their respective locations can access the platform through available technological means. In case of not having access to the digital platform, materials must be provided in printed format to each student.",2020-03-27,2020-03-27,,The policy’s end date is unknown or unreported,Paraguay,PRY,PY,National,1,,,,Closure and Regulation of Schools,Primary Schools (generally for children ages 10 and below),,"",,,,,,"","","","","","","","","","","",,,Primary Schools allowed to open with conditions,Other conditions not listed above (please provide detail in the text entry),Yes,Paraguay,"One or more countries, but not all countries",,,,,,All Residents (Citizen Residents + Foreign Residents),No special population targeted,,,Mandatory (Unspecified/Implied),"National Government,Ministry/Department of Justice",,,,,https://tummgmt.eu.qualtrics.com/Q/File.php?F=F_pasGUugqBnPEorT,https://www.mec.gov.py/sigmec/resoluciones/358-2020-PETTA.pdf,2021-07-16,2021-07-16T14:31:10Z,56,3,1,101,755,0.105,,,,,,100,32.9,2,0.961252152919769,0.823284327983856,9,29,6867062,36207104850.3802,4.95805142159847,15.74224691625,24.3125212031055,2,2,0.597955494226369,1.50005723202781,156462
R_3n2gA5GODIE57siFw,7099939Fw,new_entry,,,"","On March 27, 2020, the Paraguayan government decided that the departmental directorates of education and educational supervisions must carry out the necessary accompaniment and follow-up so that all educational institutions, teachers and students in their respective locations can access the platform through available technological means. In case of not having access to the digital platform, materials must be provided in printed format to each student.",2020-03-27,2020-03-27,,The policy’s end date is unknown or unreported,Paraguay,PRY,PY,National,1,,,,Closure and Regulation of Schools,Secondary Schools (generally for children ages 10 to 18),,"",,,,,,"","","","","","","","","","","",,,Secondary Schools allowed to open with conditions,Other conditions not listed above (please provide detail in the text entry),Yes,Paraguay,"One or more countries, but not all countries",,,,,,All Residents (Citizen Residents + Foreign Residents),No special population targeted,,,Mandatory (Unspecified/Implied),"National Government,Ministry/Department of Justice",,,,,https://tummgmt.eu.qualtrics.com/Q/File.php?F=F_pasGUugqBnPEorT,https://www.mec.gov.py/sigmec/resoluciones/358-2020-PETTA.pdf,2021-07-16,2021-07-16T14:31:10Z,56,3,1,101,755,0.105,,,,,,100,32.9,2,0.961252152919769,0.823284327983856,9,29,6867062,36207104850.3802,4.95805142159847,15.74224691625,24.3125212031055,2,2,0.597955494226369,1.50005723202781,156462
R_3eeISJKu57rRurbEl,3121167El,new_entry,,,"","In Paraguay, on 28/03/2020, it was decided that face-to-face teaching is still suspended until 12/04/2020 and teaching is online.",2020-03-28,2020-03-28,2020-04-12,The policy has a clear end date,Paraguay,PRY,PY,National,1,,,,Closure and Regulation of Schools,Preschool or childcare facilities (generally for children ages 5 and below),,"",,,,,,"","","","","","","","","","","",,,Preschool or childcare facilities allowed to open with conditions,Full remote/distance learning (e.g. All teachers must tele-teach.),Yes,Paraguay,"One or more countries, but not all countries",,,,,,All Residents (Citizen Residents + Foreign Residents),No special population targeted,,,Mandatory (Unspecified/Implied),"National Government,Ministry/Department of Education",,,,,https://tummgmt.eu.qualtrics.com/Q/File.php?F=F_3ht3o5FlSQ30RV2,https://www.mec.gov.py/sigmec/resoluciones/354-2020-PETTA.pdf,2021-07-20,2021-07-20T09:12:04Z,59,3,1,60,815,0.113,,,,,,100,32.9,2,0.961252152919769,0.823284327983856,9,29,6867062,36207104850.3802,4.95805142159847,15.74224691625,24.3125212031055,2,2,0.597955494226369,1.50005723202781,156462
R_3eeISJKu57rRurbEm,3121167Em,new_entry,,,"","In Paraguay, on 28/03/2020, it was decided that face-to-face teaching is still suspended until 12/04/2020 and teaching is online.",2020-03-28,2020-03-28,2020-04-12,The policy has a clear end date,Paraguay,PRY,PY,National,1,,,,Closure and Regulation of Schools,Primary Schools (generally for children ages 10 and below),,"",,,,,,"","","","","","","","","","","",,,Primary Schools allowed to open with conditions,Full remote/distance learning (e.g. All teachers must tele-teach.),Yes,Paraguay,"One or more countries, but not all countries",,,,,,All Residents (Citizen Residents + Foreign Residents),No special population targeted,,,Mandatory (Unspecified/Implied),"National Government,Ministry/Department of Education",,,,,https://tummgmt.eu.qualtrics.com/Q/File.php?F=F_3ht3o5FlSQ30RV2,https://www.mec.gov.py/sigmec/resoluciones/354-2020-PETTA.pdf,2021-07-20,2021-07-20T09:12:04Z,59,3,1,60,815,0.113,,,,,,100,32.9,2,0.961252152919769,0.823284327983856,9,29,6867062,36207104850.3802,4.95805142159847,15.74224691625,24.3125212031055,2,2,0.597955494226369,1.50005723202781,156462
R_3eeISJKu57rRurbFw,3121167Fw,new_entry,,,"","In Paraguay, on 28/03/2020, it was decided that face-to-face teaching is still suspended until 12/04/2020 and teaching is online.",2020-03-28,2020-03-28,2020-04-12,The policy has a clear end date,Paraguay,PRY,PY,National,1,,,,Closure and Regulation of Schools,Secondary Schools (generally for children ages 10 to 18),,"",,,,,,"","","","","","","","","","","",,,Secondary Schools allowed to open with conditions,Full remote/distance learning (e.g. All teachers must tele-teach.),Yes,Paraguay,"One or more countries, but not all countries",,,,,,All Residents (Citizen Residents + Foreign Residents),No special population targeted,,,Mandatory (Unspecified/Implied),"National Government,Ministry/Department of Education",,,,,https://tummgmt.eu.qualtrics.com/Q/File.php?F=F_3ht3o5FlSQ30RV2,https://www.mec.gov.py/sigmec/resoluciones/354-2020-PETTA.pdf,2021-07-20,2021-07-20T09:12:04Z,59,3,1,60,815,0.113,,,,,,100,32.9,2,0.961252152919769,0.823284327983856,9,29,6867062,36207104850.3802,4.95805142159847,15.74224691625,24.3125212031055,2,2,0.597955494226369,1.50005723202781,156462
R_3eeISJKu57rRurbCe,3121167Ce,new_entry,,,"","In Paraguay, on 28/03/2020, it was decided that face-to-face teaching is still suspended until 12/04/2020 and teaching is online.",2020-03-28,2020-03-28,2020-04-12,The policy has a clear end date,Paraguay,PRY,PY,National,1,,,,Closure and Regulation of Schools,Higher education institutions (i.e. degree granting institutions),,"",,,,,,"","","","","","","","","","","",,,Higher education institutions allowed to open with conditions,Full remote/distance learning (e.g. All teachers must tele-teach.),Yes,Paraguay,"One or more countries, but not all countries",,,,,,All Residents (Citizen Residents + Foreign Residents),No special population targeted,,,Mandatory (Unspecified/Implied),"National Government,Ministry/Department of Education",,,,,https://tummgmt.eu.qualtrics.com/Q/File.php?F=F_3ht3o5FlSQ30RV2,https://www.mec.gov.py/sigmec/resoluciones/354-2020-PETTA.pdf,2021-07-20,2021-07-20T09:12:04Z,59,3,1,60,815,0.113,,,,,,100,32.9,2,0.961252152919769,0.823284327983856,9,29,6867062,36207104850.3802,4.95805142159847,15.74224691625,24.3125212031055,2,2,0.597955494226369,1.50005723202781,156462
R_1LAwDHYX11WdxPKCe,8074522Ce,new_entry,,,"","For Higher Education, in Paraguay, for phase 3 of 'La Cuarentena Intelligente', which started on June 15, 2020, practical classes, laboratories and exams are now allowed if there is less than 10 person in the room. This policy is at a national level except, this is not allowed only in the departments of Paraguarí and Concepción. This phase was set to last until July 05, 2020.",2020-06-14,2020-06-15,2020-07-05,The policy has a clear end date,Paraguay,PRY,PY,National,1,,,,Closure and Regulation of Schools,Higher education institutions (i.e. degree granting institutions),,"",,,,,,"","","","","","","","","","","",,,Higher education institutions allowed to open with conditions,"Number of people on the school premises are limited (e.g. only 50 people allowed on school premises),Types of people on school premises are limited (e.g. no parents),Regular cleaning and sanitary procedures applied to classrooms (e.g. classrooms must be aired out after each class)",Yes,Paraguay,"One or more countries, but not all countries",,,,,,All Residents (Citizen Residents + Foreign Residents),"Students,Teachers",,,Mandatory (Unspecified/Implied),"National Government,Ministry/Department of Education",,,,,https://tummgmt.eu.qualtrics.com/Q/File.php?F=F_2f39tUU4H25qT7c,https://www.mspbs.gov.py/dependencias/portal/adjunto/a2d441-DECRETO3706.pdf ; https://www.abc.com.py/nacionales/2020/06/11/cuarentena-fase-3-comienza-este-lunes-no-asi-en-paraguari-y-concepcion/,2021-09-13,2021-09-13T12:45:56Z,1296,12,673,648,48729,6.75,,,,,,100,32.9,2,0.961252152919769,0.823284327983856,9,29,6867062,36207104850.3802,4.95805142159847,15.74224691625,24.3125212031055,2,2,0.597955494226369,1.50005723202781,156462
R_00c0hPsrITfxUFrCe,8074522Ce,update,End of Policy,,"","For Higher Education, in Paraguay, practical classes, laboratories and exams are now allowed starting on 15/06/2020 if there is less than 10 person in the room. This policy is at a national level except, this is not allowed only in the departments of Paraguarí and Concepción. 

END of Policy: On 13/07/2020, the department of Paraguari and Conception advanced to phase 3 of La Cuarentena Intelligente, so now the whole country is under the same restrictions. UPDATE: On July 13, 2020, Paraguari and Conception advance to phase 3 of La Cuarentena Intelligente, so now the whole country have the same restrictions",2020-06-14,2020-06-15,2020-07-13,The policy has a clear end date,Paraguay,PRY,PY,National,1,,,,Closure and Regulation of Schools,Higher education institutions (i.e. degree granting institutions),,"",,,,,,"","","","","","","","","","","",,,Higher education institutions allowed to open with conditions,"Number of people on the school premises are limited (e.g. only 50 people allowed on school premises),Types of people on school premises are limited (e.g. no parents),Regular cleaning and sanitary procedures applied to classrooms (e.g. classrooms must be aired out after each class)",Yes,Paraguay,"One or more countries, but not all countries",,,,,,All Residents (Citizen Residents + Foreign Residents),"Students,Teachers",,,Mandatory (Unspecified/Implied),"National Government,Ministry/Department of Education",,,,,https://tummgmt.eu.qualtrics.com/Q/File.php?F=F_2f39tUU4H25qT7c ; https://tummgmt.eu.qualtrics.com/Q/File.php?F=F_0D2jgPTDn08Mkg1,NA ; https://www.mspbs.gov.py/dependencias/portal/adjunto/a2d441-DECRETO3706.pdf ; https://www.abc.com.py/tv/abc-noticias/2020/07/10/paraguari-y-concepcion-avanzan-a-fase-3-de-la-cuarentena-inteligente/,2021-07-16,2021-07-16T11:07:14Z,1296,12,673,648,48729,6.75,,,,,,100,32.9,2,0.961252152919769,0.823284327983856,9,29,6867062,36207104850.3802,4.95805142159847,15.74224691625,24.3125212031055,2,2,0.597955494226369,1.50005723202781,156462
R_2A09VyufeTjsRxyCe,1533482Ce,new_entry,,,"","For Higher Education, in Paraguay, practical classes, laboratories and exams are now allowed at a national level starting on 13/07/2020 if there is less than 10 person in the room.",2020-07-10,2020-07-13,,The policy’s end date is unknown or unreported,Paraguay,PRY,PY,National,1,,,,Closure and Regulation of Schools,Higher education institutions (i.e. degree granting institutions),,"",,,,,,"","","","","","","","","","","",,,Higher education institutions allowed to open with conditions,"Number of people on the school premises are limited (e.g. only 50 people allowed on school premises),Regular cleaning and sanitary procedures applied to classrooms (e.g. classrooms must be aired out after each class)",Yes,Paraguay,"One or more countries, but not all countries",,,,,,All Residents (Citizen Residents + Foreign Residents),"Students,Teachers",,,Mandatory (Unspecified/Implied),"National Government,Ministry/Department of Education",,,,,https://tummgmt.eu.qualtrics.com/Q/File.php?F=F_2t2PWW3snnIkSLi,https://www.mspbs.gov.py/dependencias/portal/adjunto/a2d441-DECRETO3706.pdf ; https://www.abc.com.py/tv/abc-noticias/2020/07/10/paraguari-y-concepcion-avanzan-a-fase-3-de-la-cuarentena-inteligente/,2021-07-20,2021-07-20T09:40:05Z,2980,25,1293,1161,92442,12.804,,,,,,100,32.9,2,0.961252152919769,0.823284327983856,9,29,6867062,36207104850.3802,4.95805142159847,15.74224691625,24.3125212031055,2,2,0.597955494226369,1.50005723202781,156462
R_2BmV0bSB5OyWEd4Em,8302380Em,new_entry,,,"",On August 28 2020 the Minister of Education of Paraguay has announced in-person classes will be suspended until December 2020.,2020-08-28,2020-08-31,2020-12-01,The policy has a clear end date,Paraguay,PRY,PY,National,1,,,,Closure and Regulation of Schools,Primary Schools (generally for children ages 10 and below),,"",,,,,,"","","","","","","","","","","",,,Primary Schools closed/locked down,"",Yes,Paraguay,"One or more countries, but not all countries",,,,,,All Residents (Citizen Residents + Foreign Residents),No special population targeted,,,Mandatory (Unspecified/Implied),Ministry/Department of Education,,,,,https://tummgmt.eu.qualtrics.com/Q/File.php?F=F_2V462LZICNBX7kW,https://web.archive.org/web/20200902145858/https://py.usembassy.gov/covid-19-information-2/,2022-06-17,2022-06-17T10:04:38Z,17662,326,9421,2296,192465,26.659,,,,,,100,32.9,2,0.961252152919769,0.823284327983856,9,29,6867062,36207104850.3802,4.95805142159847,15.74224691625,24.3125212031055,2,2,0.597955494226369,1.50005723202781,156462
R_2BmV0bSB5OyWEd4Fw,8302380Fw,new_entry,,,"",On August 28 2020 the Minister of Education of Paraguay has announced in-person classes will be suspended until December 2020.,2020-08-28,2020-08-31,2020-12-01,The policy has a clear end date,Paraguay,PRY,PY,National,1,,,,Closure and Regulation of Schools,Secondary Schools (generally for children ages 10 to 18),,"",,,,,,"","","","","","","","","","","",,,Secondary Schools closed/locked down,"",Yes,Paraguay,"One or more countries, but not all countries",,,,,,All Residents (Citizen Residents + Foreign Residents),No special population targeted,,,Mandatory (Unspecified/Implied),Ministry/Department of Education,,,,,https://tummgmt.eu.qualtrics.com/Q/File.php?F=F_2V462LZICNBX7kW,https://web.archive.org/web/20200902145858/https://py.usembassy.gov/covid-19-information-2/,2022-06-17,2022-06-17T10:04:38Z,17662,326,9421,2296,192465,26.659,,,,,,100,32.9,2,0.961252152919769,0.823284327983856,9,29,6867062,36207104850.3802,4.95805142159847,15.74224691625,24.3125212031055,2,2,0.597955494226369,1.50005723202781,156462
R_2BmV0bSB5OyWEd4Ce,8302380Ce,new_entry,,,"",On August 28 2020 the Minister of Education of Paraguay has announced in-person classes will be suspended until December 2020.,2020-08-28,2020-08-31,2020-12-01,The policy has a clear end date,Paraguay,PRY,PY,National,1,,,,Closure and Regulation of Schools,Higher education institutions (i.e. degree granting institutions),,"",,,,,,"","","","","","","","","","","",,,Higher education institutions closed/locked down,"",Yes,Paraguay,"One or more countries, but not all countries",,,,,,All Residents (Citizen Residents + Foreign Residents),No special population targeted,,,Mandatory (Unspecified/Implied),Ministry/Department of Education,,,,,https://tummgmt.eu.qualtrics.com/Q/File.php?F=F_2V462LZICNBX7kW,https://web.archive.org/web/20200902145858/https://py.usembassy.gov/covid-19-information-2/,2022-06-17,2022-06-17T10:04:38Z,17662,326,9421,2296,192465,26.659,,,,,,100,32.9,2,0.961252152919769,0.823284327983856,9,29,6867062,36207104850.3802,4.95805142159847,15.74224691625,24.3125212031055,2,2,0.597955494226369,1.50005723202781,156462
R_1GDNVOC1DdzNhZUDe,2097134,new_entry,,,"","Paraguay entered phase 2 of 'La Cuarentena Intelligente' on May 25, 2020. During this phase, there was a national curfew from 21:00 to 05:00 which was supposed to last until June 14, 2020.",2020-05-24,2020-05-25,2020-06-14,The policy has a clear end date,Paraguay,PRY,PY,National,1,,,,Curfew,No the curfew times are always the same regardless of the day of the week,,"",,,,,,"","","","","","","","","","","",,,,"",Yes,Paraguay,"One or more countries, but not all countries",,,,,,All Residents (Citizen Residents + Foreign Residents),No special population targeted,,,"Mandatory with Legal Penalties (Jail Time),Mandatory with Fines","National Government,Ministry/Department of Justice,Military,Provincial/State Government,Municipal Government,Police",,,,,https://tummgmt.eu.qualtrics.com/Q/File.php?F=F_r7ty2URa1fxLgdj,https://www.mspbs.gov.py/dependencias/portal/adjunto/05612d-DECRETO3619n68bqrxc.pdf,2021-08-04,2021-08-04T14:05:47Z,865,11,344,404,25216,3.493,,,,,,100,32.9,2,0.961252152919769,0.823284327983856,9,29,6867062,36207104850.3802,4.95805142159847,15.74224691625,24.3125212031055,2,2,0.597955494226369,1.50005723202781,156462
R_2WwnmjgN8aVWJbfDe,3045792,new_entry,,,"",The cities of San Roque González de Santa Cruz and Ybycuí in Paraguay go back to lockdown (go back to phase 0 of 'La cuarentena inteligente'. The rest of the country keep the same curfew previously established (from 21:00 to 05:00).,2020-06-09,2020-06-09,2020-06-15,The policy has a clear end date,Paraguay,PRY,PY,National,1,,,,Curfew,No the curfew times are always the same regardless of the day of the week,,"",,,,,,"","","","","","","","","","","",,,,"",Yes,Paraguay,"One or more countries, but not all countries",,,,,,All Residents (Citizen Residents + Foreign Residents),No special population targeted,,,"Mandatory with Legal Penalties (Jail Time),Mandatory with Fines","National Government,Military,Provincial/State Government,Municipal Government,Police",,,,,https://tummgmt.eu.qualtrics.com/Q/File.php?F=F_SIZzeKF6poDfCM1,https://www.abc.com.py/tv/abc-noticias/2020/06/09/ybycui-en-cuarentena-total-por-covid-19/ ; https://www.abc.com.py/nacionales/2020/06/09/gobernacion-declara-retorno-a-fase-cero-de-la-cuarentena-en-san-roque-gonzalez/ ; https://www.mspbs.gov.py/dependencias/portal/adjunto/2a6dd2-DECRETO3619n68bqrxc.pdf,2021-06-18,2021-06-18T22:08:52Z,1187,11,604,1090,40032,5.545,,,,,,100,32.9,2,0.961252152919769,0.823284327983856,9,29,6867062,36207104850.3802,4.95805142159847,15.74224691625,24.3125212031055,2,2,0.597955494226369,1.50005723202781,156462
R_3exgxM5Jlkoh5KSHm,2163436,new_entry,,,"","On 15/06/2020, Paraguay except for the departments of Paraguarí and Concepción start phase 3 of 'la cuarentena inteligente'. The curfew is lowered and is now from 23:00 to 05:00 from Sunday to Thursday and from 00:00 to 05:00 on Friday and Saturday.",2020-06-14,2020-06-15,2020-07-13,The policy has a clear end date,Paraguay,PRY,PY,National,1,,,,Curfew,Yes the curfew times differ depending on the day of the week,,"",,,,,,"","","","","","","","","","","",,,,"",Yes,Paraguay,"One or more countries, but not all countries",,,,,,All Residents (Citizen Residents + Foreign Residents),No special population targeted,,,"Mandatory with Legal Penalties (Jail Time),Mandatory with Fines","National Government,Military,Provincial/State Government,Municipal Government,Police",,,,,https://tummgmt.eu.qualtrics.com/Q/File.php?F=F_2b3tyrMZ0j6OXM9,https://www.abc.com.py/nacionales/2020/06/11/cuarentena-fase-3-comienza-este-lunes-no-asi-en-paraguari-y-concepcion/ ; https://www.mspbs.gov.py/dependencias/portal/adjunto/a2d441-DECRETO3706.pdf,2021-06-19,2021-06-19T09:27:23Z,1296,12,673,648,48729,6.75,,,,,,100,32.9,2,0.961252152919769,0.823284327983856,9,29,6867062,36207104850.3802,4.95805142159847,15.74224691625,24.3125212031055,2,2,0.597955494226369,1.50005723202781,156462
R_1MMcFprzXXtziDrDe,6745680,new_entry,,,"","In Paraguay, the department of Paraguarí is stuck in phase 2 of 'la cuarentena inteligente' whereas the entire country has advanced to phase 3 since 15/06/2020. The curfew in this department remains the same as previously established in phase 2 (from 21:00 to 05:00).",2020-06-11,2020-06-15,2020-07-13,The policy has a clear end date,Paraguay,PRY,PY,Provincial,1,Paraguari,,,Curfew,No the curfew times are always the same regardless of the day of the week,,"",,,,,,"","","","","","","","","","","",,,,"",Yes,Paraguay,One or more provinces within one or more countries,,Paraguari,,,,All Residents (Citizen Residents + Foreign Residents),No special population targeted,,,"Mandatory with Legal Penalties (Jail Time),Mandatory with Fines","Military,Provincial/State Government,Police",,,,,https://tummgmt.eu.qualtrics.com/Q/File.php?F=F_3pmsiJWbzUCqv8E,https://www.lanacion.com.py/pais/2020/06/11/fase-3-inicia-el-lunes-con-la-apertura-de-locales-gastronomicos/ ; https://www.abc.com.py/tv/abc-noticias/2020/07/10/paraguari-y-concepcion-avanzan-a-fase-3-de-la-cuarentena-inteligente/ ; https://www.mspbs.gov.py/dependencias/portal/adjunto/2a6dd2-DECRETO3619n68bqrxc.pdf,2021-06-19,2021-06-19T09:49:28Z,1296,12,673,648,48729,6.75,,,,,,100,32.9,2,0.961252152919769,0.823284327983856,9,29,6867062,36207104850.3802,4.95805142159847,15.74224691625,24.3125212031055,2,2,0.597955494226369,1.50005723202781,156462
R_ZkqEsQasLWoyjpDDe,1909471,new_entry,,,"","In Paraguay, the department of Concepción is stuck in phase 2 of 'la cuarentena inteligente' whereas the entire country has advanced to phase 3 since 15/06/2020. The curfew in this department remains the same as previously established in phase 2 (from 21:00 to 05:00).",2020-06-11,2020-06-15,2020-07-13,The policy has a clear end date,Paraguay,PRY,PY,Provincial,1,Concepcion,,,Curfew,No the curfew times are always the same regardless of the day of the week,,"",,,,,,"","","","","","","","","","","",,,,"",Yes,Paraguay,One or more provinces within one or more countries,,Concepcion,,,,All Residents (Citizen Residents + Foreign Residents),No special population targeted,,,"Mandatory with Legal Penalties (Jail Time),Mandatory with Fines","Military,Provincial/State Government,Police",,,,,https://tummgmt.eu.qualtrics.com/Q/File.php?F=F_3emGqOPlxD1D85B,https://www.abc.com.py/tv/abc-noticias/2020/07/10/paraguari-y-concepcion-avanzan-a-fase-3-de-la-cuarentena-inteligente/ ; https://www.lanacion.com.py/pais/2020/06/11/fase-3-inicia-el-lunes-con-la-apertura-de-locales-gastronomicos/ ; https://www.mspbs.gov.py/dependencias/portal/adjunto/2a6dd2-DECRETO3619n68bqrxc.pdf,2021-06-19,2021-06-19T09:54:30Z,1296,12,673,648,48729,6.75,,,,,,100,32.9,2,0.961252152919769,0.823284327983856,9,29,6867062,36207104850.3802,4.95805142159847,15.74224691625,24.3125212031055,2,2,0.597955494226369,1.50005723202781,156462
R_3qD7y0ziKZGT7xfHm,2343875,new_entry,,,"","In Paraguay from 13/07/2020, the whole country is at phase 3 of 'la cuarentena inteligente'. Under this phase, the curfew is from 23:00 to 05:00 from Sunday to Thursday and from 00:00 to 05:00 on Friday and Saturday.",2020-07-10,2020-07-13,2020-08-01,The policy has a clear end date,Paraguay,PRY,PY,National,1,,,,Curfew,Yes the curfew times differ depending on the day of the week,,"",,,,,,"","","","","","","","","","","",,,,"",Yes,Paraguay,"One or more countries, but not all countries",,,,,,All Residents (Citizen Residents + Foreign Residents),No special population targeted,,,"Mandatory with Legal Penalties (Jail Time),Mandatory with Fines","National Government,Military,Provincial/State Government,Municipal Government,Police",,,,,https://tummgmt.eu.qualtrics.com/Q/File.php?F=F_1LLl3Hktx9Ls0G4,https://www.abc.com.py/tv/abc-noticias/2020/07/10/paraguari-y-concepcion-avanzan-a-fase-3-de-la-cuarentena-inteligente/ ; https://www.mspbs.gov.py/dependencias/portal/adjunto/a2d441-DECRETO3706.pdf ; https://www.mspbs.gov.py/dependencias/portal/adjunto/b2c798-DECRETO3900.pdf ; https://www.paraguay.com/nacionales/estas-son-las-restricciones-en-el-departamento-de-alto-parana-196227,2021-06-19,2021-06-19T10:57:56Z,2980,25,1293,1161,92442,12.804,,,,,,100,32.9,2,0.961252152919769,0.823284327983856,9,29,6867062,36207104850.3802,4.95805142159847,15.74224691625,24.3125212031055,2,2,0.597955494226369,1.50005723202781,156462
R_1nUeBchfJsJmrGXHm,184537,new_entry,,,"",Curfew in Paraguay (except in Alto Parana) from 23:00 to 05:00 from Sunday to Thursday and from 00:00 to 05:00 on Friday and Saturday from 01/08/2020 to 23/08/2020.,2020-07-30,2020-08-01,2020-08-23,The policy has a clear end date,Paraguay,PRY,PY,National,1,,,,Curfew,Yes the curfew times differ depending on the day of the week,,"",,,,,,"","","","","","","","","","","",,,,"",Yes,Paraguay,"One or more countries, but not all countries",,,,,,All Residents (Citizen Residents + Foreign Residents),No special population targeted,,,Mandatory (Unspecified/Implied),"National Government,Military,Provincial/State Government,Municipal Government,Police",,,,,https://tummgmt.eu.qualtrics.com/Q/File.php?F=F_1I5iP10UdNB3HF7,https://www.mspbs.gov.py/dependencias/portal/adjunto/a2d441-DECRETO3706.pdf ; https://www.mspbs.gov.py/dependencias/portal/adjunto/a2d441-DECRETO3706.pdf,2021-06-23,2021-06-23T10:04:40Z,5485,52,3786,1099,128709,17.828,,,,,,100,32.9,2,0.961252152919769,0.823284327983856,9,29,6867062,36207104850.3802,4.95805142159847,15.74224691625,24.3125212031055,2,2,0.597955494226369,1.50005723202781,156462
R_2fvS0mzW9PlfRQ7De,9861281,new_entry,,,"",Curfew changes in the Paraguayan department of Central. The curfew is now from 20:00 to 05:00 from 23/08/2020 to 06/09/2020.,2020-08-22,2020-08-23,2020-09-06,The policy has a clear end date,Paraguay,PRY,PY,Provincial,1,Central,,,Curfew,No the curfew times are always the same regardless of the day of the week,,"",,,,,,"","","","","","","","","","","",,,,"",Yes,Paraguay,One or more provinces within one or more countries,,Central,,,,All Residents (Citizen Residents + Foreign Residents),No special population targeted,,,"Mandatory with Legal Penalties (Jail Time),Mandatory with Fines","National Government,Military,Provincial/State Government,Municipal Government,Police",,,,,https://tummgmt.eu.qualtrics.com/Q/File.php?F=F_2VgXf436TjXoIaG,https://www.mspbs.gov.py/dependencias/portal/adjunto/c101a0-Documentosescaneados.pdf,2021-06-19,2021-06-19T18:47:22Z,13233,205,7417,1788,173340,24.01,,,,,,100,32.9,2,0.961252152919769,0.823284327983856,9,29,6867062,36207104850.3802,4.95805142159847,15.74224691625,24.3125212031055,2,2,0.597955494226369,1.50005723202781,156462
R_1eqlkFbWeLlSy4wDe,5530859,new_entry,,,"","Curfew changes in Asuncion, Paraguay. The curfew is now from 20:00 to 05:00 from 23/08/2020 to 06/09/2020.",2020-08-22,2020-08-23,2020-09-06,The policy has a clear end date,Paraguay,PRY,PY,Municipal,1,Asuncion,,Asuncion,Curfew,No the curfew times are always the same regardless of the day of the week,,"",,,,,,"","","","","","","","","","","",,,,"",Yes,Paraguay,One or more cities within one or more countries,,Asuncion,Asuncion,,,All Residents (Citizen Residents + Foreign Residents),No special population targeted,,,"Mandatory with Legal Penalties (Jail Time),Mandatory with Fines","National Government,Military,Municipal Government,Police",,,,,https://tummgmt.eu.qualtrics.com/Q/File.php?F=F_2Qrpzud6bdlvjLK,https://www.mspbs.gov.py/dependencias/portal/adjunto/c101a0-Documentosescaneados.pdf,2021-06-19,2021-06-19T18:55:04Z,13233,205,7417,1788,173340,24.01,,,,,,100,32.9,2,0.961252152919769,0.823284327983856,9,29,6867062,36207104850.3802,4.95805142159847,15.74224691625,24.3125212031055,2,2,0.597955494226369,1.50005723202781,156462
R_1oovq97nnoCInMwDe,2918276,new_entry,,,"","In Alto Parana, in Paraguay, a curfew from 20:00 to 05:00 was established. This curfew started on 23/08/2020 and finished on 06/09/2020.",2020-08-23,2020-08-23,2020-09-06,The policy has a clear end date,Paraguay,PRY,PY,Provincial,1,Alto Parana,,,Curfew,No the curfew times are always the same regardless of the day of the week,,"",,,,,,"","","","","","","","","","","",,,,"",Yes,Paraguay,One or more provinces within one or more countries,,Alto Parana,,,,All Residents (Citizen Residents + Foreign Residents),No special population targeted,,,"Mandatory with Legal Penalties (Jail Time),Mandatory with Fines","National Government,Military,Provincial/State Government,Municipal Government,Police",,,,,https://tummgmt.eu.qualtrics.com/Q/File.php?F=F_AHCEqvCa62CCxep,https://www.noticde.com/index.php/2020/08/24/nueva-cuarentena-rige-hasta-el-6-de-septiembre-en-alto-parana/,2021-06-20,2021-06-20T15:52:37Z,13233,205,7417,1788,173340,24.01,,,,,,100,32.9,2,0.961252152919769,0.823284327983856,9,29,6867062,36207104850.3802,4.95805142159847,15.74224691625,24.3125212031055,2,2,0.597955494226369,1.50005723202781,156462
R_RC7M0EDFkOmWbXHHm,7717650,new_entry,,,"","Curfew in Paraguay (except in Alto Parana, Asuncion and Central) from 23:00 to 05:00 from Sunday to Thursday and from 00:00 to 05:00 on Friday and Saturday from 23/08/2020 to 13/09/2020.",2020-08-22,2020-08-23,2020-09-13,The policy has a clear end date,Paraguay,PRY,PY,National,1,,,,Curfew,Yes the curfew times differ depending on the day of the week,,"",,,,,,"","","","","","","","","","","",,,,"",Yes,Paraguay,"One or more countries, but not all countries",,,,,,All Residents (Citizen Residents + Foreign Residents),No special population targeted,,,Mandatory (Unspecified/Implied),"National Government,Military,Provincial/State Government,Municipal Government,Police",,,,,https://tummgmt.eu.qualtrics.com/Q/File.php?F=F_3PoGdDQMETjgr0E,https://www.mspbs.gov.py/dependencias/portal/adjunto/1c26a1-DECRETO4015.pdf ; https://www.mspbs.gov.py/dependencias/portal/adjunto/c101a0-Documentosescaneados.pdf ; https://www.mspbs.gov.py/dependencias/portal/adjunto/f3a842-DECRETO4000.pdf,2021-06-23,2021-06-23T11:04:17Z,13233,205,7417,1788,173340,24.01,,,,,,100,32.9,2,0.961252152919769,0.823284327983856,9,29,6867062,36207104850.3802,4.95805142159847,15.74224691625,24.3125212031055,2,2,0.597955494226369,1.50005723202781,156462
R_3lrkHRwNSrHJWDHDe,2918276,update,Change of Policy,Strengthening,timing of policy strengthening,"In Alto Parana, in Paraguay, a curfew from 20:00 to 05:00 was established. This curfew started on 23/08/2020 and finished on 06/09/2020.  

UPDATE: The curfew from 20:00 to 05:00 in Alto Parana, Paraguay, was set to last until September 6, 2020, but it was extended to 20/09/2020. UPDATE: The curfew from 20:00 to 05:00 in Alto Parana, Paraguay, was set to last until September 6, 2020, but it was extended to 20/09/2020.",2020-09-05,2020-09-06,2020-09-20,The policy has a clear end date,Paraguay,PRY,PY,Provincial,1,Alto Parana,,,Curfew,No the curfew times are always the same regardless of the day of the week,,"",,,,,,"","","","","","","","","","","",,,,"",Yes,Paraguay,One or more provinces within one or more countries,,Alto Parana,,,,All Residents (Citizen Residents + Foreign Residents),No special population targeted,,,"Mandatory with Legal Penalties (Jail Time),Mandatory with Fines","National Government,Military,Provincial/State Government,Municipal Government,Police",,,,,https://tummgmt.eu.qualtrics.com/Q/File.php?F=F_AHCEqvCa62CCxep ; https://tummgmt.eu.qualtrics.com/Q/File.php?F=F_3KDU7ZrHoC5Nrl8,NA ; https://www.mspbs.gov.py/dependencias/portal/adjunto/c14c1d-DECRETO4017.pdf,2021-06-22,2021-06-22T10:52:14Z,22486,435,11133,2719,209202,28.977,,,,,,100,32.9,2,0.961252152919769,0.823284327983856,9,29,6867062,36207104850.3802,4.95805142159847,15.74224691625,24.3125212031055,2,2,0.597955494226369,1.50005723202781,156462
R_eRuXDryeecAczNDDe,5530859,update,Change of Policy,Strengthening,timing of policy strengthening,"Curfew changes in Asuncion, Paraguay. The curfew is now from 20:00 to 05:00 from 23/08/2020 to 06/09/2020. 

UPDATE: Curfew extended until 20/09/2020. UPDATE: In Asuncion, Paraguay, there were a curfew from 23/08/2020 until 06/09/2020. On September 4, it was decided to be extended until 20/09/2020.",2020-09-04,2020-09-06,2020-09-20,The policy has a clear end date,Paraguay,PRY,PY,Municipal,1,Asuncion,,Asuncion,Curfew,No the curfew times are always the same regardless of the day of the week,,"",,,,,,"","","","","","","","","","","",,,,"",Yes,Paraguay,One or more cities within one or more countries,,Asuncion,Asuncion,,,All Residents (Citizen Residents + Foreign Residents),No special population targeted,,,"Mandatory with Legal Penalties (Jail Time),Mandatory with Fines","National Government,Military,Municipal Government,Police",,,,,https://tummgmt.eu.qualtrics.com/Q/File.php?F=F_2Qrpzud6bdlvjLK ; https://tummgmt.eu.qualtrics.com/Q/File.php?F=F_diYSzVhqnDuu8PD,NA ; https://www.efe.com/efe/america/sociedad/el-ministerio-de-salud-pide-dos-semanas-mas-cuarentena-social-en-asuncion/20000013-4335294 ; https://www.mspbs.gov.py/dependencias/portal/adjunto/787652-DECRETO4016.pdf,2021-06-22,2021-06-22T11:43:31Z,22486,435,11133,2719,209202,28.977,,,,,,100,32.9,2,0.961252152919769,0.823284327983856,9,29,6867062,36207104850.3802,4.95805142159847,15.74224691625,24.3125212031055,2,2,0.597955494226369,1.50005723202781,156462
R_32KEsmv1cDIGDZsDe,9861281,update,Change of Policy,Strengthening,timing of policy strengthening,"Curfew changes in the Paraguayan department of Central. The curfew is now from 20:00 to 05:00 from 23/08/2020 to 06/09/2020. 

UPDATE: Curfew extended until 20/09/2020. UPDATE: In Central, Paraguay, there was a curfew from 20:00 to 05:00 that was set to last from 23/08/2020 until 06/09/2020. This curfew was extended until 20/09/202 on 05/09/2020.",2020-09-05,2020-09-06,2020-09-20,The policy has a clear end date,Paraguay,PRY,PY,Provincial,1,Central,,,Curfew,No the curfew times are always the same regardless of the day of the week,,"",,,,,,"","","","","","","","","","","",,,,"",Yes,Paraguay,One or more provinces within one or more countries,,Central,,,,All Residents (Citizen Residents + Foreign Residents),No special population targeted,,,"Mandatory with Legal Penalties (Jail Time),Mandatory with Fines","National Government,Military,Provincial/State Government,Municipal Government,Police",,,,,https://tummgmt.eu.qualtrics.com/Q/File.php?F=F_2VgXf436TjXoIaG ; https://tummgmt.eu.qualtrics.com/Q/File.php?F=F_1NFhbN087DZgKuw,NA ; https://www.mspbs.gov.py/dependencias/portal/adjunto/787652-DECRETO4016.pdf,2021-06-22,2021-06-22T11:48:08Z,22486,435,11133,2719,209202,28.977,,,,,,100,32.9,2,0.961252152919769,0.823284327983856,9,29,6867062,36207104850.3802,4.95805142159847,15.74224691625,24.3125212031055,2,2,0.597955494226369,1.50005723202781,156462
R_1hyhnFkOHHL83rGDe,9003980,new_entry,,,"","Curfew from 20:00 to 05:00 in Caaguazú, Paraguay from 13/09/2020 to 27/09/2020.",2020-09-12,2020-09-13,2020-09-27,The policy has a clear end date,Paraguay,PRY,PY,Provincial,1,Caaguazu,,,Curfew,No the curfew times are always the same regardless of the day of the week,,"",,,,,,"","","","","","","","","","","",,,,"",Yes,Paraguay,One or more provinces within one or more countries,,Caaguazu,,,,All Residents (Citizen Residents + Foreign Residents),No special population targeted,,,Mandatory (Unspecified/Implied),"National Government,Military,Provincial/State Government,Municipal Government,Police",,,,,https://tummgmt.eu.qualtrics.com/Q/File.php?F=F_2wGn6E0glULXtP5,https://www.mspbs.gov.py/dependencias/portal/adjunto/80436a-DECRETO4045.pdf,2021-06-21,2021-06-21T14:01:56Z,27818,525,14288,2981,229992,31.856,,,,,,100,32.9,2,0.961252152919769,0.823284327983856,9,29,6867062,36207104850.3802,4.95805142159847,15.74224691625,24.3125212031055,2,2,0.597955494226369,1.50005723202781,156462
R_25AyerY707Bzbd1De,7529939,new_entry,,,"","Curfew from 20:00 to 05:00 in Conception, Paraguay from 13/09/2020 to 27/09/2020.",2020-09-12,2020-09-13,2020-09-27,The policy has a clear end date,Paraguay,PRY,PY,Provincial,1,Concepcion,,,Curfew,No the curfew times are always the same regardless of the day of the week,,"",,,,,,"","","","","","","","","","","",,,,"",Yes,Paraguay,One or more provinces within one or more countries,,Concepcion,,,,All Residents (Citizen Residents + Foreign Residents),No special population targeted,,,Mandatory (Unspecified/Implied),"National Government,Military,Provincial/State Government,Municipal Government,Police",,,,,https://tummgmt.eu.qualtrics.com/Q/File.php?F=F_1GI8ULkVCfCrGhf,https://www.mspbs.gov.py/dependencias/portal/adjunto/80436a-DECRETO4045.pdf,2021-06-21,2021-06-21T14:09:42Z,27818,525,14288,2981,229992,31.856,,,,,,100,32.9,2,0.961252152919769,0.823284327983856,9,29,6867062,36207104850.3802,4.95805142159847,15.74224691625,24.3125212031055,2,2,0.597955494226369,1.50005723202781,156462
R_3PON4HkB9Dj3FfPHm,3165835,new_entry,,,"","Curfew in Paraguay (except in Alto Parana, Central, Asuncion, Conception and Caaguazu) from 23:00 to 05:00 from Sunday to Thursday and from 00:00 to 05:00 on Friday and Saturday from 13/09/2020 to 04/10/2020.",2020-09-12,2020-09-13,2020-10-04,The policy has a clear end date,Paraguay,PRY,PY,National,1,,,,Curfew,Yes the curfew times differ depending on the day of the week,,"",,,,,,"","","","","","","","","","","",,,,"",Yes,Paraguay,"One or more countries, but not all countries",,,,,,All Residents (Citizen Residents + Foreign Residents),No special population targeted,,,Mandatory (Unspecified/Implied),"National Government,Military,Provincial/State Government,Municipal Government,Police",,,,,https://tummgmt.eu.qualtrics.com/Q/File.php?F=F_2zCGU8vEIAPIfxB,https://www.mspbs.gov.py/dependencias/portal/adjunto/80436a-DECRETO4045.pdf ; https://www.mspbs.gov.py/dependencias/portal/adjunto/89dfb8-decreto4065.pdf ; https://www.mspbs.gov.py/dependencias/portal/adjunto/1c26a1-DECRETO4015.pdf,2021-06-23,2021-06-23T11:39:52Z,27818,525,14288,2981,229992,31.856,,,,,,100,32.9,2,0.961252152919769,0.823284327983856,9,29,6867062,36207104850.3802,4.95805142159847,15.74224691625,24.3125212031055,2,2,0.597955494226369,1.50005723202781,156462
R_1ogLA7CirT5GvADDe,7857544,new_entry,,,"",Curfew from 20:00 to 05:00 in the department of Caaguazú in Paraguay from 13/09/2020 until 27/09/2020.,2020-09-12,2020-09-13,2020-09-27,The policy has a clear end date,Paraguay,PRY,PY,Provincial,1,Caaguazu,,,Curfew,No the curfew times are always the same regardless of the day of the week,,"",,,,,,"","","","","","","","","","","",,,,"",Yes,Paraguay,One or more provinces within one or more countries,,Caaguazu,,,,All Residents (Citizen Residents + Foreign Residents),No special population targeted,,,Mandatory (Unspecified/Implied),"National Government,Military,Provincial/State Government,Municipal Government,Police",,,,,https://tummgmt.eu.qualtrics.com/Q/File.php?F=F_31vkFHy7Ok4VYiN,https://www.mspbs.gov.py/dependencias/portal/adjunto/80436a-DECRETO4045.pdf,2021-06-28,2021-06-28T13:56:23Z,27818,525,14288,2981,229992,31.856,,,,,,100,32.9,2,0.961252152919769,0.823284327983856,9,29,6867062,36207104850.3802,4.95805142159847,15.74224691625,24.3125212031055,2,2,0.597955494226369,1.50005723202781,156462
R_3j0acg80mETp1uuDe,9861281,update,Change of Policy,Strengthening,timing of policy strengthening,"Curfew changes in the Paraguayan department of Central. The curfew is now from 20:00 to 05:00 from 23/08/2020 to 06/09/2020. It was then extended until 20/09/2020. 

UPDATE: After being extended once until 20/09/2020, it is finally extended until 04/10/2020. UPDATE: The curfew from 20:00 to 05:00 in Central, Paraguay was set to last from 23/08/2020 to 06/09/2020. At first, it was extended until 20/09/2020. Then, it was extended further until 04/10/2020.",2020-09-19,2020-09-20,2020-10-04,The policy has a clear end date,Paraguay,PRY,PY,Provincial,1,Central,,,Curfew,No the curfew times are always the same regardless of the day of the week,,"",,,,,,"","","","","","","","","","","",,,,"",Yes,Paraguay,One or more provinces within one or more countries,,Central,,,,All Residents (Citizen Residents + Foreign Residents),No special population targeted,,,"Mandatory with Legal Penalties (Jail Time),Mandatory with Fines","National Government,Military,Provincial/State Government,Municipal Government,Police",,,,,https://tummgmt.eu.qualtrics.com/Q/File.php?F=F_2VgXf436TjXoIaG ; https://tummgmt.eu.qualtrics.com/Q/File.php?F=F_2fB3FgRJ2i2c8ql,NA ; https://www.mspbs.gov.py/dependencias/portal/adjunto/f35f6e-decreto4066.pdf,2021-06-22,2021-06-22T14:12:54Z,33520,659,18117,2506,250882,34.75,,,,,,100,32.9,2,0.961252152919769,0.823284327983856,9,29,6867062,36207104850.3802,4.95805142159847,15.74224691625,24.3125212031055,2,2,0.597955494226369,1.50005723202781,156462
R_UQIELBd10ijQaPvDe,5530859,update,Change of Policy,Strengthening,timing of policy strengthening,"Curfew changes in the Paraguayan department of Central. The curfew is now from 20:00 to 05:00 from 23/08/2020 to 06/09/2020. It was then extended until 20/09/2020. 

UPDATE: After being extended once until 20/09/2020, it is finally extended until 04/10/2020. UPDATE: The curfew from 20:00 to 05:00 in Asuncion, Paraguay was set to last from 23/08/2020 to 06/09/2020. At first, it was extended until 20/09/2020. Then, it was extended further until 04/10/2020",2020-09-19,2020-09-20,2020-10-04,The policy has a clear end date,Paraguay,PRY,PY,Municipal,1,Asuncion,,Asuncion,Curfew,No the curfew times are always the same regardless of the day of the week,,"",,,,,,"","","","","","","","","","","",,,,"",Yes,Paraguay,One or more cities within one or more countries,,Asuncion,Asuncion,,,All Residents (Citizen Residents + Foreign Residents),No special population targeted,,,"Mandatory with Legal Penalties (Jail Time),Mandatory with Fines","National Government,Military,Municipal Government,Police",,,,,https://tummgmt.eu.qualtrics.com/Q/File.php?F=F_2Qrpzud6bdlvjLK ; https://tummgmt.eu.qualtrics.com/Q/File.php?F=F_1lcJw9ZEopbizKw,NA ; https://www.mspbs.gov.py/dependencias/portal/adjunto/f35f6e-decreto4066.pdf,2021-06-22,2021-06-22T15:25:20Z,33520,659,18117,2506,250882,34.75,,,,,,100,32.9,2,0.961252152919769,0.823284327983856,9,29,6867062,36207104850.3802,4.95805142159847,15.74224691625,24.3125212031055,2,2,0.597955494226369,1.50005723202781,156462
R_PHyScJZB6ZqqrwlDe,2918276,update,Change of Policy,Strengthening,timing of policy strengthening,"The curfew from 20:00 to 05:00 in Alto Parana started on 23/08/2020. At first, it was supposed to last until 06/09/2020. It was then extended to 20/09/2020. On September 19, it was for the second time extended, this time until October 4, 2020. UPDATE: The curfew from 20:00 to 05:00 in Alto Parana started on 23/08/2020. At first, it was supposed to last until 06/09/2020. It was then extended to 20/09/2020. On September 19, it was for the second time extended, this time until October 4, 2020.",2020-09-19,2020-09-21,2020-10-04,The policy has a clear end date,Paraguay,PRY,PY,Provincial,1,Alto Parana,,,Curfew,No the curfew times are always the same regardless of the day of the week,,"",,,,,,"","","","","","","","","","","",,,,"",Yes,Paraguay,One or more provinces within one or more countries,,Alto Parana,,,,All Residents (Citizen Residents + Foreign Residents),No special population targeted,,,"Mandatory with Legal Penalties (Jail Time),Mandatory with Fines","National Government,Military,Provincial/State Government,Municipal Government,Police",,,,,https://tummgmt.eu.qualtrics.com/Q/File.php?F=F_AHCEqvCa62CCxep ; https://tummgmt.eu.qualtrics.com/Q/File.php?F=F_31gsZEWljyduJ3L,NA ; https://www.mspbs.gov.py/dependencias/portal/adjunto/1b788b-decreto4067.pdf,2021-06-22,2021-06-22T11:15:30Z,34260,676,18629,2061,252943,35.035,,,,,,100,32.9,2,0.961252152919769,0.823284327983856,9,29,6867062,36207104850.3802,4.95805142159847,15.74224691625,24.3125212031055,2,2,0.597955494226369,1.50005723202781,156462
R_3HNqSWHd1n0EzItDe,9003980,update,Change of Policy,Strengthening,timing of policy strengthening,"Curfew from 20:00 to 05:00 in Caaguazú, Paraguay from 13/09/2020 to 27/09/2020. 

UPDATE: Curfew is extended until 04/10/2020. UPDATE: Curfew from 20:00 to 05:00 in Caaguazú, Paraguay was set to last from 13/09/2020 to 27/09/2020. It was extended to October 4, 2020, on 26/09/2020.",2020-09-26,2020-09-27,2020-10-04,The policy has a clear end date,Paraguay,PRY,PY,Provincial,1,Caaguazu,,,Curfew,No the curfew times are always the same regardless of the day of the week,,"",,,,,,"","","","","","","","","","","",,,,"",Yes,Paraguay,One or more provinces within one or more countries,,Caaguazu,,,,All Residents (Citizen Residents + Foreign Residents),No special population targeted,,,Mandatory (Unspecified/Implied),"National Government,Military,Provincial/State Government,Municipal Government,Police",,,,,https://tummgmt.eu.qualtrics.com/Q/File.php?F=F_2wGn6E0glULXtP5 ; https://tummgmt.eu.qualtrics.com/Q/File.php?F=F_rkGBfvPgbc5jTUd,NA ; https://www.mspbs.gov.py/dependencias/portal/adjunto/6bd712-DECRETO4095.PDF,2021-06-22,2021-06-22T11:28:09Z,38684,803,22419,2648,269710,37.358,,,,,,100,32.9,2,0.961252152919769,0.823284327983856,9,29,6867062,36207104850.3802,4.95805142159847,15.74224691625,24.3125212031055,2,2,0.597955494226369,1.50005723202781,156462
R_1CjuqOigbmMxmozDe,7529939,update,Change of Policy,Strengthening,timing of policy strengthening,"Curfew from 20:00 to 05:00 in Conception, Paraguay from 13/09/2020 to 27/09/2020. 

UPDATE: It is extended until 04/10/2020. UPDATE: Curfew from 20:00 to 05:00 in Conception, Paraguay was set to last from 13/09/2020 to 27/09/2020. It was extended on September 26 until 04/10/2020.",2020-09-26,2020-09-27,2020-10-04,The policy has a clear end date,Paraguay,PRY,PY,Provincial,1,Concepcion,,,Curfew,No the curfew times are always the same regardless of the day of the week,,"",,,,,,"","","","","","","","","","","",,,,"",Yes,Paraguay,One or more provinces within one or more countries,,Concepcion,,,,All Residents (Citizen Residents + Foreign Residents),No special population targeted,,,Mandatory (Unspecified/Implied),"National Government,Military,Provincial/State Government,Municipal Government,Police",,,,,https://tummgmt.eu.qualtrics.com/Q/File.php?F=F_1GI8ULkVCfCrGhf ; https://tummgmt.eu.qualtrics.com/Q/File.php?F=F_1H75QgTdZ2SJZ3K,NA ; https://www.mspbs.gov.py/dependencias/portal/adjunto/6bd712-DECRETO4095.PDF,2021-06-22,2021-06-22T11:32:30Z,38684,803,22419,2648,269710,37.358,,,,,,100,32.9,2,0.961252152919769,0.823284327983856,9,29,6867062,36207104850.3802,4.95805142159847,15.74224691625,24.3125212031055,2,2,0.597955494226369,1.50005723202781,156462
R_SVJvS71uGVijDNfDe,963093,new_entry,,,"",Curfew from 23:59 to 05:00 in Paraguay from 05/10/2020 to 25/10/2020.,2020-10-03,2020-10-05,2020-10-25,The policy has a clear end date,Paraguay,PRY,PY,National,1,,,,Curfew,No the curfew times are always the same regardless of the day of the week,,"",,,,,,"","","","","","","","","","","",,,,"",Yes,Paraguay,"One or more countries, but not all countries",,,,,,All Residents (Citizen Residents + Foreign Residents),No special population targeted,,,Mandatory (Unspecified/Implied),"National Government,Military,Provincial/State Government,Municipal Government,Police",,,,,https://tummgmt.eu.qualtrics.com/Q/File.php?F=F_5BYg14A4XkX20Y9,https://www.mspbs.gov.py/dependencias/portal/adjunto/833118-DECRETO4115lvth10qp.pdf,2021-06-25,2021-06-25T15:01:27Z,44715,947,27887,2005,290507,40.238,,,,,,100,32.9,2,0.961252152919769,0.823284327983856,9,29,6867062,36207104850.3802,4.95805142159847,15.74224691625,24.3125212031055,2,2,0.597955494226369,1.50005723202781,156462
R_2Y2LjnB9tUrjy18De,963093,update,Change of Policy,Strengthening,timing of policy strengthening,"Curfew from 23:59 to 05:00 in Paraguay from 05/10/2020 to 25/10/2020. 

UPDATE: This curfew is now extended until 15/11/2020. UPDATE: At first, it was supposed to last until October 25th, 2020, but it was extended until November 15th, 2020",2020-10-25,2020-10-26,2020-11-15,The policy has a clear end date,Paraguay,PRY,PY,National,1,,,,Curfew,No the curfew times are always the same regardless of the day of the week,,"",,,,,,"","","","","","","","","","","",,,,"",Yes,Paraguay,"One or more countries, but not all countries",,,,,,All Residents (Citizen Residents + Foreign Residents),No special population targeted,,,Mandatory (Unspecified/Implied),"National Government,Military,Provincial/State Government,Municipal Government,Police",,,,,https://tummgmt.eu.qualtrics.com/Q/File.php?F=F_5BYg14A4XkX20Y9 ; https://tummgmt.eu.qualtrics.com/Q/File.php?F=F_z897xpFBXptAgmd,NA ; https://www.mspbs.gov.py/dependencias/portal/adjunto/05e25a-DECRETO4220anl90l72.pdf,2021-06-28,2021-06-28T14:56:32Z,60109,1333,40247,2426,350289,48.519,,,,,,100,32.9,2,0.961252152919769,0.823284327983856,9,29,6867062,36207104850.3802,4.95805142159847,15.74224691625,24.3125212031055,2,2,0.597955494226369,1.50005723202781,156462
R_21HyOXE3Nmt7xpODe,6924962,new_entry,,,"",Curfew from 23:00 to 05:00 in the city of Caacupé in Paraguay from 14/11/2020 to 16/12/2020.,2020-11-13,2020-11-14,2020-12-16,The policy has a clear end date,Paraguay,PRY,PY,Municipal,1,Cordillera,,Caacupé,Curfew,No the curfew times are always the same regardless of the day of the week,,"",,,,,,"","","","","","","","","","","",,,,"",Yes,Paraguay,One or more cities within one or more countries,,Cordillera,Caacupé,,,All Residents (Citizen Residents + Foreign Residents),No special population targeted,,,Mandatory (Unspecified/Implied),"National Government,Military,Municipal Government,Police",,,,,https://tummgmt.eu.qualtrics.com/Q/File.php?F=F_3nckuWAssvd0e3M,https://www.mspbs.gov.py/dependencias/portal/adjunto/8bd852-Decreto4330.pdf,2021-06-28,2021-06-28T15:05:26Z,71065,1569,50965,2589,401017,55.545,,,,,,100,32.9,2,0.961252152919769,0.823284327983856,9,29,6867062,36207104850.3802,4.95805142159847,15.74224691625,24.3125212031055,2,2,0.597955494226369,1.50005723202781,156462
R_PON8HaMowy9SPNDDe,4720690,new_entry,,,"",Curfew from 23:59 to 05:00 in Paraguay except in the city of Caacupé from 16/11/2020 to 06/12/2020.,2020-11-15,2020-11-16,2020-12-06,The policy has a clear end date,Paraguay,PRY,PY,National,1,,,,Curfew,No the curfew times are always the same regardless of the day of the week,,"",,,,,,"","","","","","","","","","","",,,,"",Yes,Paraguay,"One or more countries, but not all countries",,,,,,All Residents (Citizen Residents + Foreign Residents),No special population targeted,,,Mandatory (Unspecified/Implied),"National Government,Military,Provincial/State Government,Municipal Government,Police",,,,,https://tummgmt.eu.qualtrics.com/Q/File.php?F=F_1hExJIhRyKrxJXr,https://www.mspbs.gov.py/dependencias/portal/adjunto/4a93f8-SesquicentenariodelaEpopeyaNacional18641870.pdf ; https://www.mspbs.gov.py/dependencias/portal/adjunto/8bd852-Decreto4330.pdf,2021-06-28,2021-06-28T15:20:33Z,72099,1602,51776,3252,405816,56.21,,,,,,100,32.9,2,0.961252152919769,0.823284327983856,9,29,6867062,36207104850.3802,4.95805142159847,15.74224691625,24.3125212031055,2,2,0.597955494226369,1.50005723202781,156462
R_1jqCUz6fYhk93ADDe,4720690,update,Change of Policy,Strengthening,timing of policy strengthening,"Curfew from 23:59 to 05:00 in Paraguay except in the city of Caacupé from 16/11/2020 to 06/12/2020. 

UPDATE: Curfew from 23:59 to 05:00 in Paraguay except in Caacupé. This policy is extended until 20/12/2020. UPDATE: The national curfew except in Caacupé was first announced to last until 06/12/2020, but it was in fact extended until 20/12/2020",2020-12-06,2020-12-07,2020-12-20,The policy has a clear end date,Paraguay,PRY,PY,National,1,,,,Curfew,No the curfew times are always the same regardless of the day of the week,,"",,,,,,"","","","","","","","","","","",,,,"",Yes,Paraguay,"One or more countries, but not all countries",,,,,,All Residents (Citizen Residents + Foreign Residents),No special population targeted,,,Mandatory (Unspecified/Implied),"National Government,Military,Provincial/State Government,Municipal Government,Police",,,,,https://tummgmt.eu.qualtrics.com/Q/File.php?F=F_1hExJIhRyKrxJXr ; https://tummgmt.eu.qualtrics.com/Q/File.php?F=F_1HeovIUBrw1qGCp,NA ; https://www.mspbs.gov.py/dependencias/portal/adjunto/00f0dd-DECRETO4455.pdf,2021-07-05,2021-07-05T15:11:10Z,88723,1872,62603,3912,477350,66.118,,,,,,100,32.9,2,0.961252152919769,0.823284327983856,9,29,6867062,36207104850.3802,4.95805142159847,15.74224691625,24.3125212031055,2,2,0.597955494226369,1.50005723202781,156462
R_3nvgjuUCB0bAFowDe,5822085,new_entry,,,"",Curfew from 23:59 to 05:00 in Paraguay from 21/12/2020 to 24/12/2020,2020-12-18,2020-12-21,2020-12-24,The policy has a clear end date,Paraguay,PRY,PY,National,1,,,,Curfew,No the curfew times are always the same regardless of the day of the week,,"",,,,,,"","","","","","","","","","","",,,,"",Yes,Paraguay,"One or more countries, but not all countries",,,,,,All Residents (Citizen Residents + Foreign Residents),No special population targeted,,,Mandatory (Unspecified/Implied),"National Government,Military,Provincial/State Government,Municipal Government,Police",,,,,https://tummgmt.eu.qualtrics.com/Q/File.php?F=F_8GkHNcGmmiRuPFn,https://www.mspbs.gov.py/dependencias/portal/adjunto/471f48-Decreto4525Medidasespecficasdel21.12.20al10.01.21.pdf,2021-06-28,2021-06-28T15:33:36Z,100612,2103,72721,3683,529713,73.371,,,,,,100,32.9,2,0.961252152919769,0.823284327983856,9,29,6867062,36207104850.3802,4.95805142159847,15.74224691625,24.3125212031055,2,2,0.597955494226369,1.50005723202781,156462
R_3oYiTs2grm4dlq5De,3419091,new_entry,,,"","For the night between the 24th and 25th, in Paraguay, the curfew is from 01:00 to 05:00.",2020-12-18,2020-12-24,2020-12-25,The policy has a clear end date,Paraguay,PRY,PY,National,1,,,,Curfew,No the curfew times are always the same regardless of the day of the week,,"",,,,,,"","","","","","","","","","","",,,,"",Yes,Paraguay,"One or more countries, but not all countries",,,,,,All Residents (Citizen Residents + Foreign Residents),No special population targeted,,,Mandatory (Unspecified/Implied),"National Government,Military,Provincial/State Government,Municipal Government,Police",,,,,https://tummgmt.eu.qualtrics.com/Q/File.php?F=F_pcvQKFpoXO1Lv7H,https://www.mspbs.gov.py/dependencias/portal/adjunto/471f48-Decreto4525Medidasespecficasdel21.12.20al10.01.21.pdf,2021-06-28,2021-06-28T15:36:57Z,103329,2154,75509,3627,540457,74.859,,,,,,100,32.9,2,0.961252152919769,0.823284327983856,9,29,6867062,36207104850.3802,4.95805142159847,15.74224691625,24.3125212031055,2,2,0.597955494226369,1.50005723202781,156462
R_31acUb1x7dYbjdbDe,617181,new_entry,,,"",Curfew from 23:59 to 05:00 in Paraguay from 25/12/2020 to 31/12/2020.,2020-12-18,2020-12-25,2020-12-31,The policy has a clear end date,Paraguay,PRY,PY,National,1,,,,Curfew,No the curfew times are always the same regardless of the day of the week,,"",,,,,,"","","","","","","","","","","",,,,"",Yes,Paraguay,"One or more countries, but not all countries",,,,,,All Residents (Citizen Residents + Foreign Residents),No special population targeted,,,Mandatory (Unspecified/Implied),"National Government,Military,Provincial/State Government,Municipal Government,Police",,,,,https://tummgmt.eu.qualtrics.com/Q/File.php?F=F_1ePOZNyaLryTERu,https://www.mspbs.gov.py/dependencias/portal/adjunto/471f48-Decreto4525Medidasespecficasdel21.12.20al10.01.21.pdf,2021-06-28,2021-06-28T15:40:22Z,103888,2154,75509,3911,544368,75.401,,,,,,100,32.9,2,0.961252152919769,0.823284327983856,9,29,6867062,36207104850.3802,4.95805142159847,15.74224691625,24.3125212031055,2,2,0.597955494226369,1.50005723202781,156462
R_3OjrMEjLJpVS22TDe,8341810,new_entry,,,"","For the night between the 31st of December and the 1st of January, in Paraguay, the curfew is from 01:00 to 05:00",2020-12-18,2020-12-31,2021-01-01,The policy has a clear end date,Paraguay,PRY,PY,National,1,,,,Curfew,No the curfew times are always the same regardless of the day of the week,,"",,,,,,"","","","","","","","","","","",,,,"",Yes,Paraguay,"One or more countries, but not all countries",,,,,,All Residents (Citizen Residents + Foreign Residents),No special population targeted,,,Mandatory (Unspecified/Implied),"National Government,Military,Provincial/State Government,Municipal Government,Police",,,,,https://tummgmt.eu.qualtrics.com/Q/File.php?F=F_1GHSGJ4StgYYaOG,https://www.mspbs.gov.py/dependencias/portal/adjunto/471f48-Decreto4525Medidasespecficasdel21.12.20al10.01.21.pdf,2021-06-28,2021-06-28T15:43:23Z,107932,2262,81977,3274,560389,77.62,,,,,,100,32.9,2,0.961252152919769,0.823284327983856,9,29,6867062,36207104850.3802,4.95805142159847,15.74224691625,24.3125212031055,2,2,0.597955494226369,1.50005723202781,156462
R_88Jtzg7JrNeAREdDe,4016113,new_entry,,,"",Curfew from 23:59 to 05:00 in Paraguay from 01/01/2021 to 10/01/2021.,2020-12-18,2021-01-01,2021-01-10,The policy has a clear end date,Paraguay,PRY,PY,National,1,,,,Curfew,No the curfew times are always the same regardless of the day of the week,,"",,,,,,"","","","","","","","","","","",,,,"",Yes,Paraguay,"One or more countries, but not all countries",,,,,,All Residents (Citizen Residents + Foreign Residents),No special population targeted,,,Mandatory (Unspecified/Implied),"National Government,Military,Provincial/State Government,Municipal Government,Police",,,,,https://tummgmt.eu.qualtrics.com/Q/File.php?F=F_1mEnuB2PEH0R37d,https://www.mspbs.gov.py/dependencias/portal/adjunto/471f48-Decreto4525Medidasespecficasdel21.12.20al10.01.21.pdf,2021-06-28,2021-06-28T15:48:08Z,108349,2262,81977,3107,563496,78.05,,,,,,100,32.9,2,0.961252152919769,0.823284327983856,9,29,6867062,36207104850.3802,4.95805142159847,15.74224691625,24.3125212031055,2,2,0.597955494226369,1.50005723202781,156462
R_2zMyR96IhTBpKUZDe,8365737,new_entry,,,"",Curfew from 23:59 to 05:00 in Paraguay from 11/01/2021 to 31/01/2021.,2021-01-10,2021-01-11,2021-01-31,The policy has a clear end date,Paraguay,PRY,PY,National,1,,,,Curfew,No the curfew times are always the same regardless of the day of the week,,"",,,,,,"","","","","","","","","","","",,,,"",Yes,Paraguay,"One or more countries, but not all countries",,,,,,All Residents (Citizen Residents + Foreign Residents),No special population targeted,,,Mandatory (Unspecified/Implied),"National Government,Military,Provincial/State Government,Municipal Government,Police",,,,,https://tummgmt.eu.qualtrics.com/Q/File.php?F=F_PIqT9fAGEuYYdpf,https://www.mspbs.gov.py/dependencias/portal/adjunto/477e95-Documentosescaneados.pdf,2021-06-28,2021-06-28T15:57:01Z,116535,2421,92324,2481,589122,81.6,,,,,,100,32.9,2,0.961252152919769,0.823284327983856,9,29,6867062,36207104850.3802,4.95805142159847,15.74224691625,24.3125212031055,2,2,0.597955494226369,1.50005723202781,156462
R_2pMHnwaJABYyqBZDe,8365737,update,Change of Policy,Strengthening,timing of policy strengthening,"Curfew from 23:59 to 05:00 in Paraguay from 11/01/2021 to 31/01/2021. 

UPDATE: It is extended until 21/02/2021. UPDATE: At first, the national curfew in Paraguay was from 23:59 to 05:00 in Paraguay from 11/01/2021 to 31/01/2021. It was then extended until 21/02/2021.",2021-01-31,2021-02-01,2021-02-21,The policy has a clear end date,Paraguay,PRY,PY,National,1,,,,Curfew,No the curfew times are always the same regardless of the day of the week,,"",,,,,,"","","","","","","","","","","",,,,"",Yes,Paraguay,"One or more countries, but not all countries",,,,,,All Residents (Citizen Residents + Foreign Residents),No special population targeted,,,Mandatory (Unspecified/Implied),"National Government,Military,Provincial/State Government,Municipal Government,Police",,,,,https://tummgmt.eu.qualtrics.com/Q/File.php?F=F_PIqT9fAGEuYYdpf ; https://tummgmt.eu.qualtrics.com/Q/File.php?F=F_1g5wPKdkzVs4i2e,NA ; https://www.mspbs.gov.py/dependencias/portal/adjunto/25538d-DecretoN4798Medidasespecficashastael21defebrero.pdf,2021-07-05,2021-07-05T15:22:50Z,133781,2734,109227,3403,655988,90.862,,,,,,100,32.9,2,0.961252152919769,0.823284327983856,9,29,6867062,36207104850.3802,4.95805142159847,15.74224691625,24.3125212031055,2,2,0.597955494226369,1.50005723202781,156462
R_Y0442XwpMiJDJ3HDe,8365737,update,Change of Policy,Strengthening,timing of policy strengthening,"Curfew from 23:59 to 05:00 in Paraguay from 11/01/2021 to 31/01/2021. 

UPDATE: At first, this policy was extended until 21/02/2021, it was then extended again until 14/03/2021. UPDATE: At first, this policy was extended until 21/02/2021, it was then extended again until 14/03/2021.",2021-02-21,2021-02-22,2021-03-14,The policy has a clear end date,Paraguay,PRY,PY,National,1,,,,Curfew,No the curfew times are always the same regardless of the day of the week,,"",,,,,,"","","","","","","","","","","",,,,"",Yes,Paraguay,"One or more countries, but not all countries",,,,,,All Residents (Citizen Residents + Foreign Residents),No special population targeted,,,Mandatory (Unspecified/Implied),"National Government,Military,Provincial/State Government,Municipal Government,Police",,,,,https://tummgmt.eu.qualtrics.com/Q/File.php?F=F_PIqT9fAGEuYYdpf ; https://tummgmt.eu.qualtrics.com/Q/File.php?F=F_12nyQ2agzGhpnl9,NA ; https://www.mspbs.gov.py/dependencias/portal/adjunto/d21cbe-DECRETO488067dmn8zv.pdf,2021-07-05,2021-07-05T15:29:00Z,152658,3080,127819,3677,730141,101.133,,200,,0,,100,32.9,2,0.961252152919769,0.823284327983856,9,29,6867062,36207104850.3802,4.95805142159847,15.74224691625,24.3125212031055,2,2,0.597955494226369,1.50005723202781,156462
R_2uK6Cc2ebY5IkFUDe,8365737,update,Change of Policy,Strengthening,timing of policy strengthening,"Curfew from 23:59 to 05:00 in Paraguay from 11/01/2021 to 31/01/2021. 

UPDATE: It was first extended until 21/02/2021, then until 14/03/2021. It is now extended until 17/03/2021. UPDATE: This policy was first supposed to last until 31/01/2021. It was then extended twice until 14/03/2021. It was extended for the 3rd time until 17/03/2021.",2021-03-14,2021-03-15,2021-03-17,The policy has a clear end date,Paraguay,PRY,PY,National,1,,,,Curfew,No the curfew times are always the same regardless of the day of the week,,"",,,,,,"","","","","","","","","","","",,,,"",Yes,Paraguay,"One or more countries, but not all countries",,,,,,All Residents (Citizen Residents + Foreign Residents),No special population targeted,,,Mandatory (Unspecified/Implied),"National Government,Military,Provincial/State Government,Municipal Government,Police",,,,,https://tummgmt.eu.qualtrics.com/Q/File.php?F=F_PIqT9fAGEuYYdpf ; https://tummgmt.eu.qualtrics.com/Q/File.php?F=F_2ziuMK6y275N4dW,NA ; https://www.mspbs.gov.py/dependencias/portal/adjunto/2f49ed-DECRETO4989.pdf,2021-07-05,2021-07-05T15:39:45Z,181414,3517,150870,5097,816272,113.063,,12103,1460,0.18,218,100,32.9,2,0.961252152919769,0.823284327983856,9,29,6867062,36207104850.3802,4.95805142159847,15.74224691625,24.3125212031055,2,2,0.597955494226369,1.50005723202781,156462
R_3kAnhmV4RL6ku2vDe,3679516,new_entry,,,"","Curfew from 20:00 to 05:00 from 18/03/2021 to 27/03/2021 in the cities of Asunción, Lambaré, Luque, San Lorenzo, Fernando de la
Mora, Mariano Roque Alonso, Villa Elisa, Guarambaré, Ñemby,
Villarrica, Ciudad del Este, Caacupé, Hohenau, Caraguatay, San
Bernardino, Caazapá, Encarnación, Cnel. Bogado, Fram, San Juan
Bautista, San Ignacio, Ayolas, Paraguarí & Pila""",2021-03-17,2021-03-18,2021-03-27,The policy has a clear end date,Paraguay,PRY,PY,National,1,,,,Curfew,No the curfew times are always the same regardless of the day of the week,,"",,,,,,"","","","","","","","","","","",,,,"",Yes,Paraguay,"One or more countries, but not all countries",,,,,,All Residents (Citizen Residents + Foreign Residents),No special population targeted,,,Mandatory (Unspecified/Implied),"National Government,Ministry/Department of Justice,Military,Provincial/State Government,Municipal Government,Police",,,,,https://tummgmt.eu.qualtrics.com/Q/File.php?F=F_NXEqAYLrIMK1ADn,https://www.mspbs.gov.py/dependencias/portal/adjunto/60b95f-DECRETO5025100wpiwn.pdf,2021-07-06,2021-07-06T09:30:58Z,188493,3620,155244,5810,832387,115.295,,14545,1403,0.22,209,100,32.9,2,0.961252152919769,0.823284327983856,9,29,6867062,36207104850.3802,4.95805142159847,15.74224691625,24.3125212031055,2,2,0.597955494226369,1.50005723202781,156462
R_3n8Ew7G6wi1zJd4De,8608644,new_entry,,,"","Curfew from 23:59 to 05:00 in Paraguay (except for the cities of Asunción, Lambaré, Luque, San Lorenzo, Fernando de la
Mora, Mariano Roque Alonso, Villa Elisa, Guarambaré, Ñemby,
Villarrica, Ciudad del Este, Caacupé, Hohenau, Caraguatay, San
Bernardino, Caazapá, Encarnación, Cnel. Bogado, Fram, San Juan
Bautista, San Ignacio, Ayolas, Paraguarí & Pila) from 18/03/2021 to 27/03/2021.",2021-03-17,2021-03-18,2021-03-27,The policy has a clear end date,Paraguay,PRY,PY,National,1,,,,Curfew,No the curfew times are always the same regardless of the day of the week,,"",,,,,,"","","","","","","","","","","",,,,"",Yes,Paraguay,"One or more countries, but not all countries",,,,,,All Residents (Citizen Residents + Foreign Residents),No special population targeted,,,Mandatory (Unspecified/Implied),"National Government,Ministry/Department of Justice,Military,Provincial/State Government,Municipal Government,Police",,,,,https://tummgmt.eu.qualtrics.com/Q/File.php?F=F_C8fCgpPqpxMm0Nz,https://www.mspbs.gov.py/dependencias/portal/adjunto/60b95f-DECRETO5025100wpiwn.pdf,2021-07-08,2021-07-08T08:33:04Z,188493,3620,155244,5810,832387,115.295,,14545,1403,0.22,209,100,32.9,2,0.961252152919769,0.823284327983856,9,29,6867062,36207104850.3802,4.95805142159847,15.74224691625,24.3125212031055,2,2,0.597955494226369,1.50005723202781,156462
R_3kGtbnpQtMgLwdMDe,6283732,new_entry,,,"",National curfew in Paraguay from 23:59 to 05:00 from 05/04/2021 to 12/04/2021.,2021-04-04,2021-04-05,2021-04-12,The policy has a clear end date,Paraguay,PRY,PY,National,1,,,,Curfew,No the curfew times are always the same regardless of the day of the week,,"",,,,,,"","","","","","","","","","","",,,,"",Yes,Paraguay,"One or more countries, but not all countries",,,,,,All Residents (Citizen Residents + Foreign Residents),No special population targeted,,,Mandatory (Unspecified/Implied),"National Government,Ministry/Department of Justice,Military,Provincial/State Government,Municipal Government,Police",,,,,https://tummgmt.eu.qualtrics.com/Q/File.php?F=F_1MM2F4D96wuktui,https://www.mspbs.gov.py/dependencias/portal/adjunto/7969ce-SesquicentenariodelaEpopeyaNacional186418701.pdf,2021-07-05,2021-07-05T16:30:23Z,222663,4463,183552,5139,940486,130.268,,47292,674,0.71,101,100,32.9,2,0.961252152919769,0.823284327983856,9,29,6867062,36207104850.3802,4.95805142159847,15.74224691625,24.3125212031055,2,2,0.597955494226369,1.50005723202781,156462
