record_id,policy_id,entry_type,update_type,update_level,update_level_var,description,date_announced,date_start,date_end,date_end_spec,country,ISO_A3,ISO_A2,init_country_level,domestic_policy,province,ISO_L2,city,type,type_sub_cat,type_new_admin_coop,type_vac_cat,type_vac_mix,type_vac_reg,type_vac_purchase,type_vac_group,type_vac_group_rank,type_vac_who_pays,type_vac_dist_admin,type_vac_loc,type_vac_cost_num,type_vac_cost_scale,type_vac_cost_unit,type_vac_cost_gov_perc,type_vac_amt_num,type_vac_amt_scale,type_vac_amt_unit,type_vac_amt_gov_perc,type_text,institution_cat,institution_status,institution_conditions,target_init_same,target_country,target_geog_level,target_region,target_province,target_city,target_intl_org,target_other,target_who_what,target_who_gen,target_direction,travel_mechanism,compliance,enforcer,dist_index_high_est,dist_index_med_est,dist_index_low_est,dist_index_country_rank,pdf_link,link,date_updated,recorded_date,confirmed_cases,deaths,recovered,new_tests,total_tests,total_tests_per_thousand,tests_units,total_vaccinations,daily_vaccinations,total_vaccinations_per_hundred,daily_vaccinations_per_million,Rank_FP,Score_FP,muni_IDC,dispersive_IDC,constraining_IDC,sfi_SFI,ti_cpi_TI,pop_WDI_PW,gdp_WDI_PW,growth_WDI_PW,lnpop_WDI_PW,lngdp_WDI_PW,disap_FA,polpris_FA,latentmean_FA,transparencyindex_HR,EmigrantStock_EMS
R_21msljU3VL4xnk4Er,2672863Er,new_entry,,,"","Poland is closing schools and universities for two weeks from thursday the 12th of March to the 15th of March. Speaking at a joint conference following a special meeting on coronavirus, the ministers said that pre-schools and schools would stop teaching on Thursday, but limited care would still be provided this week to the youngest children.",2020-03-11,2020-03-12,2020-03-25,The policy has a clear end date,Poland,POL,PL,National,1,,,,Closure and Regulation of Schools,Preschool or childcare facilities (generally for children ages 5 and below),,"",,,,,,"","","","","","","","","","","",,,Preschool or childcare facilities closed/locked down,"",,Poland,,,,,,,All Residents (Citizen Residents + Foreign Residents),,,,Mandatory with Legal Penalties (Jail Time),"National Government,Ministry/Department of Health,Other (Please specify in the text box)",50.8764088326475,46.6967805956317,42.1658355238016,105,https://tummgmt.eu.qualtrics.com/Q/File.php?F=F_3Rl48qLjCEZ2Ckf,https://tvn24.pl/tvn24-news-in-english/coronavirus-crisis-polandshuts-all-schools-museums-cinemas-for-two-weeks-4346981,2020-03-28,2020-03-28T12:56:38Z,49,1,0,,,,,,,,,62,28.6,1,1.44043707847595,0.548431634902954,0,60,37974826,601720558485.059,4.93766324502775,17.4524340244738,27.1230589859233,2,2,1.66554456179387,4.8835145664111,619403
R_21msljU3VL4xnk4Et,2672863Et,new_entry,,,"","Poland is closing schools and universities for two weeks from thursday the 12th of March to the 15th of March. Speaking at a joint conference following a special meeting on coronavirus, the ministers said that pre-schools and schools would stop teaching on Thursday, but limited care would still be provided this week to the youngest children.",2020-03-11,2020-03-12,2020-03-25,The policy has a clear end date,Poland,POL,PL,National,1,,,,Closure and Regulation of Schools,Primary Schools (generally for children ages 10 and below),,"",,,,,,"","","","","","","","","","","",,,Primary Schools closed/locked down,"",,Poland,,,,,,,All Residents (Citizen Residents + Foreign Residents),,,,Mandatory with Legal Penalties (Jail Time),"National Government,Ministry/Department of Health,Other (Please specify in the text box)",50.8764088326475,46.6967805956317,42.1658355238016,105,https://tummgmt.eu.qualtrics.com/Q/File.php?F=F_3Rl48qLjCEZ2Ckf,https://tvn24.pl/tvn24-news-in-english/coronavirus-crisis-polandshuts-all-schools-museums-cinemas-for-two-weeks-4346981,2020-03-28,2020-03-28T12:56:38Z,49,1,0,,,,,,,,,62,28.6,1,1.44043707847595,0.548431634902954,0,60,37974826,601720558485.059,4.93766324502775,17.4524340244738,27.1230589859233,2,2,1.66554456179387,4.8835145664111,619403
R_21msljU3VL4xnk4Gd,2672863Gd,new_entry,,,"","Poland is closing schools and universities for two weeks from thursday the 12th of March to the 15th of March. Speaking at a joint conference following a special meeting on coronavirus, the ministers said that pre-schools and schools would stop teaching on Thursday, but limited care would still be provided this week to the youngest children.",2020-03-11,2020-03-12,2020-03-25,The policy has a clear end date,Poland,POL,PL,National,1,,,,Closure and Regulation of Schools,Secondary Schools (generally for children ages 10 to 18),,"",,,,,,"","","","","","","","","","","",,,Secondary Schools closed/locked down,"",,Poland,,,,,,,All Residents (Citizen Residents + Foreign Residents),,,,Mandatory with Legal Penalties (Jail Time),"National Government,Ministry/Department of Health,Other (Please specify in the text box)",50.8764088326475,46.6967805956317,42.1658355238016,105,https://tummgmt.eu.qualtrics.com/Q/File.php?F=F_3Rl48qLjCEZ2Ckf,https://tvn24.pl/tvn24-news-in-english/coronavirus-crisis-polandshuts-all-schools-museums-cinemas-for-two-weeks-4346981,2020-03-28,2020-03-28T12:56:38Z,49,1,0,,,,,,,,,62,28.6,1,1.44043707847595,0.548431634902954,0,60,37974826,601720558485.059,4.93766324502775,17.4524340244738,27.1230589859233,2,2,1.66554456179387,4.8835145664111,619403
R_21msljU3VL4xnk4Cr,2672863Cr,new_entry,,,"","Poland is closing schools and universities for two weeks from thursday the 12th of March to the 15th of March. Speaking at a joint conference following a special meeting on coronavirus, the ministers said that pre-schools and schools would stop teaching on Thursday, but limited care would still be provided this week to the youngest children.",2020-03-11,2020-03-12,2020-03-25,The policy has a clear end date,Poland,POL,PL,National,1,,,,Closure and Regulation of Schools,Higher education institutions (i.e. degree granting institutions),,"",,,,,,"","","","","","","","","","","",,,Higher education institutions closed/locked down,"",,Poland,,,,,,,All Residents (Citizen Residents + Foreign Residents),,,,Mandatory with Legal Penalties (Jail Time),"National Government,Ministry/Department of Health,Other (Please specify in the text box)",50.8764088326475,46.6967805956317,42.1658355238016,105,https://tummgmt.eu.qualtrics.com/Q/File.php?F=F_3Rl48qLjCEZ2Ckf,https://tvn24.pl/tvn24-news-in-english/coronavirus-crisis-polandshuts-all-schools-museums-cinemas-for-two-weeks-4346981,2020-03-28,2020-03-28T12:56:38Z,49,1,0,,,,,,,,,62,28.6,1,1.44043707847595,0.548431634902954,0,60,37974826,601720558485.059,4.93766324502775,17.4524340244738,27.1230589859233,2,2,1.66554456179387,4.8835145664111,619403
R_30wsZF59oRPYzmeEt,5301014Et,new_entry,,,"","On March 12th 2020 the Polish government mandated that classes in kindergarten, schools, and universities will be suspended from March 12th till march 25th.",2020-03-12,2020-03-12,2020-03-25,The policy has a clear end date,Poland,POL,PL,National,1,,,,Closure and Regulation of Schools,Primary Schools (generally for children ages 10 and below),,"",,,,,,"","","","","","","","","","","",,,Primary Schools closed/locked down,"",Yes,Poland,"One or more countries, but not all countries",,,,,,All Residents (Citizen Residents + Foreign Residents),No special population targeted,,,Mandatory (Unspecified/Implied),National Government,50.8764088326475,46.6967805956317,42.1658355238016,105,https://tummgmt.eu.qualtrics.com/Q/File.php?F=F_1gAdWwMzqWZ10XP,https://twitter.com/PremierRP_en/status/1237777172317814784,2021-08-24,2021-08-24T15:04:36Z,49,1,0,,,,,,,,,62,28.6,1,1.44043707847595,0.548431634902954,0,60,37974826,601720558485.059,4.93766324502775,17.4524340244738,27.1230589859233,2,2,1.66554456179387,4.8835145664111,619403
R_elKb3PXbg35reUhGd,6766669Gd,new_entry,,,"","On March 12th 2020 the Polish government mandated that classes in kindergarten, schools, and universities will be suspended from March 12th till march 25th.",2020-03-12,2020-03-12,2020-03-25,The policy has a clear end date,Poland,POL,PL,National,1,,,,Closure and Regulation of Schools,Secondary Schools (generally for children ages 10 to 18),,"",,,,,,"","","","","","","","","","","",,,Secondary Schools closed/locked down,"",Yes,Poland,"One or more countries, but not all countries",,,,,,All Residents (Citizen Residents + Foreign Residents),No special population targeted,,,Mandatory (Unspecified/Implied),National Government,50.8764088326475,46.6967805956317,42.1658355238016,105,https://tummgmt.eu.qualtrics.com/Q/File.php?F=F_2vcyAKtwJLYh8uP,https://twitter.com/PremierRP_en/status/1237777172317814784,2021-08-24,2021-08-24T15:08:36Z,49,1,0,,,,,,,,,62,28.6,1,1.44043707847595,0.548431634902954,0,60,37974826,601720558485.059,4.93766324502775,17.4524340244738,27.1230589859233,2,2,1.66554456179387,4.8835145664111,619403
R_sd4Zcq3lCXbLYvDGd,9655700Gd,new_entry,,,"","On March 12th 2020 the Polish government mandated that classes in kindergarten, schools, and universities will be suspended from March 12th till march 25th.",2020-03-12,2020-03-12,2020-03-25,The policy has a clear end date,Poland,POL,PL,National,1,,,,Closure and Regulation of Schools,Secondary Schools (generally for children ages 10 to 18),,"",,,,,,"","","","","","","","","","","",,,Secondary Schools closed/locked down,"",Yes,Poland,"One or more countries, but not all countries",,,,,,All Residents (Citizen Residents + Foreign Residents),No special population targeted,,,Mandatory (Unspecified/Implied),National Government,50.8764088326475,46.6967805956317,42.1658355238016,105,https://tummgmt.eu.qualtrics.com/Q/File.php?F=F_3rOpAGq6iG3nwbr,https://twitter.com/PremierRP_en/status/1237777172317814784,2021-08-24,2021-08-24T15:31:14Z,49,1,0,,,,,,,,,62,28.6,1,1.44043707847595,0.548431634902954,0,60,37974826,601720558485.059,4.93766324502775,17.4524340244738,27.1230589859233,2,2,1.66554456179387,4.8835145664111,619403
R_sd4Zcq3lCXbLYvDCr,9655700Cr,new_entry,,,"","On March 12th 2020 the Polish government mandated that classes in kindergarten, schools, and universities will be suspended from March 12th till march 25th.",2020-03-12,2020-03-12,2020-03-25,The policy has a clear end date,Poland,POL,PL,National,1,,,,Closure and Regulation of Schools,Higher education institutions (i.e. degree granting institutions),,"",,,,,,"","","","","","","","","","","",,,Higher education institutions closed/locked down,"",Yes,Poland,"One or more countries, but not all countries",,,,,,All Residents (Citizen Residents + Foreign Residents),No special population targeted,,,Mandatory (Unspecified/Implied),National Government,50.8764088326475,46.6967805956317,42.1658355238016,105,https://tummgmt.eu.qualtrics.com/Q/File.php?F=F_3rOpAGq6iG3nwbr,https://twitter.com/PremierRP_en/status/1237777172317814784,2021-08-24,2021-08-24T15:31:14Z,49,1,0,,,,,,,,,62,28.6,1,1.44043707847595,0.548431634902954,0,60,37974826,601720558485.059,4.93766324502775,17.4524340244738,27.1230589859233,2,2,1.66554456179387,4.8835145664111,619403
R_31jyGLKdH49yzFXCr,6919506Cr,new_entry,,,"",On April 24th 2020 the Polish government mandated that all universities are closed until May 24th,2020-04-24,2020-04-24,2020-05-24,The policy has a clear end date,Poland,POL,PL,National,1,,,,Closure and Regulation of Schools,Higher education institutions (i.e. degree granting institutions),,"",,,,,,"","","","","","","","","","","",,,Higher education institutions closed/locked down,"",Yes,Poland,"One or more countries, but not all countries",,,,,,All Residents (Citizen Residents + Foreign Residents),No special population targeted,,,Mandatory (Unspecified/Implied),National Government,68.6882353800753,65.1005781811879,61.2948756545906,48,https://tummgmt.eu.qualtrics.com/Q/File.php?F=F_3meH22ZzwChV7Ep,https://twitter.com/PremierRP_en/status/1253687518404521991,2021-08-26,2021-08-26T15:46:28Z,10892,494,1944,,,,,,,,,62,28.6,1,1.44043707847595,0.548431634902954,0,60,37974826,601720558485.059,4.93766324502775,17.4524340244738,27.1230589859233,2,2,1.66554456179387,4.8835145664111,619403
R_1hyDVhBEV8s0OIqEr,9482784Er,new_entry,,,"",On May 4th 2020 the Polish government issued that nurseries and kindergartens reopen on May 6th,2020-05-04,2020-05-04,,The policy’s end date is unknown or unreported,Poland,POL,PL,National,1,,,,Closure and Regulation of Schools,Preschool or childcare facilities (generally for children ages 5 and below),,"",,,,,,"","","","","","","","","","","",,,Preschool or childcare facilities allowed to open with no conditions,"",Yes,Poland,"One or more countries, but not all countries",,,,,,All Residents (Citizen Residents + Foreign Residents),No special population targeted,,,Voluntary/Recommended but No Penalties,National Government,68.3214188038036,65.0252795045963,61.8048616215676,55,https://tummgmt.eu.qualtrics.com/Q/File.php?F=F_3oMACIeeQ0yqBtQ,https://www.garda.com/crisis24/news-alerts/339151/poland-government-further-eases-covid-19-restrictions-from-may-4-update-10,2021-08-25,2021-08-25T15:47:57Z,14006,698,4095,7304,350048,9.261,,,,,,62,28.6,1,1.44043707847595,0.548431634902954,0,60,37974826,601720558485.059,4.93766324502775,17.4524340244738,27.1230589859233,2,2,1.66554456179387,4.8835145664111,619403
R_2QVyI2t5L6JqEiuNA,1506797,new_entry,,,"","Poland issued an ordinance that restricts movement of individuals on New Years Eve from 7pm 31.12.2020 to 6am 01.01.2021. All movement outside is prohibited except if:
a) performing official, professional or business activities
b) carrying out necessary needs related to the current affairs of everyday life.",2020-12-21,2020-12-31,2021-01-01,The policy has a clear end date,Poland,POL,PL,National,1,,,,Curfew,,,"",,,,,,"","","","","","","","","","","",,,,"",Yes,Poland,"One or more countries, but not all countries",,,,,,All Residents (Citizen Residents + Foreign Residents),No special population targeted,,,"Mandatory with Fines,Mandatory with Exceptions (Please list exceptions in the text entry)","National Government,Police",66.2898862777045,62.8257951888305,59.432652301302,92,https://tummgmt.eu.qualtrics.com/Q/File.php?F=F_3PyIz0uTNlxy50A,https://isap.sejm.gov.pl/isap.nsf/download.xsp/WDU20200002316/O/D20202316.pdf,2021-05-06,2021-05-06T14:33:01Z,1294878,28554,1036138,39052,6941502,183.652,,47600,15200,0.13,402,62,28.6,1,1.44043707847595,0.548431634902954,0,60,37974826,601720558485.059,4.93766324502775,17.4524340244738,27.1230589859233,2,2,1.66554456179387,4.8835145664111,619403
R_2znBVA0jdi8r4OlNA,1451816,new_entry,,,"",The Polish government is introducing a state of emergency in Poland on 13th of March.,2020-03-13,2020-03-13,,,Poland,POL,PL,National,1,,,,Declaration of Emergency,,,"",,,,,,"","","","","","","","","","","",,,,"",,Poland,,,,,,,All Residents (Citizen Residents + Foreign Residents),,,,Mandatory with Legal Penalties (Jail Time),National Government,51.987607170254,48.4292195851041,44.4226907616538,106,https://tummgmt.eu.qualtrics.com/Q/File.php?F=F_yBKNUWcjnXFPbCV,https://www.wroclaw.pl/en/the-polish-government-is-introducing-a-state-of-emergency-in-poland,2020-03-29,2020-03-29T11:30:48Z,68,2,0,,,,,,,,,62,28.6,1,1.44043707847595,0.548431634902954,0,60,37974826,601720558485.059,4.93766324502775,17.4524340244738,27.1230589859233,2,2,1.66554456179387,4.8835145664111,619403
R_1DC2UC0KOwIWepuCo,6264225,new_entry,,,"","On March 9th 2020 the Polish government announced that, starting March 10th, health checkpoints will be instituted at the border",2020-03-09,2020-03-10,,The policy’s end date is unknown or unreported,Poland,POL,PL,National,0,,,,External Border Restrictions,Health Screenings (e.g. temperature checks),,"",,,,,,"","","","","","","","","","","",,,,"",No,,All countries,,,,,,All (Travelers + Residents),No special population targeted,Inbound/Outbound,All kinds of transport,Mandatory (Unspecified/Implied),National Government,45.1984914949445,40.5619000313546,35.6569632402241,100,https://tummgmt.eu.qualtrics.com/Q/File.php?F=F_10VrpN7HmLzDH6o,https://www.bloomberg.com/news/articles/2020-03-13/poland-imposes-full-border-controls-quarantines-for-visitors,2021-08-24,2021-08-24T14:50:17Z,22,0,0,,,,,,,,,62,28.6,1,1.44043707847595,0.548431634902954,0,60,37974826,601720558485.059,4.93766324502775,17.4524340244738,27.1230589859233,2,2,1.66554456179387,4.8835145664111,619403
R_z5UdlQ3JQkxB8qtNA,1828264,new_entry,,,"","From Sunday, 15 March, Poland will close its borders to foreigners. All Polish citizens who are presently abroad can return to their homeland. International passenger air flights and international rail travel will be suspended for 10 days, with possibility of extension.",2020-03-13,2020-03-15,2020-03-25,The policy has a clear end date,Poland,POL,PL,National,0,,,,External Border Restrictions,,,"",,,,,,"","","","","","","","","","","",,,,"",No,,All countries,,,,,,Foreign Travelers,,Inbound,All kinds of transport,Mandatory with Exceptions (Please list exceptions in the text entry),National Government,53.701635419194,50.3443132347579,46.8376553168519,99,https://tummgmt.eu.qualtrics.com/Q/File.php?F=F_2qshqWrZoArLfLe,https://www.gov.pl/web/coronavirus/travel ; https://pl.usembassy.gov/covid-19-information/,2020-03-28,2020-03-28T11:56:12Z,119,3,0,,,,,,,,,62,28.6,1,1.44043707847595,0.548431634902954,0,60,37974826,601720558485.059,4.93766324502775,17.4524340244738,27.1230589859233,2,2,1.66554456179387,4.8835145664111,619403
R_ODr4oChKvnh1b5DNA,6972120,new_entry,,,"",Poland announces that it closes its borders for 10 days starting 15 March due to coronavirus. Poland is imposing border checks.,2020-03-15,2020-03-15,2020-03-25,The policy has a clear end date,Poland,POL,PL,National,0,,,,External Border Restrictions,,,"",,,,,,"","","","","","","","","","","",,,,"",No,,All countries,,,,,,All Travelers (Citizen Travelers + Foreign Travelers ),,Inbound,All kinds of transport,Mandatory with Legal Penalties (Jail Time),National Government,53.701635419194,50.3443132347579,46.8376553168519,99,https://tummgmt.eu.qualtrics.com/Q/File.php?F=F_2eVUCh4cHRxl2aP,https://www.gov.pl/web/qatar/polands-borders-closed-from-15-march-due-to-coronavirus,2020-03-29,2020-03-29T11:25:50Z,119,3,0,,,,,,,,,62,28.6,1,1.44043707847595,0.548431634902954,0,60,37974826,601720558485.059,4.93766324502775,17.4524340244738,27.1230589859233,2,2,1.66554456179387,4.8835145664111,619403
R_2WJeHD3qpsKHDA6NA,1828264,update,,,"","From Sunday, 15 March, Poland will close its borders to foreigners. All Polish citizens who are presently abroad can return to their homeland. International passenger air flights and international rail travel will be suspended for 10 days, with possibility of extension. 
Update: The border closure has been extended with 20 days, to April 13th. UPDATE: The original border restrictions were set to last until March 25th, they are now extended to April 13.",2020-03-13,2020-03-15,2020-04-13,The policy has a clear end date,Poland,POL,PL,National,0,,,,External Border Restrictions,,,"",,,,,,"","","","","","","","","","","",,,,"",No,,All countries,,,,,,Foreign Travelers,,Inbound,All kinds of transport,Mandatory (Unspecified/Implied),"National Government,Military",53.701635419194,50.3443132347579,46.8376553168519,99,https://tummgmt.eu.qualtrics.com/Q/File.php?F=F_3NJltOVmV7JpYz2 ; https://tummgmt.eu.qualtrics.com/Q/File.php?F=F_3szj0CAlbjfyZKF,https://www.gov.pl/web/coronavirus/travel ; https://wbj.pl/poland-extends-border-closures-until-april-13/post/126527,2020-04-02,2020-04-02T13:21:21Z,119,3,0,,,,,,,,,62,28.6,1,1.44043707847595,0.548431634902954,0,60,37974826,601720558485.059,4.93766324502775,17.4524340244738,27.1230589859233,2,2,1.66554456179387,4.8835145664111,619403
R_2AMg10HrRTJQgQdNA,1828264,update,,Strengthening,"","From Sunday, 15 March, Poland will close its borders to foreigners. All Polish citizens who are presently abroad can return to their homeland. International passenger air flights and international rail travel will be suspended until May 3rd, with possibility of extension.
 UPDATE: The border shut down has been extended until May 3rd.",2020-03-12,2020-03-15,2020-05-03,The policy has a clear end date,Poland,POL,PL,National,0,,,,External Border Restrictions,,,"",,,,,,"","","","","","","","","","","",,,,"",No,,All countries,,,,,,Foreign Travelers,,Inbound,All kinds of transport,Mandatory (Unspecified/Implied),"National Government,Ministry/Department of Health,Military",53.701635419194,50.3443132347579,46.8376553168519,99,https://tummgmt.eu.qualtrics.com/Q/File.php?F=F_YbodXMCoRSiHoMF ; https://tummgmt.eu.qualtrics.com/Q/File.php?F=F_3szj0CAlbjfyZKF,https://tvn24.pl/tvn24-news-in-english/polands-coronavirus-restrictions-extended-towards-election-date-4550678,2020-04-20,2020-04-20T12:36:29Z,119,3,0,,,,,,,,,62,28.6,1,1.44043707847595,0.548431634902954,0,60,37974826,601720558485.059,4.93766324502775,17.4524340244738,27.1230589859233,2,2,1.66554456179387,4.8835145664111,619403
R_3s61MMXFyloknmXNA,1828264,update,Change of Policy,Strengthening,timing of policy strengthening,"From Sunday, 15 March, Poland will close its borders to foreigners. All Polish citizens who are presently abroad can return to their homeland. International passenger air flights and international rail travel will be suspended until May 3rd, with possibility of extension. The border shutdown has been extended until June 12th.
 UPDATE: The border shut down has been extended until May 3rd. The border shut down has been further extended until June 12th.",2020-03-12,2020-03-15,2020-06-12,The policy has a clear end date,Poland,POL,PL,National,0,,,,External Border Restrictions,,,"",,,,,,"","","","","","","","","","","",,,,"",No,,All countries,,,,,,Foreign Travelers,,Inbound,All kinds of transport,Mandatory with Exceptions (Please list exceptions in the text entry),National Government,53.701635419194,50.3443132347579,46.8376553168519,99,https://tummgmt.eu.qualtrics.com/Q/File.php?F=F_2qshqWrZoArLfLe ; https://tummgmt.eu.qualtrics.com/Q/File.php?F=F_3szj0CAlbjfyZKF,NA ; https://www.reuters.com/article/us-health-coronavirus-poland-borders/poland-to-keep-borders-closed-for-foreigners-until-june-12-idUSKBN22P190,2020-06-13,2020-06-13T11:24:25Z,119,3,0,,,,,,,,,62,28.6,1,1.44043707847595,0.548431634902954,0,60,37974826,601720558485.059,4.93766324502775,17.4524340244738,27.1230589859233,2,2,1.66554456179387,4.8835145664111,619403
R_XUiJPbfNAxp1IbLHe,3955901,new_entry,,,"",Polish government cancels all visa appointments as of 18th March 2020 until further notice.,2020-03-16,2020-03-18,,,Poland,POL,PL,National,0,,,,External Border Restrictions,Visa restrictions (e.g. suspend issuance of visa),,"",,,,,,"","","","","","","","","","","",,,,"",No,,All countries,,,,,,Foreign Travelers,,Inbound,,Mandatory with Legal Penalties (Jail Time),National Government,54.729364395601,51.1409394605538,47.758568377003,73,https://tummgmt.eu.qualtrics.com/Q/File.php?F=F_ZeskSWfDJRSKmcx,https://www.gov.pl/web/uae/all-visa-appointments-are-being-canceled-as-of-18th-march-2020-until-further-notice,2020-03-31,2020-03-31T18:47:07Z,251,5,13,,,,,,,,,62,28.6,1,1.44043707847595,0.548431634902954,0,60,37974826,601720558485.059,4.93766324502775,17.4524340244738,27.1230589859233,2,2,1.66554456179387,4.8835145664111,619403
R_2z6YsYHUdVuvw0HHe,8542860,new_entry,,,"","The state of emergency in Poland due to Coronavirus has pushed the country to extend visas for all internationals who hold work permits, national visas, or a temporary residence permit, for 30 days after the end of the emergency state, Secretary of Management on Affairs of Foreigners Jakub Dudziak announced.",2020-04-01,2020-04-01,,,Poland,POL,PL,National,0,,,,External Border Restrictions,Visa restrictions (e.g. suspend issuance of visa),,"",,,,,,"","","","","","","","","","","",,,,"",No,Poland,"One or more countries, but not all countries",,,,,,Foreign Residents (Foreign Nationals Residing in the Country),,Outbound,,Voluntary/Recommended but No Penalties,National Government,65.2963947258898,61.8563876299404,58.6328607787245,43,https://tummgmt.eu.qualtrics.com/Q/File.php?F=F_6GqUaZpEG1cCj4Z,https://www.schengenvisainfo.com/news/poland-extends-visas-and-permits-for-foreigners-for-another-30-days/,2020-04-28,2020-04-28T14:32:10Z,2554,43,47,,,,,,,,,62,28.6,1,1.44043707847595,0.548431634902954,0,60,37974826,601720558485.059,4.93766324502775,17.4524340244738,27.1230589859233,2,2,1.66554456179387,4.8835145664111,619403
R_umsemWsNRib6QDLDu,4901584,new_entry,,,"","On May 4th 2020 the Polish government issued that borders wioll be opened to immediate EU neighbors (Lithuania, Germany, Czech Republic, Slovakia) for crossborder workers and students without 14day quarantine",2020-05-04,2020-05-04,,The policy’s end date is unknown or unreported,Poland,POL,PL,National,0,,,,External Border Restrictions,Other External Border Restriction,,"",,,,,,"","","","","","","","","","","",,,,"",No,"Czechia,Germany,Lithuania,Slovakia","One or more countries, but not all countries",,,,,,All (Travelers + Residents),No special population targeted,Inbound/Outbound,All kinds of transport,Voluntary/Recommended but No Penalties,National Government,68.3214188038036,65.0252795045963,61.8048616215676,55,https://tummgmt.eu.qualtrics.com/Q/File.php?F=F_2dmCir48vOuKK6z,https://twitter.com/PremierRP_en/status/1256120206155550720,2021-08-25,2021-08-25T15:41:08Z,14006,698,4095,7304,350048,9.261,,,,,,62,28.6,1,1.44043707847595,0.548431634902954,0,60,37974826,601720558485.059,4.93766324502775,17.4524340244738,27.1230589859233,2,2,1.66554456179387,4.8835145664111,619403
