R_24FV2f2j2gm7rguDc,5171241,new_entry,,,"","On June 16th, The Office of the President of the Republic of Poland donated 50,000 protective face masks to Iraq’s health authorities, following Iraq’s request for support in response to the COVID-19 global pandemic.",2020-06-16,2020-06-16,2020-06-23,The policy has a clear end date,Poland,POL,PL,National,0,,,,Health Resources,Masks,,"",,,,,,"","","","","","","","","","","",,,,"",No,Iraq,One or more countries and one or more regional groupings,,,,,,Health-Related Supplies,No special population targeted,,Not Applicable,Voluntary/Recommended but No Penalties,National Government,52.0021386923838,48.7761001027469,45.1198839365578,20,https://tummgmt.eu.qualtrics.com/Q/File.php?F=F_12QIOpmGGBl2T3G,https://www.nato.int/cps/en/natolive/news_176239.htm?selectedLocale=en,2020-07-16,2020-07-16T09:13:32Z,30195,1272,14654,16403,1103330,29.191,,,,,,62,28.6,1,1.44043707847595,0.548431634902954,0,60,37974826,601720558485.059,4.93766324502775,17.4524340244738,27.1230589859233,2,2,1.66554456179387,4.8835145664111,619403
R_2aeJ51qwHUZoQLADc,390225,new_entry,,,"","On June 19, a plane loaded with medical supplies for Armenia took off from the airport of Wroclaw, Poland. The humanitarian aid includes 20,000 medical masks, 2,400 face shields and 2,700 liters of hand and face sanitizers.",2020-06-19,2020-06-19,2020-06-26,The policy has a clear end date,Poland,POL,PL,National,0,,,,Health Resources,Masks,,"",,,,,,"","","","","","","","","","","",,,,"",No,Armenia,One or more countries and one or more regional groupings,,,,,,Health-Related Supplies,No special population targeted,Outbound,Flights,Voluntary/Recommended but No Penalties,National Government,51.5957428843868,48.7173054260143,44.9948312367112,22,https://tummgmt.eu.qualtrics.com/Q/File.php?F=F_3hbR2457T1yAbLC,https://en.armradio.am/2020/06/19/poland-sends-medical-supplies-to-armenia/,2020-07-01,2020-07-01T03:43:49Z,31316,1334,15698,23543,1170761,30.975,,,,,,62,28.6,1,1.44043707847595,0.548431634902954,0,60,37974826,601720558485.059,4.93766324502775,17.4524340244738,27.1230589859233,2,2,1.66554456179387,4.8835145664111,619403
R_2aeJ51qwHUZoQLAEk,390225,new_entry,,,"","On June 19, a plane loaded with medical supplies for Armenia took off from the airport of Wroclaw, Poland. The humanitarian aid includes 20,000 medical masks, 2,400 face shields and 2,700 liters of hand and face sanitizers.",2020-06-19,2020-06-19,2020-06-26,The policy has a clear end date,Poland,POL,PL,National,0,,,,Health Resources,Personal Protective Equipment,,"",,,,,,"","","","","","","","","","","",,,,"",No,Armenia,One or more countries and one or more regional groupings,,,,,,Health-Related Supplies,No special population targeted,Outbound,Flights,Voluntary/Recommended but No Penalties,National Government,51.5957428843868,48.7173054260143,44.9948312367112,22,https://tummgmt.eu.qualtrics.com/Q/File.php?F=F_3hbR2457T1yAbLC,https://en.armradio.am/2020/06/19/poland-sends-medical-supplies-to-armenia/,2020-07-01,2020-07-01T03:43:49Z,31316,1334,15698,23543,1170761,30.975,,,,,,62,28.6,1,1.44043707847595,0.548431634902954,0,60,37974826,601720558485.059,4.93766324502775,17.4524340244738,27.1230589859233,2,2,1.66554456179387,4.8835145664111,619403
R_2aeJ51qwHUZoQLACk,390225,new_entry,,,"","On June 19, a plane loaded with medical supplies for Armenia took off from the airport of Wroclaw, Poland. The humanitarian aid includes 20,000 medical masks, 2,400 face shields and 2,700 liters of hand and face sanitizers.",2020-06-19,2020-06-19,2020-06-26,The policy has a clear end date,Poland,POL,PL,National,0,,,,Health Resources,Hand Sanitizer,,"",,,,,,"","","","","","","","","","","",,,,"",No,Armenia,One or more countries and one or more regional groupings,,,,,,Health-Related Supplies,No special population targeted,Outbound,Flights,Voluntary/Recommended but No Penalties,National Government,51.5957428843868,48.7173054260143,44.9948312367112,22,https://tummgmt.eu.qualtrics.com/Q/File.php?F=F_3hbR2457T1yAbLC,https://en.armradio.am/2020/06/19/poland-sends-medical-supplies-to-armenia/,2020-07-01,2020-07-01T03:43:49Z,31316,1334,15698,23543,1170761,30.975,,,,,,62,28.6,1,1.44043707847595,0.548431634902954,0,60,37974826,601720558485.059,4.93766324502775,17.4524340244738,27.1230589859233,2,2,1.66554456179387,4.8835145664111,619403
R_s71yGffjfJXtmjnDc,3625492,new_entry,,,"","On June 25th, Poland will use air transport to deliver to Azerbaijan surgical masks, visors and disinfectant liquid worth nearly 87,000 zlotys.",2020-06-25,2020-06-25,2020-07-02,The policy has a clear end date,Poland,POL,PL,National,0,,,,Health Resources,Masks,,"",,,,,,"","","","","","","","","","","",,,,"",No,Azerbaijan,One or more countries and one or more regional groupings,,,,,,Health-Related Supplies,No special population targeted,Outbound,Flights,Voluntary/Recommended but No Penalties,National Government,51.6851770065882,48.4885856360218,45.0696586049391,22,https://tummgmt.eu.qualtrics.com/Q/File.php?F=F_1IoUBYCKVgPl4pY,https://www.gov.pl/web/diplomacy/humanitarian-aid-for-azerbaijan,2020-06-25,2020-06-25T17:33:22Z,33119,1412,18654,21453,1278454,33.824,,,,,,62,28.6,1,1.44043707847595,0.548431634902954,0,60,37974826,601720558485.059,4.93766324502775,17.4524340244738,27.1230589859233,2,2,1.66554456179387,4.8835145664111,619403
R_s71yGffjfJXtmjnEk,3625492,new_entry,,,"","On June 25th, Poland will use air transport to deliver to Azerbaijan surgical masks, visors and disinfectant liquid worth nearly 87,000 zlotys.",2020-06-25,2020-06-25,2020-07-02,The policy has a clear end date,Poland,POL,PL,National,0,,,,Health Resources,Personal Protective Equipment,,"",,,,,,"","","","","","","","","","","",,,,"",No,Azerbaijan,One or more countries and one or more regional groupings,,,,,,Health-Related Supplies,No special population targeted,Outbound,Flights,Voluntary/Recommended but No Penalties,National Government,51.6851770065882,48.4885856360218,45.0696586049391,22,https://tummgmt.eu.qualtrics.com/Q/File.php?F=F_1IoUBYCKVgPl4pY,https://www.gov.pl/web/diplomacy/humanitarian-aid-for-azerbaijan,2020-06-25,2020-06-25T17:33:22Z,33119,1412,18654,21453,1278454,33.824,,,,,,62,28.6,1,1.44043707847595,0.548431634902954,0,60,37974826,601720558485.059,4.93766324502775,17.4524340244738,27.1230589859233,2,2,1.66554456179387,4.8835145664111,619403
R_s71yGffjfJXtmjnCk,3625492,new_entry,,,"","On June 25th, Poland will use air transport to deliver to Azerbaijan surgical masks, visors and disinfectant liquid worth nearly 87,000 zlotys.",2020-06-25,2020-06-25,2020-07-02,The policy has a clear end date,Poland,POL,PL,National,0,,,,Health Resources,Hand Sanitizer,,"",,,,,,"","","","","","","","","","","",,,,"",No,Azerbaijan,One or more countries and one or more regional groupings,,,,,,Health-Related Supplies,No special population targeted,Outbound,Flights,Voluntary/Recommended but No Penalties,National Government,51.6851770065882,48.4885856360218,45.0696586049391,22,https://tummgmt.eu.qualtrics.com/Q/File.php?F=F_1IoUBYCKVgPl4pY,https://www.gov.pl/web/diplomacy/humanitarian-aid-for-azerbaijan,2020-06-25,2020-06-25T17:33:22Z,33119,1412,18654,21453,1278454,33.824,,,,,,62,28.6,1,1.44043707847595,0.548431634902954,0,60,37974826,601720558485.059,4.93766324502775,17.4524340244738,27.1230589859233,2,2,1.66554456179387,4.8835145664111,619403
R_2OUT8kzV8OdcNDEEk,8591970,new_entry,,,"","On June 29th, Poland sent critical medical assistance to Georgia, consisting of around 6,800 protective face shields and 5,400 litres of disinfectant detergent for hands and surface equipment, in response to the COVID-19 pandemic.",2020-06-29,2020-06-29,2020-07-06,The policy has a clear end date,Poland,POL,PL,National,0,,,,Health Resources,Personal Protective Equipment,,"",,,,,,"","","","","","","","","","","",,,,"",No,Georgia,One or more countries and one or more regional groupings,,,,,,Health-Related Supplies,No special population targeted,Outbound,Flights,Voluntary/Recommended but No Penalties,National Government,51.8682314946371,48.4586752669011,44.9621043809105,23,https://tummgmt.eu.qualtrics.com/Q/File.php?F=F_1rGRfVVHeJMsrHz,https://www.nato.int/cps/en/natohq/news_176923.htm,2020-07-01,2020-07-01T03:27:13Z,34154,1444,20897,7752,1338503,35.413,,,,,,62,28.6,1,1.44043707847595,0.548431634902954,0,60,37974826,601720558485.059,4.93766324502775,17.4524340244738,27.1230589859233,2,2,1.66554456179387,4.8835145664111,619403
R_2OUT8kzV8OdcNDECk,8591970,new_entry,,,"","On June 29th, Poland sent critical medical assistance to Georgia, consisting of around 6,800 protective face shields and 5,400 litres of disinfectant detergent for hands and surface equipment, in response to the COVID-19 pandemic.",2020-06-29,2020-06-29,2020-07-06,The policy has a clear end date,Poland,POL,PL,National,0,,,,Health Resources,Hand Sanitizer,,"",,,,,,"","","","","","","","","","","",,,,"",No,Georgia,One or more countries and one or more regional groupings,,,,,,Health-Related Supplies,No special population targeted,Outbound,Flights,Voluntary/Recommended but No Penalties,National Government,51.8682314946371,48.4586752669011,44.9621043809105,23,https://tummgmt.eu.qualtrics.com/Q/File.php?F=F_1rGRfVVHeJMsrHz,https://www.nato.int/cps/en/natohq/news_176923.htm,2020-07-01,2020-07-01T03:27:13Z,34154,1444,20897,7752,1338503,35.413,,,,,,62,28.6,1,1.44043707847595,0.548431634902954,0,60,37974826,601720558485.059,4.93766324502775,17.4524340244738,27.1230589859233,2,2,1.66554456179387,4.8835145664111,619403
R_oXBPr9Wcyw71EsxCs,6220128,new_entry,,,"","On October 10th, ""Special coordinating hospitals will open in every province [in Poland], with additional intensive care beds for COVID-19 patients.""",2020-10-08,2020-10-10,,,Poland,POL,PL,National,0,,,,Health Resources,Hospitals,,"",,,,,,"","","","","","","","","","","",,,,"",Yes,Poland,"One or more countries, but not all countries",,,,,,,No special population targeted,,,Voluntary/Recommended but No Penalties,"National Government,Ministry/Department of Health",45.8501539067454,41.8331649028229,37.4121719547353,14,https://tummgmt.eu.qualtrics.com/Q/File.php?F=F_pbWqHJkw9PWFgFb,https://www.pap.pl/node/732791,2020-11-19,2020-11-19T06:23:09Z,121638,2972,78982,35959,3490970,92.361,,,,,,62,28.6,1,1.44043707847595,0.548431634902954,0,60,37974826,601720558485.059,4.93766324502775,17.4524340244738,27.1230589859233,2,2,1.66554456179387,4.8835145664111,619403
R_xaTQiNv2uapR7hfGn,2857022,new_entry,,,"","As of October 19th, Poland is creating ""a temporary hospital devoted solely to COVD-19 patients is being organised at the National Stadium in Warsaw.""",2020-10-19,2020-10-19,,,Poland,POL,PL,National,0,,,,Health Resources,Temporary Medical Centers,,"",,,,,,"","","","","","","","","","","",,,,"",Yes,Poland,"One or more countries, but not all countries",,,,,,,No special population targeted,,,Voluntary/Recommended but No Penalties,National Government,48.8365616043353,45.0707739180793,41.0102069781934,23,https://tummgmt.eu.qualtrics.com/Q/File.php?F=F_6tEILUzcPece4gN,https://www.pap.pl/node/739182,2020-11-27,2020-11-27T07:20:46Z,183248,3614,94014,35484,3850148,101.864,,,,,,62,28.6,1,1.44043707847595,0.548431634902954,0,60,37974826,601720558485.059,4.93766324502775,17.4524340244738,27.1230589859233,2,2,1.66554456179387,4.8835145664111,619403
R_ylozBVmJ5aNr2YFNA,5081779,new_entry,,,"","Poland is introducing a general lock-down: until April 11 inclusive, people will not be able to move freely outside their living, health and professional goals.",2020-03-24,2020-03-25,2020-04-11,The policy has a clear end date,Poland,POL,PL,National,1,,,,Lockdown,,,"",,,,,,"","","","","","","","","","","",,,,"",,Poland,,,,,,,All Residents (Citizen Residents + Foreign Residents),,,,Mandatory (Unspecified/Implied),National Government,55.3724474482439,51.947013370578,48.5219438344647,32,https://tummgmt.eu.qualtrics.com/Q/File.php?F=F_2rHOjHiK9kH1pRW ; https://tummgmt.eu.qualtrics.com/Q/File.php?F=F_2PcWBl1LesPQXCV,NA ; https://dziennikustaw.gov.pl/D2020000052201.pdf,2021-05-18,2021-05-18T20:27:26Z,1051,14,7,,,,,,,,,62,28.6,1,1.44043707847595,0.548431634902954,0,60,37974826,601720558485.059,4.93766324502775,17.4524340244738,27.1230589859233,2,2,1.66554456179387,4.8835145664111,619403
R_27KAa7QZUbyUGrGNA,5924756,new_entry,,,"","On March 24th the Polish government stated that starting March 25th 2020 that movement limited to routes to/from work, volunteering against covid, and essential matters of everyday life",2020-03-24,2020-03-25,,The policy’s end date is unknown or unreported,Poland,POL,PL,National,1,,,,Lockdown,,,"",,,,,,"","","","","","","","","","","",,,,"",Yes,Poland,"One or more countries, but not all countries",,,,,,All Residents (Citizen Residents + Foreign Residents),No special population targeted,,,Mandatory (Unspecified/Implied),National Government,55.3724474482439,51.947013370578,48.5219438344647,32,https://tummgmt.eu.qualtrics.com/Q/File.php?F=F_SOEWfgIPyHxhKY9,https://twitter.com/PremierRP_en/status/1242440713146695680,2021-08-24,2021-08-24T16:23:43Z,1051,14,7,,,,,,,,,62,28.6,1,1.44043707847595,0.548431634902954,0,60,37974826,601720558485.059,4.93766324502775,17.4524340244738,27.1230589859233,2,2,1.66554456179387,4.8835145664111,619403
R_Q9qAN5FWTKaYWEpNA,5081779,update,Change of Policy,Strengthening,timing of policy strengthening,"Poland is introducing a general lock-down: until April 11 inclusive, people will not be able to move freely outside unless performing professional activities or completing the necessary needs related to the current affairs of everyday life, including obtaining health or psychological care. UPDATE: The original lockdown was set to last until April 11th 2020, it has been extended to April 19th",2020-03-24,2020-03-25,2020-04-19,The policy has a clear end date,Poland,POL,PL,National,1,,,,Lockdown,,,"",,,,,,"","","","","","","","","","","",,,,"",,Poland,,,,,,,All Residents (Citizen Residents + Foreign Residents),,,,Mandatory (Unspecified/Implied),National Government,55.3724474482439,51.947013370578,48.5219438344647,32,https://tummgmt.eu.qualtrics.com/Q/File.php?F=F_2rHOjHiK9kH1pRW ; https://tummgmt.eu.qualtrics.com/Q/File.php?F=F_3iPvR2Ff52xNXZ1,NA ; http://isap.sejm.gov.pl/isap.nsf/download.xsp/WDU20200000658/O/D20200658.pdf,2021-05-13,2021-05-13T23:50:12Z,1051,14,7,,,,,,,,,62,28.6,1,1.44043707847595,0.548431634902954,0,60,37974826,601720558485.059,4.93766324502775,17.4524340244738,27.1230589859233,2,2,1.66554456179387,4.8835145664111,619403
R_1QhIf37rVsfB3h5NA,9199425,new_entry,,,"","Starting April 1st 2020 minors under the age of 18 are not allowed to leave their home unless accompanied by a parent, legal guardian, or other adult.",2020-03-31,2020-04-01,2021-04-11,The policy has a clear end date,Poland,POL,PL,National,1,,,,Lockdown,,,"",,,,,,"","","","","","","","","","","",,,,"",Yes,Poland,"One or more countries, but not all countries",,,,,,All Residents (Citizen Residents + Foreign Residents),People of a certain age (please note age range in the text entry),,,Mandatory with Fines,"National Government,Police",65.2963947258898,61.8563876299404,58.6328607787245,43,https://tummgmt.eu.qualtrics.com/Q/File.php?F=F_2cCTbyTZsd55Dud,https://www.katowice.uw.gov.pl/files/28/D20200566_1_.pdf,2021-05-18,2021-05-18T20:53:19Z,2554,43,47,,,,,,,,,62,28.6,1,1.44043707847595,0.548431634902954,0,60,37974826,601720558485.059,4.93766324502775,17.4524340244738,27.1230589859233,2,2,1.66554456179387,4.8835145664111,619403
R_3PUo08wBHXBTSP9NA,7227308,new_entry,,,"","As of April 1st 2020 minors under 18 years old are not allowed to leave their home unless accompanied by a parent, legal guardian or another adult.",2020-03-31,2020-04-01,2020-04-11,The policy has a clear end date,Poland,POL,PL,National,1,,,,Lockdown,,,"",,,,,,"","","","","","","","","","","",,,,"",Yes,Poland,"One or more countries, but not all countries",,,,,,All Residents (Citizen Residents + Foreign Residents),People of a certain age (please note age range in the text entry),,,Mandatory with Fines,"National Government,Police",65.2963947258898,61.8563876299404,58.6328607787245,43,https://tummgmt.eu.qualtrics.com/Q/File.php?F=F_Df35TQbARAkIAKt,https://www.katowice.uw.gov.pl/files/28/D20200566_1_.pdf,2021-05-25,2021-05-25T20:47:35Z,2554,43,47,,,,,,,,,62,28.6,1,1.44043707847595,0.548431634902954,0,60,37974826,601720558485.059,4.93766324502775,17.4524340244738,27.1230589859233,2,2,1.66554456179387,4.8835145664111,619403
R_242khHMtjQbWCOtNA,9199425,update,Change of Policy,Strengthening,timing of policy strengthening,"Starting April 1st 2020 minors under the age of 18 are not allowed to leave their home unless accompanied by a parent, legal guardian, or other adult. UPDATE: The original policy was set to last until April 11th 2020, but it has been extended to April 19th 2020.",2020-03-31,2020-04-01,2021-04-19,The policy has a clear end date,Poland,POL,PL,National,1,,,,Lockdown,,,"",,,,,,"","","","","","","","","","","",,,,"",Yes,Poland,"One or more countries, but not all countries",,,,,,All Residents (Citizen Residents + Foreign Residents),People of a certain age (please note age range in the text entry),,,Mandatory with Fines,"National Government,Police",65.2963947258898,61.8563876299404,58.6328607787245,43,https://tummgmt.eu.qualtrics.com/Q/File.php?F=F_2cCTbyTZsd55Dud ; https://tummgmt.eu.qualtrics.com/Q/File.php?F=F_2S6rGc7QpZeSFFn,NA ; https://www.katowice.uw.gov.pl/files/28/D20200658.pdf,2021-05-25,2021-05-25T15:27:15Z,2554,43,47,,,,,,,,,62,28.6,1,1.44043707847595,0.548431634902954,0,60,37974826,601720558485.059,4.93766324502775,17.4524340244738,27.1230589859233,2,2,1.66554456179387,4.8835145664111,619403
R_2aFGdGNwCKYSYRBNA,3444186,new_entry,,,"","As of the 20th of April, minors under the age of 13 are not allowed to leave their home unless accompanied by a parent, legal guardian or other adult.",2020-04-19,2020-04-20,2020-05-17,The policy has a clear end date,Poland,POL,PL,National,1,,,,Lockdown,,,"",,,,,,"","","","","","","","","","","",,,,"",Yes,Poland,"One or more countries, but not all countries",,,,,,All Residents (Citizen Residents + Foreign Residents),People of a certain age (please note age range in the text entry),,,Mandatory with Fines,"National Government,Police",68.4253880938815,64.9372020299731,61.604720772494,44,https://tummgmt.eu.qualtrics.com/Q/File.php?F=F_a4d5x6YfPBVv5pn,https://www.katowice.uw.gov.pl/files/28/D20200697.pdf ; https://www.katowice.uw.gov.pl/files/28/D20200878.pdf,2021-05-25,2021-05-25T21:32:31Z,9593,380,1133,,,,,,,,,62,28.6,1,1.44043707847595,0.548431634902954,0,60,37974826,601720558485.059,4.93766324502775,17.4524340244738,27.1230589859233,2,2,1.66554456179387,4.8835145664111,619403
R_12QIfEMrmaytN7ZNA,9753348,new_entry,,,"","Poland announced on the 23rd of March that it would let some prisoners serve their sentences at home under electronic supervision to curb the spread of the coronavirus in prisons. Previously, only offenders serving a maximum of 1 years would qualify for electronic supervision at home, now offenders serving a maximum of 18 months qualify.",2020-03-23,2020-03-23,,,Poland,POL,PL,National,0,,,,Other Policy Not Listed Above,,,"",,,,,,"","","","","","","","","","","",Poland lets more prisoners serve their sentences at home under electronic supervision instead of prison,,,"",No,Poland,"One or more countries, but not all countries",,,,,,Other,,,Not Applicable,Mandatory with Legal Penalties (Jail Time),National Government,55.0732807486236,51.8121308500029,47.8295968302691,38,https://tummgmt.eu.qualtrics.com/Q/File.php?F=F_3rV9yWHGKBeUEsW,https://uk.reuters.com/article/uk-health-coronavirus-poland-prisons/poland-to-let-more-prisoners-serve-sentences-at-home-amid-coronavirus-idUKKBN21A20C,2020-04-28,2020-04-28T14:43:43Z,749,8,1,,,,,,,,,62,28.6,1,1.44043707847595,0.548431634902954,0,60,37974826,601720558485.059,4.93766324502775,17.4524340244738,27.1230589859233,2,2,1.66554456179387,4.8835145664111,619403
R_eKYSstlq3RVcfolNA,4796786,new_entry,,,"",From 6th of April in Poland inmates have limited or suspended opportunities for employment outside prisons and are subjected to mandatory hand disinfection and temperature checks upon leaving and returning to prisons,2020-04-06,2020-04-06,,,Poland,POL,PL,National,0,,,,Other Policy Not Listed Above,,,"",,,,,,"","","","","","","","","","","",The policy limits employment opporutinities for inmates of state prisons,,,"",Yes,Poland,"One or more countries, but not all countries",,,,,,,Prisoners,,,Mandatory (Unspecified/Implied),Other (Please specify in the text box),68.2245565657935,64.9360785775306,61.0982185696564,52,https://tummgmt.eu.qualtrics.com/Q/File.php?F=F_1jZ27x3w7HmTxQn,https://www.radio.bialystok.pl/koronawirus/index/id/181779,2020-06-06,2020-06-06T09:51:44Z,4413,107,162,,,,,,,,,62,28.6,1,1.44043707847595,0.548431634902954,0,60,37974826,601720558485.059,4.93766324502775,17.4524340244738,27.1230589859233,2,2,1.66554456179387,4.8835145664111,619403
R_1jOJut2OQHu3xnsNA,624369,new_entry,,,"","As of the 20th of April, all minors under the age of 13 must be accompanied by an adult when going outside (before 20th of April this was all minors).",2020-04-20,2020-04-20,,,Poland,POL,PL,National,0,,,,Other Policy Not Listed Above,,,"",,,,,,"","","","","","","","","","","",Minors under 13 are not allowed to leave the house unaccompanied by an adult.,,,"",No,Poland,"One or more countries, but not all countries",,,,,,All Residents (Citizen Residents +Foreign Residents),,,Not Applicable,Mandatory with Fines,"National Government,Ministry/Department of Health,Police",68.4253880938815,64.9372020299731,61.604720772494,44,https://tummgmt.eu.qualtrics.com/Q/File.php?F=F_AoD0ie4RnI9v7VL,https://www.premier.gov.pl/en/news/news/prime-minister-today-we-are-proposing-new-rules-within-the-new-economic-reality.html,2020-04-28,2020-04-28T15:34:00Z,9593,380,1133,,,,,,,,,62,28.6,1,1.44043707847595,0.548431634902954,0,60,37974826,601720558485.059,4.93766324502775,17.4524340244738,27.1230589859233,2,2,1.66554456179387,4.8835145664111,619403
R_u20JFKjMNzNLFm1NA,624369,update,End of Policy,,"","As of the 20th of April, all minors under the age of 13 must be accompanied by an adult when going outside (before 20th of April this was all minors).
Upadte: This requirement was annulled from 17th of March UPDATE: As of the 20th of April, all minors under the age of 13 must be accompanied by an adult when going outside (before 20th of April this was all minors).
Update: This requirement was annulled from 17th of May.",2020-05-13,2020-05-17,,,Poland,POL,PL,National,0,,,,Other Policy Not Listed Above,,,"",,,,,,"","","","","","","","","","","",Minors under 13 are not allowed to leave the house unaccompanied by an adult.,,,"",No,Poland,"One or more countries, but not all countries",,,,,,All Residents (Citizen Residents +Foreign Residents),,,Not Applicable,Mandatory with Fines,"National Government,Ministry/Department of Health,Police",68.7106793965573,64.9464024542408,61.4933438548801,60,https://tummgmt.eu.qualtrics.com/Q/File.php?F=F_AoD0ie4RnI9v7VL ; https://tummgmt.eu.qualtrics.com/Q/File.php?F=F_12bPB0gM9AxNejh,"NA ; https://www.dziennikwschodni.pl/edukacja/wiadomo-kiedy-dzieci-ponizej-13-roku-zycia-beda-mogly-wychodzic-same-z-domu-najmlodsze-moga-wrocic-do-szkol,n,1000266359.html",2020-06-06,2020-06-06T09:21:00Z,18529,925,7451,17263,567055,15.003,,,,,,62,28.6,1,1.44043707847595,0.548431634902954,0,60,37974826,601720558485.059,4.93766324502775,17.4524340244738,27.1230589859233,2,2,1.66554456179387,4.8835145664111,619403
R_1jB5NIRKVloXRKsNA,7072879,new_entry,,,"","From June 27th to July 31st, The Polish Development Fund (PFR) will pay out some PLN 60 bln (EUR 13.5 bln) in government pandemic aid to small firms, out of the total of PLN 75 bln (EUR 16.8 bln) planned",2020-06-26,2020-06-26,2020-07-31,The policy has a clear end date,Poland,POL,PL,National,0,,,,Other Policy Not Listed Above,,,"",,,,,,"","","","","","","","","","","",Financial Aid to Businesses,,,"",Yes,Poland,"One or more countries, but not all countries",,,,,,,No special population targeted,,,Voluntary/Recommended but No Penalties,Other (Please specify in the text box),52.1142025681475,48.4732109102793,45.2036047551354,22,https://tummgmt.eu.qualtrics.com/Q/File.php?F=F_3nuTgh3e8PZ7qxW,https://www.pap.pl/node/670440,2020-08-20,2020-08-20T21:14:43Z,33395,1429,19218,18336,1296790,34.309,,,,,,62,28.6,1,1.44043707847595,0.548431634902954,0,60,37974826,601720558485.059,4.93766324502775,17.4524340244738,27.1230589859233,2,2,1.66554456179387,4.8835145664111,619403
R_1N36ZdmhwyKikC6NA,4659954,new_entry,,,"","As of July 24th, Poland will double the budget of the Fund for Local Investments to PLN 12 billion (EUR 2.7 billion).",2020-07-24,2020-07-24,,,Poland,POL,PL,National,0,,,,Other Policy Not Listed Above,,,"",,,,,,"","","","","","","","","","","",Financial Aid for Local Governments,,,"",Yes,Poland,"One or more countries, but not all countries",,,,,,,No special population targeted,,,Voluntary/Recommended but No Penalties,National Government,41.7097941677868,37.59443687052,33.3692168785311,14,https://tummgmt.eu.qualtrics.com/Q/File.php?F=F_2D03ptzqByNEObi,https://www.pap.pl/node/688101,2020-08-20,2020-08-20T21:38:56Z,42038,1655,31997,18098,1800348,47.632,,,,,,62,28.6,1,1.44043707847595,0.548431634902954,0,60,37974826,601720558485.059,4.93766324502775,17.4524340244738,27.1230589859233,2,2,1.66554456179387,4.8835145664111,619403
