record_id,policy_id,entry_type,update_type,update_level,update_level_var,description,date_announced,date_start,date_end,date_end_spec,country,ISO_A3,ISO_A2,init_country_level,domestic_policy,province,ISO_L2,city,type,type_sub_cat,type_new_admin_coop,type_vac_cat,type_vac_mix,type_vac_reg,type_vac_purchase,type_vac_group,type_vac_group_rank,type_vac_who_pays,type_vac_dist_admin,type_vac_loc,type_vac_cost_num,type_vac_cost_scale,type_vac_cost_unit,type_vac_cost_gov_perc,type_vac_amt_num,type_vac_amt_scale,type_vac_amt_unit,type_vac_amt_gov_perc,type_text,institution_cat,institution_status,institution_conditions,target_init_same,target_country,target_geog_level,target_region,target_province,target_city,target_intl_org,target_other,target_who_what,target_who_gen,target_direction,travel_mechanism,compliance,enforcer,dist_index_high_est,dist_index_med_est,dist_index_low_est,dist_index_country_rank,pdf_link,link,date_updated,recorded_date,confirmed_cases,deaths,recovered,new_tests,total_tests,total_tests_per_thousand,tests_units,total_vaccinations,daily_vaccinations,total_vaccinations_per_hundred,daily_vaccinations_per_million,Rank_FP,Score_FP,muni_IDC,dispersive_IDC,constraining_IDC,sfi_SFI,ti_cpi_TI,pop_WDI_PW,gdp_WDI_PW,growth_WDI_PW,lnpop_WDI_PW,lngdp_WDI_PW,disap_FA,polpris_FA,latentmean_FA,transparencyindex_HR,EmigrantStock_EMS
R_1inGzzoPyQt03UONA,4914205,new_entry,,,"",On March 20 the Security and Intelligence Service of the Republic of Moldova decided executive measures for eliminating COVID-19 related misinformation. Internet providers will cease the access to fake news websites during the state of emergency.,2020-03-20,2020-03-20,,,Moldova,MDA,MD,National,1,,,,Anti-Disinformation Measures,,,"",,,,,,"","","","","","","","","","","",,,,"",,Moldova,,,,,,,All Residents (Citizen Residents + Foreign Residents),,,,Mandatory with Fines,"National Government,Other (Please specify in the text box)",56.7787717819654,53.3049379978119,49.9854048814082,68,https://tummgmt.eu.qualtrics.com/Q/File.php?F=F_2QnQzjFySRM0ck5,https://www.sis.md/en/content/executive-measures-eliminating-causes-and-conditions-contribute-threats-national-security,2020-05-01,2020-05-01T13:35:11Z,66,1,1,,,,,,,,,91,31.1,2,-0.824784338474274,-0.31783652305603,8,31,3549196,9151593756.55574,4.69079342838687,15.0822316569281,22.9371938821104,2,1,0.249926918547173,5.63572688074547,106374
R_3k0WHkpE7Kk4rsFNA,3350012,new_entry,,,"","From March 27, the providers of media services in Moldova will be obliged to broadcast information about COVID-19 exclusively from mandatorily verified sources, by mandatorily presenting the position of the competent pubic authorities.",2020-03-27,2020-03-27,,,Moldova,MDA,MD,National,1,,,,Anti-Disinformation Measures,,,"",,,,,,"","","","","","","","","","","",,,,"",,Moldova,,,,,,,All Residents (Citizen Residents + Foreign Residents),,,,Mandatory (Unspecified/Implied),National Government,75.578402681671,72.1184246560819,68.8456485480033,114,https://tummgmt.eu.qualtrics.com/Q/File.php?F=F_2urILg2kXfwL0ok,https://www.ipn.md/en/print/new-decision-concerning-media-coverage-of-covid-19--7967_1072508.html,2020-05-15,2020-05-15T20:15:05Z,199,2,2,,,,,,,,,91,31.1,2,-0.824784338474274,-0.31783652305603,8,31,3549196,9151593756.55574,4.69079342838687,15.0822316569281,22.9371938821104,2,1,0.249926918547173,5.63572688074547,106374
R_1ghW8M922mVEc7fNA,5226036,new_entry,,,"","Moldova's Ministry of Health, Labor and Social Protection (in partnership with the Office of the World Health Organization of the Republic of Moldova and the UN Office for Human Rights), has launched a campaign to help combat the social stigmatization of people who are infected with, have recovered from or work with those who have COVID-19.",2020-09-17,2020-09-17,,,Moldova,MDA,MD,National,1,,,,Anti-Disinformation Measures,,,"",,,,,,"","","","","","","","","","","",,,,"",Yes,Moldova,"One or more countries, but not all countries",,,,,,All Residents (Citizen Residents + Foreign Residents),"Homeless population,People with certain health conditions (please note which health conditions in the text entry),Essential workers (please note their occuption in the text entry where applicable)",,,Voluntary/Recommended but No Penalties,"Ministry/Department of Health,Other (Please specify in the text box)",54.3813392463352,51.3943862620336,47.8761290159791,43,https://tummgmt.eu.qualtrics.com/Q/File.php?F=F_1N6iofXDv6BvucV,https://www.jurnaltv.md/news/643b9f10ff0a5a84/in-r-moldova-a-inceput-campania-de-informare-reducerea-stigmei-asociate-cu-covid-19.html,2020-09-22,2020-09-22T07:31:00Z,44983,1170,33239,,,,,,,,,91,31.1,2,-0.824784338474274,-0.31783652305603,8,31,3549196,9151593756.55574,4.69079342838687,15.0822316569281,22.9371938821104,2,1,0.249926918547173,5.63572688074547,106374
R_1Kfrg9GIJcO49HrEe,4563050Ee,new_entry,,,"","On March 11, Moldova closed all its schools and educational establishments",2020-03-11,2020-03-11,,,Moldova,MDA,MD,National,1,,,,Closure and Regulation of Schools,Preschool or childcare facilities (generally for children ages 5 and below),,"",,,,,,"","","","","","","","","","","",,,Preschool or childcare facilities closed/locked down,"",,Moldova,,,,,,,All Residents (Citizen Residents + Foreign Residents),,,,Mandatory (Unspecified/Implied),"National Government,Provincial/State Government,Municipal Government",49.0725481262973,45.0062263572397,40.5450231360368,108,https://tummgmt.eu.qualtrics.com/Q/File.php?F=F_12tpZ3VcsgRtOGK,https://www.reuters.com/article/us-health-coronavirus-moldova/moldova-closes-schools-universities-to-prevent-virus-spread-idUSKBN20Y0VP,2020-04-02,2020-04-02T13:07:46Z,3,0,0,,,,,,,,,91,31.1,2,-0.824784338474274,-0.31783652305603,8,31,3549196,9151593756.55574,4.69079342838687,15.0822316569281,22.9371938821104,2,1,0.249926918547173,5.63572688074547,106374
R_1Kfrg9GIJcO49HrEf,4563050Ef,new_entry,,,"","On March 11, Moldova closed all its schools and educational establishments",2020-03-11,2020-03-11,,,Moldova,MDA,MD,National,1,,,,Closure and Regulation of Schools,Primary Schools (generally for children ages 10 and below),,"",,,,,,"","","","","","","","","","","",,,Primary Schools closed/locked down,"",,Moldova,,,,,,,All Residents (Citizen Residents + Foreign Residents),,,,Mandatory (Unspecified/Implied),"National Government,Provincial/State Government,Municipal Government",49.0725481262973,45.0062263572397,40.5450231360368,108,https://tummgmt.eu.qualtrics.com/Q/File.php?F=F_12tpZ3VcsgRtOGK,https://www.reuters.com/article/us-health-coronavirus-moldova/moldova-closes-schools-universities-to-prevent-virus-spread-idUSKBN20Y0VP,2020-04-02,2020-04-02T13:07:46Z,3,0,0,,,,,,,,,91,31.1,2,-0.824784338474274,-0.31783652305603,8,31,3549196,9151593756.55574,4.69079342838687,15.0822316569281,22.9371938821104,2,1,0.249926918547173,5.63572688074547,106374
R_1Kfrg9GIJcO49HrFp,4563050Fp,new_entry,,,"","On March 11, Moldova closed all its schools and educational establishments",2020-03-11,2020-03-11,,,Moldova,MDA,MD,National,1,,,,Closure and Regulation of Schools,Secondary Schools (generally for children ages 10 to 18),,"",,,,,,"","","","","","","","","","","",,,Secondary Schools closed/locked down,"",,Moldova,,,,,,,All Residents (Citizen Residents + Foreign Residents),,,,Mandatory (Unspecified/Implied),"National Government,Provincial/State Government,Municipal Government",49.0725481262973,45.0062263572397,40.5450231360368,108,https://tummgmt.eu.qualtrics.com/Q/File.php?F=F_12tpZ3VcsgRtOGK,https://www.reuters.com/article/us-health-coronavirus-moldova/moldova-closes-schools-universities-to-prevent-virus-spread-idUSKBN20Y0VP,2020-04-02,2020-04-02T13:07:46Z,3,0,0,,,,,,,,,91,31.1,2,-0.824784338474274,-0.31783652305603,8,31,3549196,9151593756.55574,4.69079342838687,15.0822316569281,22.9371938821104,2,1,0.249926918547173,5.63572688074547,106374
R_1Kfrg9GIJcO49HrCb,4563050Cb,new_entry,,,"","On March 11, Moldova closed all its schools and educational establishments",2020-03-11,2020-03-11,,,Moldova,MDA,MD,National,1,,,,Closure and Regulation of Schools,Higher education institutions (i.e. degree granting institutions),,"",,,,,,"","","","","","","","","","","",,,Higher education institutions closed/locked down,"",,Moldova,,,,,,,All Residents (Citizen Residents + Foreign Residents),,,,Mandatory (Unspecified/Implied),"National Government,Provincial/State Government,Municipal Government",49.0725481262973,45.0062263572397,40.5450231360368,108,https://tummgmt.eu.qualtrics.com/Q/File.php?F=F_12tpZ3VcsgRtOGK,https://www.reuters.com/article/us-health-coronavirus-moldova/moldova-closes-schools-universities-to-prevent-virus-spread-idUSKBN20Y0VP,2020-04-02,2020-04-02T13:07:46Z,3,0,0,,,,,,,,,91,31.1,2,-0.824784338474274,-0.31783652305603,8,31,3549196,9151593756.55574,4.69079342838687,15.0822316569281,22.9371938821104,2,1,0.249926918547173,5.63572688074547,106374
R_1qa3cCotzNC2s2WNA,967704,new_entry,,,"","The movement of citizens through the town of Sângerei, Moldova, will be restricted, in particular after 10pm between March 21 and April 1.",2020-03-21,2020-03-21,2020-04-01,The policy has a clear end date,Moldova,MDA,MD,Municipal,1,Singerei,MD-SI,Singerei,Curfew,,,"",,,,,,"","","","","","","","","","","",,,,"",Yes,Moldova,One or more cities within one or more countries,,Singerei,Singerei,,,All Residents (Citizen Residents + Foreign Residents),,,,Mandatory (Unspecified/Implied),"Military,Municipal Government,Police",58.8607770433688,55.2004473188505,51.8255329735505,71,https://tummgmt.eu.qualtrics.com/Q/File.php?F=F_NURSw383taBe00h,https://www.ipn.md/en/print/sangerei-town-placed-under-quarantine--7967_1072353.html,2020-05-15,2020-05-15T19:34:54Z,80,1,1,,,,,,,,,91,31.1,2,-0.824784338474274,-0.31783652305603,8,31,3549196,9151593756.55574,4.69079342838687,15.0822316569281,22.9371938821104,2,1,0.249926918547173,5.63572688074547,106374
R_Qi7SWLtt39fvsNbNA,2911622,new_entry,,,"","On March 16, The Parliament of Moldova declared a State of Emergency allowing the government to impose additional border controls, limit movement, prohibit large gatherings, manage food supplies, and coordinate media messaging about the pandemic. It will end in 60 days.
",2020-03-16,2020-03-16,2020-05-15,The policy has a clear end date,Moldova,MDA,MD,National,1,,,,Declaration of Emergency,,,"",,,,,,"","","","","","","","","","","",,,,"",,Moldova,,,,,,,All Residents (Citizen Residents + Foreign Residents),,,,Mandatory with Legal Penalties (Jail Time),National Government,53.6191101947075,50.0647371329577,46.4150444558291,88,https://tummgmt.eu.qualtrics.com/Q/File.php?F=F_Ck2uyKnx2bGeLol,https://md.usembassy.gov/moldovan-government-has-declared-a-state-of-emergency-in-response-to-the-covid-19/,2020-04-01,2020-04-01T15:03:44Z,23,0,0,,,,,,,,,91,31.1,2,-0.824784338474274,-0.31783652305603,8,31,3549196,9151593756.55574,4.69079342838687,15.0822316569281,22.9371938821104,2,1,0.249926918547173,5.63572688074547,106374
R_29ssZVWyAoE9AxqNA,2431564,new_entry,,,"",A state of emergency was declared in the Transnistrian region of Moldova. It will last from March 17 until April 5.,2020-03-17,2020-03-17,2020-04-05,The policy has a clear end date,Moldova,MDA,MD,Provincial,1,Transnistria,,,Declaration of Emergency,,,"",,,,,,"","","","","","","","","","","",,,,"",,Moldova,,,Transnistria,,,,All Residents (Citizen Residents + Foreign Residents),,,,Mandatory (Unspecified/Implied),Provincial/State Government,53.9852047885487,50.6440433775985,47.2808144342257,85,https://tummgmt.eu.qualtrics.com/Q/File.php?F=F_1FmJW2QOIC7Moem,https://www.ipn.md/en/print/state-of-emergency-amid-covid-19-pandemic-declared-in-transnistria--7967_1072252.html,2020-05-15,2020-05-15T18:53:43Z,30,0,1,,,,,,,,,91,31.1,2,-0.824784338474274,-0.31783652305603,8,31,3549196,9151593756.55574,4.69079342838687,15.0822316569281,22.9371938821104,2,1,0.249926918547173,5.63572688074547,106374
R_33k9SWAG5WnhCn0NA,2431564,update,Change of Policy,Strengthening,timing of policy strengthening,"A state of emergency was declared in the Transnistrian region of Moldova. It will last from March 17 until April 5. On March 30, it was extended until May 1. UPDATE: The state of emergency declared in the Transnistrian region for the period between March 17 and April 5 was extended until May 1.",2020-03-17,2020-03-17,2020-05-01,The policy has a clear end date,Moldova,MDA,MD,Provincial,1,Transnistria,,,Declaration of Emergency,,,"",,,,,,"","","","","","","","","","","",,,,"",,Moldova,,,Transnistria,,,,All Residents (Citizen Residents + Foreign Residents),,,,Mandatory (Unspecified/Implied),Provincial/State Government,53.9852047885487,50.6440433775985,47.2808144342257,85,https://tummgmt.eu.qualtrics.com/Q/File.php?F=F_1FmJW2QOIC7Moem ; https://tummgmt.eu.qualtrics.com/Q/File.php?F=F_1IF75oEUFkNChHD,NA ; https://www.ipn.md/en/state-of-emergency-extended-in-transnistrian-region-7967_1072554.html,2020-05-15,2020-05-15T20:32:22Z,30,0,1,,,,,,,,,91,31.1,2,-0.824784338474274,-0.31783652305603,8,31,3549196,9151593756.55574,4.69079342838687,15.0822316569281,22.9371938821104,2,1,0.249926918547173,5.63572688074547,106374
R_2Vec170YF6Js4adNA,2431564,update,Change of Policy,Strengthening,timing of policy strengthening,A state of emergency was declared in the Transnistrian region of Moldova. It will last from March 17 until April 5. It is extended on April 24 until May 15. UPDATE: The state of emergency declared in the Transnistrian region for the period between March 17 and April 5 was originally extended until May 1. It is extended for a second time until May 15.,2020-03-17,2020-03-17,2020-05-15,The policy has a clear end date,Moldova,MDA,MD,Provincial,1,Transnistria,,,Declaration of Emergency,,,"",,,,,,"","","","","","","","","","","",,,,"",,Moldova,,,Transnistria,,,,All Residents (Citizen Residents + Foreign Residents),,,,Mandatory (Unspecified/Implied),Provincial/State Government,53.9852047885487,50.6440433775985,47.2808144342257,85,https://tummgmt.eu.qualtrics.com/Q/File.php?F=F_1FmJW2QOIC7Moem ; https://tummgmt.eu.qualtrics.com/Q/File.php?F=F_10PJcgzdAXK5Mr0,NA ; https://www.ipn.md/en/print/state-of-emergency-in-transnistrian-region-extended--7967_1073097.html,2020-05-16,2020-05-16T09:43:11Z,30,0,1,,,,,,,,,91,31.1,2,-0.824784338474274,-0.31783652305603,8,31,3549196,9151593756.55574,4.69079342838687,15.0822316569281,22.9371938821104,2,1,0.249926918547173,5.63572688074547,106374
R_Ojomrlz76LN6iWtNA,2142027,new_entry,,,"","The National Extraordinary Commission for Public Health in Moldova will declare a public health emergency on May 15. Through the platform of this commission, the sanitary-epidemiological rules will be further adjusted.",2020-05-13,2020-05-15,,,Moldova,MDA,MD,National,1,,,,Declaration of Emergency,,,"",,,,,,"","","","","","","","","","","",,,,"",,Moldova,,,,,,,All Residents (Citizen Residents + Foreign Residents),,,,Mandatory (Unspecified/Implied),"National Government,Ministry/Department of Health",76.8469236459159,73.5193230008934,69.8857368327626,102,https://tummgmt.eu.qualtrics.com/Q/File.php?F=F_3KOYgIbFIx93l1j,https://www.ipn.md/en/print/national-commission-for-public-health-will-declare-state-of-emergency-in-healthc--7967_1073499.html,2020-05-16,2020-05-16T10:18:15Z,5745,202,2228,,,,,,,,,91,31.1,2,-0.824784338474274,-0.31783652305603,8,31,3549196,9151593756.55574,4.69079342838687,15.0822316569281,22.9371938821104,2,1,0.249926918547173,5.63572688074547,106374
R_23WS4EILtSkfY7QNA,2142027,update,Change of Policy,Strengthening,timing of policy strengthening,"The National Extraordinary Commission for Public Health in Moldova will declare a public health emergency on May 15. Through the platform of this commission, the sanitary-epidemiological rules will be further adjusted.

On July 24 the Commission extended the state of public health emergency to August 31. UPDATE: The original state of public health emergency was set to last until June 30, since that time the National Extraordinary Public Health Committee has extended this state of emergency twice, as of the committee's decree of July 24, 2020 the state of emergency will remain in place until August 31",2020-05-13,2020-05-15,2020-08-31,The policy has a clear end date,Moldova,MDA,MD,National,1,,,,Declaration of Emergency,,,"",,,,,,"","","","","","","","","","","",,,,"",,Moldova,,,,,,,All Residents (Citizen Residents + Foreign Residents),,,,Mandatory (Unspecified/Implied),"National Government,Ministry/Department of Health",76.8469236459159,73.5193230008934,69.8857368327626,102,https://tummgmt.eu.qualtrics.com/Q/File.php?F=F_3KOYgIbFIx93l1j ; https://tummgmt.eu.qualtrics.com/Q/File.php?F=F_3lzzMZIL34Jhrg8,NA ; https://www.moldova.org/en/the-state-of-public-health-emergency-was-again-prolonged-in-moldova/ ; https://gov.md/sites/default/files/postanovlenie_nchkoz_no_21_ot_24.07.2020_1.pdf,2020-08-19,2020-08-19T06:03:56Z,5745,202,2228,,,,,,,,,91,31.1,2,-0.824784338474274,-0.31783652305603,8,31,3549196,9151593756.55574,4.69079342838687,15.0822316569281,22.9371938821104,2,1,0.249926918547173,5.63572688074547,106374
R_OjRgVtUOJQiSNmFNA,2142027,update,Change of Policy,Strengthening,timing of policy strengthening,"The National Extraordinary Commission for Public Health in Moldova will declare a public health emergency on May 15. Through the platform of this commission, the sanitary-epidemiological rules will be further adjusted.

The public health emergency has again been extended to September 15, 2020 by the National Extraordinary Commission for Public Health in Moldova. UPDATE: Moldova's state of public health emergency has been extended to September 15, 2020",2020-05-13,2020-05-15,2020-08-31,The policy has a clear end date,Moldova,MDA,MD,National,1,,,,Declaration of Emergency,,,"",,,,,,"","","","","","","","","","","",,,,"",,Moldova,,,,,,,All Residents (Citizen Residents + Foreign Residents),,,,Mandatory (Unspecified/Implied),"National Government,Ministry/Department of Health",76.8469236459159,73.5193230008934,69.8857368327626,102,https://tummgmt.eu.qualtrics.com/Q/File.php?F=F_3KOYgIbFIx93l1j ; https://tummgmt.eu.qualtrics.com/Q/File.php?F=F_VW1RBykBYhzsWo9,NA ; https://newsmaker.md/rus/novosti/v-moldove-prodlili-rezhim-chrezvychaynogo-polozheniya-v-zdravoohranenii/,2020-08-30,2020-08-30T01:32:21Z,5745,202,2228,,,,,,,,,91,31.1,2,-0.824784338474274,-0.31783652305603,8,31,3549196,9151593756.55574,4.69079342838687,15.0822316569281,22.9371938821104,2,1,0.249926918547173,5.63572688074547,106374
R_1HbOYC7XVOcIkluNA,2142027,update,Change of Policy,Strengthening,timing of policy strengthening,"The National Extraordinary Commission for Public Health in Moldova will declare a public health emergency on May 15. Through the platform of this commission, the sanitary-epidemiological rules will be further adjusted.

This state of Public health emergency will now continue to remain in effect until September 30 UPDATE: The state of national health emergency has been extended to September 30 by the National Extraordinary Commission on Public Heath.",2020-05-13,2020-05-15,2020-08-31,The policy has a clear end date,Moldova,MDA,MD,National,1,,,,Declaration of Emergency,,,"",,,,,,"","","","","","","","","","","",,,,"",,Moldova,,,,,,,All Residents (Citizen Residents + Foreign Residents),,,,Mandatory (Unspecified/Implied),"National Government,Ministry/Department of Health",76.8469236459159,73.5193230008934,69.8857368327626,102,https://tummgmt.eu.qualtrics.com/Q/File.php?F=F_3KOYgIbFIx93l1j ; https://tummgmt.eu.qualtrics.com/Q/File.php?F=F_AiyfA3hgv4L6Z69,NA ; https://gov.md/sites/default/files/postanovlenie_nchkoz_no_30_ot_11.09.2020.pdf,2020-09-22,2020-09-22T06:15:14Z,5745,202,2228,,,,,,,,,91,31.1,2,-0.824784338474274,-0.31783652305603,8,31,3549196,9151593756.55574,4.69079342838687,15.0822316569281,22.9371938821104,2,1,0.249926918547173,5.63572688074547,106374
R_3qQnBFJ65SCiLDoNA,2142027,update,Change of Policy,Strengthening,timing of policy strengthening,"The National Extraordinary Commission for Public Health in Moldova will declare a public health emergency between May 16 and June 30. Through the platform of this commission, the sanitary-epidemiological rules will be further adjusted. UPDATE: The period of the public health emergency was officially set between May 16 and June 30.",2020-05-13,2020-05-16,2020-06-30,The policy has a clear end date,Moldova,MDA,MD,National,1,,,,Declaration of Emergency,,,"",,,,,,"","","","","","","","","","","",,,,"",,Moldova,,,,,,,All Residents (Citizen Residents + Foreign Residents),,,,Mandatory (Unspecified/Implied),"National Government,Ministry/Department of Health",75.7716812491018,72.6519627165645,69.3438096546847,101,https://tummgmt.eu.qualtrics.com/Q/File.php?F=F_3KOYgIbFIx93l1j ; https://tummgmt.eu.qualtrics.com/Q/File.php?F=F_1ityvQvxJDB3Zsc,NA ; https://www.ipn.md/en/print/public-health-emergency-declared-in-moldova-until-june-30--7967_1073563.html,2020-05-16,2020-05-16T10:23:14Z,5934,207,2344,,,,,,,,,91,31.1,2,-0.824784338474274,-0.31783652305603,8,31,3549196,9151593756.55574,4.69079342838687,15.0822316569281,22.9371938821104,2,1,0.249926918547173,5.63572688074547,106374
R_3LgL06zBiaQ4yaSDj,5554984,new_entry,,,"",Moldova suspends air traffic with Italy as of March 12. The measure is valid until March 31.,2020-03-11,2020-03-12,2020-03-31,The policy has a clear end date,Moldova,MDA,MD,National,0,,,,External Border Restrictions,Other External Border Restriction,,"",,,,,,"","","","","","","","","","","",,,,"",No,Italy,"One or more countries, but not all countries",,,,,,All (Travelers + Residents),,Inbound/Outbound,Flights,Mandatory (Unspecified/Implied),"National Government,Ministry/Department of Health",50.4528417282198,46.9732184937954,42.5380837147551,106,https://tummgmt.eu.qualtrics.com/Q/File.php?F=F_31nDtalCBSTcDGJ,https://www.ipn.md/en/authorities-suspend-air-traffic-with-italy-7967_1072096.html,2020-05-15,2020-05-15T15:53:40Z,3,0,0,,,,,,,,,91,31.1,2,-0.824784338474274,-0.31783652305603,8,31,3549196,9151593756.55574,4.69079342838687,15.0822316569281,22.9371938821104,2,1,0.249926918547173,5.63572688074547,106374
R_CfzAgjoKLTj8NodDj,5650891,new_entry,,,"","The air operators on Moldova are obliged not to allow travellers from Italy, China, Iran and South Korea from March 12.
",2020-03-11,2020-03-12,,,Moldova,MDA,MD,National,0,,,,External Border Restrictions,Other External Border Restriction,,"",,,,,,"","","","","","","","","","","",,,,"",No,"China,Iran,Italy,South Korea","One or more countries, but not all countries",,,,,,Foreign Travelers,,Inbound,Flights,Mandatory (Unspecified/Implied),"National Government,Ministry/Department of Health",50.4528417282198,46.9732184937954,42.5380837147551,106,https://tummgmt.eu.qualtrics.com/Q/File.php?F=F_1IuCcjfwgJwVxp1,https://www.ipn.md/en/authorities-suspend-air-traffic-with-italy-7967_1072096.html,2020-05-15,2020-05-15T15:56:46Z,3,0,0,,,,,,,,,91,31.1,2,-0.824784338474274,-0.31783652305603,8,31,3549196,9151593756.55574,4.69079342838687,15.0822316569281,22.9371938821104,2,1,0.249926918547173,5.63572688074547,106374
R_bdCVoR6bEq0VIClDj,5650891,update,End of Policy,,"","The air operators on Moldova are obliged not to allow travellers from Italy, China, Iran and South Korea from March 12.

The National Extraordinary Commission on Public Health eased restrictions by decree on 15 May, 2020 to allow passengers of any nationality transit through Moldovan territory on repatriation journeys organized by their home countries. As of May 25, 2020 The National Extraordinary Commission on Public Health have fully lifted all restrictions on passengers transiting Moldova. UPDATE: Restrictions on foreign passengers transiting Moldovan territory were fully lifted May 25, 2020 by decree of the National Extraordinary Committee on Public Health.",2020-03-11,2020-03-12,2020-05-25,The policy has a clear end date,Moldova,MDA,MD,National,0,,,,External Border Restrictions,Other External Border Restriction,,"",,,,,,"","","","","","","","","","","",,,,"",No,"China,Iran,Italy,South Korea","One or more countries, but not all countries",,,,,,Foreign Travelers,,Inbound,Flights,Mandatory (Unspecified/Implied),"National Government,Ministry/Department of Health",50.4528417282198,46.9732184937954,42.5380837147551,106,https://tummgmt.eu.qualtrics.com/Q/File.php?F=F_1IuCcjfwgJwVxp1 ; https://tummgmt.eu.qualtrics.com/Q/File.php?F=F_28Ce3u91YZKjnaX,NA ; https://gov.md/sites/default/files/postanovlenie_no_11_ot_15.05.2020_g._nacionalnoy_chrezvychaynoy_komissii_obshchestvennogo_zdorovya.pdf ; https://gov.md/sites/default/files/postanovlenie_no12_ot_25.05.2020_g._nacionalnoy_chrezvychaynoy_komissii_obshchestvennogo_zdorovya.pdf,2020-08-29,2020-08-29T19:20:57Z,3,0,0,,,,,,,,,91,31.1,2,-0.824784338474274,-0.31783652305603,8,31,3549196,9151593756.55574,4.69079342838687,15.0822316569281,22.9371938821104,2,1,0.249926918547173,5.63572688074547,106374
R_12cfpzOshDTw7dpDj,3325323,new_entry,,,"",The Republic of Moldova closes its airspace for the regular flights from Spain and France as of March 13. The Chisinau-Barcelona and Chisinau-Paris flights are also annulled.,2020-03-13,2020-03-13,,,Moldova,MDA,MD,National,0,,,,External Border Restrictions,Other External Border Restriction,,"",,,,,,"","","","","","","","","","","",,,,"",No,"France,Spain","One or more countries, but not all countries",,,,,,All (Travelers + Residents),,Inbound/Outbound,Flights,Mandatory (Unspecified/Implied),National Government,51.4747805312556,48.0069551441525,44.1000473287961,105,https://tummgmt.eu.qualtrics.com/Q/File.php?F=F_3G8TvczVBLdrTsG,https://www.ipn.md/en/chisinau-barcelona-and-chisinau-paris-flights-cancelled-as-of-march-7967_1072159.html,2020-05-15,2020-05-15T16:45:00Z,6,0,0,,,,,,,,,91,31.1,2,-0.824784338474274,-0.31783652305603,8,31,3549196,9151593756.55574,4.69079342838687,15.0822316569281,22.9371938821104,2,1,0.249926918547173,5.63572688074547,106374
