R_xr4at4BYS5tGsaREa,3320442,new_entry,,,"","The Ministry of Finance in Moldova announced on March 31 to allocate 
the amount of 5.4 million lei, to the Ministry of Health for procuring protective coveralls.",2020-03-31,2020-03-31,,,Moldova,MDA,MD,National,0,,,,Health Resources,Personal Protective Equipment,,"",,,,,,"","","","","","","","","","","",,,,"",Yes,Moldova,"One or more countries, but not all countries",,,,,,,,,,Mandatory (Unspecified/Implied),Ministry/Department of Health,78.0505116574352,74.9797974254582,71.3117105754917,121,https://tummgmt.eu.qualtrics.com/Q/File.php?F=F_cGVqALkuZMHnigh,http://tvrmoldova.md/economic/ministerul-finantelor-va-aloca-5-8-milioane-de-lei-pentru-procurarea-combinezoanelor-de-protectie-si-acordarea-indemnizatiilor-unice-pentru-cadre-medicale/,2020-05-01,2020-05-01T14:07:21Z,353,4,18,,,,,,,,,91,31.1,2,-0.824784338474274,-0.31783652305603,8,31,3549196,9151593756.55574,4.69079342838687,15.0822316569281,22.9371938821104,2,1,0.249926918547173,5.63572688074547,106374
R_1eRxVPSA8FIYjwBFz,7416239,new_entry,,,"","The Chisinau, Moldova, COVID-19 Center in the Exhibitions Center “Moldexpo” will become functional on April 3. At the first stage, this will have a capacity of 300-400 places.",2020-04-02,2020-04-03,,,Moldova,MDA,MD,National,0,,,,Health Resources,Temporary Medical Centers,,"",,,,,,"","","","","","","","","","","",,,,"",No,Moldova,One or more cities within one or more countries,,,Chisinau,,,All (Travelers + Residents),,,Not Applicable,Mandatory (Unspecified/Implied),National Government,78.7143854749496,75.6572598293002,72.3891749401348,118,https://tummgmt.eu.qualtrics.com/Q/File.php?F=F_yrtRcUPClcq1FHb,https://www.ipn.md/en/print/sorting-center-at-moldexpo-to-become-functional-april-3--7967_1072641.html,2020-05-16,2020-05-16T08:53:21Z,591,8,26,,,,,,,,,91,31.1,2,-0.824784338474274,-0.31783652305603,8,31,3549196,9151593756.55574,4.69079342838687,15.0822316569281,22.9371938821104,2,1,0.249926918547173,5.63572688074547,106374
R_3hAAkhsK9RFQgfMGb,2880891,new_entry,,,"","On April 3, the Exceptional Situations Commission in Moldova took the decision to purchase tests for COVID-19 infection, worth 35.5 million lei, money allocated by the National Medical Insurance Company.",2020-04-04,2020-04-04,,,Moldova,MDA,MD,National,0,,,,Health Resources,Test Kits,,"",,,,,,"","","","","","","","","","","",,,,"",Yes,Moldova,"One or more countries, but not all countries",,,,,,,,,,Mandatory (Unspecified/Implied),Ministry/Department of Health,78.8968206504708,75.9581503079565,72.2667561002694,119,https://tummgmt.eu.qualtrics.com/Q/File.php?F=F_BWIYRpDeOd4vXXj,https://www.jurnal.md/ro/news/4ac790c919083973/dupa-12-decese-si-752-de-infectati-cnam-achizitioneaza-in-regim-de-urgenta-teste-pentru-depistarea-covid-19.html,2020-05-01,2020-05-01T14:22:22Z,752,12,29,,,,,,,,,91,31.1,2,-0.824784338474274,-0.31783652305603,8,31,3549196,9151593756.55574,4.69079342838687,15.0822316569281,22.9371938821104,2,1,0.249926918547173,5.63572688074547,106374
R_2DMmaQ36tzRQJ7ANA,5560178,new_entry,,,"","The authorities in Moldova decided on April 6 to massively test all the doctors in Ştefan-Vodă and Soroca. The doctors in the rest of the regions, from all the medical institutions, will be tested later, gradually.",2020-04-06,2020-04-06,,,Moldova,MDA,MD,National,0,,,,Health Testing,,,"",,,,,,"","","","","","","","","","","",,,,"",No,Moldova,One or more cities within one or more countries,,,Ştefan-Vodă; Soroca,,,Health Staff,,,Not Applicable,Mandatory (Unspecified/Implied),"National Government,Municipal Government",79.5368473463154,75.9131857503409,72.6152640741605,119,https://tummgmt.eu.qualtrics.com/Q/File.php?F=F_yZSZ4AbDEUItO1j,https://www.ipn.md/en/print/persons-with-slight-forms-of-covid-19-will-no-longer-be-hospitalized--7967_1072706.html,2020-05-16,2020-05-16T09:14:51Z,965,19,37,,,,,,,,,91,31.1,2,-0.824784338474274,-0.31783652305603,8,31,3549196,9151593756.55574,4.69079342838687,15.0822316569281,22.9371938821104,2,1,0.249926918547173,5.63572688074547,106374
R_1liASR6RsdL1UgLCf,6407366,new_entry,,,"",The managers and owners of passenger transportation companies in Moldiva are to ensure from March 13 the cleaning and disinfection of the motor vehicles after each route.,2020-03-13,2020-03-13,,,Moldova,MDA,MD,National,1,,,,Hygiene,Hygiene measures for public transport,,"",,,,,,"","","","","","","","","","","",,,,"",,Moldova,,,,,,,All Residents (Citizen Residents + Foreign Residents),,,,Mandatory (Unspecified/Implied),National Government,51.4747805312556,48.0069551441525,44.1000473287961,105,https://tummgmt.eu.qualtrics.com/Q/File.php?F=F_bdWvzLtR7dUDnln,https://www.ipn.md/en/print/covid-19-nationwide-red-alert--7967_1072167.html,2020-05-15,2020-05-15T17:09:40Z,6,0,0,,,,,,,,,91,31.1,2,-0.824784338474274,-0.31783652305603,8,31,3549196,9151593756.55574,4.69079342838687,15.0822316569281,22.9371938821104,2,1,0.249926918547173,5.63572688074547,106374
R_tFZTWuEHLKrQ5nXDf,4828392,new_entry,,,"","Each housing stock manager in Chisinau, Moldova, is obliged to sanitize balustrades, stairs and elevators in apartments twice a day and playgrounds each morning from March 13, 2020. The workers are issued with protective face masks and gloves.",2020-03-13,2020-03-13,,The policy’s end date is unknown or unreported,Moldova,MDA,MD,Municipal,1,Chisinau Municipality,MD-CU,Chisinau,Hygiene,Other Areas Hygiene Measures Applied,,"",,,,,,"","","","","","","","","","","",,,,"",,Moldova,,,Chisinau Municipality,Chisinau,,,All Residents (Citizen Residents + Foreign Residents),,,,Mandatory (Unspecified/Implied),Municipal Government,51.4747805312556,48.0069551441525,44.1000473287961,105,https://tummgmt.eu.qualtrics.com/Q/File.php?F=F_3JDk4r84Q1frfvG,https://www.ipn.md/en/print/disinfection-works-performed-in-blocks-and-on-playgrounds-in-chisinau--7967_1072165.html,2021-05-01,2021-05-01T10:10:19Z,6,0,0,,,,,,,,,91,31.1,2,-0.824784338474274,-0.31783652305603,8,31,3549196,9151593756.55574,4.69079342838687,15.0822316569281,22.9371938821104,2,1,0.249926918547173,5.63572688074547,106374
R_2wsfUs55U4vou5jCe,4067132,new_entry,,,"","The new parliamentary elections that will take place in Hincești, Moldova, on March 15 will be held in conditions of increased protection and sanitation. Antiseptics will be available in polling stations and the members of electoral bureaus will wear medical face masks. The number of voters inside a polling station will be limited.",2020-03-14,2020-03-15,2020-03-15,The policy has a clear end date,Moldova,MDA,MD,Municipal,1,Hincesti,MD-HI,Hincesti,Hygiene,Hygiene measures for public areas,,"",,,,,,"","","","","","","","","","","",,,,"",,Moldova,,,Hincesti,Hincesti,,,All Residents (Citizen Residents + Foreign Residents),,,,Mandatory (Unspecified/Implied),Municipal Government,52.7585429992965,49.554520637002,46.0022960100142,94,https://tummgmt.eu.qualtrics.com/Q/File.php?F=F_0fAD4tecD6gOPxT,https://www.ipn.md/en/print/elections-in-hancesti-pens-will-be-disinfected-after-each-voter-while-surfaces-o--8008_1072179.html,2020-05-15,2020-05-15T17:19:48Z,23,0,0,,,,,,,,,91,31.1,2,-0.824784338474274,-0.31783652305603,8,31,3549196,9151593756.55574,4.69079342838687,15.0822316569281,22.9371938821104,2,1,0.249926918547173,5.63572688074547,106374
R_300LE9JsiBhJEP8Cf,4284073,new_entry,,,"","The Chisinau City Hall in Moldova said that as of March 20, 2020, hand sanitizer dispensers will be available in all the trolleybuses running on routes in the capital city.",2020-03-20,2020-03-20,2020-03-21,The policy is a one-time measure (e.g. publication of guidelines),Moldova,MDA,MD,Municipal,1,Chisinau Municipality,MD-CU,Chisinau,Hygiene,Hygiene measures for public transport,,"",,,,,,"","","","","","","","","","","",,,,"",,Moldova,,,Chisinau Municipality,Chisinau,,,All Residents (Citizen Residents + Foreign Residents),,,,Mandatory (Unspecified/Implied),Municipal Government,56.7787717819654,53.3049379978119,49.9854048814082,68,https://tummgmt.eu.qualtrics.com/Q/File.php?F=F_8jq9Qjna4AxpLNf,https://www.ipn.md/en/print/public-transport-in-chisinau-outfitted-with-hand-sanitizer-dispensers--7967_1072320.html,2021-05-01,2021-05-01T10:15:48Z,66,1,1,,,,,,,,,91,31.1,2,-0.824784338474274,-0.31783652305603,8,31,3549196,9151593756.55574,4.69079342838687,15.0822316569281,22.9371938821104,2,1,0.249926918547173,5.63572688074547,106374
R_C3vlO5ZEkudNRgRNA,4896209,new_entry,,,"","Transnistria, Moldova, bans from March 17 the entrance of non-residents of the region, except for diplomats and those who transport food products and other essentials.",2020-03-17,2020-03-17,2020-04-05,The policy has a clear end date,Moldova,MDA,MD,Provincial,1,Transnistria,,,Internal Border Restrictions,,,"",,,,,,"","","","","","","","","","","",,,,"",No,Moldova,"One or more countries, but not all countries",,Transnistria,,,,Foreign Travelers,,,,Mandatory (Unspecified/Implied),Provincial/State Government,53.9852047885487,50.6440433775985,47.2808144342257,85,https://tummgmt.eu.qualtrics.com/Q/File.php?F=F_3lsOretGVD0WjlV,https://www.ipn.md/en/print/state-of-emergency-amid-covid-19-pandemic-declared-in-transnistria--7967_1072252.html,2020-05-15,2020-05-15T18:57:37Z,30,0,1,,,,,,,,,91,31.1,2,-0.824784338474274,-0.31783652305603,8,31,3549196,9151593756.55574,4.69079342838687,15.0822316569281,22.9371938821104,2,1,0.249926918547173,5.63572688074547,106374
R_1HdYz1VXacC0msqNA,7562068,new_entry,,,"","From March 17, residents of the Transnistrian region in Moldova will be able to leave after filling out a mandatory form.",2020-03-17,2020-03-17,2020-04-05,The policy has a clear end date,Moldova,MDA,MD,Provincial,1,Transnistria,,,Internal Border Restrictions,,,"",,,,,,"","","","","","","","","","","",,,,"",No,Moldova,"One or more countries, but not all countries",,Transnistria,,,,Citizen Travelers,,,,Mandatory (Unspecified/Implied),Provincial/State Government,53.9852047885487,50.6440433775985,47.2808144342257,85,https://tummgmt.eu.qualtrics.com/Q/File.php?F=F_22Fy6UOW8NFq4TV,https://www.ipn.md/en/print/state-of-emergency-amid-covid-19-pandemic-declared-in-transnistria--7967_1072252.html,2020-05-15,2020-05-15T19:00:44Z,30,0,1,,,,,,,,,91,31.1,2,-0.824784338474274,-0.31783652305603,8,31,3549196,9151593756.55574,4.69079342838687,15.0822316569281,22.9371938821104,2,1,0.249926918547173,5.63572688074547,106374
R_1HhRzOPur6EAZymNA,4020694,new_entry,,,"","On March 21 and 22, the public transport in the municipality of Chisinau, Moldova will run on routes from 7am until 10am and then from 4pm until 7:30pm only.",2020-03-21,2020-03-21,2020-03-22,The policy has a clear end date,Moldova,MDA,MD,Municipal,1,Chisinau Municipality,MD-CU,Chisinau,Internal Border Restrictions,,,"",,,,,,"","","","","","","","","","","",,,,"",Yes,Moldova,One or more cities within one or more countries,,Chisinau Municipality,Chisinau,,,All Residents (Citizen Residents + Foreign Residents),,,,Mandatory (Unspecified/Implied),Municipal Government,58.8607770433688,55.2004473188505,51.8255329735505,71,https://tummgmt.eu.qualtrics.com/Q/File.php?F=F_ehAyV2XeEpbcY9z,https://www.ipn.md/en/print/public-transport-in-chisinau-limited-on-weekend--7967_1072347.html,2020-05-15,2020-05-15T19:28:19Z,80,1,1,,,,,,,,,91,31.1,2,-0.824784338474274,-0.31783652305603,8,31,3549196,9151593756.55574,4.69079342838687,15.0822316569281,22.9371938821104,2,1,0.249926918547173,5.63572688074547,106374
R_2BgHGiph80Paf6aNA,4461628,new_entry,,,"","The transit transport in Chisinau, Moldova, has a new work program as of March 23. The trolleybuses and buses will run from 5:30am until 10:00am and then from 4:00pm until 8:00pm.",2020-03-23,2020-03-23,,,Moldova,MDA,MD,Municipal,1,Chisinau Municipality,MD-CU,Chisinau,Internal Border Restrictions,,,"",,,,,,"","","","","","","","","","","",,,,"",Yes,Moldova,One or more cities within one or more countries,,Chisinau Municipality,Chisinau,,,All Residents (Citizen Residents + Foreign Residents),,,,Mandatory (Unspecified/Implied),Municipal Government,65.2795419988046,61.5009700879258,58.3271119101302,83,https://tummgmt.eu.qualtrics.com/Q/File.php?F=F_1LGNChgMpr9FZlq,https://www.ipn.md/en/print/public-transport-in-chisinau-will-run-according-to-new-program--7967_1072366.html,2020-05-15,2020-05-15T19:43:42Z,109,1,1,,,,,,,,,91,31.1,2,-0.824784338474274,-0.31783652305603,8,31,3549196,9151593756.55574,4.69079342838687,15.0822316569281,22.9371938821104,2,1,0.249926918547173,5.63572688074547,106374
R_1i3xUvnEaUS0f4DNA,1364959,new_entry,,,"",The Commission for Exceptional Situations in Moldova decided that public transport in the municipalities of Chisinau and Bălți will not run on April 11 and 12.,2020-04-09,2020-04-11,2020-04-12,The policy has a clear end date,Moldova,MDA,MD,National,1,,,,Internal Border Restrictions,,,"",,,,,,"","","","","","","","","","","",,,,"",No,Moldova,One or more cities within one or more countries,,,Chisinau; Bălți,,,All (Travelers + Residents),,,,Mandatory (Unspecified/Implied),Municipal Government,79.4058415993677,75.9635361481707,72.7862904220116,115,https://tummgmt.eu.qualtrics.com/Q/File.php?F=F_DSGPbJX5UCDHVQt,https://www.ipn.md/en/print/public-transport-in-chisinau-and-balti-suspended-on-weekend--7967_1072783.html,2020-05-16,2020-05-16T09:23:55Z,1560,30,75,,,,,,,,,91,31.1,2,-0.824784338474274,-0.31783652305603,8,31,3549196,9151593756.55574,4.69079342838687,15.0822316569281,22.9371938821104,2,1,0.249926918547173,5.63572688074547,106374
R_OpWSxrGT9DiqMPDNA,9163497,new_entry,,,"","From 8 am on April 14th, Moldova placed the town of Glodeni into quarantine. This is on top of quarantines placed on Soroca municipality, Boghiceni village of Hâncești district, Ștefan Vodă town, Carahasani and Talmaza villages of Ștefan Vodă district.",2020-04-13,2020-04-14,,,Moldova,MDA,MD,National,1,,,,Internal Border Restrictions,,,"",,,,,,"","","","","","","","","","","",,,,"",No,Moldova,One or more cities within one or more countries,,,Glodeni; Karakhasani; Soroca; Stefan Voda; Talmaza,,,All (Travelers + Residents),,,,Mandatory (Unspecified/Implied),"National Government,Municipal Government,Police",79.4048385079464,76.3114938954611,73.0078206895064,117,https://tummgmt.eu.qualtrics.com/Q/File.php?F=F_3oHgcxCCJksuCud,https://www.ipn.md/en/glodeni-to-be-in-quarantine-from-april-14-7967_1072865.html,2020-04-25,2020-04-25T17:20:44Z,1934,40,134,,,,,,,,,91,31.1,2,-0.824784338474274,-0.31783652305603,8,31,3549196,9151593756.55574,4.69079342838687,15.0822316569281,22.9371938821104,2,1,0.249926918547173,5.63572688074547,106374
R_umPfTcvpN1Y6NXPNA,8442614,new_entry,,,"","Access through the town of Sângerei, Moldova, is restricted between March 21 and April 1. Only the persons who need to make purchases and need the services of the Public Services Agency are an exception.",2020-03-21,2020-03-21,2020-04-01,The policy has a clear end date,Moldova,MDA,MD,Municipal,1,Singerei,MD-SI,Singerei,Lockdown,,,"",,,,,,"","","","","","","","","","","",,,,"",,Moldova,,,Singerei,Singerei,,,All Residents (Citizen Residents + Foreign Residents),,,,Mandatory (Unspecified/Implied),"Military,Municipal Government,Police",58.8607770433688,55.2004473188505,51.8255329735505,71,https://tummgmt.eu.qualtrics.com/Q/File.php?F=F_vZXCQrCnIa6LILT,https://www.ipn.md/en/print/sangerei-town-placed-under-quarantine--7967_1072353.html,2020-05-15,2020-05-15T19:36:57Z,80,1,1,,,,,,,,,91,31.1,2,-0.824784338474274,-0.31783652305603,8,31,3549196,9151593756.55574,4.69079342838687,15.0822316569281,22.9371938821104,2,1,0.249926918547173,5.63572688074547,106374
R_2awwRpPDoQYgFbRFq,5176689,new_entry,,,"",The town Sângerei in Moldova will be in lockdown from March 21 until April 1.,2020-03-21,2020-03-21,2020-04-01,The policy has a clear end date,Moldova,MDA,MD,Municipal,1,Singerei,MD-SI,Singerei,Lockdown,,,"",,,,,,"","","","","","","","","","","",,,,"",Yes,Moldova,One or more cities within one or more countries,,Singerei,Singerei,,,All Residents (Citizen Residents + Foreign Residents),,,,Mandatory (Unspecified/Implied),"Military,Municipal Government,Police",58.8607770433688,55.2004473188505,51.8255329735505,71,https://tummgmt.eu.qualtrics.com/Q/File.php?F=F_2Vg2jQSP3nW0V6J,NA,2020-07-22,2020-07-22T14:03:15Z,80,1,1,,,,,,,,,91,31.1,2,-0.824784338474274,-0.31783652305603,8,31,3549196,9151593756.55574,4.69079342838687,15.0822316569281,22.9371938821104,2,1,0.249926918547173,5.63572688074547,106374
R_3D7SkN8sLMH9QucNA,1886789,new_entry,,,"",The government of the Transnistria region in Moldova have suspended the operation of all public transport beginning March 24.,2020-03-23,2020-03-24,,,Moldova,MDA,MD,Provincial,1,Transnistria,,,Lockdown,,,"",,,,,,"","","","","","","","","","","",,,,"",Yes,Moldova,One or more provinces within one or more countries,,Transnistria,,,,All Residents (Citizen Residents + Foreign Residents),No special population targeted,,,Mandatory (Unspecified/Implied),New (COVID-19 specific) Task Force,69.0611964910246,65.8523176879416,62.5342724070888,98,https://tummgmt.eu.qualtrics.com/Q/File.php?F=F_3jSQkWpe4msbz8r,https://novostipmr.com/ru/news/20-03-23/obshchestvennyy-transport-vremenno-prekrashchaet-svoyu-rabotu,2020-08-12,2020-08-12T08:57:42Z,125,1,2,,,,,,,,,91,31.1,2,-0.824784338474274,-0.31783652305603,8,31,3549196,9151593756.55574,4.69079342838687,15.0822316569281,22.9371938821104,2,1,0.249926918547173,5.63572688074547,106374
R_2TMGIOCxQef6dXoNA,1886789,update,End of Policy,,"","The government of the Transnistria region in Moldova have suspended the operation of all public transport beginning March 24. 

As part of the gradual easing of lockdown restrictions, public transport will be permitted to operate freely within the Transnistrian region beginning June 27th. UPDATE: On March 24, authorities in the Transnistria region suspended all public transport. On June 25 the COVID 19 task force of the Interior Ministry of the Transnistrian region decided that as part of the gradual easing of COVID 19 related restrictions, public transport services would be resumed in full beginning June 27, 2020.",2020-03-23,2020-03-24,2020-06-27,The policy has a clear end date,Moldova,MDA,MD,Provincial,1,Transnistria,,,Lockdown,,,"",,,,,,"","","","","","","","","","","",,,,"",Yes,Moldova,One or more provinces within one or more countries,,Transnistria,,,,All Residents (Citizen Residents + Foreign Residents),No special population targeted,,,Mandatory (Unspecified/Implied),New (COVID-19 specific) Task Force,69.0611964910246,65.8523176879416,62.5342724070888,98,https://tummgmt.eu.qualtrics.com/Q/File.php?F=F_3jSQkWpe4msbz8r ; https://tummgmt.eu.qualtrics.com/Q/File.php?F=F_2E6MWQ52ZW78NBb,NA ; https://mvdpmr.org/novosti/resheniya-opershtaba/31844-reshenie-operativnogo-shtaba-ot-25-iunia-2020-goda.html,2020-08-20,2020-08-20T06:52:57Z,125,1,2,,,,,,,,,91,31.1,2,-0.824784338474274,-0.31783652305603,8,31,3549196,9151593756.55574,4.69079342838687,15.0822316569281,22.9371938821104,2,1,0.249926918547173,5.63572688074547,106374
R_3EtHVkIaKd2l60GFq,8327559,new_entry,,,"",From March 25 it is forbidden to persons over 63 years of age in Moldova to be away from home and in public spaces without urgent need except for medicine and grocery shopping.,2020-03-23,2020-03-25,,,Moldova,MDA,MD,National,1,,,,Lockdown,,,"",,,,,,"","","","","","","","","","","",,,,"",Yes,Moldova,"One or more countries, but not all countries",,,,,,All Residents (Citizen Residents +Foreign Residents),People of a certain age (please note age range in the text entry),,,Mandatory (Unspecified/Implied),"National Government,Ministry/Department of Health,Provincial/State Government,Municipal Government,Police",72.2376978433629,68.7416437932876,65.2553878618187,104,https://tummgmt.eu.qualtrics.com/Q/File.php?F=F_23TxzGty57eYBGM,https://www.moldova.org/in-r-moldova-se-limiteaza-accesul-in-locurile-publice-persoanele-de-peste-63-ani-obligate-sa-stea-acasa/,2020-07-14,2020-07-14T13:02:08Z,149,1,2,,,,,,,,,91,31.1,2,-0.824784338474274,-0.31783652305603,8,31,3549196,9151593756.55574,4.69079342838687,15.0822316569281,22.9371938821104,2,1,0.249926918547173,5.63572688074547,106374
R_2QzHIuubqaEfgqNNA,1164047,new_entry,,,"","The clients and employees of hypermarkets, supermarkets and quarter stores in Chisinau, Moldova, will have their body temperature checked on entry from April 6. If the temperature is higher than 37°C, the person will be banned access to the store.",2020-04-06,2020-04-06,,,Moldova,MDA,MD,Municipal,0,Chisinau Municipality,MD-CU,Chisinau,Other Policy Not Listed Above,,,"",,,,,,"","","","","","","","","","","",All customers and employees of supermarkets will have their temperature checked before they can enter the shop.,,,"",Yes,Moldova,One or more cities within one or more countries,,Chisinau Municipality,Chisinau,,,,,,,Mandatory (Unspecified/Implied),Municipal Government,79.5368473463154,75.9131857503409,72.6152640741605,119,https://tummgmt.eu.qualtrics.com/Q/File.php?F=F_1lblwYWWQFN7I1h,https://www.ipn.md/en/those-with-temperature-higher-than-370c-will-not-be-7967_1072702.html,2020-05-16,2020-05-16T09:11:09Z,965,19,37,,,,,,,,,91,31.1,2,-0.824784338474274,-0.31783652305603,8,31,3549196,9151593756.55574,4.69079342838687,15.0822316569281,22.9371938821104,2,1,0.249926918547173,5.63572688074547,106374
R_21zjIDXXwCqf2WXNA,4473449,new_entry,,,"","On June 1st, Moldova announced charter flights would be organized to a number of international destinations, despite Chisinau airport remaining closed.",2020-06-01,2020-06-01,,,Moldova,MDA,MD,National,0,,,,Other Policy Not Listed Above,,,"",,,,,,"","","","","","","","","","","","On June 1st Moldiva announced that the main airport would remain closed. Despite this, they decided to organize a number of charter flights to other coubtries. So it isn't really a policy uodate, but rather a new pokicy which complements another, the airport closure and the halting of commercial flights.",,,"",Yes,Moldova,"One or more countries, but not all countries",,,,,,,Other population not specifed above,,,Mandatory (Unspecified/Implied),"National Government,Other (Please specify in the text box)",73.4841331733661,70.0716564864788,66.6113647371436,102,https://tummgmt.eu.qualtrics.com/Q/File.php?F=F_3RaLF9ENNbgJXHT,https://md.usembassy.gov/message-to-u-s-citizens-u-s-embassy-chisinau-moldova-june-1-2020/,2020-07-23,2020-07-23T10:49:47Z,8360,305,4622,,,,,,,,,91,31.1,2,-0.824784338474274,-0.31783652305603,8,31,3549196,9151593756.55574,4.69079342838687,15.0822316569281,22.9371938821104,2,1,0.249926918547173,5.63572688074547,106374
R_28GuI0EMHqoFGynBd,9977775,new_entry,,,"","On March 16, Monaco published, on social medias, a graphic sheet for the public to explain for who and how the remote working can be implemented.",2020-03-16,2020-03-16,2020-03-17,The policy is a one-time measure (e.g. publication of guidelines),Moldova,MDA,MD,National,1,,,,Public Awareness Measures,Disseminating information related to COVID-19 to the public that is reliable and factually accurate,,"",,,,,,"","","","","","","","","","","",,,,"",Yes,Moldova,"One or more countries, but not all countries",,,,,,All Residents (Citizen Residents + Foreign Residents),Other population not specifed above,,,Voluntary/Recommended but No Penalties,National Government,53.6191101947075,50.0647371329577,46.4150444558291,88,https://tummgmt.eu.qualtrics.com/Q/File.php?F=F_3lA12jmiN7HFV0f,Twitter,2021-06-04,2021-06-04T20:09:54Z,23,0,0,,,,,,,,,91,31.1,2,-0.824784338474274,-0.31783652305603,8,31,3549196,9151593756.55574,4.69079342838687,15.0822316569281,22.9371938821104,2,1,0.249926918547173,5.63572688074547,106374
R_3LaO7AqfjkfndZjNA,5763558,new_entry,,,"","In Moldova on March 20, a new on-line platform allowing real-time monitoring of COVID-19 cases in the Republic of Moldova was launched by the Ministry of Health, Labour and Social Protection.",2020-03-20,2020-03-20,,,Moldova,MDA,MD,National,1,,,,Public Awareness Measures,,,"",,,,,,"","","","","","","","","","","",,,,"",,Moldova,,,,,,,All Residents (Citizen Residents + Foreign Residents),,,,Voluntary/Recommended but No Penalties,Ministry/Department of Health,56.7787717819654,53.3049379978119,49.9854048814082,68,https://tummgmt.eu.qualtrics.com/Q/File.php?F=F_1LNimIwZwUGE9Kf,https://msmps.gov.md/en/node/11175,2020-04-01,2020-04-01T17:39:45Z,66,1,1,,,,,,,,,91,31.1,2,-0.824784338474274,-0.31783652305603,8,31,3549196,9151593756.55574,4.69079342838687,15.0822316569281,22.9371938821104,2,1,0.249926918547173,5.63572688074547,106374
R_2QEUP9MFrsOJrq3At,5942469,new_entry,,,"",A platform was released for reporting violations related to the state of emergency in Moldova as of April 3. It contains free standard forms that ensure juridical guidance for those who want to inform the responsible authorities about particular abuses and web accessible resources concerning organizations who provide COVID-19 related assistance.,2020-04-03,2020-04-03,,,Moldova,MDA,MD,National,1,,,,Public Awareness Measures,Both Disseminating and Gathering information related to COVID-19,,"",,,,,,"","","","","","","","","","","",,,,"",,Moldova,,,,,,,All Residents (Citizen Residents + Foreign Residents),,,,Mandatory (Unspecified/Implied),National Government,78.7143854749496,75.6572598293002,72.3891749401348,118,https://tummgmt.eu.qualtrics.com/Q/File.php?F=F_3CJKmv8Jq4sGqwz,https://www.ipn.md/en/print/citizens-can-report-violations-related-to-state-of-emergency-on-wwwmonitormd--7967_1072669.html,2020-05-16,2020-05-16T09:03:45Z,591,8,26,,,,,,,,,91,31.1,2,-0.824784338474274,-0.31783652305603,8,31,3549196,9151593756.55574,4.69079342838687,15.0822316569281,22.9371938821104,2,1,0.249926918547173,5.63572688074547,106374
