R_3svIkfrkt65h8TDDr,7453104,update,Change of Policy,Strengthening,timing of policy strengthening,"From October 8, 2020, the Swedish Ministry of Foreign Affairs advice against non-essential travel to certain countries in the EU, EEA, and Schengen areas until October 21, 2020. The following countries in these areas are subject to the travel advisory: Estonia, Ireland, Latvia, and Lithuania. The previous travel advisory is lifted for Malta and Slovenia. This was announced on October 7, 2020.
 UPDATE: On October 22, 2020, The Ministry for Foreign Affairs announced that they would extend the policy until November 4, 2020.",2020-10-22,2020-10-22,2020-11-04,The policy has a clear end date,Sweden,SWE,SE,National,0,,,,External Border Restrictions,Other External Border Restriction,,"",,,,,,"","","","","","","","","","","",,,,"",No,"Estonia,Ireland,Latvia,Lithuania,Austria,Belgium,Bulgaria,Croatia,Cyprus,Czechia,Denmark,Estonia,Finland,France,Germany,Greece,Hungary,Ireland,Italy,Latvia,Lithuania,Luxembourg,Malta,Netherlands,Poland,Portugal,Romania,Slovakia,Slovenia,Spain,Sweden,Austria,Belgium,Czech Republic,Denmark,Estonia,Finland,France,Germany,Greece,Hungary,Iceland,Italy,Latvia,Liechtenstein,Lithuania,Luxembourg,Malta,Netherlands,Norway,Poland,Portugal,Slovakia,Slovenia,Spain,Sweden,Switzerland",One or more countries and one or more regional groupings,"European Union (without the UK),Schengen Area (without the UK),Other Regions (please specify below)",,,,,All Citizens (Citizen Residents + Citizen Travelers),No special population targeted,Outbound,All kinds of transport,Voluntary/Recommended but No Penalties,Ministry/Department of Foreign Affairs,58.9655798876933,56.6880086674796,54.4713995477509,68,https://tummgmt.eu.qualtrics.com/Q/File.php?F=F_3j2mGIqyDlgkFvG ; https://tummgmt.eu.qualtrics.com/Q/File.php?F=F_1faeu1MA7IlR28G,NA ; https://www.government.se/press-releases/2020/10/advice-against-travel-to-estonia-ireland-latvia-and-lithuania-extended/,2022-12-04,2022-12-04T12:08:17Z,108969,5930,0,23961,1661149,158.702,,,,,,4,9.25,2,0.41813737154007,0.309990167617798,0,85,10183175,589823541463.317,2.22523861239767,16.1362474065114,27.1030892468466,2,2,2.49917945942907,4.66464682875734,2005210
R_DM0FJNUCX23708pGq,3067072,update,Change of Policy,Strengthening,timing of policy strengthening,"Starting August 15, 2020, the Swedish government implemented an adjusted version of its ban on non-essential travel into Sweden by foreign nationals who are travelling from outside the EEA or Switzerland, Andorra, Monaco, San Marino and the Vatican. Foreign nationals who are residents from the following countries are exempt from the travel ban: Australia, Georgia, Japan, Canada, New Zealand, Rwanda, South Korea, Thailand, Tunisia, and Uruguay. Foreign nationals who are residents of Morocco were previously exempt from the ban, but they have now been removed from the list. Exceptions are made for certain groups of travellers, such as essential workers and those travelling for emergency family reasons. The policy was announced on August 13, 2020, and is planned to end on August 31, 2020.
 UPDATE: The policy was initially extended until October 31, 2020. On October 22, 2020, the Swedish government extended this policy once more until December 22, 2020.",2020-10-22,2020-11-01,2020-12-22,The policy has a clear end date,Sweden,SWE,SE,National,0,,,,External Border Restrictions,Total border crossing ban,,"",,,,,,"","","","","","","","","","","",,,,"",No,"Afghanistan,Albania,Algeria,Angola,Antigua and Barbuda,Argentina,Armenia,Azerbaijan,Bahamas,Bahrain,Bangladesh,Barbados,Belarus,Belize,Benin,Bhutan,Bolivia,Bosnia and Herzegovina,Botswana,Brazil,Brunei,Burkina Faso,Burundi,Cabo Verde,Cambodia,Cameroon,Central African Republic,Chad,Chile,China,Colombia,Comoros,Costa Rica,Cuba,Democratic Republic of the Congo,Djibouti,Dominica,Dominican Republic,Ecuador,Egypt,El Salvador,Equatorial Guinea,Eritrea,Eswatini,Ethiopia,Fiji,Gabon,Gambia,Ghana,Grenada,Guatemala,Guinea,Guinea-Bissau,Guyana,Haiti,Honduras,Hong Kong,India,Indonesia,Iran,Iraq,Israel,Ivory Coast,Jamaica,Jordan,Kazakhstan,Kenya,Kiribati,Kosovo,Kuwait,Kyrgyzstan,Laos,Lebanon,Lesotho,Liberia,Libya,Macau,Madagascar,Malawi,Malaysia,Maldives,Mali,Marshall Islands,Mauritania,Mauritius,Mexico,Micronesia,Moldova,Mongolia,Montenegro,Morocco,Mozambique,Myanmar,Namibia,Nauru,Nepal,Nicaragua,Niger,Nigeria,North Korea,North Macedonia,Northern Cyprus,Oman,Pakistan,Palau,Palestine,Panama,Papua New Guinea,Paraguay,Peru,Philippines,Qatar,Republic of the Congo,Russia,Saint Kitts and Nevis,Saint Lucia,Saint Vincent and the Grenadines,Samoa,Sao Tome and Principe,Saudi Arabia,Senegal,Serbia,Seychelles,Sierra Leone,Singapore,Solomon Islands,Somalia,South Africa,South Sudan,Sri Lanka,Sudan,Suriname,Syria,Taiwan,Tajikistan,Tanzania,Timor Leste,Togo,Tonga,Trinidad and Tobago,Turkmenistan,Tuvalu,Uganda,Ukraine,United Arab Emirates,United Kingdom,United States,Uzbekistan,Vanuatu,Venezuela,Vietnam,Yemen,Zambia,Zimbabwe,Ukraine,France,Spain,Sweden,Norway,Germany,Finland,Poland,Italy,United Kingdom,Romania,Belarus,Greece,Bulgaria,Iceland,Hungary,Portugal,Austria,Czech Republic,Serbia,Ireland,Lithuania,Latvia,Croatia,Bosnia and Herzegovina,Slovakia,Estonia,Denmark,Switzerland,Netherlands,Moldova,Belgium,Armenia,Albania,Macedonia,Slovenia,Montenegro,Kosovo,Cyprus,Luxembourg,Georgia,Andorra,Malta,Liechtenstein,San Marino,Monaco,Vatican,Algeria,Angola,Botswana,Burundi,Cameroon,Cabo Verde,Central African Republic,Chad,Comoros,Republic of Congo,Democratic Republic of the Congo,Benin,Equatorial Guinea,Ethiopia,Eritrea,Djibouti,Gabon,Gambia,Ghana,Guinea,Ivory Coast,Kenya,Lesotho,Liberia,Libya,Madagascar,Malawi,Mali,Mauritania,Mauritius,Morocco,Mozambique,Namibia,Niger,Nigeria,Guinea-Bissau,Réunion,Rwanda,Sao Tome and Principe,Senegal,Seychelles,Sierra Leone,Somalia,South Africa,Zimbabwe,South Sudan,Sudan,Swaziland,Togo,Tunisia,Uganda,Republic of Tanzania,Burkina Faso,Zambia,Afghanistan,Azerbaijan,Bangladesh,Bhutan,Brunei,Cambodia,China,India,Indonesia,Japan,Kazakhstan,Korea,North Korea,South Korea,Kyrgyzstan,Laos,Malaysia,Maldives,Mongolia,Myanmar,Nepal,Pakistan,Philippines,Russia,Singapore,Sri Lanka,Tajikistan,Thailand,East Timor,Turkey,Turkmenistan,Uzbekistan,Vietnam,Taiwan,Macau,Brunei,Cambodia,Indonesia,Laos,Malaysia,Myanmar,Philippines,Singapore,Thailand,Vietnam,United States,Mexico,Canada,Cuba,Haiti,Dominican Republic,Puerto Rico,Jamaica,Trinidad and Tobago,Guadeloupe,Martinique,The Bahamas,Barbados,Saint Lucia,Virgin Islands,Grenada,Antigua and Barbuda,Dominica,Saint Kitts and Nevis,Saint Martin,British Virgin Islands,Anguilla,Montserrat,Saint Vincent and the Grenadines,Argentina,Bolivia,Brazil,Chile,Colombia,Ecuador,Falkland Islands,Guyana,Paraguay,Peru,Suriname,Uruguay,Venezuela,Guatemala,Belize,Honduras,El Salvador,Nicaragua,Costa Rica,Panama,Australia,Papua New Guinea,New Zealand,Fiji,Solomon Islands,Vanuatu,Kiribati,Federated States of Micronesia,Tonga,American Samoa,Marshall Islands,Palau,Tuvalu,Nauru,Samoa,Bahrain,Egypt,Iran,Iraq,Israel,Jordan,Kuwait,Lebanon,Oman,Palestine,Qatar,Saudi Arabia,Syria,United Arab Emirates,Yemen",One or more countries and one or more regional groupings,"Europe,Africa,Asia,ASEAN Countries,North America,Latin America,Central America,Oceania,Middle East",,,,,Foreign Travelers,No special population targeted,Inbound,All kinds of transport,"Mandatory with Exceptions (Please list exceptions in the text entry),Mandatory (Other; please list other enforcement mechanisms in the text entry)","National Government,Ministry/Department of Foreign Affairs",59.1548723942717,56.8807910624399,54.3696821513668,71,https://tummgmt.eu.qualtrics.com/Q/File.php?F=F_BYEi7zimV4Uv3Sp ; https://tummgmt.eu.qualtrics.com/Q/File.php?F=F_2dASKnwMCp9ux36,NA ; https://www.lagboken.se/Lagboken/start/sfs/sfs/2020/800-899/d_4110844-sfs-2020_847-forordning-om-fortsatt-giltighet-av-forordningen-2020_127-om-tillfalligt-inreseforbud,2022-12-04,2022-12-04T12:19:42Z,124355,5938,0,27613,1926323,184.036,,,,,,4,9.25,2,0.41813737154007,0.309990167617798,0,85,10183175,589823541463.317,2.22523861239767,16.1362474065114,27.1030892468466,2,2,2.49917945942907,4.66464682875734,2005210
R_1pJrWEyKlpSU2BDGq,2622686,new_entry,,,"","Starting November 2, 2020, the Swedish government implemented an adjusted version of its ban on non-essential travel into Sweden by foreign nationals who are travelling from outside the EEA or Switzerland, Andorra, Monaco, San Marino and the Vatican. Foreign nationals who are residents from the following countries are exempt from the travel ban: Australia, Japan, New Zealand, Rwanda, South Korea, Thailand, and Uruguay. Foreign nationals who are residents of Canada, Georgia, or Tunisia were previously also exempt from the ban, but they have now been removed from the list. Exceptions are also made for certain groups of travellers, such as essential workers and those travelling for emergency family reasons. The policy was announced on October 29, 2020, and is planned to end on December 22, 2020.
",2020-10-29,2020-11-02,2020-12-22,The policy has a clear end date,Sweden,SWE,SE,National,0,,,,External Border Restrictions,Total border crossing ban,,"",,,,,,"","","","","","","","","","","",,,,"",No,"Afghanistan,Albania,Algeria,Angola,Antigua and Barbuda,Argentina,Armenia,Azerbaijan,Bahamas,Bahrain,Bangladesh,Barbados,Belarus,Belize,Benin,Bhutan,Bolivia,Bosnia and Herzegovina,Botswana,Brazil,Brunei,Burkina Faso,Burundi,Cabo Verde,Cambodia,Cameroon,Canada,Central African Republic,Chad,Chile,China,Colombia,Comoros,Costa Rica,Cuba,Democratic Republic of the Congo,Djibouti,Dominica,Dominican Republic,Ecuador,Egypt,El Salvador,Equatorial Guinea,Eritrea,Eswatini,Ethiopia,Fiji,Gabon,Gambia,Georgia,Ghana,Grenada,Guatemala,Guinea,Guinea-Bissau,Guyana,Haiti,Honduras,Hong Kong,India,Indonesia,Iran,Iraq,Israel,Ivory Coast,Jamaica,Jordan,Kazakhstan,Kenya,Kiribati,Kosovo,Kuwait,Kyrgyzstan,Laos,Lebanon,Lesotho,Liberia,Libya,Macau,Madagascar,Malawi,Malaysia,Maldives,Mali,Marshall Islands,Mauritania,Mauritius,Mexico,Micronesia,Moldova,Mongolia,Montenegro,Morocco,Mozambique,Myanmar,Namibia,Nauru,Nepal,Nicaragua,Niger,Nigeria,North Korea,North Macedonia,Northern Cyprus,Oman,Pakistan,Palau,Palestine,Panama,Papua New Guinea,Paraguay,Peru,Philippines,Qatar,Republic of the Congo,Russia,Saint Kitts and Nevis,Saint Lucia,Saint Vincent and the Grenadines,Samoa,Sao Tome and Principe,Saudi Arabia,Senegal,Serbia,Seychelles,Sierra Leone,Singapore,Solomon Islands,Somalia,South Africa,South Sudan,Sri Lanka,Sudan,Suriname,Syria,Taiwan,Tajikistan,Tanzania,Timor Leste,Togo,Tonga,Trinidad and Tobago,Tunisia,Turkey,Turkmenistan,Tuvalu,Uganda,Ukraine,United Arab Emirates,United Kingdom,United States,Uzbekistan,Vanuatu,Venezuela,Vietnam,Yemen,Zambia,Zimbabwe,Ukraine,France,Spain,Sweden,Norway,Germany,Finland,Poland,Italy,United Kingdom,Romania,Belarus,Greece,Bulgaria,Iceland,Hungary,Portugal,Austria,Czech Republic,Serbia,Ireland,Lithuania,Latvia,Croatia,Bosnia and Herzegovina,Slovakia,Estonia,Denmark,Switzerland,Netherlands,Moldova,Belgium,Armenia,Albania,Macedonia,Slovenia,Montenegro,Kosovo,Cyprus,Luxembourg,Georgia,Andorra,Malta,Liechtenstein,San Marino,Monaco,Vatican,Algeria,Angola,Botswana,Burundi,Cameroon,Cabo Verde,Central African Republic,Chad,Comoros,Republic of Congo,Democratic Republic of the Congo,Benin,Equatorial Guinea,Ethiopia,Eritrea,Djibouti,Gabon,Gambia,Ghana,Guinea,Ivory Coast,Kenya,Lesotho,Liberia,Libya,Madagascar,Malawi,Mali,Mauritania,Mauritius,Morocco,Mozambique,Namibia,Niger,Nigeria,Guinea-Bissau,Réunion,Rwanda,Sao Tome and Principe,Senegal,Seychelles,Sierra Leone,Somalia,South Africa,Zimbabwe,South Sudan,Sudan,Swaziland,Togo,Tunisia,Uganda,Republic of Tanzania,Burkina Faso,Zambia,Afghanistan,Azerbaijan,Bangladesh,Bhutan,Brunei,Cambodia,China,India,Indonesia,Japan,Kazakhstan,Korea,North Korea,South Korea,Kyrgyzstan,Laos,Malaysia,Maldives,Mongolia,Myanmar,Nepal,Pakistan,Philippines,Russia,Singapore,Sri Lanka,Tajikistan,Thailand,East Timor,Turkey,Turkmenistan,Uzbekistan,Vietnam,Taiwan,Macau,Brunei,Cambodia,Indonesia,Laos,Malaysia,Myanmar,Philippines,Singapore,Thailand,Vietnam,United States,Mexico,Canada,Cuba,Haiti,Dominican Republic,Puerto Rico,Jamaica,Trinidad and Tobago,Guadeloupe,Martinique,The Bahamas,Barbados,Saint Lucia,Virgin Islands,Grenada,Antigua and Barbuda,Dominica,Saint Kitts and Nevis,Saint Martin,British Virgin Islands,Anguilla,Montserrat,Saint Vincent and the Grenadines,Argentina,Bolivia,Brazil,Chile,Colombia,Ecuador,Falkland Islands,Guyana,Paraguay,Peru,Suriname,Uruguay,Venezuela,Guatemala,Belize,Honduras,El Salvador,Nicaragua,Costa Rica,Panama,Australia,Papua New Guinea,New Zealand,Fiji,Solomon Islands,Vanuatu,Kiribati,Federated States of Micronesia,Tonga,American Samoa,Marshall Islands,Palau,Tuvalu,Nauru,Samoa,Bahrain,Egypt,Iran,Iraq,Israel,Jordan,Kuwait,Lebanon,Oman,Palestine,Qatar,Saudi Arabia,Syria,United Arab Emirates,Yemen",One or more countries and one or more regional groupings,"Europe,Africa,Asia,ASEAN Countries,North America,Latin America,Central America,Oceania,Middle East",,,,,Foreign Travelers,No special population targeted,Inbound,All kinds of transport,Mandatory with Exceptions (Please list exceptions in the text entry),"National Government,Ministry/Department of Foreign Affairs",59.0689501232514,56.9429190251154,54.4452835503081,71,https://tummgmt.eu.qualtrics.com/Q/File.php?F=F_e9vWNxnOEDD06mW,https://www.lagboken.se/Lagboken/start/sfs/sfs/2020/800-899/d_4118049-sfs-2020_866-forordning-om-andring-i-forordningen-2020_127-om-tillfalligt-inreseforbud-till-sverige,2023-01-04,2023-01-04T13:14:56Z,124355,5938,0,33414,1959737,187.228,,,,,,4,9.25,2,0.41813737154007,0.309990167617798,0,85,10183175,589823541463.317,2.22523861239767,16.1362474065114,27.1030892468466,2,2,2.49917945942907,4.66464682875734,2005210
R_21zSQyDQa38QGKVDr,3278694,new_entry,,,"","The Swedish ministry of foreign affairs advises against non-essential travel to all countries within the EU, EEA, and Schengen except for Belgium, France, Greece, Iceland, Italy, Croatia, Monaco, Luxembourg, Portugal, San Marino, Spain, Hungary, The Vatican City, Andorra, Poland, Germany, Denmark, Norway, The czech Republic, Swizerland, Liechtenstein, Austria, Bulgaria, Netherlands, Cyprus, Great Britain, Finland, Slovakia, Malta, Slovenia, and Lithuania. For other countries within EU, EEA, and Schengen not mentioned above, the advise against travelling is valid until November 18, 2020.",2020-11-04,2020-11-05,2020-11-18,The policy has a clear end date,Sweden,SWE,SE,National,0,,,,External Border Restrictions,Other External Border Restriction,,"",,,,,,"","","","","","","","","","","",,,,"",No,Bolivia,"One or more countries, but not all countries",Schengen Area (without the UK),,,,,All (Travelers + Residents),No special population targeted,Outbound,All kinds of transport,Voluntary/Recommended but No Penalties,Ministry/Department of Foreign Affairs,59.5409862998242,57.0373885445332,54.9830924947253,69,https://tummgmt.eu.qualtrics.com/Q/File.php?F=F_3koxMLrmNbetvFL ; https://tummgmt.eu.qualtrics.com/Q/File.php?F=F_yJWOcPcwuxsRdEl,NA ; https://www.regeringskansliet.se/pressmeddelanden/2020/11/ud-haver-avradan-fran-resor-till-litauen/,2021-04-29,2021-04-29T09:38:05Z,141764,6002,0,33414,2059979,196.805,,,,,,4,9.25,2,0.41813737154007,0.309990167617798,0,85,10183175,589823541463.317,2.22523861239767,16.1362474065114,27.1030892468466,2,2,2.49917945942907,4.66464682875734,2005210
R_1mFvs8yITRP0nzyDr,9966831,new_entry,,,"","The Swedish ministry of foreign affairs advises against non-essential travel from Sweden to Estonia, Ireland, and Lativa until November 18, 2020.",2020-11-09,2020-11-09,2020-11-18,The policy has a clear end date,Sweden,SWE,SE,National,0,,,,External Border Restrictions,Other External Border Restriction,,"",,,,,,"","","","","","","","","","","",,,,"",No,"Estonia,Ireland,Latvia","One or more countries, but not all countries",,,,,,All (Travelers + Residents),No special population targeted,Outbound,All kinds of transport,Voluntary/Recommended but No Penalties,Ministry/Department of Foreign Affairs,60.0518094176135,57.9611367405854,55.7397959036972,76,https://tummgmt.eu.qualtrics.com/Q/File.php?F=F_3nVJeLI6qxQUl82,https://www.regeringen.se/pressmeddelanden/2020/11/ud-forlanger-reseavradan/,2021-05-04,2021-05-04T13:19:14Z,146461,6022,0,37239,2197460,209.94,,,,,,4,9.25,2,0.41813737154007,0.309990167617798,0,85,10183175,589823541463.317,2.22523861239767,16.1362474065114,27.1030892468466,2,2,2.49917945942907,4.66464682875734,2005210
R_zfdVol0AGGzsGOtDr,5632449,new_entry,,,"","The Swedish ministry of foreign affairs advises against non-essential travel from Sweden to Estonia, Ireland, and Lativa until November 18, 2020.",2020-11-09,2020-11-09,2020-11-18,The policy has a clear end date,Sweden,SWE,SE,National,0,,,,External Border Restrictions,Other External Border Restriction,,"",,,,,,"","","","","","","","","","","",,,,"",No,"Estonia,Ireland,Latvia","One or more countries, but not all countries",,,,,,All (Travelers + Residents),No special population targeted,Outbound,All kinds of transport,Voluntary/Recommended but No Penalties,Ministry/Department of Foreign Affairs,60.0518094176135,57.9611367405854,55.7397959036972,76,https://tummgmt.eu.qualtrics.com/Q/File.php?F=F_21plUfW17TwgglX,https://www.regeringen.se/pressmeddelanden/2020/11/ud-forlanger-reseavradan/,2021-05-11,2021-05-11T13:14:41Z,146461,6022,0,37239,2197460,209.94,,,,,,4,9.25,2,0.41813737154007,0.309990167617798,0,85,10183175,589823541463.317,2.22523861239767,16.1362474065114,27.1030892468466,2,2,2.49917945942907,4.66464682875734,2005210
R_29ojaHrIjQCMAHSDr,7118011,update,Change of Policy,Strengthening,timing of policy strengthening,"The Swedish ministry of foreign affairs advise against travelling to countries outside the UK, EU, EES and Schengen until August 31, 2020. This was announced on June 17, 2020. UPDATE: The policy was set to end on November 15, 2020. It has now been extended until January 31, 2021.",2020-11-09,2020-11-16,2021-01-31,The policy has a clear end date,Sweden,SWE,SE,National,0,,,,External Border Restrictions,Other External Border Restriction,,"",,,,,,"","","","","","","","","","","",,,,"",No,,One or more regional groupings,Other Regions (please specify below),,,,,All Residents (Citizen Residents +Foreign Residents),No special population targeted,Outbound,All kinds of transport,Voluntary/Recommended but No Penalties,Ministry/Department of Foreign Affairs,61.2483954614585,59.2202419590242,56.9487214335141,80,https://tummgmt.eu.qualtrics.com/Q/File.php?F=F_6oihZDunA26QPTo ; https://tummgmt.eu.qualtrics.com/Q/File.php?F=F_1kFgxtw7vog5KYO,NA ; https://www.regeringen.se/pressmeddelanden/2020/11/ud-forlanger-reseavradan/,2021-04-26,2021-04-26T08:08:42Z,177355,6164,0,38266,2459160,234.942,,,,,,4,9.25,2,0.41813737154007,0.309990167617798,0,85,10183175,589823541463.317,2.22523861239767,16.1362474065114,27.1030892468466,2,2,2.49917945942907,4.66464682875734,2005210
R_1cSKysILAvTw356Dr,3278694,update,Change of Policy,Strengthening,timing of policy strengthening,"The Swedish ministry of foreign affairs advises against non-essential travel to all countries within the EU, EEA, and Schengen except for Belgium, France, Greece, Iceland, Italy, Croatia, Monaco, Luxembourg, Portugal, San Marino, Spain, Hungary, The Vatican City, Andorra, Poland, Germany, Denmark, Norway, The Czech Republic, Swizerland, Liechtenstein, Austria, Bulgaria, Netherlands, Cyprus, Great Britain, Finland, Slovakia, Malta, Slovenia, and Lithuania. For other countries within EU, EEA, and Schengen not mentioned above, the advise against travelling is valid until November 18, 2020. UPDATE: The original policy was set to last until November 18, 2020. It has been extended until January 31, 2021.",2020-11-09,2020-11-19,2021-01-31,The policy has a clear end date,Sweden,SWE,SE,National,0,,,,External Border Restrictions,Other External Border Restriction,,"",,,,,,"","","","","","","","","","","",,,,"",No,Bolivia,"One or more countries, but not all countries",Schengen Area (without the UK),,,,,All (Travelers + Residents),No special population targeted,Outbound,All kinds of transport,Voluntary/Recommended but No Penalties,Ministry/Department of Foreign Affairs,61.5375754978185,59.4664147884403,57.1795553757363,81,https://tummgmt.eu.qualtrics.com/Q/File.php?F=F_3koxMLrmNbetvFL ; https://tummgmt.eu.qualtrics.com/Q/File.php?F=F_3fDg3UmNvb3UktK,NA ; https://www.regeringskansliet.se/pressmeddelanden/2020/11/ud-forlanger-reseavradan/,2021-05-03,2021-05-03T13:59:11Z,201055,6340,0,38266,2573958,245.909,,,,,,4,9.25,2,0.41813737154007,0.309990167617798,0,85,10183175,589823541463.317,2.22523861239767,16.1362474065114,27.1030892468466,2,2,2.49917945942907,4.66464682875734,2005210
R_1OJIOlvl17wroBjDr,9966831,update,Change of Policy,Strengthening,timing of policy strengthening,"The Swedish ministry of foreign affairs advises against non-essential travel from Sweden to Estonia, Ireland, and Lativa until November 18, 2020. UPDATE: The original policy was set to last until November 18, 2020. It has been extended to December 2, 2020.",2020-11-18,2020-11-19,2020-12-02,The policy has a clear end date,Sweden,SWE,SE,National,0,,,,External Border Restrictions,Other External Border Restriction,,"",,,,,,"","","","","","","","","","","",,,,"",No,"Estonia,Ireland,Latvia","One or more countries, but not all countries",,,,,,All (Travelers + Residents),No special population targeted,Outbound,All kinds of transport,Voluntary/Recommended but No Penalties,Ministry/Department of Foreign Affairs,61.5375754978185,59.4664147884403,57.1795553757363,81,https://tummgmt.eu.qualtrics.com/Q/File.php?F=F_3nVJeLI6qxQUl82 ; https://tummgmt.eu.qualtrics.com/Q/File.php?F=F_3iOIDAIuX9Af0cW,NA ; https://www.regeringen.se/pressmeddelanden/2020/11/forlangd-avradan-for-estland-irland-och-lettland/,2021-05-05,2021-05-05T08:31:14Z,201055,6340,0,38266,2573958,245.909,,,,,,4,9.25,2,0.41813737154007,0.309990167617798,0,85,10183175,589823541463.317,2.22523861239767,16.1362474065114,27.1030892468466,2,2,2.49917945942907,4.66464682875734,2005210
