R_82H5zWp3pqoFs5jEn,1767621En,update,End of Policy,,"","The Swedish Medical Agency has decided to prohibit testing kits to private persons for coronavirus sold to Swedish customers by
the company lifelab.se. The testing kits lack proper certification for self-testing, but may be bought by professionals. This was anounced on May 8th, 2020. UPDATE: The prohibition against lifelab.se has been lifted due to a change of the product description. The testing kits can now be sold to professionals (however not to private persons).",2020-05-08,2020-05-08,,,Sweden,SWE,SE,National,1,,,,Restriction and Regulation of Businesses,Pharmacies,,"",,,,,,"","","","","","","","","","","",,No information in the policy about whether the business is considered essential or non-essential,"This type of business  (""Pharmacies"") is allowed to open with conditions",Other condition not specified above (please provide detail in the text entry),Yes,Sweden,"One or more countries, but not all countries",,,,,,All Residents (Citizen Residents + Foreign Residents),No special population targeted,,,Mandatory with Fines,Other (Please specify in the text box),61.7085971882295,59.5713064902198,57.3063822326103,31,https://tummgmt.eu.qualtrics.com/Q/File.php?F=F_1SxkSnAe1tNvaya ; https://tummgmt.eu.qualtrics.com/Q/File.php?F=F_1mwousevCOeWYoa,NA ; https://www.lakemedelsverket.se/sv/nyheter/lakemedelsverket-andrar-marknadsforbud-mot-ett-covid-19-test,2020-07-31,2020-07-31T14:30:18Z,26059,3175,0,,,,,,,,,4,9.25,2,0.41813737154007,0.309990167617798,0,85,10183175,589823541463.317,2.22523861239767,16.1362474065114,27.1030892468466,2,2,2.49917945942907,4.66464682875734,2005210
R_2YmQHrtwwgCTMBMEn,652250En,new_entry,,,"","The Swedish Medical Agency has decided to prohibit self-testing kits for coronavirus sold to Swedish customers by the company aponea.se. The testing kits lack proper documentation. This was announced on May 18th, 2020.",2020-05-18,2020-05-18,2020-05-19,The policy is a one-time measure (e.g. publication of guidelines),Sweden,SWE,SE,National,1,,,,Restriction and Regulation of Businesses,Pharmacies,,"",,,,,,"","","","","","","","","","","",,No information in the policy about whether the business is considered essential or non-essential,"This type of business  (""Pharmacies"") is allowed to open with conditions",Other condition not specified above (please provide detail in the text entry),Yes,Sweden,"One or more countries, but not all countries",,,,,,All Residents (Citizen Residents + Foreign Residents),No special population targeted,,,Mandatory with Fines,Other (Please specify in the text box),61.8936555228484,59.5368770438147,57.2246385589382,38,https://tummgmt.eu.qualtrics.com/Q/File.php?F=F_eba0OzGsJmnZbJc,https://www.lakemedelsverket.se/sv/nyheter/lakemedelsverket-forbjuder-ytterligare-sjalvtest-for-covid-192,2022-07-26,2022-07-26T11:28:16Z,31151,3698,0,,,,,,,,,4,9.25,2,0.41813737154007,0.309990167617798,0,85,10183175,589823541463.317,2.22523861239767,16.1362474065114,27.1030892468466,2,2,2.49917945942907,4.66464682875734,2005210
R_3iVwnhTBNyWYrjYAl,9848343Al,new_entry,,,"","The Swedish Department of Justice has proclaimed a change of the law to allow annual general meetings for stock companies and other organizations to be held more easily and in a manner that minimizes the risk of the spread of COVID-19. Specifically, stockholders may meet virtually and vote via post or consider voting without even a virtual meeting. This was announced on May 16th and is valid from the 18th of May, 2020.",2020-05-16,2020-05-18,2023-01-24,The policy has an unlimited time span (e.g. recommendation to wash one's hands; passing of a legal bill),Sweden,SWE,SE,National,1,,,,Restriction and Regulation of Businesses,All or unspecified businesses,,"",,,,,,"","","","","","","","","","","",,No information in the policy about whether the business is considered essential or non-essential,"This type of business  (""All or unspecified businesses"") is allowed to open with conditions",Other condition not specified above (please provide detail in the text entry),Yes,Sweden,"One or more countries, but not all countries",,,,,,All Residents (Citizen Residents + Foreign Residents),No special population targeted,,,Mandatory (Unspecified/Implied),Ministry/Department of Justice,61.8936555228484,59.5368770438147,57.2246385589382,38,https://tummgmt.eu.qualtrics.com/Q/File.php?F=F_cGsaBMMDVveEDNY,https://svenskforfattningssamling.se/sites/default/files/sfs/2020-05/SFS2020-300.pdf,2022-10-16,2022-10-16T12:09:40Z,31151,3698,0,,,,,,,,,4,9.25,2,0.41813737154007,0.309990167617798,0,85,10183175,589823541463.317,2.22523861239767,16.1362474065114,27.1030892468466,2,2,2.49917945942907,4.66464682875734,2005210
R_2646NtORgaHRwJ1Do,2647590Do,new_entry,,,"","The Public Health Agency in Sweden has released guidelines for businesses that offer antibody testing for coronavirus antibodies. The guidelines offer information on how to interpret results, the limitations of different tests etc. The Agency published the guidelines on June 8th.",2020-06-08,2020-06-08,2020-06-09,The policy is a one-time measure (e.g. publication of guidelines),Sweden,SWE,SE,National,1,,,,Restriction and Regulation of Businesses,Other Businesses,,"",,,,,,"","","","","","","","","","","",,No information in the policy about whether the business is considered essential or non-essential,"This type of business (""Other Businesses"") is allowed to open with no conditions attached","",Yes,Sweden,"One or more countries, but not all countries",,,,,,All Residents (Citizen Residents + Foreign Residents),No special population targeted,,,Voluntary/Recommended but No Penalties,Ministry/Department of Health,61.4498553459941,59.1207124999106,56.9223640050754,47,https://tummgmt.eu.qualtrics.com/Q/File.php?F=F_R4CwUC3ZGBeMcPD,https://www.folkhalsomyndigheten.se/nyheter-och-press/nyhetsarkiv/2020/juni/ny-vagledning-om-antikroppstester/,2021-11-02,2021-11-02T10:06:05Z,45363,4694,0,,,,,,,,,4,9.25,2,0.41813737154007,0.309990167617798,0,85,10183175,589823541463.317,2.22523861239767,16.1362474065114,27.1030892468466,2,2,2.49917945942907,4.66464682875734,2005210
R_3qgkcfwiM603esoEn,992485En,new_entry,,,"",Swedish Work Environment Agency checks PPEs in social sector. It must inspect close to 300 workplaces in care and elderly care to check that the protective equipment used meets the safety requirements and provides the intended infection protection.,2020-06-10,2020-06-10,,The policy’s end date is unknown or unreported,Sweden,SWE,SE,National,1,,,,Restriction and Regulation of Businesses,Pharmacies,,"",,,,,,"","","","","","","","","","","",,No information in the policy about whether the business is considered essential or non-essential,"This type of business  (""Pharmacies"") is allowed to open with conditions",Other condition not specified above (please provide detail in the text entry),No,All countries,All countries,,,,,,Health-Related Supplies,No special population targeted,,,Mandatory (Other; please list other enforcement mechanisms in the text entry),"National Government,Ministry/Department of Health",61.2261590175161,59.0208072750068,56.9498716221215,52,https://tummgmt.eu.qualtrics.com/Q/File.php?F=F_Zn5WZsJpPEeaGFr,https://www.av.se/press/arbetsmiljoverket-granskar-skyddsutrustning-i-vard-och-aldreomsorg/,2022-10-08,2022-10-08T20:22:46Z,47736,4795,0,,,,,,,,,4,9.25,2,0.41813737154007,0.309990167617798,0,85,10183175,589823541463.317,2.22523861239767,16.1362474065114,27.1030892468466,2,2,2.49917945942907,4.66464682875734,2005210
R_3r2MfdhBJK8rOYTFm,4682050Fm,new_entry,,,"",Amends 2020:526 to grant the Swedish Public Health Agency responsibility for national supervisory guidance and the County Administrative Board of Stockholm County to coordinate the work of the county administrative boards. The Swedish Public Health Authority may also issue further regulations on enforcement of the act (2020:256).,2020-06-17,2020-06-17,2021-01-01,The policy has a clear end date,Sweden,SWE,SE,National,1,,,,Restriction and Regulation of Businesses,Restaurants,,"",,,,,,"","","","","","","","","","","",,Non-Essential Businesses,"This type of business  (""Restaurants"") is allowed to open with conditions","Hygiene and sanitation measures required,Other Health Monitoring",Yes,Sweden,"One or more countries, but not all countries",,,,,,All Residents (Citizen Residents + Foreign Residents),No special population targeted,,,Mandatory (Unspecified/Implied),"National Government,Ministry/Department of Health",59.4844442677466,57.1828021207348,54.8280233306288,47,https://tummgmt.eu.qualtrics.com/Q/File.php?F=F_yt49CfRd5MbH7q1,https://dl.airtable.com/.attachments/aa09ab68c22e59694253a4c1b4ec63a9/315f178c/Sweden_Statue_PlacesofServiceInfectionControlMeasures_17June2020.pdf ; https://www.svenskforfattningssamling.se/sites/default/files/sfs/2020-06/SFS2020-527.pdf,2022-10-08,2022-10-08T20:47:32Z,55186,5041,0,,,,,,,,,4,9.25,2,0.41813737154007,0.309990167617798,0,85,10183175,589823541463.317,2.22523861239767,16.1362474065114,27.1030892468466,2,2,2.49917945942907,4.66464682875734,2005210
R_3r2MfdhBJK8rOYTAt,4682050At,new_entry,,,"",Amends 2020:526 to grant the Swedish Public Health Agency responsibility for national supervisory guidance and the County Administrative Board of Stockholm County to coordinate the work of the county administrative boards. The Swedish Public Health Authority may also issue further regulations on enforcement of the act (2020:256).,2020-06-17,2020-06-17,2021-01-01,The policy has a clear end date,Sweden,SWE,SE,National,1,,,,Restriction and Regulation of Businesses,Bars,,"",,,,,,"","","","","","","","","","","",,Non-Essential Businesses,"This type of business  (""Bars"") is allowed to open with conditions","Hygiene and sanitation measures required,Other Health Monitoring",Yes,Sweden,"One or more countries, but not all countries",,,,,,All Residents (Citizen Residents + Foreign Residents),No special population targeted,,,Mandatory (Unspecified/Implied),"National Government,Ministry/Department of Health",59.4844442677466,57.1828021207348,54.8280233306288,47,https://tummgmt.eu.qualtrics.com/Q/File.php?F=F_yt49CfRd5MbH7q1,https://dl.airtable.com/.attachments/aa09ab68c22e59694253a4c1b4ec63a9/315f178c/Sweden_Statue_PlacesofServiceInfectionControlMeasures_17June2020.pdf ; https://www.svenskforfattningssamling.se/sites/default/files/sfs/2020-06/SFS2020-527.pdf,2022-10-08,2022-10-08T20:47:32Z,55186,5041,0,,,,,,,,,4,9.25,2,0.41813737154007,0.309990167617798,0,85,10183175,589823541463.317,2.22523861239767,16.1362474065114,27.1030892468466,2,2,2.49917945942907,4.66464682875734,2005210
R_1n9lCSwmYyV2ZdnAl,5484604Al,new_entry,,,"",Gällivare municipality urges everyone to work from home if possible.,2020-06-17,2020-06-17,2023-01-24,The policy has an unlimited time span (e.g. recommendation to wash one's hands; passing of a legal bill),Sweden,SWE,SE,Municipal,1,Norrbotten,SE-BD,Gällivare,Restriction and Regulation of Businesses,All or unspecified businesses,,"",,,,,,"","","","","","","","","","","",,No information in the policy about whether the business is considered essential or non-essential,"This type of business  (""All or unspecified businesses"") is closed/locked down","",Yes,Sweden,One or more cities within one or more countries,,Norrbotten,Gällivare,,,All Residents (Citizen Residents + Foreign Residents),No special population targeted,,,Voluntary/Recommended but No Penalties,Municipal Government,59.4844442677466,57.1828021207348,54.8280233306288,47,https://tummgmt.eu.qualtrics.com/Q/File.php?F=F_3dRiQANeeobWAP6,https://www.svt.se/nyheter/lokalt/norrbotten/krislage-i-gallivare-vill-att-busstrafiken-ska-stoppas,2022-10-08,2022-10-08T22:34:28Z,55186,5041,0,,,,,,,,,4,9.25,2,0.41813737154007,0.309990167617798,0,85,10183175,589823541463.317,2.22523861239767,16.1362474065114,27.1030892468466,2,2,2.49917945942907,4.66464682875734,2005210
R_3pmprwgLY4RSI9ZCk,5408771Ck,new_entry,,,"","On Jun. 17, 2020, due to the socially dangerous spread of Covid-19, Gällivare municipality is now closing the majority of businesses to visitors in order to slow down the spread of infection.",2020-06-17,2020-06-17,2023-01-24,The policy has an unlimited time span (e.g. recommendation to wash one's hands; passing of a legal bill),Sweden,SWE,SE,Municipal,1,Norrbotten,SE-BD,Gällivare,Restriction and Regulation of Businesses,Information service activities,,"",,,,,,"","","","","","","","","","","",,No information in the policy about whether the business is considered essential or non-essential,"This type of business  (""Information service activities"") is closed/locked down","",Yes,Sweden,One or more cities within one or more countries,,Norrbotten,Gällivare,,,All Residents (Citizen Residents + Foreign Residents),No special population targeted,,,Mandatory (Unspecified/Implied),Municipal Government,59.4844442677466,57.1828021207348,54.8280233306288,47,https://tummgmt.eu.qualtrics.com/Q/File.php?F=F_BA5DvtxcMWzR4Wt,http://www.gellivare.se/Kommun/Nyheter/Stangt-for-att-minska-smitta/,2022-10-08,2022-10-08T22:43:17Z,55186,5041,0,,,,,,,,,4,9.25,2,0.41813737154007,0.309990167617798,0,85,10183175,589823541463.317,2.22523861239767,16.1362474065114,27.1030892468466,2,2,2.49917945942907,4.66464682875734,2005210
R_3pmprwgLY4RSI9ZDo,5408771Do,new_entry,,,"","On Jun. 17, 2020, due to the socially dangerous spread of Covid-19, Gällivare municipality is now closing the majority of businesses to visitors in order to slow down the spread of infection.",2020-06-17,2020-06-17,2023-01-24,The policy has an unlimited time span (e.g. recommendation to wash one's hands; passing of a legal bill),Sweden,SWE,SE,Municipal,1,Norrbotten,SE-BD,Gällivare,Restriction and Regulation of Businesses,Other Businesses,,"",,,,,,"","","","","","","","","","","",,No information in the policy about whether the business is considered essential or non-essential,"This type of business  (""Other Businesses"") is closed/locked down","",Yes,Sweden,One or more cities within one or more countries,,Norrbotten,Gällivare,,,All Residents (Citizen Residents + Foreign Residents),No special population targeted,,,Mandatory (Unspecified/Implied),Municipal Government,59.4844442677466,57.1828021207348,54.8280233306288,47,https://tummgmt.eu.qualtrics.com/Q/File.php?F=F_BA5DvtxcMWzR4Wt,http://www.gellivare.se/Kommun/Nyheter/Stangt-for-att-minska-smitta/,2022-10-08,2022-10-08T22:43:17Z,55186,5041,0,,,,,,,,,4,9.25,2,0.41813737154007,0.309990167617798,0,85,10183175,589823541463.317,2.22523861239767,16.1362474065114,27.1030892468466,2,2,2.49917945942907,4.66464682875734,2005210
R_3kdjtbCxQ6rmU7DFm,3457732Fm,new_entry,,,"","Restaurants are responsible for 
1) ensuring congestion is avoided and that visitors can keep a safe distance from each other 
2) the activities in general are organized so that the spread of infection is minimized 
3) routines for infection prevention are implemented.",2020-06-18,2020-07-01,2021-01-01,The policy has a clear end date,Sweden,SWE,SE,National,1,,,,Restriction and Regulation of Businesses,Restaurants,,"",,,,,,"","","","","","","","","","","",,Non-Essential Businesses,"This type of business  (""Restaurants"") is allowed to open with conditions","Hygiene and sanitation measures required,Other condition not specified above (please provide detail in the text entry)",Yes,Sweden,"One or more countries, but not all countries",,,,,,All Residents (Citizen Residents + Foreign Residents),Other population not specifed above,,,"Mandatory with Fines,Mandatory (Other; please list other enforcement mechanisms in the text entry)",National Government,59.3231810616988,56.7323514112203,54.3040991836974,55,https://tummgmt.eu.qualtrics.com/Q/File.php?F=F_2dsCrfomvJ8EAN6,https://dl.airtable.com/.attachments/be7f9d685362a55241bdaa11987ad43f/07df6d11/Sweden_Statue_RestaurantsInfectionControlMeasures_17June2020.pdf,2022-10-08,2022-10-08T21:02:35Z,68608,5370,0,11789,35367,3.379,,,,,,4,9.25,2,0.41813737154007,0.309990167617798,0,85,10183175,589823541463.317,2.22523861239767,16.1362474065114,27.1030892468466,2,2,2.49917945942907,4.66464682875734,2005210
R_3kdjtbCxQ6rmU7DAt,3457732At,new_entry,,,"","Restaurants are responsible for 
1) ensuring congestion is avoided and that visitors can keep a safe distance from each other 
2) the activities in general are organized so that the spread of infection is minimized 
3) routines for infection prevention are implemented.",2020-06-18,2020-07-01,2021-01-01,The policy has a clear end date,Sweden,SWE,SE,National,1,,,,Restriction and Regulation of Businesses,Bars,,"",,,,,,"","","","","","","","","","","",,Non-Essential Businesses,"This type of business  (""Bars"") is allowed to open with conditions","Hygiene and sanitation measures required,Other condition not specified above (please provide detail in the text entry)",Yes,Sweden,"One or more countries, but not all countries",,,,,,All Residents (Citizen Residents + Foreign Residents),Other population not specifed above,,,"Mandatory with Fines,Mandatory (Other; please list other enforcement mechanisms in the text entry)",National Government,59.3231810616988,56.7323514112203,54.3040991836974,55,https://tummgmt.eu.qualtrics.com/Q/File.php?F=F_2dsCrfomvJ8EAN6,https://dl.airtable.com/.attachments/be7f9d685362a55241bdaa11987ad43f/07df6d11/Sweden_Statue_RestaurantsInfectionControlMeasures_17June2020.pdf,2022-10-08,2022-10-08T21:02:35Z,68608,5370,0,11789,35367,3.379,,,,,,4,9.25,2,0.41813737154007,0.309990167617798,0,85,10183175,589823541463.317,2.22523861239767,16.1362474065114,27.1030892468466,2,2,2.49917945942907,4.66464682875734,2005210
R_1OUfzm92k33fioGFm,8063572Fm,new_entry,,,"","On July 1, 2020, a new law on measures to prevent spread of infectious diseases at places serving food and beverages comes into force. Places such as restaurants, bars and cafes are now given responsibility for taking measures to prevent the spread of COVID-19. The law also means that it is the municipalities who are responsible for both supervising and making decisions about injunctions and prohibitions if it is necessary for the law to be followed. The municipalities are thus given the opportunity to close serving places if the law is not followed.",2020-07-01,2020-07-01,2021-07-01,The policy has a clear end date,Sweden,SWE,SE,National,1,,,,Restriction and Regulation of Businesses,Restaurants,,"",,,,,,"","","","","","","","","","","",,No information in the policy about whether the business is considered essential or non-essential,"This type of business  (""Restaurants"") is allowed to open with conditions",Hygiene and sanitation measures required,Yes,Sweden,"One or more countries, but not all countries",,,,,,All Residents (Citizen Residents + Foreign Residents),No special population targeted,,,"Mandatory with Fines,Mandatory (Unspecified/Implied),Mandatory (Other; please list other enforcement mechanisms in the text entry)",National Government,59.3231810616988,56.7323514112203,54.3040991836974,55,https://tummgmt.eu.qualtrics.com/Q/File.php?F=F_2xRcd7u32E8nhK7,https://web.archive.org/web/20200701161305/https://www.folkhalsomyndigheten.se/nyheter-och-press/nyhetsarkiv/2020/juli/ny-restauranglag-ska-bidra-till-minskad-spridning-av-covid-19/,2022-10-08,2022-10-08T21:14:25Z,68608,5370,0,11789,35367,3.379,,,,,,4,9.25,2,0.41813737154007,0.309990167617798,0,85,10183175,589823541463.317,2.22523861239767,16.1362474065114,27.1030892468466,2,2,2.49917945942907,4.66464682875734,2005210
R_1OUfzm92k33fioGAt,8063572At,new_entry,,,"","On July 1, 2020, a new law on measures to prevent spread of infectious diseases at places serving food and beverages comes into force. Places such as restaurants, bars and cafes are now given responsibility for taking measures to prevent the spread of COVID-19. The law also means that it is the municipalities who are responsible for both supervising and making decisions about injunctions and prohibitions if it is necessary for the law to be followed. The municipalities are thus given the opportunity to close serving places if the law is not followed.",2020-07-01,2020-07-01,2021-07-01,The policy has a clear end date,Sweden,SWE,SE,National,1,,,,Restriction and Regulation of Businesses,Bars,,"",,,,,,"","","","","","","","","","","",,No information in the policy about whether the business is considered essential or non-essential,"This type of business  (""Bars"") is allowed to open with conditions",Hygiene and sanitation measures required,Yes,Sweden,"One or more countries, but not all countries",,,,,,All Residents (Citizen Residents + Foreign Residents),No special population targeted,,,"Mandatory with Fines,Mandatory (Unspecified/Implied),Mandatory (Other; please list other enforcement mechanisms in the text entry)",National Government,59.3231810616988,56.7323514112203,54.3040991836974,55,https://tummgmt.eu.qualtrics.com/Q/File.php?F=F_2xRcd7u32E8nhK7,https://web.archive.org/web/20200701161305/https://www.folkhalsomyndigheten.se/nyheter-och-press/nyhetsarkiv/2020/juli/ny-restauranglag-ska-bidra-till-minskad-spridning-av-covid-19/,2022-10-08,2022-10-08T21:14:25Z,68608,5370,0,11789,35367,3.379,,,,,,4,9.25,2,0.41813737154007,0.309990167617798,0,85,10183175,589823541463.317,2.22523861239767,16.1362474065114,27.1030892468466,2,2,2.49917945942907,4.66464682875734,2005210
R_7X1Jhv3XfyoGn3XFm,9212018Fm,new_entry,,,"","On July 1, 2020, a new law on measures to prevent spread of infectious diseases at places serving food and beverages comes into force. Places such as restaurants, bars and cafes are now given responsibility for taking measures to prevent the spread of COVID-19. The law also means that it is the municipalities who are responsible for both supervising and making decisions about injunctions and prohibitions if it is necessary for the law to be followed. The municipalities are thus given the opportunity to close serving places if the law is not followed",2020-07-01,2020-07-01,2021-01-01,The policy has a clear end date,Sweden,SWE,SE,National,1,,,,Restriction and Regulation of Businesses,Restaurants,,"",,,,,,"","","","","","","","","","","",,No information in the policy about whether the business is considered essential or non-essential,"This type of business  (""Restaurants"") is allowed to open with conditions",Hygiene and sanitation measures required,Yes,Sweden,"One or more countries, but not all countries",,,,,,All Residents (Citizen Residents + Foreign Residents),No special population targeted,,,"Mandatory with Fines,Mandatory (Unspecified/Implied),Mandatory (Other; please list other enforcement mechanisms in the text entry)",National Government,59.3231810616988,56.7323514112203,54.3040991836974,55,https://tummgmt.eu.qualtrics.com/Q/File.php?F=F_1gcoWPIWjKisL3e,https://web.archive.org/web/20200701161305/https://www.folkhalsomyndigheten.se/nyheter-och-press/nyhetsarkiv/2020/juli/ny-restauranglag-ska-bidra-till-minskad-spridning-av-covid-19/,2022-10-09,2022-10-09T21:09:41Z,68608,5370,0,11789,35367,3.379,,,,,,4,9.25,2,0.41813737154007,0.309990167617798,0,85,10183175,589823541463.317,2.22523861239767,16.1362474065114,27.1030892468466,2,2,2.49917945942907,4.66464682875734,2005210
R_7X1Jhv3XfyoGn3XAt,9212018At,new_entry,,,"","On July 1, 2020, a new law on measures to prevent spread of infectious diseases at places serving food and beverages comes into force. Places such as restaurants, bars and cafes are now given responsibility for taking measures to prevent the spread of COVID-19. The law also means that it is the municipalities who are responsible for both supervising and making decisions about injunctions and prohibitions if it is necessary for the law to be followed. The municipalities are thus given the opportunity to close serving places if the law is not followed",2020-07-01,2020-07-01,2021-01-01,The policy has a clear end date,Sweden,SWE,SE,National,1,,,,Restriction and Regulation of Businesses,Bars,,"",,,,,,"","","","","","","","","","","",,No information in the policy about whether the business is considered essential or non-essential,"This type of business  (""Bars"") is allowed to open with conditions",Hygiene and sanitation measures required,Yes,Sweden,"One or more countries, but not all countries",,,,,,All Residents (Citizen Residents + Foreign Residents),No special population targeted,,,"Mandatory with Fines,Mandatory (Unspecified/Implied),Mandatory (Other; please list other enforcement mechanisms in the text entry)",National Government,59.3231810616988,56.7323514112203,54.3040991836974,55,https://tummgmt.eu.qualtrics.com/Q/File.php?F=F_1gcoWPIWjKisL3e,https://web.archive.org/web/20200701161305/https://www.folkhalsomyndigheten.se/nyheter-och-press/nyhetsarkiv/2020/juli/ny-restauranglag-ska-bidra-till-minskad-spridning-av-covid-19/,2022-10-09,2022-10-09T21:09:41Z,68608,5370,0,11789,35367,3.379,,,,,,4,9.25,2,0.41813737154007,0.309990167617798,0,85,10183175,589823541463.317,2.22523861239767,16.1362474065114,27.1030892468466,2,2,2.49917945942907,4.66464682875734,2005210
