R_1l6tQXSncA3W24KGr,7402266,new_entry,,,"","The government has restricted travellers from the United Kingdom of Great Britain and Northern Ireland from entering Myanmar as a precautionary measure to control and limit the risk of transmission of the new SARS-CoV-2 variant to the country. The temporary restrictive measure took effect starting from 31 December 2020. Under the restriction, the country will not allow residents of the UK and Northern Ireland and travellers who had visited those countries during the last 14 days to enter Myanmar.",2021-01-02,2020-12-31,,The policy’s end date is unknown or unreported,Myanmar,MMR,MM,National,0,,,,External Border Restrictions,Total border crossing ban,,"",,,,,,"","","","","","","","","","","",,,,"",No,United Kingdom,One or more countries and one or more regional groupings,,,,,,All (Travelers + Residents),No special population targeted,Inbound,All kinds of transport,Mandatory (Unspecified/Implied),"National Government,Ministry/Department of Health,Ministry/Department of Foreign Affairs",https://tummgmt.eu.qualtrics.com/Q/File.php?F=F_10vCmYkRVfEjMvV,https://www.mmtimes.com/news/myanmar-bans-entry-travellers-uk-and-northern-ireland.html,CoronaNet (original),,2022-09-26,2022-09-26T23:59:59Z,124630,2682,107069,24007,1818260,33.798,,,,,,139,44.7,0,-0.345599442720413,0.669777810573578,19,30,53382581,79495831532.5896,6.75862882426273,17.7929950522142,25.0989704236797,0,0,-1.87784326663643,0.371828637683638,73309
R_2xFaaHLresjHfA0Gr,2059245,update,Change of Policy,Relaxing,Volume of policy relaxing,"The ban on international flights has been extended to January 31st. However, starting January 1, 2021, plans to resume incoming international flights are being discussed. The number of flights, COVID-19 testing procedures, and quarantine requirements remain unclear. UPDATE: Myanmar stopped allowing the landing of all international commercial passenger flights in all airports, effective starting March 30. This ban was extended until December 31. Starting January 1, 2021, some incoming international flights will resume.",2020-12-31,2020-12-31,2021-01-31,The policy has a clear end date,Myanmar,MMR,MM,National,0,,,,External Border Restrictions,Total border crossing ban,,"",,,,,,"","","","","","","","","","","",,,,"",No,All countries,All countries,,,,,,All (Travelers + Residents),,Inbound,Flights,Mandatory with Exceptions (Please list exceptions in the text entry),"Ministry/Department of Health,Other (Please specify in the text box)",https://tummgmt.eu.qualtrics.com/Q/File.php?F=F_3qaPBvYsBPYFQtX ; https://tummgmt.eu.qualtrics.com/Q/File.php?F=F_3gT1si1BISza7DS,"NA ; https://www.mmtimes.com/news/myanmar-government-extends-traveller-entry-and-intl-flight-restrictions-january-31.html ; https://mm.usembassy.gov/covid-19-information/#:~:text=If%20you%20are%20a%20U.S.,notify%20us%20and%20seek%20assistance.&text=If%20a%20U.S.%20citizen%20is,a%20seven%2Dday%20home%20quarantine.",CoronaNet (original),,2021-01-04,2021-01-04T22:41:18Z,124630,2682,107069,24007,1818260,33.798,,,,,,139,44.7,0,-0.345599442720413,0.669777810573578,19,30,53382581,79495831532.5896,6.75862882426273,17.7929950522142,25.0989704236797,0,0,-1.87784326663643,0.371828637683638,73309
R_1jIzkhAYgvgXq9MHf,9920511,new_entry,,,"","The Ministry of Foreign Affairs announced on January 30 that it will be extending the temporary suspension of all types of visas until the end of February. Diplomatic missions, UN officials and those with compelling reasons can do so via relief or special flights by contacting the Myanmar Mission for visa restriction exceptions.",2021-01-30,2021-01-30,2021-02-28,The policy has a clear end date,Myanmar,MMR,MM,National,0,,,,External Border Restrictions,Visa restrictions (e.g. suspend issuance of visa),,"",,,,,,"","","","","","","","","","","",,,,"",No,All countries,All countries,,,,,,All (Travelers + Residents),No special population targeted,,Not Applicable,Mandatory (Unspecified/Implied),Ministry/Department of Foreign Affairs,https://tummgmt.eu.qualtrics.com/Q/File.php?F=F_1KOqzLX0gLixJvj,https://www.mmtimes.com/news/myanmar-extends-covid-19-measures-entry-restrictions-february-28.html,CDC_ITF,CDC_ITF_882232_1,2022-07-05,2022-07-05T09:03:49Z,139864,3125,124441,16325,2374068,44.129,,,32300,,596,139,44.7,0,-0.345599442720413,0.669777810573578,19,30,53382581,79495831532.5896,6.75862882426273,17.7929950522142,25.0989704236797,0,0,-1.87784326663643,0.371828637683638,73309
R_Ckvk8zwhXhJrK6ZGr,8685629,new_entry,,,"",As of 1 February Myanmar’s airports have been shut to regular commercial air services until the end of May. Some relief flights are operating. Neighbouring countries have also closed their land borders to Myanmar.,2020-02-01,2021-02-01,2021-05-31,The policy has a clear end date,Myanmar,MMR,MM,National,0,,,,External Border Restrictions,Total border crossing ban,,"",,,,,,"","","","","","","","","","","",,,,"",No,All countries,All countries,,,,,,All (Travelers + Residents),No special population targeted,Inbound/Outbound,Flights,Mandatory (Unspecified/Implied),National Government,https://tummgmt.eu.qualtrics.com/Q/File.php?F=F_Zqydije1dKOodsB,http://web.archive.org/web/20210308194756/https://mm.usembassy.gov/covid-19-information/,OxCGRT,OXCGRT_Myanmar_20210223_extmvt,2022-07-05,2022-07-05T12:16:58Z,140354,3138,125324,9019,2399366,44.599,,,35467,,655,139,44.7,0,-0.345599442720413,0.669777810573578,19,30,53382581,79495831532.5896,6.75862882426273,17.7929950522142,25.0989704236797,0,0,-1.87784326663643,0.371828637683638,73309
R_CesRvIq9VaxXApHCz,1027035,new_entry,,,"","On February 1st, 2021, government of Myanmar announced that negative COVID-19 test taken within 72 hours required for entering Myanmar, at day 7 after entry. Business entry permits require negative test within 36 hours before boarding flights, taking a COVID-19 test upon arrival. People who can enter Myanmar must test negative for COVID-19 within 72 hours before the trips. Upon arrival, the passengers must isolate for another seven days at a government facility and undergo another COVID-19 test. If the travelers obtain a negative test result, they will then quarantine for another seven days at their residence.Authorities also permit business trips for those working in important sectors, such as oil, gas, and power from mainland China and Japan in a so-called  fast-lane  arrangement, with protocols in place. Safeguards for the fast-lane agreements include requiring travelers to present a medical document attesting that they are COVID-19-negative within 36 hours before boarding flights, taking a COVID-19 test upon arrival in Myanmar, and isolating at designated facilities.",2021-02-01,2021-02-01,,The policy’s end date is unknown or unreported,Myanmar,MMR,MM,National,0,,,,External Border Restrictions,Negative COVID-19 Test,,"",,,,,,"","","","","","","","","","","",,,,"",No,All countries,All countries,,,,,,All (Travelers + Residents),No special population targeted,,Not Applicable,Mandatory (Unspecified/Implied),National Government,https://tummgmt.eu.qualtrics.com/Q/File.php?F=F_3kjABeCoHv5TuKi,https://crisis24.garda.com/alerts/2021/02/myanmar-authorities-extended-covid-19-restrictions-through-feb-28-update-31,CDC_ITF,CDC_ITF_969853_1,2022-07-31,2022-07-31T10:26:53Z,140354,3138,125324,9019,2399366,44.599,,,35467,,655,139,44.7,0,-0.345599442720413,0.669777810573578,19,30,53382581,79495831532.5896,6.75862882426273,17.7929950522142,25.0989704236797,0,0,-1.87784326663643,0.371828637683638,73309
R_7Utd4clepHwIcV3Gr,8346042,new_entry,,,"","Officials of Myanmar have closed airports nationwide and suspended all domestic and international flights through May 31.  Exceptions apply to relief flights, all-cargo flights, medical evacuation flights and special flights specifically approved by the Department of Civil Aviation.",2021-02-28,2021-03-01,2021-05-31,The policy has a clear end date,Myanmar,MMR,MM,National,0,,,,External Border Restrictions,Total border crossing ban,,"",,,,,,"","","","","","","","","","","",,,,"",No,All countries,All countries,,,,,,All (Travelers + Residents),No special population targeted,Inbound/Outbound,Flights,Mandatory (Unspecified/Implied),National Government,https://tummgmt.eu.qualtrics.com/Q/File.php?F=F_DhLw1DhV6ov24PT,https://crisis24.garda.com/alerts/2021/02/myanmar-authorities-extended-covid-19-restrictions-through-march-31-update-32,CDC_ITF,CDC_ITF_1264794_2,2022-07-05,2022-07-05T09:38:36Z,141916,3199,131487,,,,,,12222,,226,139,44.7,0,-0.345599442720413,0.669777810573578,19,30,53382581,79495831532.5896,6.75862882426273,17.7929950522142,25.0989704236797,0,0,-1.87784326663643,0.371828637683638,73309
R_2txRmIuHaZ3ADOwGr,1390028,new_entry,,,"","On March 19, 2020, Burmese authorities announced the temporary suspension of entry and exit of foreign nationals through land borders. U.S. citizens cannot enter/exit Burma from/to any of Burma’s land borders with Thailand, Laos, China, India, and Bangladesh.",2021-03-19,2021-03-19,2021-03-23,The policy has a clear end date,Myanmar,MMR,MM,National,0,,,,External Border Restrictions,Total border crossing ban,,"",,,,,,"","","","","","","","","","","",,,,"",No,All countries,All countries,,,,,,All Foreign Nationals (Foreign Residents + Foreign Travelers),No special population targeted,Inbound/Outbound,Land Border,Mandatory (Unspecified/Implied),National Government,https://tummgmt.eu.qualtrics.com/Q/File.php?F=F_29prZHT8u0u2okH,http://web.archive.org/web/20210322060444/https://mm.usembassy.gov/covid-19-information/,OxCGRT,OXCGRT_Myanmar_20210309_extmvt,2022-07-05,2022-07-05T14:11:45Z,142212,3204,131754,,,,,,12222,,226,139,44.7,0,-0.345599442720413,0.669777810573578,19,30,53382581,79495831532.5896,6.75862882426273,17.7929950522142,25.0989704236797,0,0,-1.87784326663643,0.371828637683638,73309
R_1k0RQ5ZSvzP6HEFGr,3420746,new_entry,,,"","The suspension of flights into Myanmar has been extended to 30th April 2021. According to the notice from the Department of Civil Aviation issued on 31 March 2021, the earlier restrictions for all international airlines operating air services to and from the Yangon International Airport have been further extended up to 30 April 2021, 2359 Hours MST.",2021-04-01,2021-04-01,2021-04-30,The policy has a clear end date,Myanmar,MMR,MM,Municipal,0,Rangoon,,Yangon,External Border Restrictions,Total border crossing ban,,"",,,,,,"","","","","","","","","","","",,,,"",No,All countries,All countries,,,,,,All (Travelers + Residents),No special population targeted,Inbound/Outbound,Flights,Mandatory (Unspecified/Implied),"National Government,Other (Please specify in the text box)",https://tummgmt.eu.qualtrics.com/Q/File.php?F=F_vvLMYooiBPNczux,https://archive.vn/ZGufA#selection-1169.32-1169.61,OxCGRT,OXCGRT_Myanmar_20210413_extmvt,2022-07-05,2022-07-05T15:33:52Z,142466,3206,131802,,,,,,15197,,280,139,44.7,0,-0.345599442720413,0.669777810573578,19,30,53382581,79495831532.5896,6.75862882426273,17.7929950522142,25.0989704236797,0,0,-1.87784326663643,0.371828637683638,73309
R_pyEYEWJFQkpzHKVGr,8178921,new_entry,,,"",The military of Myanmar has directed airports to close to regular international commercial passenger flights until 31st May 2021 at the earliest.,2021-04-26,2021-04-26,2021-05-31,The policy has a clear end date,Myanmar,MMR,MM,National,0,,,,External Border Restrictions,Total border crossing ban,,"",,,,,,"","","","","","","","","","","",,,,"",No,All countries,All countries,,,,,,All (Travelers + Residents),No special population targeted,Inbound/Outbound,Flights,Mandatory (Unspecified/Implied),Military,https://tummgmt.eu.qualtrics.com/Q/File.php?F=F_3IuEZfl74Ld1H5T,http://web.archive.org/web/20210517164803/https://blog.wego.com/myanmar-burma-travel-restrictions-and-quarantine-requirements/,OxCGRT,OXCGRT_Myanmar_20210426_extmvt,2022-07-04,2022-07-04T20:53:17Z,142722,3207,131932,,,,,,47860,,883,139,44.7,0,-0.345599442720413,0.669777810573578,19,30,53382581,79495831532.5896,6.75862882426273,17.7929950522142,25.0989704236797,0,0,-1.87784326663643,0.371828637683638,73309
R_3qjVixC07zxrE5jGr,1777411,new_entry,,,"","Until 30 June 2021, flights to Myanmar are suspended.",2021-06-14,2021-06-14,2021-06-30,The policy has a clear end date,Myanmar,MMR,MM,National,0,,,,External Border Restrictions,Total border crossing ban,,"",,,,,,"","","","","","","","","","","",,,,"",No,All countries,All countries,,,,,,All (Travelers + Residents),No special population targeted,Inbound,Flights,Mandatory (Unspecified/Implied),National Government,https://tummgmt.eu.qualtrics.com/Q/File.php?F=F_1IgGeiM6rNixZdQ,https://blog.wego.com/myanmar-burma-travel-restrictions-and-quarantine-requirements/,OxCGRT,OXCGRT_Myanmar_20210614_extmvt,2022-07-04,2022-07-04T21:43:15Z,145826,3248,132969,2819,2651053,49.278,,,5075,,94,139,44.7,0,-0.345599442720413,0.669777810573578,19,30,53382581,79495831532.5896,6.75862882426273,17.7929950522142,25.0989704236797,0,0,-1.87784326663643,0.371828637683638,73309
R_1dKpMnlzotbjbDdGr,5825563,new_entry,,,"",Myanmar's officials suspended flights to Myanmar are suspended until 30 June 2021.,2021-06-14,2021-06-14,2021-06-30,The policy has a clear end date,Myanmar,MMR,MM,National,0,,,,External Border Restrictions,Total border crossing ban,,"",,,,,,"","","","","","","","","","","",,,,"",No,All countries,All countries,,,,,,All (Travelers + Residents),No special population targeted,Inbound,Flights,Mandatory (Unspecified/Implied),National Government,https://tummgmt.eu.qualtrics.com/Q/File.php?F=F_2cw1eKP3LjTBSj9,http://web.archive.org/web/20210629032703/https://blog.wego.com/myanmar-burma-travel-restrictions-and-quarantine-requirements/,OxCGRT,OXCGRT_Myanmar_20210614_extmvt,2022-07-05,2022-07-05T15:45:01Z,145826,3248,132969,2819,2651053,49.278,,,5075,,94,139,44.7,0,-0.345599442720413,0.669777810573578,19,30,53382581,79495831532.5896,6.75862882426273,17.7929950522142,25.0989704236797,0,0,-1.87784326663643,0.371828637683638,73309
R_2zkf0g3K6G4f7CFNA,2720282,new_entry,,,"","Myanmar is tracing citizens that attended a religious gathering a Malaysia, which was linked to COVID-19 cases, announced on March 18.",2020-03-18,2020-03-18,2020-04-02,The policy has an imprecise natural end date (e.g. masks will be distributed until they run out),Myanmar,MMR,MM,National,0,,,,Health Monitoring,,,"",,,,,,"","","","","","","","","","","",,,,"",No,Myanmar,"One or more countries, but not all countries",,,,,,Other,,Inbound,Not Applicable,Mandatory (Unspecified/Implied),"National Government,Ministry/Department of Health,Other (Please specify in the text box)",https://tummgmt.eu.qualtrics.com/Q/File.php?F=F_1K3g2Rfklf0TRkB,https://www.mmtimes.com/news/myanmar-begins-tracing-citizens-malaysian-religious-event.html,CoronaNet (original),,2022-09-26,2022-09-26T23:59:59Z,0,0,0,,,,,,,,,139,44.7,0,-0.345599442720413,0.669777810573578,19,30,53382581,79495831532.5896,6.75862882426273,17.7929950522142,25.0989704236797,0,0,-1.87784326663643,0.371828637683638,73309
R_esKNp7OxSGUYeEFNA,8343472,new_entry,,,"","On March 28, Mon State (Myanmar) imposes rules  for returnees from foreign countries, stating they must report to the authorities and undergo a health check.",2020-03-28,2020-03-28,,The policy’s end date is unknown or unreported,Myanmar,MMR,MM,Provincial,0,Mon,,,Health Monitoring,,,"",,,,,,"","","","","","","","","","","",,,,"",No,Myanmar,One or more geographical or administrative units (other than provincial or city level units) within one or more countries,,,,,Mon State,All (Travelers + Residents),,Inbound,All kinds of transport,Mandatory (Unspecified/Implied),Provincial/State Government,https://tummgmt.eu.qualtrics.com/Q/File.php?F=F_2ZW8kI3nWZcSuNe,https://www.irrawaddy.com/specials/myanmar-covid-19/myanmars-states-issue-heavy-restrictions-movement-ahead-thingyan-curb-covid-19.html,CoronaNet (original),,2022-09-26,2022-09-26T23:59:59Z,8,0,0,,,,,,,,,139,44.7,0,-0.345599442720413,0.669777810573578,19,30,53382581,79495831532.5896,6.75862882426273,17.7929950522142,25.0989704236797,0,0,-1.87784326663643,0.371828637683638,73309
R_d4PGcdZ0KmjlKedNA,9127171,new_entry,,,"","In Yamethin and Meiktila districts, medical and local authorities are conducting regular health checks as these districts have the most returnees from abroad, announced on April 2.",2020-04-02,2020-04-02,2020-04-17,The policy has an imprecise natural end date (e.g. masks will be distributed until they run out),Myanmar,MMR,MM,Provincial,0,Mandalay,,,Health Monitoring,,,"",,,,,,"","","","","","","","","","","",,,,"",No,Myanmar,One or more geographical or administrative units (other than provincial or city level units) within one or more countries,,,,,Yamethin District; Meiktila District,All (Travelers + Residents),,Inbound/Outbound,"All kinds of transport,Not Applicable",Mandatory (Unspecified/Implied),"Provincial/State Government,Municipal Government,Other (Please specify in the text box)",https://tummgmt.eu.qualtrics.com/Q/File.php?F=F_2EG1JwTV8uja9iv,https://www.mmtimes.com/news/more-3200-people-under-quarantine-mandalay.html,CoronaNet (original),,2022-09-26,2022-09-26T23:59:59Z,20,1,0,,,,,,,,,139,44.7,0,-0.345599442720413,0.669777810573578,19,30,53382581,79495831532.5896,6.75862882426273,17.7929950522142,25.0989704236797,0,0,-1.87784326663643,0.371828637683638,73309
R_D0IsKCpeZUTmRrjNA,464952,new_entry,,,"","The Myanmar Computer Federation (MCF) has developed the official contact-tracing app, “Saw Saw Shar”, to facilitate containment efforts of the COVID-19 Control and Emergency Response ICT team under the Ministry of Transport & Communication, and the Ministry of Health and Sports. In addition to monitoring symptoms, the app provides timely notifications on nearby potential high-risk areas with positive cases, and the official COVID-19 hotlines contacts, closest fever clinics and quarantine center.",2020-04-28,2020-04-28,2023-08-01,The policy has an unlimited time span (e.g. recommendation to wash one's hands; passing of a legal bill),Myanmar,MMR,MM,National,0,,,,Health Monitoring,,,"",,,,,,"","","","","","","","","","","",,,,"",Yes,Myanmar,"One or more countries, but not all countries",,,,,,,No special population targeted,,,Voluntary/Recommended but No Penalties,Ministry/Department of Health,https://tummgmt.eu.qualtrics.com/Q/File.php?F=F_3EiZlVP2QDQ9nKj,https://www.mmtimes.com/news/tackling-new-virus-through-smart-tech.html,CoronaNet (original),,2022-09-26,2022-09-26T23:59:59Z,150,5,16,,7215,0.134,,,,,,139,44.7,0,-0.345599442720413,0.669777810573578,19,30,53382581,79495831532.5896,6.75862882426273,17.7929950522142,25.0989704236797,0,0,-1.87784326663643,0.371828637683638,73309
R_8jP7pNGjmuyhndnNA,150746,new_entry,,,"","It is found that some people infected with COVID-19 from confirmed patients of local transmissions in Rakhine State went to other regions and states, so the National-Level Central Committee on Prevention, Control and Treatment of Coronavirus Disease 2019 (COVID-19) has already issued a public announcement dated 26-8-2020 urging those from Rakhine State who made their visits to other regions and states for any reasons since 10-8-2020, or those who visited Rakhine State and went back to their regions and states, to inform their nearest health centres, and the departments and the organizations concerned. In addition, they must inform their nearest health centres, and the departments and the organizations concerned by 11-9-2020. Actions will be taken against the travellers from Rakhine State who fail to inform by the deadline or those who know the travellers but conceal them.",2020-08-26,2020-08-26,2020-09-11,The policy has a clear end date,Myanmar,MMR,MM,National,0,,,,Health Monitoring,,,"",,,,,,"","","","","","","","","","","",,,,"",Yes,Myanmar,"One or more countries, but not all countries",,,,,,,No special population targeted,,,Mandatory (Unspecified/Implied),"Ministry/Department of Health,New (COVID-19 specific) Task Force",https://tummgmt.eu.qualtrics.com/Q/File.php?F=F_pKOAG8eQIJ8SFvr,https://www.gnlm.com.mm/national-level-central-committee-on-prevention-control-and-treatment-of-coronavirus-disease-2019-covid-19-public-announcement/,CoronaNet (original),,2020-11-08,2020-11-08T16:16:17Z,580,6,345,2041,149861,2.786,,,,,,139,44.7,0,-0.345599442720413,0.669777810573578,19,30,53382581,79495831532.5896,6.75862882426273,17.7929950522142,25.0989704236797,0,0,-1.87784326663643,0.371828637683638,73309
R_eloWMtnYBTPjaX7NA,9168048,new_entry,,,"","Myanmar State Counselor Nay Pyi Taw is instructing procedures in the voting process to ensure public health safety amidst the upcoming elections. Polling precincts will now require temperatures to be checked and social distancing to be enforced. Protective materials will be distributed, and the number of polling stations in areas with large populations will be expanded.",2020-10-08,2020-11-08,2020-11-08,The policy has a clear end date,Myanmar,MMR,MM,National,0,,,,Health Monitoring,,,"",,,,,,"","","","","","","","","","","",,,,"",Yes,Myanmar,"One or more countries, but not all countries",,,,,,,Other population not specifed above,,,Voluntary/Recommended but No Penalties,Other (Please specify in the text box),https://tummgmt.eu.qualtrics.com/Q/File.php?F=F_1MZ3mMtN8f5ASfv,https://www.mmtimes.com/news/myanmar-state-counsellor-checks-voting-procedure-ensure-safety.html ; https://www.rfa.org/english/news/myanmar/voter-safety-10272020185339.html,CoronaNet (original),,2020-11-12,2020-11-12T01:20:09Z,61377,1420,45756,14173,717966,13.346,,,,,,139,44.7,0,-0.345599442720413,0.669777810573578,19,30,53382581,79495831532.5896,6.75862882426273,17.7929950522142,25.0989704236797,0,0,-1.87784326663643,0.371828637683638,73309
R_1IW6PRgRStm7d6oNA,7399270,new_entry,,,"","The government in Myanmar allocates K300 million (US$206,000) from emergency fund for prevention and treatment of the new coronavirus, announced on February 11.",2020-02-10,2020-02-10,2020-02-12,The policy is a one-time measure (e.g. publication of guidelines),Myanmar,MMR,MM,National,0,,,,Health Resources,,,"",,,,,,"","","","","","","","","","","",,,,"",No,Myanmar,"One or more countries, but not all countries",,,,,,Other,,,Not Applicable,Mandatory (Unspecified/Implied),"National Government,Ministry/Department of Health",https://tummgmt.eu.qualtrics.com/Q/File.php?F=F_qQwdAYpKgJRBxi9,https://www.mmtimes.com/news/myanmar-acquire-medical-kits-test-coronavirus.html,CoronaNet (original),,2022-09-19,2022-09-19T23:59:59Z,0,0,0,,,,,,,,,139,44.7,0,-0.345599442720413,0.669777810573578,19,30,53382581,79495831532.5896,6.75862882426273,17.7929950522142,25.0989704236797,0,0,-1.87784326663643,0.371828637683638,73309
R_3EN18wMoufwEqSWGo,5235406,new_entry,,,"","Myanmar acquires 450 medical test kits for the new coronavirus from the National Centre for Global Health, Thailand, and the US Centers for Disease Control; announced on February 10.",2020-02-10,2020-02-20,2020-02-22,The policy is a one-time measure (e.g. publication of guidelines),Myanmar,MMR,MM,National,0,,,,Health Resources,Test Kits,,"",,,,,,"","","","","","","","","","","",,,,"",No,Myanmar,"One or more countries, but not all countries",,,,,,Health-Related Supplies,,Inbound,Not Applicable,Voluntary/Recommended but No Penalties,"National Government,Ministry/Department of Health,Other (Please specify in the text box)",https://tummgmt.eu.qualtrics.com/Q/File.php?F=F_26oZwuj6oTK0H7j,https://www.mmtimes.com/news/myanmar-acquire-medical-kits-test-coronavirus.html,CoronaNet (original),,2022-09-19,2022-09-19T23:59:59Z,0,0,0,,,,,,,,,139,44.7,0,-0.345599442720413,0.669777810573578,19,30,53382581,79495831532.5896,6.75862882426273,17.7929950522142,25.0989704236797,0,0,-1.87784326663643,0.371828637683638,73309
R_2wzbHetnZNvrtO0Gn,9680797,new_entry,,,"","Mandalay Region government sets up quarantine areas at every hospital in the region, announced on March 17.",2020-03-17,2020-03-17,2020-03-19,The policy is a one-time measure (e.g. publication of guidelines),Myanmar,MMR,MM,Provincial,0,Mandalay,,,Health Resources,Temporary Quarantine Centers,,"",,,,,,"","","","","","","","","","","",,,,"",No,Myanmar,One or more provinces within one or more countries,,Mandalay,,,,Health-Related Supplies,,Inbound,Not Applicable,Mandatory (Unspecified/Implied),Provincial/State Government,https://tummgmt.eu.qualtrics.com/Q/File.php?F=F_3qgjcxdZXrGQb2P,https://www.mmtimes.com/news/mandalay-beefs-effort-avoid-outbreak.html,CoronaNet (original),,2022-09-19,2022-09-19T23:59:59Z,0,0,0,,,,,,,,,139,44.7,0,-0.345599442720413,0.669777810573578,19,30,53382581,79495831532.5896,6.75862882426273,17.7929950522142,25.0989704236797,0,0,-1.87784326663643,0.371828637683638,73309
R_3hyeXcpKPH0LNLWGx,8669222,new_entry,,,"","Yangon Region Government (Myanmar) prepares facilities for quarantine purposes, announced on March 21.",2020-03-21,2020-03-21,2023-08-01,The policy has an unlimited time span (e.g. recommendation to wash one's hands; passing of a legal bill),Myanmar,MMR,MM,Provincial,0,Rangoon,,,Health Resources,Unspecified Health Materials,,"",,,,,,"","","","","","","","","","","",,,,"",No,Myanmar,One or more geographical or administrative units (other than provincial or city level units) within one or more countries,,,,,Rangoon (Yangon) region,Health-Related Supplies,,Inbound,Not Applicable,Mandatory (Unspecified/Implied),Provincial/State Government,https://tummgmt.eu.qualtrics.com/Q/File.php?F=F_2zYJh97AgyN7uMZ,https://www.mmtimes.com/news/govt-readies-facilities-possible-quarantine.html,CoronaNet (original),,2022-09-26,2022-09-26T23:59:59Z,0,0,0,,,,,,,,,139,44.7,0,-0.345599442720413,0.669777810573578,19,30,53382581,79495831532.5896,6.75862882426273,17.7929950522142,25.0989704236797,0,0,-1.87784326663643,0.371828637683638,73309
