R_295ONz8wkTN3mqRDj,2318865,new_entry,,,"","Air operators are banned from carrying persons of other nationalities than Moldovan to Moldova from March 13, except for stateless persons and foreigners with residence, domicile or with permit of stay in Moldova.",2020-03-13,2020-03-13,2020-03-31,The policy has a clear end date,Moldova,MDA,MD,National,0,,,,External Border Restrictions,Other External Border Restriction,,"",,,,,,"","","","","","","","","","","",,,,"",No,,All countries,,,,,,Foreign Travelers,,Inbound,Flights,Mandatory (Unspecified/Implied),National Government,51.4747805312556,48.0069551441525,44.1000473287961,105,https://tummgmt.eu.qualtrics.com/Q/File.php?F=F_1hy644S96LfF2aN,https://www.ipn.md/en/print/covid-19-nationwide-red-alert--7967_1072167.html,2020-05-15,2020-05-15T17:07:04Z,6,0,0,,,,,,,,,91,31.1,2,-0.824784338474274,-0.31783652305603,8,31,3549196,9151593756.55574,4.69079342838687,15.0822316569281,22.9371938821104,2,1,0.249926918547173,5.63572688074547,106374
R_yPJQmXAEcK2j2rnDj,3325323,update,End of Policy,,"","The Republic of Moldova closes its airspace for the regular flights from Spain and France as of March 13. The Chisinau-Barcelona and Chisinau-Paris flights are also annulled.

Flights to and from all destinations are permitted to resume from June 15, 2020. UPDATE: All commercial flights in and out of Moldova to all destinations were resumed as of June 15, 2020",2020-03-13,2020-03-13,2020-06-15,The policy has a clear end date,Moldova,MDA,MD,National,0,,,,External Border Restrictions,Other External Border Restriction,,"",,,,,,"","","","","","","","","","","",,,,"",No,"France,Spain","One or more countries, but not all countries",,,,,,All (Travelers + Residents),,Inbound/Outbound,Flights,Mandatory (Unspecified/Implied),National Government,51.4747805312556,48.0069551441525,44.1000473287961,105,https://tummgmt.eu.qualtrics.com/Q/File.php?F=F_3G8TvczVBLdrTsG ; https://tummgmt.eu.qualtrics.com/Q/File.php?F=F_1jizHkAJ7Y7MXGx,NA ; https://www.moldova.org/en/new-restrictions-to-be-lifted-in-moldova-regular-charter-flights-and-passenger-flights-will-be-resumed/,2020-08-21,2020-08-21T07:02:56Z,6,0,0,,,,,,,,,91,31.1,2,-0.824784338474274,-0.31783652305603,8,31,3549196,9151593756.55574,4.69079342838687,15.0822316569281,22.9371938821104,2,1,0.249926918547173,5.63572688074547,106374
R_3ekM7ApMaDw9VriGe,496541,new_entry,,,"","Moldova stopped flights at the Chisinau Airport from March 17 until May 15, at the earliest. This suspends all inbound and outbund flights from the country.",2020-03-16,2020-03-17,2020-05-15,The policy has a clear end date,Moldova,MDA,MD,National,0,,,,External Border Restrictions,Total border crossing ban,,"",,,,,,"","","","","","","","","","","",,,,"",No,,All countries,,,,,,All (Travelers + Residents),No special population targeted,Inbound/Outbound,"Flights,Trains",Mandatory (Unspecified/Implied),"National Government,Military,Police",53.9852047885487,50.6440433775985,47.2808144342257,85,https://tummgmt.eu.qualtrics.com/Q/File.php?F=F_2zJ5yRU7Y3VIme2,https://www.osac.gov/Content/Report/f9092f27-ae82-4d2d-b52a-183644ecde91 ; https://md.usembassy.gov/u-s-citizen-services/covid-19-information/,2020-06-18,2020-06-18T08:53:10Z,30,0,1,,,,,,,,,91,31.1,2,-0.824784338474274,-0.31783652305603,8,31,3549196,9151593756.55574,4.69079342838687,15.0822316569281,22.9371938821104,2,1,0.249926918547173,5.63572688074547,106374
R_2yjtMUzzjDGYgpEDj,2882287,new_entry,,,"","As of March 17th, 2020 Moldova restricted its air and land borders to admit Moldovan citizens only (with exceptions for foreigners legally residing in Moldova, commercial vehicle operators and crew, accredited diplomatic staff or representatives of international organizations or missions and their family members. Further exceptions to be decided by the Ministry of Foreign Affairs and European Integration).",2020-03-15,2020-03-17,,,Moldova,MDA,MD,National,0,,,,External Border Restrictions,Other External Border Restriction,,"",,,,,,"","","","","","","","","","","",,,,"",No,,All countries,,,,,,Foreign Travelers,No special population targeted,Inbound,All kinds of transport,Mandatory with Exceptions (Please list exceptions in the text entry),"Ministry/Department of Health,New (COVID-19 specific) Task Force",53.9852047885487,50.6440433775985,47.2808144342257,85,https://tummgmt.eu.qualtrics.com/Q/File.php?F=F_OfKQPLHFgcZBe6t,https://www.moldpres.md/en/news/2020/03/16/20002314,2020-08-21,2020-08-21T06:46:43Z,30,0,1,,,,,,,,,91,31.1,2,-0.824784338474274,-0.31783652305603,8,31,3549196,9151593756.55574,4.69079342838687,15.0822316569281,22.9371938821104,2,1,0.249926918547173,5.63572688074547,106374
R_aftIFDzQbQmpeKZDj,2882287,update,Change of Policy,Relaxing,timing of policy relaxing,"As of March 17th, 2020 Moldova restricted its air and land borders to admit Moldovan citizens only (with exceptions for foreigners legally residing in Moldova, commercial vehicle operators and crew, accredited diplomatic staff or representatives of international organizations or missions and their family members. Further exceptions to be decided by the Ministry of Foreign Affairs and European Integration).  

In the most recent update to the border restrictions (July 24), only Moldovan citizens may continue to enter Moldova freely, with exceptions for foreign citizens who are: relatives of Moldovan citizens, non-citizen residents and long-term visa holders, business travellers (with appropriate visas), diplomatic staff or staff of international organizations or missions and their family members, transiting passengers, persons travelling for health or humanitarian reasons (with appropriate documents), cross-border workers, and operators and crew of commercial vehicles. UPDATE: Access to Moldovan territory remains restricted to Moldovan citizens with an expanded list of valid reasons foreign persons may enter Moldova. As of the July 24 decision by the National Extraordinary Public Health Committee, this restriction will continue as long as Moldova Remains in a state of 'public health emergency'",2020-03-15,2020-03-17,,,Moldova,MDA,MD,National,0,,,,External Border Restrictions,Other External Border Restriction,,"",,,,,,"","","","","","","","","","","",,,,"",No,,All countries,,,,,,Foreign Travelers,No special population targeted,Inbound,All kinds of transport,Mandatory with Exceptions (Please list exceptions in the text entry),"Ministry/Department of Health,New (COVID-19 specific) Task Force",53.9852047885487,50.6440433775985,47.2808144342257,85,https://tummgmt.eu.qualtrics.com/Q/File.php?F=F_OfKQPLHFgcZBe6t ; https://tummgmt.eu.qualtrics.com/Q/File.php?F=F_3m4gc3cXyBKojeZ,NA ; https://gov.md/sites/default/files/postanovlenie_nchkoz_no_21_ot_24.07.2020_1.pdf,2020-08-21,2020-08-21T07:44:35Z,30,0,1,,,,,,,,,91,31.1,2,-0.824784338474274,-0.31783652305603,8,31,3549196,9151593756.55574,4.69079342838687,15.0822316569281,22.9371938821104,2,1,0.249926918547173,5.63572688074547,106374
R_29sIMp7EG0lTXkdDj,8460369,new_entry,,,"","Citizens of the de facto Transnistria holding residence permits issued after June 3, 2020 who live in territory claimed by Transnistria, but currently under the administration of the Moldovan Government at Chisinau, must receive special permission to cross into Transnistrian territory from the Transnistrian Ministry of Internal Affairs' Operational Headquarters for the Prevention and Prevention of the Spread of Viral Infection. The areas subject to this requirement are:  the village of Varnitsa; the village of Kopanka, Slobodzeya region; the villages of Novaya Molovata, Kociery, Pogrebea, Dorotskoe , Koshnitsa, Pyryta, Dubossary region.",2020-09-17,2020-09-17,,,Moldova,MDA,MD,Provincial,0,Transnistria,,,External Border Restrictions,Other External Border Restriction,,"",,,,,,"","","","","","","","","","","",,,,"",No,Moldova,One or more cities within one or more countries,,Transnistria,"Varnitsa (Transnistria); Kopanka (Transnistria), Slobodzeya and area (Transnistria); Novaya Molovata (Transnistria); Kociery (Transnistria); Pogrebea (Transnistria); Dorotskoe (Transnistria); Koshnitsa (Transnistria); Pyryta (Transnistria); Dubossary and area (Transnistria)",,,Citizen Travelers,No special population targeted,Inbound,All kinds of transport,Mandatory (Unspecified/Implied),"Provincial/State Government,New (COVID-19 specific) Task Force",54.3813392463352,51.3943862620336,47.8761290159791,43,https://tummgmt.eu.qualtrics.com/Q/File.php?F=F_1fjapMusStLzgGE,https://mvdpmr.org/novosti/resheniya-opershtaba/32657-reshenie-operativnogo-shtaba-ot-17-sentyabrya-2020-goda.html,2020-09-30,2020-09-30T06:36:09Z,44983,1170,33239,,,,,,,,,91,31.1,2,-0.824784338474274,-0.31783652305603,8,31,3549196,9151593756.55574,4.69079342838687,15.0822316569281,22.9371938821104,2,1,0.249926918547173,5.63572688074547,106374
R_6lpyxmY1aBxmsSJCn,8412186,new_entry,,,"","Medical face masks, gloves and medical disinfectants cannot be exported from Moldova until April 15, as dictated by a Government decision approved on March 11.",2020-03-11,2020-03-11,2020-04-15,The policy has a clear end date,Moldova,MDA,MD,National,0,,,,Health Resources,Masks,,"",,,,,,"","","","","","","","","","","",,,,"",No,All countries,All countries,,,,,,Health-Related Supplies,,Outbound,Not Applicable,Mandatory (Unspecified/Implied),National Government,49.0725481262973,45.0062263572397,40.5450231360368,108,https://tummgmt.eu.qualtrics.com/Q/File.php?F=F_qXjKMjvYUUjFJEB,https://www.ipn.md/en/government-introduces-temporary-restrictions-on-export-of-medical-masks-7966_1072105.html,2020-05-15,2020-05-15T16:12:25Z,3,0,0,,,,,,,,,91,31.1,2,-0.824784338474274,-0.31783652305603,8,31,3549196,9151593756.55574,4.69079342838687,15.0822316569281,22.9371938821104,2,1,0.249926918547173,5.63572688074547,106374
R_6lpyxmY1aBxmsSJEa,8412186,new_entry,,,"","Medical face masks, gloves and medical disinfectants cannot be exported from Moldova until April 15, as dictated by a Government decision approved on March 11.",2020-03-11,2020-03-11,2020-04-15,The policy has a clear end date,Moldova,MDA,MD,National,0,,,,Health Resources,Personal Protective Equipment,,"",,,,,,"","","","","","","","","","","",,,,"",No,All countries,All countries,,,,,,Health-Related Supplies,,Outbound,Not Applicable,Mandatory (Unspecified/Implied),National Government,49.0725481262973,45.0062263572397,40.5450231360368,108,https://tummgmt.eu.qualtrics.com/Q/File.php?F=F_qXjKMjvYUUjFJEB,https://www.ipn.md/en/government-introduces-temporary-restrictions-on-export-of-medical-masks-7966_1072105.html,2020-05-15,2020-05-15T16:12:25Z,3,0,0,,,,,,,,,91,31.1,2,-0.824784338474274,-0.31783652305603,8,31,3549196,9151593756.55574,4.69079342838687,15.0822316569281,22.9371938821104,2,1,0.249926918547173,5.63572688074547,106374
R_6lpyxmY1aBxmsSJBu,8412186,new_entry,,,"","Medical face masks, gloves and medical disinfectants cannot be exported from Moldova until April 15, as dictated by a Government decision approved on March 11.",2020-03-11,2020-03-11,2020-04-15,The policy has a clear end date,Moldova,MDA,MD,National,0,,,,Health Resources,Hand Sanitizer,,"",,,,,,"","","","","","","","","","","",,,,"",No,All countries,All countries,,,,,,Health-Related Supplies,,Outbound,Not Applicable,Mandatory (Unspecified/Implied),National Government,49.0725481262973,45.0062263572397,40.5450231360368,108,https://tummgmt.eu.qualtrics.com/Q/File.php?F=F_qXjKMjvYUUjFJEB,https://www.ipn.md/en/government-introduces-temporary-restrictions-on-export-of-medical-masks-7966_1072105.html,2020-05-15,2020-05-15T16:12:25Z,3,0,0,,,,,,,,,91,31.1,2,-0.824784338474274,-0.31783652305603,8,31,3549196,9151593756.55574,4.69079342838687,15.0822316569281,22.9371938821104,2,1,0.249926918547173,5.63572688074547,106374
R_OI6wwvla2Z8n8rvGb,1213218,new_entry,,,"","On March 12, Moldova will receive 1,000 COVID-19 tests from the World Health Organization.",2020-03-11,2020-03-12,,,Moldova,MDA,MD,National,0,,,,Health Resources,Test Kits,,"",,,,,,"","","","","","","","","","","",,,,"",Yes,Moldova,"One or more countries, but not all countries",,,,,,,,,,Mandatory (Unspecified/Implied),National Government,50.4528417282198,46.9732184937954,42.5380837147551,106,https://tummgmt.eu.qualtrics.com/Q/File.php?F=F_yO98iprBityuym5,https://www.ipn.md/en/all-persons-who-return-from-infection-risk-zones-could-be-7967_1072099.html,2020-05-15,2020-05-15T16:02:26Z,3,0,0,,,,,,,,,91,31.1,2,-0.824784338474274,-0.31783652305603,8,31,3549196,9151593756.55574,4.69079342838687,15.0822316569281,22.9371938821104,2,1,0.249926918547173,5.63572688074547,106374
R_3p0iZbnF0KySvMJGb,1213218,update,End of Policy,,"","On March 12 2020, Moldova will receive 1,000 COVID-19 tests from the World Health Organization. UPDATE: President Dodon said tests are also transmitted to the Transnistrian region and the taken samples are brought to laboratories in Chisinau.",2020-03-11,2020-03-12,2020-03-13,The policy is a one-time measure (e.g. publication of guidelines),Moldova,MDA,MD,National,0,,,,Health Resources,Test Kits,,"",,,,,,"","","","","","","","","","","",,,,"",Yes,Moldova,"One or more countries, but not all countries",,,,,,,,,,Mandatory (Unspecified/Implied),National Government,50.4528417282198,46.9732184937954,42.5380837147551,106,https://tummgmt.eu.qualtrics.com/Q/File.php?F=F_yO98iprBityuym5,https://www.ipn.md/en/all-persons-who-return-from-infection-risk-zones-could-be-7967_1072099.html,2021-06-05,2021-06-05T09:45:51Z,3,0,0,,,,,,,,,91,31.1,2,-0.824784338474274,-0.31783652305603,8,31,3549196,9151593756.55574,4.69079342838687,15.0822316569281,22.9371938821104,2,1,0.249926918547173,5.63572688074547,106374
R_1GQ69FxLDfktbzbCn,9732858,new_entry,,,"","The National Medical Insurance Company in Moldova will provide 2,000,000 lei for the purchase of 640,000 medical gloves and 250,000 medical masks.",2020-03-19,2020-03-19,,,Moldova,MDA,MD,National,0,,,,Health Resources,Masks,,"",,,,,,"","","","","","","","","","","",,,,"",Yes,Moldova,"One or more countries, but not all countries",,,,,,,,,,Mandatory (Unspecified/Implied),Ministry/Department of Health,55.2683211624401,51.9832024327916,48.8960304425903,67,https://tummgmt.eu.qualtrics.com/Q/File.php?F=F_yWRmhwPfRlcHFKx,https://stiri.md/article/social/cnam-va-aloca-2-000-000-de-lei-pentru-masti-si-manusi-medicale,2020-05-01,2020-05-01T13:09:57Z,49,1,1,,,,,,,,,91,31.1,2,-0.824784338474274,-0.31783652305603,8,31,3549196,9151593756.55574,4.69079342838687,15.0822316569281,22.9371938821104,2,1,0.249926918547173,5.63572688074547,106374
R_1GQ69FxLDfktbzbEa,9732858,new_entry,,,"","The National Medical Insurance Company in Moldova will provide 2,000,000 lei for the purchase of 640,000 medical gloves and 250,000 medical masks.",2020-03-19,2020-03-19,,,Moldova,MDA,MD,National,0,,,,Health Resources,Personal Protective Equipment,,"",,,,,,"","","","","","","","","","","",,,,"",Yes,Moldova,"One or more countries, but not all countries",,,,,,,,,,Mandatory (Unspecified/Implied),Ministry/Department of Health,55.2683211624401,51.9832024327916,48.8960304425903,67,https://tummgmt.eu.qualtrics.com/Q/File.php?F=F_yWRmhwPfRlcHFKx,https://stiri.md/article/social/cnam-va-aloca-2-000-000-de-lei-pentru-masti-si-manusi-medicale,2020-05-01,2020-05-01T13:09:57Z,49,1,1,,,,,,,,,91,31.1,2,-0.824784338474274,-0.31783652305603,8,31,3549196,9151593756.55574,4.69079342838687,15.0822316569281,22.9371938821104,2,1,0.249926918547173,5.63572688074547,106374
R_eQC4wCxefC1xCApCn,8839521,new_entry,,,"","The Ministry of Justice of Moldova donated 45,000 protective masks to the Chisinau Emergency Medicine Institute on March 19.",2020-03-19,2020-03-19,2020-03-19,The policy has a clear end date,Moldova,MDA,MD,National,0,,,,Health Resources,Masks,,"",,,,,,"","","","","","","","","","","",,,,"",Yes,Moldova,"One or more countries, but not all countries",,,,,,,,,,Mandatory (Unspecified/Implied),National Government,55.2683211624401,51.9832024327916,48.8960304425903,67,https://tummgmt.eu.qualtrics.com/Q/File.php?F=F_2drLhJzZDhnCkkL,https://www.ipn.md/en/print/masks-made-at-penitentiary-donated-to-emergency-medicine-institute--7967_1072313.html,2020-05-15,2020-05-15T19:19:07Z,49,1,1,,,,,,,,,91,31.1,2,-0.824784338474274,-0.31783652305603,8,31,3549196,9151593756.55574,4.69079342838687,15.0822316569281,22.9371938821104,2,1,0.249926918547173,5.63572688074547,106374
R_3JldcpBffJbBMOHCn,9732858,update,End of Policy,,"","The National Medical Insurance Company in Moldova announced on March 19 2020 that it will provide 2,000,000 lei for the purchase of 640,000 medical gloves and 250,000 medical masks. UPDATE: This will be executed as a one-time policy.",2020-03-19,2020-03-19,2020-04-02,The policy has an imprecise natural end date (e.g. masks will be distributed until they run out),Moldova,MDA,MD,National,0,,,,Health Resources,Masks,,"",,,,,,"","","","","","","","","","","",,,,"",Yes,Moldova,"One or more countries, but not all countries",,,,,,,,,,Mandatory (Unspecified/Implied),Ministry/Department of Health,55.2683211624401,51.9832024327916,48.8960304425903,67,https://tummgmt.eu.qualtrics.com/Q/File.php?F=F_yWRmhwPfRlcHFKx,https://stiri.md/article/social/cnam-va-aloca-2-000-000-de-lei-pentru-masti-si-manusi-medicale,2021-06-05,2021-06-05T09:53:11Z,49,1,1,,,,,,,,,91,31.1,2,-0.824784338474274,-0.31783652305603,8,31,3549196,9151593756.55574,4.69079342838687,15.0822316569281,22.9371938821104,2,1,0.249926918547173,5.63572688074547,106374
R_3JldcpBffJbBMOHEa,9732858,update,End of Policy,,"","The National Medical Insurance Company in Moldova announced on March 19 2020 that it will provide 2,000,000 lei for the purchase of 640,000 medical gloves and 250,000 medical masks. UPDATE: This will be executed as a one-time policy.",2020-03-19,2020-03-19,2020-04-02,The policy has an imprecise natural end date (e.g. masks will be distributed until they run out),Moldova,MDA,MD,National,0,,,,Health Resources,Personal Protective Equipment,,"",,,,,,"","","","","","","","","","","",,,,"",Yes,Moldova,"One or more countries, but not all countries",,,,,,,,,,Mandatory (Unspecified/Implied),Ministry/Department of Health,55.2683211624401,51.9832024327916,48.8960304425903,67,https://tummgmt.eu.qualtrics.com/Q/File.php?F=F_yWRmhwPfRlcHFKx,https://stiri.md/article/social/cnam-va-aloca-2-000-000-de-lei-pentru-masti-si-manusi-medicale,2021-06-05,2021-06-05T09:53:11Z,49,1,1,,,,,,,,,91,31.1,2,-0.824784338474274,-0.31783652305603,8,31,3549196,9151593756.55574,4.69079342838687,15.0822316569281,22.9371938821104,2,1,0.249926918547173,5.63572688074547,106374
R_rcMlCuHNMWmTBZLGb,5590493,new_entry,,,"","Moldova received on March 24 another 1,000 COVID-19 test kits from WHO.",2020-03-24,2020-03-24,2020-03-24,The policy has a clear end date,Moldova,MDA,MD,National,0,,,,Health Resources,Test Kits,,"",,,,,,"","","","","","","","","","","",,,,"",Yes,Moldova,"One or more countries, but not all countries",,,,,,,,,,Mandatory (Unspecified/Implied),National Government,69.0611964910246,65.8523176879416,62.5342724070888,98,https://tummgmt.eu.qualtrics.com/Q/File.php?F=F_qUiBY4FPhwmjrep,https://www.ipn.md/en/print/who-offers-another-1000-test-kits-for-covid-19--7967_1072410.html,2020-05-15,2020-05-15T19:52:16Z,125,1,2,,,,,,,,,91,31.1,2,-0.824784338474274,-0.31783652305603,8,31,3549196,9151593756.55574,4.69079342838687,15.0822316569281,22.9371938821104,2,1,0.249926918547173,5.63572688074547,106374
R_0dr8sPqikfIWHfjCn,5673546,new_entry,,,"","Doctors and medical assistants from ten districts in Moldova will receive masks, around 100,000 gloves and 760 liters of disinfectant from the Swiss Cooperation Office in the country on between March 25 and March 31.",2020-03-25,2020-03-25,2020-03-31,The policy has a clear end date,Moldova,MDA,MD,Provincial,0,,,,Health Resources,Masks,,"",,,,,,"","","","","","","","","","","",,,,"",No,Moldova,One or more provinces within one or more countries,,Fălești; Ungheni; Ștefan Vodă; Cahul; Orhei; Criuleni; Taraclia; Vulcănești; Edineț; Briceni,,,,Health Staff,,,Not Applicable,Mandatory (Unspecified/Implied),Ministry/Department of Health,72.2376978433629,68.7416437932876,65.2553878618187,104,https://tummgmt.eu.qualtrics.com/Q/File.php?F=F_1OP07eA5JGTnVIk,https://www.ipn.md/en/print/health-centers-receive-donation-of-masks-gloves-and-disinfectants--7967_1072451.html,2020-05-15,2020-05-15T20:06:43Z,149,1,2,,,,,,,,,91,31.1,2,-0.824784338474274,-0.31783652305603,8,31,3549196,9151593756.55574,4.69079342838687,15.0822316569281,22.9371938821104,2,1,0.249926918547173,5.63572688074547,106374
R_0dr8sPqikfIWHfjEa,5673546,new_entry,,,"","Doctors and medical assistants from ten districts in Moldova will receive masks, around 100,000 gloves and 760 liters of disinfectant from the Swiss Cooperation Office in the country on between March 25 and March 31.",2020-03-25,2020-03-25,2020-03-31,The policy has a clear end date,Moldova,MDA,MD,Provincial,0,,,,Health Resources,Personal Protective Equipment,,"",,,,,,"","","","","","","","","","","",,,,"",No,Moldova,One or more provinces within one or more countries,,Fălești; Ungheni; Ștefan Vodă; Cahul; Orhei; Criuleni; Taraclia; Vulcănești; Edineț; Briceni,,,,Health Staff,,,Not Applicable,Mandatory (Unspecified/Implied),Ministry/Department of Health,72.2376978433629,68.7416437932876,65.2553878618187,104,https://tummgmt.eu.qualtrics.com/Q/File.php?F=F_1OP07eA5JGTnVIk,https://www.ipn.md/en/print/health-centers-receive-donation-of-masks-gloves-and-disinfectants--7967_1072451.html,2020-05-15,2020-05-15T20:06:43Z,149,1,2,,,,,,,,,91,31.1,2,-0.824784338474274,-0.31783652305603,8,31,3549196,9151593756.55574,4.69079342838687,15.0822316569281,22.9371938821104,2,1,0.249926918547173,5.63572688074547,106374
R_0dr8sPqikfIWHfjBu,5673546,new_entry,,,"","Doctors and medical assistants from ten districts in Moldova will receive masks, around 100,000 gloves and 760 liters of disinfectant from the Swiss Cooperation Office in the country on between March 25 and March 31.",2020-03-25,2020-03-25,2020-03-31,The policy has a clear end date,Moldova,MDA,MD,Provincial,0,,,,Health Resources,Hand Sanitizer,,"",,,,,,"","","","","","","","","","","",,,,"",No,Moldova,One or more provinces within one or more countries,,Fălești; Ungheni; Ștefan Vodă; Cahul; Orhei; Criuleni; Taraclia; Vulcănești; Edineț; Briceni,,,,Health Staff,,,Not Applicable,Mandatory (Unspecified/Implied),Ministry/Department of Health,72.2376978433629,68.7416437932876,65.2553878618187,104,https://tummgmt.eu.qualtrics.com/Q/File.php?F=F_1OP07eA5JGTnVIk,https://www.ipn.md/en/print/health-centers-receive-donation-of-masks-gloves-and-disinfectants--7967_1072451.html,2020-05-15,2020-05-15T20:06:43Z,149,1,2,,,,,,,,,91,31.1,2,-0.824784338474274,-0.31783652305603,8,31,3549196,9151593756.55574,4.69079342838687,15.0822316569281,22.9371938821104,2,1,0.249926918547173,5.63572688074547,106374
R_3ozKfYsGxHGbVmWEa,7129292,new_entry,,,"","With a decree from March 28, the Moldovan Ministry of Finance will allocate 19.5 million lei to the Ministry of Health for procurement of respirators.",2020-03-28,2020-03-28,,,Moldova,MDA,MD,National,0,,,,Health Resources,Personal Protective Equipment,,"",,,,,,"","","","","","","","","","","",,,,"",Yes,Moldova,"One or more countries, but not all countries",,,,,,,,,,Mandatory (Unspecified/Implied),Ministry/Department of Health,76.4965376862739,73.1588302948361,69.7296651928022,115,https://tummgmt.eu.qualtrics.com/Q/File.php?F=F_3CGUxhYSz7g4YDS,http://tvrmoldova.md/actualitate/ministerul-finantelor-va-aloca-peste-19-milioane-de-lei-pentru-procurarea-respiratoarelor/,2020-05-01,2020-05-01T14:03:02Z,231,2,2,,,,,,,,,91,31.1,2,-0.824784338474274,-0.31783652305603,8,31,3549196,9151593756.55574,4.69079342838687,15.0822316569281,22.9371938821104,2,1,0.249926918547173,5.63572688074547,106374
R_pmAQtYzUb5GuQwhEa,7129292,update,End of Policy,,"","With a decree from March 28 2020, the Moldovan Ministry of Finance will allocate 19.5 million lei to the Ministry of Health for procurement of respirators. UPDATE: Procurement will take place through the Center for Centralized Public Procurement in Health.",2020-03-28,2020-03-28,2020-04-11,The policy has an imprecise natural end date (e.g. masks will be distributed until they run out),Moldova,MDA,MD,National,0,,,,Health Resources,Personal Protective Equipment,,"",,,,,,"","","","","","","","","","","",,,,"",Yes,Moldova,"One or more countries, but not all countries",,,,,,,,,,Mandatory (Unspecified/Implied),Ministry/Department of Health,76.4965376862739,73.1588302948361,69.7296651928022,115,https://tummgmt.eu.qualtrics.com/Q/File.php?F=F_3CGUxhYSz7g4YDS,http://tvrmoldova.md/actualitate/ministerul-finantelor-va-aloca-peste-19-milioane-de-lei-pentru-procurarea-respiratoarelor/,2021-06-05,2021-06-05T09:58:28Z,231,2,2,,,,,,,,,91,31.1,2,-0.824784338474274,-0.31783652305603,8,31,3549196,9151593756.55574,4.69079342838687,15.0822316569281,22.9371938821104,2,1,0.249926918547173,5.63572688074547,106374
R_1P7VexBDCpKqC1HGb,5351803,new_entry,,,"","Moldova will purchase 100,000 COVID-19 test kits from China on March 30.",2020-03-30,2020-03-30,2020-03-30,The policy has a clear end date,Moldova,MDA,MD,National,0,,,,Health Resources,Test Kits,,"",,,,,,"","","","","","","","","","","",,,,"",No,China,"One or more countries, but not all countries",,,,,,Health-Related Supplies,,Inbound,Not Applicable,Mandatory (Unspecified/Implied),National Government,77.5953131092215,74.611285429654,70.9142205034339,119,https://tummgmt.eu.qualtrics.com/Q/File.php?F=F_3MKgWOWN8IyNx3z,https://www.ipn.md/en/print/authorities-purchase-100000-covid-19-test-kits-from-china--7967_1072541.html,2020-05-15,2020-05-15T20:26:26Z,298,2,15,,,,,,,,,91,31.1,2,-0.824784338474274,-0.31783652305603,8,31,3549196,9151593756.55574,4.69079342838687,15.0822316569281,22.9371938821104,2,1,0.249926918547173,5.63572688074547,106374
