R_3exfZ4L8XTD1U3zFx,6033843,new_entry,,,"","On January 9th, 2021, the government of Slovenia enforces a quarantine on all people entering the country from a red-list country. There is a possibility to shorten the duration of the quarantine if the people undergo a PCR test with negative result. Entry to Slovenia from a red-listed country without a referral to quarantine at home or the submission of a negative test is permitted to
persons who daily or occasionally cross the border due to education or scientific research in the Republic of Slovenia or an EU Member State or a Member State of the Schengen Area.",2021-01-08,2021-01-09,,The policy’s end date is unknown or unreported,Slovenia,SVN,SI,National,0,,,,Quarantine,Self-Quarantine (i.e. quarantine at home),,"",,,,,,"","","","","","","","","","","",,,,"",No,"Afghanistan,Albania,Algeria,Andorra,Angola,Antigua and Barbuda,Argentina,Armenia,Australia,Austria,Azerbaijan,Bahamas,Bahrain,Bangladesh,Barbados,Belarus,Belgium,Belize,Benin,Bhutan,Bolivia,Bosnia and Herzegovina,Botswana,Brazil,Brunei,Bulgaria,Burkina Faso,Burundi,Cabo Verde,Cambodia,Cameroon,Canada,Central African Republic,Chad,Chile,China,Colombia,Comoros,Costa Rica,Croatia,Cuba,Cyprus,Czechia,Democratic Republic of the Congo,Denmark,Djibouti,Dominica,Dominican Republic,Ecuador,Egypt,El Salvador,Equatorial Guinea,Eritrea,Estonia,Eswatini,Ethiopia,Fiji,France,Gabon,Gambia,Georgia,Germany,Ghana,Greece,Grenada,Guatemala,Guinea,Guinea-Bissau,Guyana,Haiti,Honduras,Hong Kong,Hungary,Iceland,India,Indonesia,Iran,Iraq,Ireland,Israel,Italy,Ivory Coast,Jamaica,Japan,Jordan,Kazakhstan,Kenya,Kiribati,Kosovo,Kuwait,Kyrgyzstan,Laos,Latvia,Lebanon,Lesotho,Liberia,Libya,Liechtenstein,Lithuania,Luxembourg,Macau,Madagascar,Malawi,Malaysia,Maldives,Mali,Malta,Marshall Islands,Mauritania,Mauritius,Mexico,Micronesia,Moldova,Monaco,Mongolia,Montenegro,Morocco,Mozambique,Myanmar,Namibia,Nauru,Nepal,Netherlands,New Zealand,Nicaragua,Niger,Nigeria,North Korea,North Macedonia,Northern Cyprus,Norway,Oman,Pakistan,Palau,Palestine,Panama,Papua New Guinea,Paraguay,Peru,Philippines,Poland,Portugal,Qatar,Republic of the Congo,Romania,Russia,Rwanda,Saint Kitts and Nevis,Saint Lucia,Saint Vincent and the Grenadines,Samoa,San Marino,Sao Tome and Principe,Saudi Arabia,Senegal,Serbia,Seychelles,Sierra Leone,Singapore,Slovakia,Solomon Islands,Somalia,South Africa,South Korea,South Sudan,Spain,Sri Lanka,Sudan,Suriname,Sweden,Switzerland,Syria,Taiwan,Tajikistan,Tanzania,Thailand,Timor Leste,Togo,Tonga,Trinidad and Tobago,Tunisia,Turkey,Turkmenistan,Tuvalu,Uganda,Ukraine,United Arab Emirates,United Kingdom,United States,Uruguay,Uzbekistan,Vanuatu,Vatican,Venezuela,Vietnam,Yemen,Zambia,Zimbabwe","One or more countries, but not all countries",,,,,,All Travelers (Citizen Travelers + Foreign Travelers ),No special population targeted,Inbound,All kinds of transport,"Mandatory (Unspecified/Implied),Mandatory with Exceptions (Please list exceptions in the text entry)","National Government,Ministry/Department of Health,Police",,,,,https://tummgmt.eu.qualtrics.com/Q/File.php?F=F_9M2dP3h0PBaM0db,https://archive.vn/vWP8z#selection-629.0-631.78,2021-11-17,2021-11-17T11:17:37Z,138518,2973,111269,2669,716375,344.623,,30629,2655,1.47,1277,32,22.6,2,-0.824784338474274,0.548431634902954,0,61,2066388,53151337559.3359,4.83338291255969,14.541312713546,24.6964091071625,2,2,2.76737934190672,1.21948064343388,237616
R_Y50USU4iPFXEGnDFx,6033843,update,End of Policy,,"","On January 9th, 2021, the government of Slovenia enforces a quarantine on all people entering the country from a red-list country. There is a possibility to shorten the duration of the quarantine if the people undergo a PCR test with negative result. Entry to Slovenia from a red-listed country without a referral to quarantine at home or the submission of a negative test is permitted to
persons who daily or occasionally cross the border due to education or scientific research in the Republic of Slovenia or an EU Member State or a Member State of the Schengen Area. UPDATE: The policy ends on January 28, 2021",2021-01-08,2021-01-09,2021-01-28,The policy has a clear end date,Slovenia,SVN,SI,National,0,,,,Quarantine,Self-Quarantine (i.e. quarantine at home),,"",,,,,,"","","","","","","","","","","",,,,"",No,"Afghanistan,Albania,Algeria,Andorra,Angola,Antigua and Barbuda,Argentina,Armenia,Australia,Austria,Azerbaijan,Bahamas,Bahrain,Bangladesh,Barbados,Belarus,Belgium,Belize,Benin,Bhutan,Bolivia,Bosnia and Herzegovina,Botswana,Brazil,Brunei,Bulgaria,Burkina Faso,Burundi,Cabo Verde,Cambodia,Cameroon,Canada,Central African Republic,Chad,Chile,China,Colombia,Comoros,Costa Rica,Croatia,Cuba,Cyprus,Czechia,Democratic Republic of the Congo,Denmark,Djibouti,Dominica,Dominican Republic,Ecuador,Egypt,El Salvador,Equatorial Guinea,Eritrea,Estonia,Eswatini,Ethiopia,Fiji,France,Gabon,Gambia,Georgia,Germany,Ghana,Greece,Grenada,Guatemala,Guinea,Guinea-Bissau,Guyana,Haiti,Honduras,Hong Kong,Hungary,Iceland,India,Indonesia,Iran,Iraq,Ireland,Israel,Italy,Ivory Coast,Jamaica,Japan,Jordan,Kazakhstan,Kenya,Kiribati,Kosovo,Kuwait,Kyrgyzstan,Laos,Latvia,Lebanon,Lesotho,Liberia,Libya,Liechtenstein,Lithuania,Luxembourg,Macau,Madagascar,Malawi,Malaysia,Maldives,Mali,Malta,Marshall Islands,Mauritania,Mauritius,Mexico,Micronesia,Moldova,Monaco,Mongolia,Montenegro,Morocco,Mozambique,Myanmar,Namibia,Nauru,Nepal,Netherlands,New Zealand,Nicaragua,Niger,Nigeria,North Korea,North Macedonia,Northern Cyprus,Norway,Oman,Pakistan,Palau,Palestine,Panama,Papua New Guinea,Paraguay,Peru,Philippines,Poland,Portugal,Qatar,Republic of the Congo,Romania,Russia,Rwanda,Saint Kitts and Nevis,Saint Lucia,Saint Vincent and the Grenadines,Samoa,San Marino,Sao Tome and Principe,Saudi Arabia,Senegal,Serbia,Seychelles,Sierra Leone,Singapore,Slovakia,Solomon Islands,Somalia,South Africa,South Korea,South Sudan,Spain,Sri Lanka,Sudan,Suriname,Sweden,Switzerland,Syria,Taiwan,Tajikistan,Tanzania,Thailand,Timor Leste,Togo,Tonga,Trinidad and Tobago,Tunisia,Turkey,Turkmenistan,Tuvalu,Uganda,Ukraine,United Arab Emirates,United Kingdom,United States,Uruguay,Uzbekistan,Vanuatu,Vatican,Venezuela,Vietnam,Yemen,Zambia,Zimbabwe","One or more countries, but not all countries",,,,,,All Travelers (Citizen Travelers + Foreign Travelers ),No special population targeted,Inbound,All kinds of transport,"Mandatory (Unspecified/Implied),Mandatory with Exceptions (Please list exceptions in the text entry)","National Government,Ministry/Department of Health,Police",,,,,https://tummgmt.eu.qualtrics.com/Q/File.php?F=F_9M2dP3h0PBaM0db ; https://tummgmt.eu.qualtrics.com/Q/File.php?F=F_2bNts0bBJvLitWA,NA ; https://wiki.unece.org/display/CTRBSBC/Slovenia,2021-11-17,2021-11-17T11:53:40Z,138518,2973,111269,2669,716375,344.623,,30629,2655,1.47,1277,32,22.6,2,-0.824784338474274,0.548431634902954,0,61,2066388,53151337559.3359,4.83338291255969,14.541312713546,24.6964091071625,2,2,2.76737934190672,1.21948064343388,237616
R_8udDXsUv5eG6l6VFx,4941847,new_entry,,,"","On January 28, 2021, Slovenia enforces a quarantine on people entering Slovenia and applicates different set of rules for different categories. People that have spent at least 14 days in a country from the green list before entering Slovenia do not have to quarantine or show a negative test result. Travellers arriving in Slovenia from a EU Member State or from a Schengen Associated Country included on the ""orange"" list can enter Slovenia without restrictions or quarantine. Travellers who are a resident in a country from the red list or who arrive from such a country, shall be required to stay in quarantine for a period of 10 days. The quarantine is not imposed to travellers from the ""red"" list if they can provid a medical certificate proving that they have tested negative for SARS-CoV-2 (COVID-19). The test should not be older than 48 hours. The test must be performed in a EU Member State or Schengen Associated Country",2021-01-28,2021-01-28,,The policy’s end date is unknown or unreported,Slovenia,SVN,SI,National,0,,,,Quarantine,Self-Quarantine (i.e. quarantine at home),,"",,,,,,"","","","","","","","","","","",,,,"",No,All countries,All countries,,,,,,All Travelers (Citizen Travelers + Foreign Travelers ),No special population targeted,Inbound,All kinds of transport,"Mandatory (Unspecified/Implied),Mandatory with Exceptions (Please list exceptions in the text entry)","National Government,Police",,,,,https://tummgmt.eu.qualtrics.com/Q/File.php?F=F_3LXCnRgsj7JWFid,https://wiki.unece.org/display/CTRBSBC/Slovenia,2021-11-17,2021-11-17T12:19:36Z,163235,3448,142134,4506,796793,383.309,,78220,2335,3.76,1123,32,22.6,2,-0.824784338474274,0.548431634902954,0,61,2066388,53151337559.3359,4.83338291255969,14.541312713546,24.6964091071625,2,2,2.76737934190672,1.21948064343388,237616
R_24jiXPUlraA1QHMFx,4941847,update,End of Policy,,"","On January 28, 2021, Slovenia enforces a quarantine on people entering Slovenia and applicates different set of rules for different categories. People that have spent at least 14 days in a country from the green list before entering Slovenia do not have to quarantine or show a negative test result. Travellers arriving in Slovenia from a EU Member State or from a Schengen Associated Country included on the ""orange"" list can enter Slovenia without restrictions or quarantine. Travellers who are a resident in a country from the red list or who arrive from such a country, shall be required to stay in quarantine for a period of 10 days. The quarantine is not imposed to travellers from the ""red"" list if they can provid a medical certificate proving that they have tested negative for SARS-CoV-2 (COVID-19). The test should not be older than 48 hours. The test must be performed in a EU Member State or Schengen Associated Country UPDATE: On February 13, 2021, a new policy enters into force that will end this original policy.",2021-01-28,2021-01-28,2021-02-13,The policy has a clear end date,Slovenia,SVN,SI,National,0,,,,Quarantine,Self-Quarantine (i.e. quarantine at home),,"",,,,,,"","","","","","","","","","","",,,,"",No,All countries,All countries,,,,,,All Travelers (Citizen Travelers + Foreign Travelers ),No special population targeted,Inbound,All kinds of transport,"Mandatory (Unspecified/Implied),Mandatory with Exceptions (Please list exceptions in the text entry)","National Government,Police",,,,,https://tummgmt.eu.qualtrics.com/Q/File.php?F=F_3LXCnRgsj7JWFid ; https://tummgmt.eu.qualtrics.com/Q/File.php?F=F_3dLgEfTrIlTeVpY,NA ; https://www.policija.si/eng/newsroom/news-archive/107697-border-control-free-entry-also-for-those-who-have-been-vaccinated-against-covid-19-and-those-who-have-recovered-from-it,2021-11-17,2021-11-17T13:30:37Z,163235,3448,142134,4506,796793,383.309,,78220,2335,3.76,1123,32,22.6,2,-0.824784338474274,0.548431634902954,0,61,2066388,53151337559.3359,4.83338291255969,14.541312713546,24.6964091071625,2,2,2.76737934190672,1.21948064343388,237616
R_ZHMEwsZrs5LmQalFx,6944564,new_entry,,,"","On February 13, the government of Slovenia enters new exceptions about who is exempt from quarantining. As for the previous policy, travellers who are a resident in a country from the red list or who arrive from such a country, shall be required to stay in quarantine. The quarantine is not imposed to travellers from the ""red"" list if they can provid a medical certificate proving that they have tested negative for SARS-CoV-2. From Feb. 13 the new ordinance allows entry without quarantine and negative test also for persons who have been vaccinated against Covid-19 and persons who have recovered from Covid-19. These persons will have to produce certificates of testing or of vaccination.",2021-02-13,2021-02-13,,The policy’s end date is unknown or unreported,Slovenia,SVN,SI,National,0,,,,Quarantine,Self-Quarantine (i.e. quarantine at home),,"",,,,,,"","","","","","","","","","","",,,,"",No,All countries,All countries,,,,,,All Travelers (Citizen Travelers + Foreign Travelers ),"People with natural immunity against COVID-19 (e.g. those who have already had and survived COVID-19),People who are fully vaccinated against COVID-19",Inbound,All kinds of transport,"Mandatory (Unspecified/Implied),Mandatory with Exceptions (Please list exceptions in the text entry)","National Government,Police",,,,,https://tummgmt.eu.qualtrics.com/Q/File.php?F=F_3rSPUhLb6ORcero,https://www.policija.si/eng/newsroom/news-archive/107697-border-control-free-entry-also-for-those-who-have-been-vaccinated-against-covid-19-and-those-who-have-recovered-from-it,2021-11-17,2021-11-17T13:44:01Z,179148,3705,162248,2224,858085,412.794,,124905,3166,6.01,1523,32,22.6,2,-0.824784338474274,0.548431634902954,0,61,2066388,53151337559.3359,4.83338291255969,14.541312713546,24.6964091071625,2,2,2.76737934190672,1.21948064343388,237616
R_2tmpnLNHABMPeexFx,6944564,update,End of Policy,,"","On February 13, the government of Slovenia enters new exceptions about who is exempt from quarantining. As for the previous policy, travellers who are a resident in a country from the red list or who arrive from such a country, shall be required to stay in quarantine. The quarantine is not imposed to travellers from the ""red"" list if they can provid a medical certificate proving that they have tested negative for SARS-CoV-2. From Feb. 13 the new ordinance allows entry without quarantine and negative test also for persons who have been vaccinated against Covid-19 and persons who have recovered from Covid-19. These persons will have to produce certificates of testing or of vaccination. UPDATE: The policy ends on March 29, 2021.",2021-02-13,2021-02-13,2021-03-29,The policy has a clear end date,Slovenia,SVN,SI,National,0,,,,Quarantine,Self-Quarantine (i.e. quarantine at home),,"",,,,,,"","","","","","","","","","","",,,,"",No,All countries,All countries,,,,,,All Travelers (Citizen Travelers + Foreign Travelers ),"People with natural immunity against COVID-19 (e.g. those who have already had and survived COVID-19),People who are fully vaccinated against COVID-19",Inbound,All kinds of transport,"Mandatory (Unspecified/Implied),Mandatory with Exceptions (Please list exceptions in the text entry)","National Government,Police",,,,,https://tummgmt.eu.qualtrics.com/Q/File.php?F=F_3rSPUhLb6ORcero ; https://tummgmt.eu.qualtrics.com/Q/File.php?F=F_2WI7ZiCWqecVTst,NA ; https://www.gov.si/en/news/2021-03-29-goal-of-the-public-life-stoppage-is-to-keep-the-basic-reproduction-number-r-close-to-1/,2021-11-22,2021-11-22T18:26:07Z,179148,3705,162248,2224,858085,412.794,,124905,3166,6.01,1523,32,22.6,2,-0.824784338474274,0.548431634902954,0,61,2066388,53151337559.3359,4.83338291255969,14.541312713546,24.6964091071625,2,2,2.76737934190672,1.21948064343388,237616
R_3gYrL7ati3u5j6DFx,46168,new_entry,,,"","On March 29, 2021 the government of Slovenia forces a 10 day quarantine on all people coming from a country on the ""red"" list. 
It is no longer possible to end quarantine early. All people entering Slovenia must show a PCR test. As of today, a PCR test is valid only if it is performed in an EU or Schengen Area member state. All exceptions related to crossing of the border with a seven-day test have also been deleted. As of today, this exception applies only to daily work migrants, school children older than 13 years and persons who accompany them, and owners of land on both sides of the border.",2021-03-29,2021-03-29,,The policy’s end date is unknown or unreported,Slovenia,SVN,SI,National,0,,,,Quarantine,Self-Quarantine (i.e. quarantine at home),,"",,,,,,"","","","","","","","","","","",,,,"",No,All countries,All countries,,,,,,All Travelers (Citizen Travelers + Foreign Travelers ),No special population targeted,Inbound,All kinds of transport,"Mandatory (Unspecified/Implied),Mandatory with Exceptions (Please list exceptions in the text entry)","National Government,Police",,,,,https://tummgmt.eu.qualtrics.com/Q/File.php?F=F_2ziEUWXv0Z6sbGR,https://www.gov.si/en/news/2021-03-29-goal-of-the-public-life-stoppage-is-to-keep-the-basic-reproduction-number-r-close-to-1/,2021-11-22,2021-11-22T18:41:40Z,212966,4024,196518,5513,1051619,505.897,,352354,7809,16.95,3757,32,22.6,2,-0.824784338474274,0.548431634902954,0,61,2066388,53151337559.3359,4.83338291255969,14.541312713546,24.6964091071625,2,2,2.76737934190672,1.21948064343388,237616
R_BsvEWxsHwUb72ilFx,46168,update,End of Policy,,"","On March 29, 2021 the government of Slovenia forces a 10 day quarantine on all people coming from a country on the ""red"" list. 
It is no longer possible to end quarantine early. All people entering Slovenia must show a PCR test. As of today, a PCR test is valid only if it is performed in an EU or Schengen Area member state. All exceptions related to crossing of the border with a seven-day test have also been deleted. As of today, this exception applies only to daily work migrants, school children older than 13 years and persons who accompany them, and owners of land on both sides of the border. UPDATE: The policy ends on April 12, 2021.",2021-03-29,2021-03-29,2021-04-12,The policy has a clear end date,Slovenia,SVN,SI,National,0,,,,Quarantine,Self-Quarantine (i.e. quarantine at home),,"",,,,,,"","","","","","","","","","","",,,,"",No,All countries,All countries,,,,,,All Travelers (Citizen Travelers + Foreign Travelers ),No special population targeted,Inbound,All kinds of transport,"Mandatory (Unspecified/Implied),Mandatory with Exceptions (Please list exceptions in the text entry)","National Government,Police",,,,,https://tummgmt.eu.qualtrics.com/Q/File.php?F=F_2ziEUWXv0Z6sbGR ; https://tummgmt.eu.qualtrics.com/Q/File.php?F=F_1FaXDOFEWRLksTb,NA ; https://archive.vn/hIG6i,2021-11-22,2021-11-22T18:52:08Z,212966,4024,196518,5513,1051619,505.897,,352354,7809,16.95,3757,32,22.6,2,-0.824784338474274,0.548431634902954,0,61,2066388,53151337559.3359,4.83338291255969,14.541312713546,24.6964091071625,2,2,2.76737934190672,1.21948064343388,237616
R_3qQ0CE2weYZB4kHFx,9213684,new_entry,,,"","On April 12, 2021, the government of Slovenia annouces that all travelers arriving from countries on the ''Red List'' have to self-quarantine for 10 days if they do not provide a negative result from a COVID-19 PCR test taken within the previous 48 hours, a positive PCR test no more than 21 days but less than six months old, or proof of COVID-19 vaccination showing that at least seven days have passed since the second dose of the Pfizer-BioNTech vaccine, at least 14 days since the second dose of the Moderna vaccine, or 21 days since the first dose of the AstraZeneca vaccine. 
International hauliers, hauliers leaving or entering the country for no more than eight hours, persons in transit, and diplomats are exempt. Nonessential travel from non-EU/Schengen Area countries remains prohibited. Individuals arriving from countries not on the Red List may enter without restriction.",2021-04-12,2021-04-12,2021-04-15,The policy has a clear end date,Slovenia,SVN,SI,National,0,,,,Quarantine,Self-Quarantine (i.e. quarantine at home),,"",,,,,,"","","","","","","","","","","",,,,"",No,All countries,All countries,,,,,,All Travelers (Citizen Travelers + Foreign Travelers ),"People who are not vaccinated against COVID-19,Other population not specifed above",Inbound,All kinds of transport,"Mandatory (Unspecified/Implied),Mandatory with Exceptions (Please list exceptions in the text entry)","National Government,Police",,,,,https://tummgmt.eu.qualtrics.com/Q/File.php?F=F_3NI0oUKAMUJ9unp,https://archive.vn/hIG6i#selection-1739.0-1739.848 ; https://regnum.ru/news/society/3243377.html,2021-11-22,2021-11-22T19:22:59Z,226786,4126,208842,4707,1110921,534.425,,469075,8202,22.57,3946,32,22.6,2,-0.824784338474274,0.548431634902954,0,61,2066388,53151337559.3359,4.83338291255969,14.541312713546,24.6964091071625,2,2,2.76737934190672,1.21948064343388,237616
R_Ti8OZXFCKlIs7U5Fx,8760134,new_entry,,,"","""On April 15, 2021, the government of Slovenia annouces that all travelers arriving from countries on the ''Red List'' have to self-quarantine for 10 days if they do not provide a negative result from a COVID-19 PCR test taken within the previous 48 hours, a positive PCR test no more than 21 days but less than six months old, or proof of COVID-19 vaccination showing that at least seven days have passed since the second dose of the Pfizer-BioNTech vaccine, at least 14 days since the second dose of the Moderna vaccine, or 21 days since the first dose of the AstraZeneca, the Johnson & Johnson or the Russian Sputnik V vaccine. 
International hauliers, hauliers leaving or entering the country for no more than eight hours, persons in transit, and diplomats are exempt. Nonessential travel from non-EU/Schengen Area countries remains prohibited. Individuals arriving from countries not on the Red List may enter without restriction.""",2021-04-15,2021-04-15,,The policy’s end date is unknown or unreported,Slovenia,SVN,SI,National,0,,,,Quarantine,Self-Quarantine (i.e. quarantine at home),,"",,,,,,"","","","","","","","","","","",,,,"",No,All countries,All countries,,,,,,All Travelers (Citizen Travelers + Foreign Travelers ),People who are not vaccinated against COVID-19,Inbound,All kinds of transport,"Mandatory (Unspecified/Implied),Mandatory with Exceptions (Please list exceptions in the text entry)","National Government,Police",,,,,https://tummgmt.eu.qualtrics.com/Q/File.php?F=F_1q518y3PD0dWCUO,https://regnum.ru/news/society/3243377.html,2021-11-24,2021-11-24T10:37:04Z,229967,4142,212815,4315,1124972,541.184,,504214,9732,24.26,4682,32,22.6,2,-0.824784338474274,0.548431634902954,0,61,2066388,53151337559.3359,4.83338291255969,14.541312713546,24.6964091071625,2,2,2.76737934190672,1.21948064343388,237616
R_qDW9FgOo9wW8RoJFx,8760134,update,End of Policy,,"","""On April 15, 2021, the government of Slovenia annouces that all travelers arriving from countries on the ''Red List'' have to self-quarantine for 10 days if they do not provide a negative result from a COVID-19 PCR test taken within the previous 48 hours, a positive PCR test no more than 21 days but less than six months old, or proof of COVID-19 vaccination showing that at least seven days have passed since the second dose of the Pfizer-BioNTech vaccine, at least 14 days since the second dose of the Moderna vaccine, or 21 days since the first dose of the AstraZeneca, the Johnson & Johnson or the Russian Sputnik V vaccine. 
International hauliers, hauliers leaving or entering the country for no more than eight hours, persons in transit, and diplomats are exempt. Nonessential travel from non-EU/Schengen Area countries remains prohibited. Individuals arriving from countries not on the Red List may enter without restriction."" UPDATE: The policy ends on May 17, 2021",2021-04-15,2021-04-15,2021-05-17,The policy has a clear end date,Slovenia,SVN,SI,National,0,,,,Quarantine,Self-Quarantine (i.e. quarantine at home),,"",,,,,,"","","","","","","","","","","",,,,"",No,All countries,All countries,,,,,,All Travelers (Citizen Travelers + Foreign Travelers ),People who are not vaccinated against COVID-19,Inbound,All kinds of transport,"Mandatory (Unspecified/Implied),Mandatory with Exceptions (Please list exceptions in the text entry)","National Government,Police",,,,,https://tummgmt.eu.qualtrics.com/Q/File.php?F=F_1q518y3PD0dWCUO ; https://tummgmt.eu.qualtrics.com/Q/File.php?F=F_TvIpGdccDJjBL2h,NA ; https://archive.vn/qLIM5,2021-11-24,2021-11-24T11:29:05Z,229967,4142,212815,4315,1124972,541.184,,504214,9732,24.26,4682,32,22.6,2,-0.824784338474274,0.548431634902954,0,61,2066388,53151337559.3359,4.83338291255969,14.541312713546,24.6964091071625,2,2,2.76737934190672,1.21948064343388,237616
