R_3JgEhexmWOoJKd9NA,8588990,new_entry,,,"","The Public Health Agency in Sweden are sampling 4000 individuals to test for coronavirus, in order to assess the spread in the country. This was announced on April 7, 2020. The sampling is similar to a smaller investigation conducted by the Agency previously in the Stockholm area. The Swedish Armed Forces will aid the Public Health Agency in conducting the sampling.",2020-04-07,2020-04-07,2020-04-08,The policy is a one-time measure (e.g. publication of guidelines),Sweden,SWE,SE,National,0,,,,Health Testing,,,"",,,,,,"","","","","","","","","","","",,,,"",Yes,Sweden,"One or more countries, but not all countries",,,,,,,No special population targeted,,,Voluntary/Recommended but No Penalties,"Ministry/Department of Health,Military",61.1295133377739,58.7142237333977,56.3273512995902,23,https://tummgmt.eu.qualtrics.com/Q/File.php?F=F_1LpU3KhikHY0f6a,https://www.folkhalsomyndigheten.se/nyheter-och-press/nyhetsarkiv/2020/april/undersokning-for-att-mata-forekomsten-av-covid-19-i-sverige/,2021-06-09,2021-06-09T09:49:27Z,8299,591,0,,,,,,,,,4,9.25,2,0.41813737154007,0.309990167617798,0,85,10183175,589823541463.317,2.22523861239767,16.1362474065114,27.1030892468466,2,2,2.49917945942907,4.66464682875734,2005210
R_3KMTsqomBgxlQeSNA,286117,update,End of Policy,,"","On 17th of April, the Public Health Agency of Sweden stated that the first version of the national strategy for increasing the testing in Sweden was ready to be implemented. The Public Health Agency had been asked by the Swedish government to rapidly put the strategy together. Tthe overall testing capacity is recommended to be increased from the current 50 000 tests per week to 150 000 tests per week. The increased capacity will be used to firstly fill the regional exceptions where the capacity of COVID-a9 patients is insufficient. Secondly, testing of personnel in healthcare and elderly care will be conducted, Thirdly, the rest of the increased testing will be for essential workers not working in healthcare or elderly care. With time, the testing capacity will start testing for antibodies and immunity against the virus in the population as well as those that are infected. UPDATE: After announcing that there will be a national strategy for testing, there was a new anouncement on April 17th that updated the previous information with more details on the strategy",2020-04-17,2020-04-17,,,Sweden,SWE,SE,National,0,,,,Health Testing,,,"",,,,,,"","","","","","","","","","","",,,,"",No,Sweden,"One or more countries, but not all countries",,,,,,All Residents (Citizen Residents +Foreign Residents),,Inbound/Outbound,Not Applicable,Mandatory (Unspecified/Implied),"National Government,Ministry/Department of Health",61.5920739042904,59.3697484682606,57.2166415443571,26,https://tummgmt.eu.qualtrics.com/Q/File.php?F=F_DT3KH72Uu5mdFcd ; https://tummgmt.eu.qualtrics.com/Q/File.php?F=F_2q3LVdGEckSE80w,NA ; https://www.folkhalsomyndigheten.se/nyheter-och-press/nyhetsarkiv/2020/april/nationell-strategi-for-att-utoka-provtagningen-for-covid-19/,2020-05-30,2020-05-30T18:31:55Z,13743,1400,0,,,,,,,,,4,9.25,2,0.41813737154007,0.309990167617798,0,85,10183175,589823541463.317,2.22523861239767,16.1362474065114,27.1030892468466,2,2,2.49917945942907,4.66464682875734,2005210
R_2UVrYOOkZeUsOdcNA,8588990,update,Change of Policy,Strengthening,timing of policy strengthening,"The Public Health Agency in Sweden are sampling 4000 individuals to test for coronavirus, in order to assess the spread in the country. This was anounced on April 7th. The sampling is similar to a smaller investigation conducted by the Agency previously in the Stockholm area. The Swedish Armed Forces will aid the Public Health Agency in conducting the sampling. The sampling is starting on April 29th and the results are estimated to be published in June. UPDATE: Original entry stated the wrong start date, it was assumed to be publication date but more information about start date is now available (April 29th) as well as a preliminary end date (June 30th)",2020-04-07,2020-04-29,2020-06-30,The policy has a clear end date,Sweden,SWE,SE,National,0,,,,Health Testing,,,"",,,,,,"","","","","","","","","","","",,,,"",Yes,Sweden,"One or more countries, but not all countries",,,,,,,No special population targeted,,,Voluntary/Recommended but No Penalties,"Ministry/Department of Health,Military",61.8285105976624,59.4704118136138,57.4088681160659,27,https://tummgmt.eu.qualtrics.com/Q/File.php?F=F_1LpU3KhikHY0f6a ; https://tummgmt.eu.qualtrics.com/Q/File.php?F=F_1dzEGZD1rlXZzoc,NA ; https://www.folkhalsomyndigheten.se/nyheter-och-press/nyhetsarkiv/2020/april/ny-undersokning-for-att-mata-forekomsten-av-covid-19-i-sverige/,2020-06-16,2020-06-16T09:31:31Z,20966,2462,0,,,,,,,,,4,9.25,2,0.41813737154007,0.309990167617798,0,85,10183175,589823541463.317,2.22523861239767,16.1362474065114,27.1030892468466,2,2,2.49917945942907,4.66464682875734,2005210
R_1f3pCJzMSlHvXyNNA,8588990,update,Change of Policy,Relaxing,timing of policy relaxing,"The Public Health Agency in Sweden have sampled 2573 individuals to test for coronavirus, in order to assess the spread in the country. This was anounced on April 7th. The sampling is similar to a smaller investigation conducted by the Agency previously in the Stockholm area. The Swedish Armed Forces will aid the Public Health Agency in conducting the sampling. The sampling were conducted in the end of April, from April 29th and forward. UPDATE: New info on when the sampling was conducted and the total number sampled.",2020-04-07,2020-04-29,2020-04-30,The policy has a clear end date,Sweden,SWE,SE,National,0,,,,Health Testing,,,"",,,,,,"","","","","","","","","","","",,,,"",Yes,Sweden,"One or more countries, but not all countries",,,,,,,No special population targeted,,,Voluntary/Recommended but No Penalties,"Ministry/Department of Health,Military",61.8285105976624,59.4704118136138,57.4088681160659,27,https://tummgmt.eu.qualtrics.com/Q/File.php?F=F_1LpU3KhikHY0f6a ; https://tummgmt.eu.qualtrics.com/Q/File.php?F=F_2739gIEawJIxNkI,NA ; https://www.folkhalsomyndigheten.se/nyheter-och-press/nyhetsarkiv/2020/maj/nya-resultat-fran-undersokning-av-forekomsten-av-covid-19-i-sverige/,2020-06-16,2020-06-16T10:21:07Z,20966,2462,0,,,,,,,,,4,9.25,2,0.41813737154007,0.309990167617798,0,85,10183175,589823541463.317,2.22523861239767,16.1362474065114,27.1030892468466,2,2,2.49917945942907,4.66464682875734,2005210
R_3oFmKmSCV7a82prNA,286117,update,End of Policy,,"","The Public Health Agency of Sweden announced that they have updated the strategy of testing of COVID-19 in Sweden. The new strategy includes tests for antibodies, to see whether the immune system of an individual already is recognising the coronavirus. The new strategy was anounced on April 30th and is an expansion of the strategy already in place. UPDATE: The original strategy didn't include testing of antibodies. This has now been added to the strategy.",2020-04-30,2020-04-30,,,Sweden,SWE,SE,National,0,,,,Health Testing,,,"",,,,,,"","","","","","","","","","","",,,,"",No,Sweden,"One or more countries, but not all countries",,,,,,All Residents (Citizen Residents +Foreign Residents),,Inbound/Outbound,Not Applicable,Mandatory (Unspecified/Implied),"National Government,Ministry/Department of Health",61.9926330997067,59.5297421909981,57.4939805474122,27,https://tummgmt.eu.qualtrics.com/Q/File.php?F=F_DT3KH72Uu5mdFcd ; https://tummgmt.eu.qualtrics.com/Q/File.php?F=F_3gLzWcn1HhhtlQE,NA ; https://www.folkhalsomyndigheten.se/nyheter-och-press/nyhetsarkiv/2020/april/uppdaterad-strategi-for-utokad-provtagning-och-testning-av-covid-19/,2020-06-16,2020-06-16T09:39:13Z,21601,2586,0,,,,,,,,,4,9.25,2,0.41813737154007,0.309990167617798,0,85,10183175,589823541463.317,2.22523861239767,16.1362474065114,27.1030892468466,2,2,2.49917945942907,4.66464682875734,2005210
R_zVEURGlD9gMwdLrNA,1863139,new_entry,,,"","The Public Health Agency in Sweden has anounced a investigation for antibodies in Sweden nationally, from May 3rd until June 28th, in order to assess how many in the population that has COVID-19. This was anounced on May 20th. The investigation is conducted by analysing blood samples in nine regions: Jämtland, Jönköping, Kalmar, Skåne, Stockholm, Uppsala, Västerbotten, Västra Götaland och Örebro. The investigation is conducted in cooperation with SciLifeLab and Kungliga Tekniska Högskolan.",2020-05-20,2020-05-03,2020-06-28,The policy has a clear end date,Sweden,SWE,SE,National,0,,,,Health Testing,,,"",,,,,,"","","","","","","","","","","",,,,"",Yes,Sweden,"One or more countries, but not all countries",,,,,,,No special population targeted,,,Mandatory (Unspecified/Implied),Ministry/Department of Health,61.7631246843087,59.5629172285366,57.3566217056012,29,https://tummgmt.eu.qualtrics.com/Q/File.php?F=F_1HqIKOterITefI7,https://www.folkhalsomyndigheten.se/nyheter-och-press/nyhetsarkiv/2020/maj/forsta-resultaten-fran-pagaende-undersokning-av-antikroppar-for-covid-19-virus/,2020-06-16,2020-06-16T10:30:06Z,22693,2679,0,,,,,,,,,4,9.25,2,0.41813737154007,0.309990167617798,0,85,10183175,589823541463.317,2.22523861239767,16.1362474065114,27.1030892468466,2,2,2.49917945942907,4.66464682875734,2005210
R_2AZnZnFFOSVgmt5Cd,8732267,new_entry,,,"","On May 13, 2020, the Swedish Public Health authority releases the results of the first survey at national level, with a total of 2 573 participants. The results show that approximately 0.9 percent of the population had an ongoing infection with covid-19 when the samples were collected during the period April 21-24. Based on the results obtained, it is not possible to draw conclusions about the differences between different regions.",2020-05-13,2020-05-13,,The policy’s end date is unknown or unreported,Sweden,SWE,SE,National,0,,,,Health Testing,Health testing of entire population under the government's jurisdiction,,"",,,,,,"","","","","","","","","","","",,,,"",Yes,Sweden,"One or more countries, but not all countries",,,,,,,No special population targeted,,,Voluntary/Recommended but No Penalties,Ministry/Department of Health,61.8305410370766,59.5848539839492,57.2532608329173,33,https://tummgmt.eu.qualtrics.com/Q/File.php?F=F_3006kG7GcdNOBDE,https://outbreaknewstoday.com/sweden-releases-results-of-covid-19-prevalence-investigation-76786/,2022-10-09,2022-10-09T17:49:47Z,28755,3460,0,,,,,,,,,4,9.25,2,0.41813737154007,0.309990167617798,0,85,10183175,589823541463.317,2.22523861239767,16.1362474065114,27.1030892468466,2,2,2.49917945942907,4.66464682875734,2005210
R_3g0iagLFTnC9vcdBt,4020423,new_entry,,,"","On May 19, 2020, the national plan for the testing as proof of recovery from covid-19 established. For persons without symptoms, test may be done earliest 7 days after positive result.",2020-05-19,2020-05-19,,The policy’s end date is unknown or unreported,Sweden,SWE,SE,National,0,,,,Health Testing,Fixed Health Testing stations (excluding drive-ins),,"",,,,,,"","","","","","","","","","","",,,,"",Yes,Sweden,"One or more countries, but not all countries",,,,,,,Asymptomatic people,,,Voluntary/Recommended but No Penalties,Ministry/Department of Health,61.8252511584833,59.5490667428883,57.2424891207457,38,https://tummgmt.eu.qualtrics.com/Q/File.php?F=F_Wd4R124VMbNilax,https://www.folkhalsomyndigheten.se/nyheter-och-press/nyhetsarkiv/2020/maj/ny-vagledning-om-smittfrihet-efter-covid-19/,2022-11-12,2022-11-12T15:26:25Z,31818,3743,0,,,,,,,,,4,9.25,2,0.41813737154007,0.309990167617798,0,85,10183175,589823541463.317,2.22523861239767,16.1362474065114,27.1030892468466,2,2,2.49917945942907,4.66464682875734,2005210
R_1dsKzo7KYCQWx5INA,8005876,new_entry,,,"","The Public Health Agency of Sweden recommends health screening for COVID-19 cases in elderly care facilities in Sweden. This was announced on May 29, 2020.This applies both to the elderly and to personnel, that either moves in or are returning from healthcare.",2020-05-29,2020-05-29,2020-05-30,The policy is a one-time measure (e.g. publication of guidelines),Sweden,SWE,SE,National,0,,,,Health Testing,,,"",,,,,,"","","","","","","","","","","",,,,"",Yes,Sweden,"One or more countries, but not all countries",,,,,,,"People in nursing homes/long term care facilities,Other workers where the distinction between essential or non-essential is not explictely made (please note the occupation in the text entry)",,,Voluntary/Recommended but No Penalties,Ministry/Department of Health,61.6257574138618,59.5480267606863,57.0853052352103,41,https://tummgmt.eu.qualtrics.com/Q/File.php?F=F_1qWEKlFT0XXAvkL,https://www.folkhalsomyndigheten.se/nyheter-och-press/nyhetsarkiv/2020/maj/nytt-om-provtagning-inom-aldreomsorgen/,2021-04-20,2021-04-20T07:24:24Z,37964,4350,0,,,,,,,,,4,9.25,2,0.41813737154007,0.309990167617798,0,85,10183175,589823541463.317,2.22523861239767,16.1362474065114,27.1030892468466,2,2,2.49917945942907,4.66464682875734,2005210
R_3Rxr7utEjCAOJAINA,9427968,new_entry,,,"","The Public Health Agency in Sweden has recommended increased testing in elderly care, both among elderly and personell. They have also published information to help elderly care centers implement testing in their facilities. This was announced on May 29, 2020.",2020-05-29,2020-05-29,2023-01-24,The policy has an unlimited time span (e.g. recommendation to wash one's hands; passing of a legal bill),Sweden,SWE,SE,National,0,,,,Health Testing,,,"",,,,,,"","","","","","","","","","","",,,,"",Yes,Sweden,"One or more countries, but not all countries",,,,,,,"People in nursing homes/long term care facilities,Other workers where the distinction between essential or non-essential is not explictely made (please note the occupation in the text entry)",,,Voluntary/Recommended but No Penalties,Ministry/Department of Health,61.6257574138618,59.5480267606863,57.0853052352103,41,https://tummgmt.eu.qualtrics.com/Q/File.php?F=F_a4a5sRxwr0N5cYh,https://www.folkhalsomyndigheten.se/nyheter-och-press/nyhetsarkiv/2020/maj/nytt-om-provtagning-inom-aldreomsorgen/,2021-06-09,2021-06-09T09:53:57Z,37964,4350,0,,,,,,,,,4,9.25,2,0.41813737154007,0.309990167617798,0,85,10183175,589823541463.317,2.22523861239767,16.1362474065114,27.1030892468466,2,2,2.49917945942907,4.66464682875734,2005210
R_bvEeSpLebpqbfX3NA,9427968,update,End of Policy,,"","The Public Health Agency in Sweden has recommended increased testing in care facilities, both public and private, that in some way treat the elderly. The testing is to be conducted both among elderly and personell. They have also published information to help elderly care centers implement testing in their facilities. This was anounced on May 29th. UPDATE: The recommendation of increased testing has now been extended from only elderly care to all care facilities that treat elderly, public as well as privately owned.",2020-05-29,2020-05-29,,,Sweden,SWE,SE,National,0,,,,Health Testing,,,"",,,,,,"","","","","","","","","","","",,,,"",Yes,Sweden,"One or more countries, but not all countries",,,,,,,"People in nursing homes/long term care facilities,Other workers where the distinction between essential or non-essential is not explictely made (please note the occupation in the text entry)",,,Voluntary/Recommended but No Penalties,Ministry/Department of Health,61.6257574138618,59.5480267606863,57.0853052352103,41,https://tummgmt.eu.qualtrics.com/Q/File.php?F=F_a4a5sRxwr0N5cYh ; https://tummgmt.eu.qualtrics.com/Q/File.php?F=F_z9n0QkyPpynRHPz,NA ; https://www.folkhalsomyndigheten.se/nyheter-och-press/nyhetsarkiv/2020/juni/reviderat-stod-for-provtagning-for-covid-19-inom-aldreomsorgen/,2020-07-06,2020-07-06T17:00:35Z,37964,4350,0,,,,,,,,,4,9.25,2,0.41813737154007,0.309990167617798,0,85,10183175,589823541463.317,2.22523861239767,16.1362474065114,27.1030892468466,2,2,2.49917945942907,4.66464682875734,2005210
R_3fB1OysRF0w6Yt4Cd,3640595,new_entry,,,"","On June 4, 2020, the Swedish government announced major changes to the way coronavirus testing will be carried out, including free tests for anyone with symptoms and the resumption of contact tracing.",2020-06-04,2020-06-04,2020-06-26,The policy has a clear end date,Sweden,SWE,SE,National,0,,,,Health Testing,Health testing of entire population under the government's jurisdiction,,"",,,,,,"","","","","","","","","","","",,,,"",Yes,Sweden,"One or more countries, but not all countries",,,,,,,Other population not specifed above,,,Voluntary/Recommended but No Penalties,National Government,61.9230165356434,59.3460067968078,57.0538156886561,45,https://tummgmt.eu.qualtrics.com/Q/File.php?F=F_ypPzQkPA70ET3Vv,https://www.thelocal.se/20200604/sweden-announces-major-overhaul-of-coronavirus-testing-strategy/,2022-10-09,2022-10-09T18:00:40Z,42295,4562,0,,,,,,,,,4,9.25,2,0.41813737154007,0.309990167617798,0,85,10183175,589823541463.317,2.22523861239767,16.1362474065114,27.1030892468466,2,2,2.49917945942907,4.66464682875734,2005210
R_yJTvJzopLkiqXmNCd,5278853,new_entry,,,"","On June 15, 2020, Aftonbadlet newspaper reported that an outbreak of COVID-19 has been recorded in Gothenburgs southern archipelago. Mass testing and contact tracing are being implemented on affected islands. The outbreak is suspected to originate from a choir meeting at Vrango, held in the end of May",2020-06-15,2020-06-15,,The policy’s end date is unknown or unreported,Sweden,SWE,SE,Municipal,0,Vaestra Goetaland,,Gothenburg,Health Testing,Health testing of entire population under the government's jurisdiction,,"",,,,,,"","","","","","","","","","","",,,,"",Yes,Sweden,One or more cities within one or more countries,,Vaestra Goetaland,Gothenburg,,,,No special population targeted,,,Voluntary/Recommended but No Penalties,Municipal Government,59.9860878588341,57.6229014746698,55.2331878519734,47,https://tummgmt.eu.qualtrics.com/Q/File.php?F=F_10qmkEu0DfCrlc3,https://www.aftonbladet.se/nyheter/a/b5EeMk/stor-smittspridning-pa-vrango-efter-kortraff,2022-12-01,2022-12-01T19:17:02Z,52511,4891,0,,,,,,,,,4,9.25,2,0.41813737154007,0.309990167617798,0,85,10183175,589823541463.317,2.22523861239767,16.1362474065114,27.1030892468466,2,2,2.49917945942907,4.66464682875734,2005210
R_3QXKzJ2p6ynl8mDBk,7897358,new_entry,,,"","From June 15, 2020, the Stockholm Health Agency announced that its population can book a time slot for a PCR test or an antibody test using the app. On the first day, 30,000 people were scheduled to be tested, of which 5,000 were signed up for PCR tests.
",2020-06-15,2020-06-16,,The policy’s end date is unknown or unreported,Sweden,SWE,SE,Provincial,0,Stockholm,SE-AB,,Health Testing,Drive-in Testing Centers,,"",,,,,,"","","","","","","","","","","",,,,"",Yes,Sweden,One or more provinces within one or more countries,,Stockholm,,,,,Not specified,,,Voluntary/Recommended but No Penalties,Ministry/Department of Health,59.9047260491451,57.3438269413559,55.0405386873477,48,https://tummgmt.eu.qualtrics.com/Q/File.php?F=F_1jqu0GwV0ml7x3l,https://www.regionstockholm.se/verksamhet/halsa-och-vard/nyheter-halsa-och-vard/2020/06/enormt-intresse-for-provtagning--svart-att-na-bokning-under-gardagen/,2022-11-18,2022-11-18T04:54:59Z,53729,4939,0,,,,,,,,,4,9.25,2,0.41813737154007,0.309990167617798,0,85,10183175,589823541463.317,2.22523861239767,16.1362474065114,27.1030892468466,2,2,2.49917945942907,4.66464682875734,2005210
R_3Rz1YoFMlFCwbXENA,9451133,new_entry,,,"",The Swedish National Parliament has accepted a proposal from the Government to change the national budget in order to grant the regional governments an additional SEK 60 million to increase the testing capacity. The new budget was decided upon on June 17th and is valid from June 22nd until the end of the year.,2020-06-17,2020-06-22,2020-12-31,The policy has a clear end date,Sweden,SWE,SE,National,0,,,,Health Testing,,,"",,,,,,"","","","","","","","","","","",,,,"",Yes,Sweden,"One or more countries, but not all countries",,,,,,,No special population targeted,,,Mandatory (Unspecified/Implied),Provincial/State Government,59.1301284784469,56.9332465637793,54.528878032007,50,https://tummgmt.eu.qualtrics.com/Q/File.php?F=F_PAjQXwm3womt7Tb,https://data.riksdagen.se/fil/A5C1819D-F8FD-460B-9B10-0D7A96BE4D58 ; https://data.riksdagen.se/fil/F0CD5569-2B5A-48EA-A170-5544F7303659,2020-07-01,2020-07-01T06:15:18Z,59718,5053,0,,,,,,,,,4,9.25,2,0.41813737154007,0.309990167617798,0,85,10183175,589823541463.317,2.22523861239767,16.1362474065114,27.1030892468466,2,2,2.49917945942907,4.66464682875734,2005210
R_z0X8rwo0jKBX28hDz,3107644,new_entry,,,"","On Juli 1, 2020, Emergency information from Swedish authorities posted detailed information on tests, vaccination and treatment in Sweden.",2020-07-01,2020-07-01,,The policy’s end date is unknown or unreported,Sweden,SWE,SE,National,0,,,,Health Testing,Other Health Testing,,"",,,,,,"","","","","","","","","","","",,,,"",Yes,Sweden,"One or more countries, but not all countries",,,,,,,Symptomatic people,,,Voluntary/Recommended but No Penalties,"National Government,Ministry/Department of Health",59.3231810616988,56.7323514112203,54.3040991836974,55,https://tummgmt.eu.qualtrics.com/Q/File.php?F=F_2dtirZqGaGtONum,https://archive.vn/GwaIs,2022-11-18,2022-11-18T04:48:26Z,68608,5370,0,11789,35367,3.379,,,,,,4,9.25,2,0.41813737154007,0.309990167617798,0,85,10183175,589823541463.317,2.22523861239767,16.1362474065114,27.1030892468466,2,2,2.49917945942907,4.66464682875734,2005210
R_3lnLLZsm6d1782JGd,3086513,new_entry,,,"","On July 7, 2020, the Swedish Public Health Agency recommended that anyone with symptoms of COVID-19 get tested to see if they have a current COVID-19 infection. He also recommended testing in cases of contact tracing or screening.",2020-07-07,2020-07-07,2020-07-31,The policy has a clear end date,Sweden,SWE,SE,National,0,,,,Health Testing,Self-testing (e.g. at home),,"",,,,,,"","","","","","","","","","","",,,,"",Yes,Sweden,"One or more countries, but not all countries",,,,,,,"Symptomatic people,Confirmed contact to a person infected with COVID-19",,,Voluntary/Recommended but No Penalties,Ministry/Department of Health,59.1411090872989,56.750009670635,54.1442634197194,57,https://tummgmt.eu.qualtrics.com/Q/File.php?F=F_3nPjibCtU6qvGyx,https://archive.vn/nZsDb,2022-11-20,2022-11-20T06:10:24Z,71210,5447,0,11869,106261,10.152,,,,,,4,9.25,2,0.41813737154007,0.309990167617798,0,85,10183175,589823541463.317,2.22523861239767,16.1362474065114,27.1030892468466,2,2,2.49917945942907,4.66464682875734,2005210
R_1mW9WlU9G94oTzuNA,155453,new_entry,,,"","The Swedish Public Health Agency are sampling 4000 for testing in order to assess the spread of coronavirus in Sweden. The sampling is conducted between July 29th and July 31st. This was anounced on July 29th, 2020.",2020-07-29,2020-07-29,2020-07-31,The policy has a clear end date,Sweden,SWE,SE,National,0,,,,Health Testing,,,"",,,,,,"","","","","","","","","","","",,,,"",Yes,Sweden,"One or more countries, but not all countries",,,,,,,No special population targeted,,,Voluntary/Recommended but No Penalties,Ministry/Department of Health,58.9456824025079,56.7479907881813,54.0198885381784,63,https://tummgmt.eu.qualtrics.com/Q/File.php?F=F_SDXMPaE6jAyROwN,https://www.folkhalsomyndigheten.se/nyheter-och-press/nyhetsarkiv/2020/juli/ny-undersokning-for-att-mata-forekomsten-av-covid-19-i-sverige/,2020-08-03,2020-08-03T09:25:32Z,76516,5730,0,7576,317071,30.292,,,,,,4,9.25,2,0.41813737154007,0.309990167617798,0,85,10183175,589823541463.317,2.22523861239767,16.1362474065114,27.1030892468466,2,2,2.49917945942907,4.66464682875734,2005210
R_cXYxFdxGXRNsLGVNA,2779186,new_entry,,,"","The Swedish Public Health Agency has initiated a sampling of individuals for testing of coronavirus in order to assess the spread in Swedish society. 4000 individuals will be sampled from a panel of participants. This will take place from August 28th until the beginning of October, and was anounced on August 28th, 2020.",2020-08-28,2020-08-28,2020-10-01,The policy has a clear end date,Sweden,SWE,SE,National,0,,,,Health Testing,,,"",,,,,,"","","","","","","","","","","",,,,"",Yes,Sweden,"One or more countries, but not all countries",,,,,,,No special population targeted,,,Voluntary/Recommended but No Penalties,Ministry/Department of Health,59.01442632599,56.7774907893156,54.3010177877388,68,https://tummgmt.eu.qualtrics.com/Q/File.php?F=F_oYRfGVt5BPvvvnb,https://www.folkhalsomyndigheten.se/nyheter-och-press/nyhetsarkiv/2020/augusti/ytterligare-en-undersokning-for-att-mata-forekomsten-av-covid-19-i-sverige/,2020-09-01,2020-09-01T10:36:32Z,83958,5821,0,12203,584195,55.813,,,,,,4,9.25,2,0.41813737154007,0.309990167617798,0,85,10183175,589823541463.317,2.22523861239767,16.1362474065114,27.1030892468466,2,2,2.49917945942907,4.66464682875734,2005210
R_2bJnzRH1vFO1DMiGd,7141753,new_entry,,,"","On October 1, 2020, the Swedish Public Health Agency announced that people should be tested if their symptoms do not improve within 24 hours or if their symptoms have no other explanation, e.g. allergies or migraines. The region always decides who to test based on regional conditions.",2020-10-01,2020-10-01,,The policy’s end date is unknown or unreported,Sweden,SWE,SE,National,0,,,,Health Testing,Self-testing (e.g. at home),,"",,,,,,"","","","","","","","","","","",,,,"",Yes,Sweden,"One or more countries, but not all countries",,,,,,,Symptomatic people,,,Voluntary/Recommended but No Penalties,Ministry/Department of Health,58.9634857696308,56.6535368688617,54.3267007333947,73,https://tummgmt.eu.qualtrics.com/Q/File.php?F=F_D6TSnNrm65AWekx,https://web.archive.org/web/20201003121245/https://www.folkhalsomyndigheten.se/the-public-health-agency-of-sweden/communicable-disease-control/covid-19/,2022-11-20,2022-11-20T06:33:31Z,93615,5893,0,18580,1219205,116.48,,,,,,4,9.25,2,0.41813737154007,0.309990167617798,0,85,10183175,589823541463.317,2.22523861239767,16.1362474065114,27.1030892468466,2,2,2.49917945942907,4.66464682875734,2005210
