R_2aWxtCIxkXIjwQKNA,4130703,new_entry,,,"","The Ministry of Health and Sports imposed a lockdown in the Sittwe township of Rakhine, stating that locals will need to remain in their residences (excluding those working in government departments, organisations, companies, factories and workshops). Other instructions include: only one person from a household allowed to shop for essentials if necessary; two persons from a household allowed to go to a clinic if necessary.",2020-08-20,2020-08-20,,The policy’s end date is unknown or unreported,Myanmar,MMR,MM,National,1,,,,Lockdown,,,"",,,,,,"","","","","","","","","","","",,,,"",Yes,Myanmar,"One or more countries, but not all countries",,,,,,All Residents (Citizen Residents + Foreign Residents),No special population targeted,,,Mandatory with Legal Penalties (Jail Time),Ministry/Department of Health,https://tummgmt.eu.qualtrics.com/Q/File.php?F=F_0xCzUxBEfRN6Ur7,https://www.mmtimes.com/news/fresh-outbreak-covid-19-leads-stay-home-order-sittwe-rakhine.html,CoronaNet (original),,2022-10-10,2022-10-10T23:59:59Z,399,6,333,1530,141044,2.622,,,,,,139,44.7,0,-0.345599442720413,0.669777810573578,19,30,53382581,79495831532.5896,6.75862882426273,17.7929950522142,25.0989704236797,0,0,-1.87784326663643,0.371828637683638,73309
R_3EWNp2A8RKvL3H7NA,3883960,new_entry,,,"","As of 8:00 AM on September 21, the Burmese government enforced ""stay-at-home orders for all of Yangon Region (except for Coco Island). Residents can only leave home for work or essential and emergency purposes. Only one person per household may go grocery shopping, and only two people per household are allowed for medical treatment.""",2020-09-21,2020-09-21,,The policy’s end date is unknown or unreported,Myanmar,MMR,MM,National,1,,,,Lockdown,,,"",,,,,,"","","","","","","","","","","",,,,"",No,Myanmar,One or more geographical or administrative units (other than provincial or city level units) within one or more countries,,Rangoon,,,,All Residents (Citizen Residents + Foreign Residents),No special population targeted,,,Mandatory with Legal Penalties (Jail Time),National Government,https://tummgmt.eu.qualtrics.com/Q/File.php?F=F_ZIw5kfwVobX2feh,https://mm.usembassy.gov/covid-19-information/ ; https://www.worldaware.com/covid-19-alert-myanmar-enacts-stay-home-rules-lockdown-measures-across-yangon-region ; https://www.aljazeera.com/news/2020/9/21/myanmar-locks-down-yangon-region-after-record-jump-in-covid-cases,CoronaNet (original),,2022-10-10,2022-10-10T23:59:59Z,6471,100,1445,4196,224383,4.171,,,,,,139,44.7,0,-0.345599442720413,0.669777810573578,19,30,53382581,79495831532.5896,6.75862882426273,17.7929950522142,25.0989704236797,0,0,-1.87784326663643,0.371828637683638,73309
R_1rJ871EDIk2Q6yBNA,1383331,new_entry,,,"","Mandalay imposes semi-lockdown for seven townships with the highest number of COVID-19 cases and persons under investigation in Mandalay, from December 5 to 18. The Mandalay Region government has issued a statement on December 2 evening to Mandalay citizens to adhere to the measures from December 5 to December 18. The regional government issued a total of 17 rules. The rules instruct people not to gather and not to go outside unnecessarily. Meanwhile, permit cards are also issued for traveling from one township to another.",2020-12-02,2020-12-05,2020-12-18,The policy has a clear end date,Myanmar,MMR,MM,Provincial,1,Mandalay,,,Lockdown,,,"",,,,,,"","","","","","","","","","","",,,,"",Yes,Myanmar,One or more provinces within one or more countries,,Mandalay,,,,All Residents (Citizen Residents + Foreign Residents),No special population targeted,,,Mandatory with Fines,Provincial/State Government,https://tummgmt.eu.qualtrics.com/Q/File.php?F=F_10IPWv8Ubu9dEj2,https://elevenmyanmar.com/news/mandalay-imposes-semi-lockdown-for-seven-townships-from-december-5-to-18 ; https://www.mmtimes.com/news/mandalay-district-faces-rising-covid-19-cases-despite-stay-home-order.html,CoronaNet (original),,2020-12-26,2020-12-26T08:15:54Z,98047,2081,76382,21390,1246524,23.17,,,,,,139,44.7,0,-0.345599442720413,0.669777810573578,19,30,53382581,79495831532.5896,6.75862882426273,17.7929950522142,25.0989704236797,0,0,-1.87784326663643,0.371828637683638,73309
R_22tvm1oq0ocnC3YNA,5912568,new_entry,,,"","On December 27, the Myanmar government lifted stay-at-home orders in parts of three Yangon townships: Seikgyikanaungto, Twante and Kungyangon. Every other township in mainland Yangon Region remained under stay-at-home orders. The rest of the Yangon Region has been on stay-at-home order since 21 September 2020.",2020-12-27,2020-12-27,,The policy’s end date is unknown or unreported,Myanmar,MMR,MM,National,1,,,,Lockdown,,,"",,,,,,"","","","","","","","","","","",,,,"",No,Myanmar,One or more provinces within one or more countries,,Rangoon,,,,All (Travelers + Residents),No special population targeted,,,Mandatory with Legal Penalties (Jail Time),National Government,https://tummgmt.eu.qualtrics.com/Q/File.php?F=F_2CrZkvPZyhVr88M,https://www.frontiermyanmar.net/en/new-normal-government-confuses-with-yangon-stay-at-home-statement/,CoronaNet (original),,2021-04-09,2021-04-09T15:52:32Z,121886,2601,103223,16607,1756644,32.653,,,,,,139,44.7,0,-0.345599442720413,0.669777810573578,19,30,53382581,79495831532.5896,6.75862882426273,17.7929950522142,25.0989704236797,0,0,-1.87784326663643,0.371828637683638,73309
R_1gcPNA70hYY0dj2NA,3883960,update,End of Policy,,"","As of 8:00 AM on September 21, the Burmese government enforced ""stay-at-home orders for all of Yangon Region (except for Coco Island). Residents can only leave home for work or essential and emergency purposes. Only one person per household may go grocery shopping, and only two people per household are allowed for medical treatment."" UPDATE: UPDATE: On December 27, the Myanmar government lifted stay-at-home orders in parts of three Yangon townships: Seikgyikanaungto, Twante and Kungyangon. Every other township in mainland Yangon Region remained under stay-at-home orders. The lockdown for the rest of the Yangon region will be coded as a separate policy",2020-12-27,2020-12-27,,The policy’s end date is unknown or unreported,Myanmar,MMR,MM,National,1,,,,Lockdown,,,"",,,,,,"","","","","","","","","","","",,,,"",No,Myanmar,One or more geographical or administrative units (other than provincial or city level units) within one or more countries,,Rangoon,,,,All Residents (Citizen Residents + Foreign Residents),No special population targeted,,,Mandatory with Legal Penalties (Jail Time),National Government,https://tummgmt.eu.qualtrics.com/Q/File.php?F=F_ZIw5kfwVobX2feh ; https://tummgmt.eu.qualtrics.com/Q/File.php?F=F_ZyjiwR1A3GHrQyd,https://mm.usembassy.gov/covid-19-information/ ; https://www.worldaware.com/covid-19-alert-myanmar-enacts-stay-home-rules-lockdown-measures-across-yangon-region ; https://www.aljazeera.com/news/2020/9/21/myanmar-locks-down-yangon-region-after-record-jump-in-covid-cases,CoronaNet (original),,2021-11-16,2021-11-16T06:58:04Z,121886,2601,103223,16607,1756644,32.653,,,,,,139,44.7,0,-0.345599442720413,0.669777810573578,19,30,53382581,79495831532.5896,6.75862882426273,17.7929950522142,25.0989704236797,0,0,-1.87784326663643,0.371828637683638,73309
R_3lWUHnRAJ5E8sZONA,7609674,new_entry,,,"","It was announced on the 14 Jan 2021 that the entire Saint Joseph Camp (P.L.N Village) has been placed under lockdown after an individual from the internally displaced persons (IDP) camp tested positive for COVID-19, said U Than Win, township administrator of the General Administration Department in Myitkyina.",2021-01-14,2021-01-14,,The policy’s end date is unknown or unreported,Myanmar,MMR,MM,Municipal,1,Kachin,,Myitkyina,Lockdown,,,"",,,,,,"","","","","","","","","","","",,,,"",No,Myanmar,One or more cities within one or more countries,,Kachin,Myitkyina (Kachin),,,Other,Other population not specifed above,,,Mandatory (Unspecified/Implied),"Provincial/State Government,Municipal Government",https://tummgmt.eu.qualtrics.com/Q/File.php?F=F_1gkE3D1tseFuqkz,https://www.mmtimes.com/news/saint-joseph-camp-placed-under-lockdown.html,CoronaNet (original),,2021-03-04,2021-03-04T07:59:48Z,132865,2912,116100,18820,2074577,38.562,,,,,,139,44.7,0,-0.345599442720413,0.669777810573578,19,30,53382581,79495831532.5896,6.75862882426273,17.7929950522142,25.0989704236797,0,0,-1.87784326663643,0.371828637683638,73309
R_31pdEbAsCqfOzXbNA,4346727,new_entry,,,"","Myanmar forms a new central committee ""Committee to Prevent, Control ad Treat the 2019 Novel Coronavirus"" to enable quick reaction and to coordinate response of ministries and departments, announced on January 31.",2020-01-31,2020-01-31,2020-02-02,The policy is a one-time measure (e.g. publication of guidelines),Myanmar,MMR,MM,National,1,,,,"New Task Force, Bureau or Administrative Configuration",,,"",,,,,,"","","","","","","","","","","",,,,"",Yes,Myanmar,"One or more countries, but not all countries",,,,,,All Residents (Citizen Residents + Foreign Residents),,,,Mandatory (Unspecified/Implied),"National Government,Provincial/State Government,Other (Please specify in the text box)",https://tummgmt.eu.qualtrics.com/Q/File.php?F=F_R4iq9gDAj93dpHX,https://www.irrawaddy.com/news/burma/myanmar-forms-central-committee-coordinate-coronavirus-response.html,CoronaNet (original),,2022-10-10,2022-10-10T23:59:59Z,0,0,0,,,,,,,,,139,44.7,0,-0.345599442720413,0.669777810573578,19,30,53382581,79495831532.5896,6.75862882426273,17.7929950522142,25.0989704236797,0,0,-1.87784326663643,0.371828637683638,73309
R_WCE1TXPIOzDLOvfDe,9512533,new_entry,,,"","Establishment of Central Committee on Prevention, Control and Treatment of COVID-19 led by the State Counsellor",2020-03-13,2020-03-13,2020-03-15,The policy is a one-time measure (e.g. publication of guidelines),Myanmar,MMR,MM,National,1,,,,"New Task Force, Bureau or Administrative Configuration",New Task Force or Bureau (i.e. establishment of a temporary body),,"",,,,,,"","","","","","","","","","","",,,,"",Yes,Myanmar,"One or more countries, but not all countries",,,,,,All Residents (Citizen Residents + Foreign Residents),No special population targeted,,,Mandatory (Unspecified/Implied),Other (Please specify in the text box),https://tummgmt.eu.qualtrics.com/Q/File.php?F=F_30tPuaKgDt5UhcW,https://reliefweb.int/sites/reliefweb.int/files/resources/OCHA%20Myanmar%20-%20%20COVID-19%20Situation%20report%201.pdf,CoronaNet (original),,2021-08-15,2021-08-15T13:59:24Z,0,0,0,,,,,,,,,139,44.7,0,-0.345599442720413,0.669777810573578,19,30,53382581,79495831532.5896,6.75862882426273,17.7929950522142,25.0989704236797,0,0,-1.87784326663643,0.371828637683638,73309
R_2VDBu14hsbwBthgNA,4346727,update,,,"","Myanmar's president form a new inter-ministerial anti-COVID-19 committee, taking over all the functions of the previously established one, to coordinate response against COVID-19, announced on March 31. UPDATE: The previously established committee from January 31 has been replaced on March 31 by an inter-ministerial committee which will also coordinate response to COVID-19. The functions of this committee have also been expanded, while it previously focused on coordinating the monitoring and control of spread, issuing safety measures, information for the public; it now is responsible for quaranting people, empowering and implementing communiyt lockdowns, helping provide food, health care, etc. as well as ensuring that essential services are continuing to operate safely.",2020-03-31,2020-03-31,2020-04-02,The policy is a one-time measure (e.g. publication of guidelines),Myanmar,MMR,MM,National,1,,,,"New Task Force, Bureau or Administrative Configuration",,,"",,,,,,"","","","","","","","","","","",,,,"",Yes,Myanmar,"One or more countries, but not all countries",,,,,,All Residents (Citizen Residents + Foreign Residents),,,,Mandatory (Unspecified/Implied),"National Government,Other (Please specify in the text box)",https://tummgmt.eu.qualtrics.com/Q/File.php?F=F_3EEFmioU1rz4Ref,https://www.mmtimes.com/news/myanmar-leader-forms-new-anti-covid-19-committee.html,CoronaNet (original),,2022-10-10,2022-10-10T23:59:59Z,15,1,0,,,,,,,,,139,44.7,0,-0.345599442720413,0.669777810573578,19,30,53382581,79495831532.5896,6.75862882426273,17.7929950522142,25.0989704236797,0,0,-1.87784326663643,0.371828637683638,73309
R_22XrKrTLUhD1jqWNA,5805989,new_entry,,,"","The Myanmar government arranges evacuation flights for 63 students stranded in Wuhan, China; announced on January 30.",2020-01-30,2020-01-30,2020-02-01,The policy is a one-time measure (e.g. publication of guidelines),Myanmar,MMR,MM,National,0,,,,Other Policy Not Listed Above,,,"",,,,,,"","","","","","","","","","","",Evacuation flights for stranded students,,,"",No,China,One or more cities within one or more countries,,,Wuhan,,,Other,,Inbound,Flights,Voluntary/Recommended but No Penalties,"National Government,Other (Please specify in the text box)",https://tummgmt.eu.qualtrics.com/Q/File.php?F=F_3R4JdgZ1mpwBvGW,https://www.mmtimes.com/news/myanmar-evacuate-63-students-wuhan.html,CoronaNet (original),,2022-10-10,2022-10-10T23:59:59Z,0,0,0,,,,,,,,,139,44.7,0,-0.345599442720413,0.669777810573578,19,30,53382581,79495831532.5896,6.75862882426273,17.7929950522142,25.0989704236797,0,0,-1.87784326663643,0.371828637683638,73309
R_zVyLBnTpp1RA825NA,2796253,new_entry,,,"",Myanmar eases visa rules for in-country foreign employees starting March 24.,2020-03-24,2020-03-24,,The policy’s end date is unknown or unreported,Myanmar,MMR,MM,National,0,,,,Other Policy Not Listed Above,,,"",,,,,,"","","","","","","","","","","","For foreigners already based in the country (expat community), the government will make it easier to extend their visa/apply for new visa and stay permits (in order to reduce risk of having to be quarantined after travelling abroad to apply for a new visa).  Foreigenrs can now apply for new visa and stay permits until up to 5 days of expiry of their existing visas (previously, such applications had to be submitted 21 days before expiry of the current visa).",,,"",,,,,,,,,,,,,Mandatory (Unspecified/Implied),"National Government,Other (Please specify in the text box)",https://tummgmt.eu.qualtrics.com/Q/File.php?F=F_3qQnWc1kLog9fqu,https://www.mmtimes.com/news/myanmar-eases-visa-rules-country-foreign-employees.html,CoronaNet (original),,2022-10-10,2022-10-10T23:59:59Z,0,0,0,,,,,,,,,139,44.7,0,-0.345599442720413,0.669777810573578,19,30,53382581,79495831532.5896,6.75862882426273,17.7929950522142,25.0989704236797,0,0,-1.87784326663643,0.371828637683638,73309
R_2E3Rqk1Rq5wMHIsNA,53211,new_entry,,,"","Yangon (Myanmar) instructs bus line operators to keep windows open during operation, announced on March 24.",2020-03-24,2020-03-24,,The policy’s end date is unknown or unreported,Myanmar,MMR,MM,Provincial,0,Rangoon,,,Other Policy Not Listed Above,,,"",,,,,,"","","","","","","","","","","",All bus line operators are instructed to run their buses with windows open.,,,"",,,,,,,,,,,,,Mandatory (Unspecified/Implied),"Provincial/State Government,Other (Please specify in the text box)",https://tummgmt.eu.qualtrics.com/Q/File.php?F=F_3DwJ4PqzENGaa8k,https://www.mmtimes.com/news/buses-yangon-open-windows.html,CoronaNet (original),,2022-10-10,2022-10-10T23:59:59Z,0,0,0,,,,,,,,,139,44.7,0,-0.345599442720413,0.669777810573578,19,30,53382581,79495831532.5896,6.75862882426273,17.7929950522142,25.0989704236797,0,0,-1.87784326663643,0.371828637683638,73309
R_2Xmrw8yrohooV75NA,593419,new_entry,,,"","Myanmar appeals for foreign help and asks for medical equipment and supplies, in a statement to foreign embassies, on April 3.",2020-04-03,2020-04-03,2023-08-01,The policy has an unlimited time span (e.g. recommendation to wash one's hands; passing of a legal bill),Myanmar,MMR,MM,National,0,,,,Other Policy Not Listed Above,,,"",,,,,,"","","","","","","","","","","",Appealing for foreign help to receive medical supplies (especially test kits) in the fight against COVID-19,,,"",,,,,,,,,,,,,Voluntary/Recommended but No Penalties,"National Government,Other (Please specify in the text box)",https://tummgmt.eu.qualtrics.com/Q/File.php?F=F_3G1W7m40TZg1W7G,https://www.mmtimes.com/news/myanmar-appeals-foreign-help-covid-19-fight.html,CoronaNet (original),,2022-10-10,2022-10-10T23:59:59Z,20,1,0,,,,,,,,,139,44.7,0,-0.345599442720413,0.669777810573578,19,30,53382581,79495831532.5896,6.75862882426273,17.7929950522142,25.0989704236797,0,0,-1.87784326663643,0.371828637683638,73309
R_3eaGxI3AB28u37HNA,8497915,new_entry,,,"","The COVID-19 Prevent, Control, Treatment Committee (Myanmar) announces on April 3 that the government will provide basic food for those struggling across the country during the 10-day New Year holiday.",2020-04-03,2020-04-03,2020-04-18,The policy has an imprecise natural end date (e.g. masks will be distributed until they run out),Myanmar,MMR,MM,National,0,,,,Other Policy Not Listed Above,,,"",,,,,,"","","","","","","","","","","",providing basic foods for those who lack a regular income during the holiday,,,"",No,Myanmar,"One or more countries, but not all countries",,,,,,Other,,,Not Applicable,Voluntary/Recommended but No Penalties,"National Government,Other (Please specify in the text box)",https://tummgmt.eu.qualtrics.com/Q/File.php?F=F_ePcAvPFGcvBsmiJ,https://www.irrawaddy.com/specials/myanmar-covid-19/myanmar-govt-provide-free-basic-food-poor-covid-19-shutdown.html,CoronaNet (original),,2022-10-10,2022-10-10T23:59:59Z,20,1,0,,,,,,,,,139,44.7,0,-0.345599442720413,0.669777810573578,19,30,53382581,79495831532.5896,6.75862882426273,17.7929950522142,25.0989704236797,0,0,-1.87784326663643,0.371828637683638,73309
R_2aWXS5cirRsAZliNA,9142513,new_entry,,,"","Myanmar's state counsellor warns people that food hoarding and quarantine evading will be persecuted, reported on April 3.",2020-04-03,2020-04-03,2020-04-05,The policy is a one-time measure (e.g. publication of guidelines),Myanmar,MMR,MM,National,0,,,,Other Policy Not Listed Above,,,"",,,,,,"","","","","","","","","","","",Warning that certain actions will be penalized,,,"",,,,,,,,,,,,,"Mandatory with Legal Penalties (Jail Time),Mandatory with Fines,Mandatory (Unspecified/Implied)","National Government,Ministry/Department of Health",https://tummgmt.eu.qualtrics.com/Q/File.php?F=F_Tua5yS8P7zXudUd,https://www.mmtimes.com/news/myanmar-state-counsellor-warns-hoarders-quarantine-evaders.html,CoronaNet (original),,2022-10-10,2022-10-10T23:59:59Z,20,1,0,,,,,,,,,139,44.7,0,-0.345599442720413,0.669777810573578,19,30,53382581,79495831532.5896,6.75862882426273,17.7929950522142,25.0989704236797,0,0,-1.87784326663643,0.371828637683638,73309
R_2zIJT7Zzqs2lPYRNA,2822947,new_entry,,,"","The Shan state government (Myanmar) states that if residents have to go outside, they must wear a mask to prevent the spread of COVID-19; reported in the Irrawaddy on April 6.",2020-04-06,2020-04-06,,The policy’s end date is unknown or unreported,Myanmar,MMR,MM,Provincial,0,Shan,,,Other Policy Not Listed Above,,,"",,,,,,"","","","","","","","","","","",Residents must wear a mask when going outside,,,"",No,Myanmar,One or more geographical or administrative units (other than provincial or city level units) within one or more countries,,,,,Shan State,All Residents (Citizen Residents + Foreign Residents),,,Not Applicable,Mandatory (Unspecified/Implied),Provincial/State Government,https://tummgmt.eu.qualtrics.com/Q/File.php?F=F_1lbiafVka7DbHa4,https://www.irrawaddy.com/specials/myanmar-covid-19/myanmars-states-issue-heavy-restrictions-movement-ahead-thingyan-curb-covid-19.html,CoronaNet (original),,2022-10-10,2022-10-10T23:59:59Z,22,1,0,,,,,,,,,139,44.7,0,-0.345599442720413,0.669777810573578,19,30,53382581,79495831532.5896,6.75862882426273,17.7929950522142,25.0989704236797,0,0,-1.87784326663643,0.371828637683638,73309
R_1QyEVSudcLA2MaGNA,2538425,new_entry,,,"","The Sagaing region government (Myanmar) states that residents must wear masks if they go outside, from April 7 until April 21; reported in the Irrawaddy on April 6.",2020-04-06,2020-04-07,2020-04-21,The policy has a clear end date,Myanmar,MMR,MM,Provincial,0,Sagain,,,Other Policy Not Listed Above,,,"",,,,,,"","","","","","","","","","","",Residents must wear masks in public,,,"",No,Myanmar,One or more geographical or administrative units (other than provincial or city level units) within one or more countries,,,,,Sagaing Region,All Residents (Citizen Residents +Foreign Residents),,,Not Applicable,Mandatory (Unspecified/Implied),Provincial/State Government,https://tummgmt.eu.qualtrics.com/Q/File.php?F=F_1HdgnTKWEfbedz0,https://www.irrawaddy.com/specials/myanmar-covid-19/myanmars-states-issue-heavy-restrictions-movement-ahead-thingyan-curb-covid-19.html,CoronaNet (original),,2020-04-16,2020-04-16T22:28:45Z,22,1,0,,1340,0.025,,,,,,139,44.7,0,-0.345599442720413,0.669777810573578,19,30,53382581,79495831532.5896,6.75862882426273,17.7929950522142,25.0989704236797,0,0,-1.87784326663643,0.371828637683638,73309
R_2UfLcat7qNiAI5uNA,4082884,new_entry,,,"","The Ministry of Social Welfare, Relief and Resettlement starts a free counseling service for people in every region and state under quarantine on April 8, available every day from 9.30 AM to 4.30 PM; which it plans to extend; announced on April 25.",2020-04-08,2020-04-08,2023-08-01,The policy has an unlimited time span (e.g. recommendation to wash one's hands; passing of a legal bill),Myanmar,MMR,MM,National,0,,,,Other Policy Not Listed Above,,,"",,,,,,"","","","","","","","","","","",Free counseling service/program for people under quarantine,,,"",No,Myanmar,"One or more countries, but not all countries",,,,,,Other,,,Not Applicable,Mandatory (Unspecified/Implied),"National Government,Other (Please specify in the text box)",https://tummgmt.eu.qualtrics.com/Q/File.php?F=F_eM5ANeFwo0lJcul,https://www.mmtimes.com/news/quarantined-people-sagaing-nay-pyi-taw-yangon-seek-counselling.html,CoronaNet (original),,2022-10-10,2022-10-10T23:59:59Z,22,3,0,,,,,,,,,139,44.7,0,-0.345599442720413,0.669777810573578,19,30,53382581,79495831532.5896,6.75862882426273,17.7929950522142,25.0989704236797,0,0,-1.87784326663643,0.371828637683638,73309
R_3oC3DBvgLUlKTWXNA,8042890,new_entry,,,"","The Ministry of Health (Myanmar) issues an order for seven townships in Yangon that have a stay-at-home-order in place, stating that all are required to wear masks upon leaving their homes, effective starting April 18.",2020-04-18,2020-04-18,,The policy’s end date is unknown or unreported,Myanmar,MMR,MM,National,0,,,,Other Policy Not Listed Above,,,"",,,,,,"","","","","","","","","","","",People are required to wear a mask when leaving their home,,,"",No,Myanmar,One or more cities within one or more countries,,,South Okkalapa; Pabedan; Bahan; Mayangone; Insein; Shwe Pyi Thar; Hlaing Tharyar,,,All (Travelers + Residents),,,Not Applicable,"Mandatory with Legal Penalties (Jail Time),Mandatory with Fines","Ministry/Department of Health,Municipal Government",https://tummgmt.eu.qualtrics.com/Q/File.php?F=F_2CIdslmD38MBjMi,https://www.mmtimes.com/news/yangon-impose-lockdown-measures-seven-townships.html,CoronaNet (original),,2022-10-10,2022-10-10T23:59:59Z,98,5,5,,3880,0.072,,,,,,139,44.7,0,-0.345599442720413,0.669777810573578,19,30,53382581,79495831532.5896,6.75862882426273,17.7929950522142,25.0989704236797,0,0,-1.87784326663643,0.371828637683638,73309
R_3Du1hrpf7ny2yitNA,8061245,new_entry,,,"","The Health Ministry in Myanmar urges those who have been in ""close contact with positive patients""(face-to-face-contact within one metre for more than 15 mins, physical contact, contact with infectious secretions, having been in a closed environment for more than 15 minutes, having been in an aircraft and sitting within 2 seats of a case, crew members serving in a section of the aircraft where a case was seated, healthcare worker providing care to a COVID-case, laboratory workers handling patient specimens) to inform the nearest health departments; this was announced on April 19.",2020-04-19,2020-04-19,,The policy’s end date is unknown or unreported,Myanmar,MMR,MM,National,0,,,,Other Policy Not Listed Above,,,"",,,,,,"","","","","","","","","","","",Those who have been in close contact with positive patients are urged to inform the nearest health departments,,,"",No,Myanmar,"One or more countries, but not all countries",,,,,,Other,,,Not Applicable,Voluntary/Recommended but No Penalties,Ministry/Department of Health,https://tummgmt.eu.qualtrics.com/Q/File.php?F=F_1QbgOZUv3te4lBy,https://www.mmtimes.com/news/myanmar-reports-another-surge-covid-19-cases-107.html,CoronaNet (original),,2022-10-10,2022-10-10T23:59:59Z,111,5,7,267,4147,0.077,,,,,,139,44.7,0,-0.345599442720413,0.669777810573578,19,30,53382581,79495831532.5896,6.75862882426273,17.7929950522142,25.0989704236797,0,0,-1.87784326663643,0.371828637683638,73309
