record_id,policy_id,entry_type,update_type,update_level,update_level_var,description,date_announced,date_start,date_end,date_end_spec,country,ISO_A3,ISO_A2,init_country_level,domestic_policy,province,ISO_L2,city,type,type_sub_cat,type_new_admin_coop,type_vac_cat,type_vac_mix,type_vac_reg,type_vac_purchase,type_vac_group,type_vac_group_rank,type_vac_who_pays,type_vac_dist_admin,type_vac_loc,type_vac_cost_num,type_vac_cost_scale,type_vac_cost_unit,type_vac_cost_gov_perc,type_vac_amt_num,type_vac_amt_scale,type_vac_amt_unit,type_vac_amt_gov_perc,type_text,institution_cat,institution_status,institution_conditions,target_init_same,target_country,target_geog_level,target_region,target_province,target_city,target_intl_org,target_other,target_who_what,target_who_gen,target_direction,travel_mechanism,compliance,enforcer,pdf_link,link,collab,collab_id,date_updated,recorded_date
R_6A3HM3GiEtQE4RXAh,7498689,new_entry,,,"","On December 15, 2020, the head of the government of Cabo Verde announced that vaccination within the country will begin during the first quarter of 2021.",2020-12-15,2021-01-01,2021-03-31,The policy has a clear end date,Cape Verde,CPV,CV,National,0,,,,COVID-19 Vaccines,Administering of the vaccine (i.e. giving people the vaccine shot),,Unspecified Vaccines,This distribution policy is not about mixing and matching of different vaccines.,,,Mass vaccinations (e.g. first-come first serve),,Vaccine is free for the individual,National government entity,All medical institutions allowed to administer vaccines,"","","","","","","",100,,,,"",Yes,Cabo Verde,"One or more countries, but not all countries",,,,,,,No special population targeted,,,Voluntary/Recommended but No Penalties,National Government,https://tummgmt.eu.qualtrics.com/Q/File.php?F=F_2tnxggG2TtATxtG,https://web.archive.org/web/20210105002753/https://www.noticiasaominuto.com/mundo/1647208/cabo-verde-inicia-vacinacao-no-primeiro-trimestre-diz-primeiro-ministro,OxCGRT,OXCGRT_Cape Verde_20201215_vax,2022-04-22,2022-04-22T03:15:38Z
R_XvOMbL8oVK8tqBbFc,8984412,new_entry,,,"","On February 11, 2021, the Board of the World Bank announced that Cabo Verde will be the first African country to receive a funding of five million US dollars for 400000 vaccines.",2021-02-11,2021-02-11,,The policy has an imprecise natural end date (e.g. masks will be distributed until they run out),Cape Verde,CPV,CV,National,0,,,,COVID-19 Vaccines,Purchase of COVID-19 vaccines,,Unspecified Vaccines,,,Regular order of vaccines,,,"","","",5,millions,usd,0,400,thousands,doses,0,,,,"",Yes,Cabo Verde,"One or more countries, but not all countries",,,,,,,No special population targeted,,,Voluntary/Recommended but No Penalties,National Government,https://tummgmt.eu.qualtrics.com/Q/File.php?F=F_1OweKIwZrfJs5Vq,https://web.archive.org/web/20210215195400/https://covid19.cv/cabo-verde-e-o-primeiro-pais-em-africa-financiado-pelo-banco-mundial-para-aquisicao-de-vacinas-da-covid-19/,OxCGRT,OXCGRT_Cape Verde_20210211_vax,2022-04-22,2022-04-22T03:25:14Z
R_1oF2d466ueOqDYsDf,1001549,new_entry,,,"","As announced by the Prime Minister of Cabo Verde on May 15, 2020, the obligation of home collection will be exercised, and people are allowed to go to work or purchase essential goods and services until 9:30 pm.",2020-05-15,2020-05-15,,The policy’s end date is unknown or unreported,Cape Verde,CPV,CV,Provincial,1,Praia,,,Curfew,No the curfew times are always the same regardless of the day of the week,,"",,,,,,"","","","","","","","","","","",,,,"",Yes,Cabo Verde,One or more provinces within one or more countries,,Praia,,,,All Residents (Citizen Residents + Foreign Residents),No special population targeted,,,Mandatory (Unspecified/Implied),National Government,https://tummgmt.eu.qualtrics.com/Q/File.php?F=F_1i3y5Xk2mipYwps,https://www.governo.cv/primeiro-ministro-diz-que-se-justifica-o-prolongamento-do-estado-de-emergencia-em-santiago/,ACAPS,ACAPS_10944,2023-07-24,2023-07-24T15:26:26Z
R_4UtH2Ag5xRIoeFHNA,7898159,new_entry,,,"","Effective March 28, 2020 the Government of Cabo Verde has declared a “State of Emergency” that will remain in place through April 17. The state of emergency will allow the government to enforce social-isolation and social-distancing measures more strictly and oblige non-essential businesses to close.",2020-03-28,2020-03-28,2020-04-17,The policy has a clear end date,Cape Verde,CPV,CV,National,1,,,,Declaration of Emergency,,,"",,,,,,"","","","","","","","","","","",,,,"",,Cabo Verde,,,,,,,All Residents (Citizen Residents + Foreign Residents),,,,Mandatory (Unspecified/Implied),National Government,https://tummgmt.eu.qualtrics.com/Q/File.php?F=F_2TN2KUsfx0X6cv3,https://cv.usembassy.gov/covid-19-information/,CoronaNet (original),,2020-04-04,2020-04-04T11:43:36Z
R_3PiZtlxCuNI7qO5NA,8761244,new_entry,,,"","Republic of Cabo Verde - República de Cabo Verde
- Cabo Verde is and island country

-March 28, 2020: The Government of Cabo Verde has declared a ""State of Emergency"" that will remain in place through April 17. The state of emergency will allow the government to enforce social - isolation and social - distancing measures more strictly and oblige non-essential businesses to close. 
",2020-03-28,2020-03-28,2020-04-17,The policy has a clear end date,Cape Verde,CPV,CV,National,1,,,,Declaration of Emergency,,,"",,,,,,"","","","","","","","","","","",,,,"",Yes,Cabo Verde,"One or more countries, but not all countries",,,,,,All Residents (Citizen Residents + Foreign Residents),,,,Mandatory (Unspecified/Implied),"National Government,Ministry/Department of Health",https://tummgmt.eu.qualtrics.com/Q/File.php?F=F_1H0hpritacF9Mw0,'-	https://cv.usembassy.gov/covid-19-information/ ; '-	https://www.larepublica.co/especial-covid-19/cabo-verde ; '-	https://caboverdeairlines.com/faqcovid19/ ; '-	http://spanish.xinhuanet.com/2020-03/20/c_138899126.htm ; '-	http://spanish.xinhuanet.com/2020-03/20/c_138899126.htm ; '-	http://www.africafundacion.org/spip.php?article37082,CoronaNet (original),,2021-11-30,2021-11-30T11:16:44Z
R_yl1h6fYVdiAr2uZNA,7898159,update,End of Policy,,"","Effective March 28, 2020 the Government of Cabo Verde has declared a “State of Emergency” that will remain in place through April 17. The state of emergency will allow the government to enforce social-isolation and social-distancing measures more strictly and oblige non-essential businesses to close. UPDATE: The national state of emergency has ended at a national level on April 16th.",2020-03-28,2020-03-28,2020-04-16,The policy has a clear end date,Cape Verde,CPV,CV,National,1,,,,Declaration of Emergency,,,"",,,,,,"","","","","","","","","","","",,,,"",,Cabo Verde,,,,,,,All Residents (Citizen Residents + Foreign Residents),,,,Mandatory (Unspecified/Implied),National Government,https://tummgmt.eu.qualtrics.com/Q/File.php?F=F_2TN2KUsfx0X6cv3 ; https://tummgmt.eu.qualtrics.com/Q/File.php?F=F_zUOdF4N3kp9F4Ih,NA ; https://cv.usembassy.gov/alert-u-s-embassy-praia-cabo-verde/,CoronaNet (original),,2020-05-30,2020-05-30T00:08:39Z
R_1JEGCHFVy8dlHa3NA,3984993,new_entry,,,"","On April 16, the Government of Cabo Verde extended the State of Emergency for the islands of Boa Vista, Santiago, and Sao Vicente until May 2, 2020.  The State of Emergency was extended for the islands of Santo Antão, São Nicolau, Sal, Maio, Fogo, and Brava until April 26, 2020.

",2020-04-16,2020-04-16,2020-04-26,The policy has a clear end date,Cape Verde,CPV,CV,National,1,,,,Declaration of Emergency,,,"",,,,,,"","","","","","","","","","","",It's a declaration of emergency at the national level targeted at specific subnational units. I can't select this on the original Declaration of Emergency category.,,,"",No,Cabo Verde,One or more geographical or administrative units (other than provincial or city level units) within one or more countries,,,,,Santo Antão; São Nicolau; Sal; Maio; Fogo; Brava,All Residents (Citizen Residents +Foreign Residents),,,,Mandatory (Unspecified/Implied),National Government,https://tummgmt.eu.qualtrics.com/Q/File.php?F=F_37Ct990OdjGYy5j,https://cv.usembassy.gov/alert-u-s-embassy-praia-cabo-verde/,CoronaNet (original),,2020-12-02,2020-12-02T13:02:52Z
R_3hiq3VxbAndvgB5Gq,4852234,new_entry,,,"","The Cape Verdean Government has suspended all air connections from Italy for a period of three weeks, until March 20, but which may be extended.",2020-03-02,2020-03-02,2020-03-20,The policy has a clear end date,Cape Verde,CPV,CV,National,0,,,,External Border Restrictions,Total border crossing ban,,"",,,,,,"","","","","","","","","","","",,,,"",No,Italy,"One or more countries, but not all countries",,,,,,All Travelers (Citizen Travelers + Foreign Travelers ),,Inbound,Flights,Mandatory (Unspecified/Implied),National Government,https://tummgmt.eu.qualtrics.com/Q/File.php?F=F_8vRJ2HCnz4w7niN,https://jornaleconomico.sapo.pt/en/news/covid-19-suspected-case-in-cape-verde-was-in-portugal-553737,CoronaNet (original),,2020-04-04,2020-04-04T12:20:34Z
R_3ltBoscThOcqyEADq,4812641,new_entry,,,"","Cabo Verde Airlines temporarily suspended its flights from Cabo Verde to Washington due to significantly-reduced customer demand prompted by global health concerns related to COVID-19. The suspension is  set from  March 8 to May 31, 2020",2020-03-06,2020-03-08,2020-05-31,The policy has a clear end date,Cape Verde,CPV,CV,National,0,,,,External Border Restrictions,Other External Border Restriction,,"",,,,,,"","","","","","","","","","","",,,,"",No,United States,One or more cities within one or more countries,,Washington,Washington,,,All Travelers (Citizen Travelers + Foreign Travelers ),No special population targeted,Outbound,Flights,Mandatory (Unspecified/Implied),Other (Please specify in the text box),https://tummgmt.eu.qualtrics.com/Q/File.php?F=F_1SoEjf8gPOsfcHv,https://caboverdeairlines.com/covid19-flightsuspension/,ACAPS,ACAPS_2331,2023-07-22,2023-07-22T20:52:40Z
R_3EhRmYvYb4cj932Gq,4852234,update,Change of Policy,Strengthening,timing of policy strengthening,"The Cape Verdean Government has suspended all air connections from Italy for a period of three weeks, until March 20, but which may be extended. UPDATE: The flights from Italy were suspended until March 20.
March 13:The deadline is extended to April 30, 2020 banning all flights from Italy
to Cape Verde.",2020-03-13,2020-03-13,2020-04-30,The policy has a clear end date,Cape Verde,CPV,CV,National,0,,,,External Border Restrictions,Total border crossing ban,,"",,,,,,"","","","","","","","","","","",,,,"",No,Italy,"One or more countries, but not all countries",,,,,,All Travelers (Citizen Travelers + Foreign Travelers ),,Inbound,Flights,Mandatory (Unspecified/Implied),National Government,https://tummgmt.eu.qualtrics.com/Q/File.php?F=F_8vRJ2HCnz4w7niN ; https://tummgmt.eu.qualtrics.com/Q/File.php?F=F_1diRORni2EFNtKn,NA ; https://covid19.cv/wp-content/uploads/2020/04/BO-30-RES-45_RES-46_RES-47-2020.pdf,OxCGRT,OXCGRT_Cape Verde_20200313_extmvt,2023-07-21,2023-07-21T21:21:49Z
R_3IWS9oCITb2XJybGq,959663,new_entry,,,"","Cabo Verde Airlines will suspend all its transport activities from 18-03-2020 and for a period of at least 30 days. The Government decided, as of 18th March, to ban all air connections with Portugal and all European countries with Covid-19 cases, as well as for the United States of America, Brazil, Senegal, and Nigeria.",2020-03-17,2020-03-18,2020-04-17,The policy has a clear end date,Cape Verde,CPV,CV,National,0,,,,External Border Restrictions,Total border crossing ban,,"",,,,,,"","","","","","","","","","","",,,,"",No,"Brazil,France,Nigeria,Portugal,Senegal,United States","One or more countries, but not all countries",,,,,,All Travelers (Citizen Travelers + Foreign Travelers ),No special population targeted,Inbound/Outbound,Flights,Mandatory with Legal Penalties (Jail Time),National Government,https://tummgmt.eu.qualtrics.com/Q/File.php?F=F_3s09nDWTylgV8Dd,https://caboverdeairlines.com/covid19-flightsuspension/,CDC_ITF,CDC-ITF-CV-00019_1,2023-07-21,2023-07-21T21:07:26Z
R_2qvINeJbTyM2b9DGu,163130,new_entry,,,"","As of March 19,  the Government of Cabo Verde has suspended commercial passenger flights in and out of Cabo Verde, including flights to Portugal, Senegal, the United States, and other European countries, with limited exceptions for citizens returning home from Cabo Verde and for medical emergencies.  In addition, passengers on board cruise ships and sailboats will not be allowed to disembark.  The government announced that these restrictions will remain in place for three weeks and may be renewed.",2020-03-19,2020-03-19,2020-04-09,The policy has a clear end date,Cape Verde,CPV,CV,National,0,,,,External Border Restrictions,Travel History Form (e.g. documents where traveler has recently been),,"",,,,,,"","","","","","","","","","","",,,,"",No,"Portugal,Senegal,United States,Ukraine,France,Spain,Sweden,Norway,Germany,Finland,Poland,Italy,United Kingdom,Romania,Belarus,Greece,Bulgaria,Iceland,Hungary,Portugal,Austria,Czech Republic,Serbia,Ireland,Lithuania,Latvia,Croatia,Bosnia and Herzegovina,Slovakia,Estonia,Denmark,Switzerland,Netherlands,Moldova,Belgium,Armenia,Albania,Macedonia,Slovenia,Montenegro,Kosovo,Cyprus,Luxembourg,Georgia,Andorra,Malta,Liechtenstein,San Marino,Monaco,Vatican",One or more countries and one or more regional groupings,Europe,,,,,All (Travelers + Residents),,Inbound/Outbound,"Flights,Cruises,Other (please specify)",Mandatory (Unspecified/Implied),National Government,https://tummgmt.eu.qualtrics.com/Q/File.php?F=F_1K222ENPXd3uZ5R,https://cv.usembassy.gov/covid-19-information/,CoronaNet (original),,2021-06-04,2021-06-04T13:42:49Z
R_2sR3dKDS7Myx9EwGq,6714882,new_entry,,,"","As of March 19, non-Cabo Verdean citizens will not be permitted entry for a period of three weeks. This travel restriction will reviewed by the Government of Cabo Verde at the end of this period.",2020-03-19,2020-03-19,2020-04-09,The policy has a clear end date,Cape Verde,CPV,CV,National,0,,,,External Border Restrictions,Total border crossing ban,,"",,,,,,"","","","","","","","","","","",,,,"",No,All countries,All countries,,,,,,All Foreign Nationals (Foreign Residents + Foreign Travelers),,Inbound,All kinds of transport,Mandatory (Unspecified/Implied),National Government,https://tummgmt.eu.qualtrics.com/Q/File.php?F=F_32M8tX8QAwibYjn,https://cv.usembassy.gov/covid-19-information/,CoronaNet (original),,2021-06-04,2021-06-04T13:49:02Z
R_6Map2WvWPWFtgS5Gq,7468906,new_entry,,,"","On March 20, 2020 the Cabo Verde Ministry of Health confirmed a case of COVID-19 on the island of Boa Vista. \ The government announced that flights and ferries to and from Boa Vista are suspended until April 4.",2020-03-20,2020-03-20,2020-04-04,The policy has a clear end date,Cape Verde,CPV,CV,Municipal,0,Boa Vista,,Boa Vista,External Border Restrictions,Total border crossing ban,,"",,,,,,"","","","","","","","","","","",,,,"",No,All countries,All countries,,,,,,All Travelers (Citizen Travelers + Foreign Travelers ),No special population targeted,Inbound/Outbound,"Flights,Seaports,Ferries",Mandatory with Legal Penalties (Jail Time),Ministry/Department of Health,https://tummgmt.eu.qualtrics.com/Q/File.php?F=F_22K6xXYioYWCVxQ,https://www.osac.gov/Content/Report/774bc1a8-e83a-4715-aefe-183e9e6b8ba2,John Hopkins HIT-COVID dataset,"JHU_6534_border_in_air,6534_border_in_sea,6534_border_out_air,6534_border_out_sea",2023-07-21,2023-07-21T21:32:30Z
R_3oMAsV1KyRc5s4tGq,9274085,new_entry,,,"","March 27, 2020: Government officials announced that there are no commercial flights out of Cape Verde, and all inter-island flights have been suspended until at least April 17. The Cape Verdean authorities have also closed all sea borders.",2020-03-27,2020-03-28,2020-04-17,The policy has a clear end date,Cape Verde,CPV,CV,National,0,,,,External Border Restrictions,Total border crossing ban,,"",,,,,,"","","","","","","","","","","",,,,"",No,All countries,All countries,,,,,,All Travelers (Citizen Travelers + Foreign Travelers ),No special population targeted,Inbound/Outbound,"Flights,Seaports,Cruises,Ferries",Mandatory with Legal Penalties (Jail Time),National Government,https://tummgmt.eu.qualtrics.com/Q/File.php?F=F_2zRXgzf5MtMJRNm,https://crisis24.garda.com/alerts/2020/04/cape-verde-authorities-declare-nationwide-state-of-emergency-in-place-until-april-17-update-3,CDC_ITF,CDC-ITF-CV-00030_1,2023-07-21,2023-07-21T22:03:38Z
R_2TMDbk4bY3ELZolGq,9538663,new_entry,,,"","'-March 18, 2020: The Cabo Verde Government decided to ban all air connections with Portugal and all European countries with COVID -19 cases, as well as with the United States, Brazil, Senegal, and Nigeria. Consequently, since this decision impacts all Cabo Verde Airlines routes, Cabo Verde Airlines will suspend all its flights from 18 March 2020 through 30 June 2020. -March 19, 2020: The Government of Cabo Verde has suspended commercial passenger flights in and out of Cabo Verde, including flights to Portugal, Senegal, the United States, and other European countries, with limited exceptions for citizens returning home from Cabo Verde and for medical emergencies. In addition, passengers onboard cruise ships and sailboats will not be allowed to disembark. The Government of Cabo Verde announced that these restrictions will remain in place for 3 weeks and may be renewed. -March 19, 2020: Non-Cabo Verdean citizens will not be permitted entry for a period of three weeks. This travel restriction will be reviewed by the Government of Cabo Verde and the end of the period.",2020-03-19,2020-04-19,,The policy’s end date is unknown or unreported,Cape Verde,CPV,CV,National,0,,,,External Border Restrictions,Total border crossing ban,,"",,,,,,"","","","","","","","","","","",,,,"",No,,One or more regional groupings,Other Regions (please specify below),,,,,All Travelers (Citizen Travelers + Foreign Travelers ),,Outbound,"Flights,Cruises,Other (please specify)",Mandatory with Exceptions (Please list exceptions in the text entry),National Government,https://tummgmt.eu.qualtrics.com/Q/File.php?F=F_2aDh0eN5mzBYNUK,https://cv.usembassy.gov/covid-19-information/ ; https://www.larepublica.co/especial-covid-19/cabo-verde ; https://caboverdeairlines.com/faqcovid19/ ; http://spanish.xinhuanet.com/2020-03/20/c_138899126.htm ; https://en.wikipedia.org/wiki/2020_coronavirus_pandemic_in_Cape_Verde ; http://www.africafundacion.org/spip.php?article37082,CoronaNet (original),,2022-05-16,2022-05-16T23:59:59Z
R_2B9zG361HbLpje3Cy,3653069,new_entry,,,"","Oct 12, 2020: Travelers entering the Cape Verde must show a COVID-19 PCR-RT test that was administered within 72-hours of departure to gain entry to Cape Verde. Children under age seven are exempt from presenting a COVID-19 PCR-RT test result.",2020-10-12,2020-10-12,,The policy’s end date is unknown or unreported,Cape Verde,CPV,CV,National,0,,,,External Border Restrictions,Negative COVID-19 Test,,"",,,,,,"","","","","","","","","","","",,,,"",No,All countries,All countries,,,,,,All Travelers (Citizen Travelers + Foreign Travelers ),No special population targeted,Inbound,"Flights,Seaports,Cruises,Ferries",Mandatory (Unspecified/Implied),National Government,https://tummgmt.eu.qualtrics.com/Q/File.php?F=F_1gNqtMeFcp9KL5w,https://crisis24.garda.com/alerts/2020/10/cape-verde-international-marine-and-air-passenger-transportation-resumes-from-october-12-update-7,ACAPS,ACAPS_139272,2023-07-21,2023-07-21T22:29:35Z
R_2tmKe3L5cmJOQfECb,1216648,new_entry,,,"","03 Nov, 2020, Cabo Verde: Travelers will be screened at ports of entry and will be required to complete an online health form and an airport security tax form.",2020-11-03,2020-11-03,,The policy’s end date is unknown or unreported,Cape Verde,CPV,CV,National,0,,,,External Border Restrictions,Health Screenings (e.g. temperature checks),,"",,,,,,"","","","","","","","","","","",,,,"",No,All countries,All countries,,,,,,All Travelers (Citizen Travelers + Foreign Travelers ),No special population targeted,Inbound,"Flights,Seaports",Mandatory (Unspecified/Implied),National Government,https://tummgmt.eu.qualtrics.com/Q/File.php?F=F_OflFdriMQWYu0ZH,https://crisis24.garda.com/alerts/2020/11/cape-verde-authorities-extend-state-of-calamity-for-santiago-and-fogo-through-november-14-update-8,ACAPS,ACAPS_142006,2023-07-21,2023-07-21T22:48:10Z
R_1msCteXj5JE3zV3Cy,8083106,new_entry,,,"","Effective December 15, the Government of Cabo Verde has authorized the use of antigen tests (Ag-RDT) to detect COVID-19 prior to travel.  Travelers entering Cabo Verde must present results of a negative COVID-19 PCR-RT test or an antigen test (Ag-RDT, commonly known as a “rapid test”) administered no more than 72 hours prior to flight departure to gain entry to Cabo Verde.  Children under age seven are exempt from presenting test results to gain entry to Cabo Verde. ",2020-12-15,2020-12-15,,The policy’s end date is unknown or unreported,Cape Verde,CPV,CV,National,0,,,,External Border Restrictions,Negative COVID-19 Test,,"",,,,,,"","","","","","","","","","","",,,,"",No,All countries,All countries,,,,,,All Travelers (Citizen Travelers + Foreign Travelers ),No special population targeted,Inbound,All kinds of transport,Mandatory (Unspecified/Implied),National Government,https://tummgmt.eu.qualtrics.com/Q/File.php?F=F_2947XRbc47wRvQv,https://web.archive.org/web/20210103205242/https://cv.usembassy.gov/covid-19-tests-no-longer-needed-for-inter-island-travel-from-santiago-but-required-from-fogo-maio-sao-vicente-and-santo-antao/,OxCGRT,OXCGRT_Cape Verde_20201215_extmvt,2023-07-21,2023-07-21T22:58:47Z
R_126kyC5oXW9K8uHNA,5080022,new_entry,,,"","'-March 15, 2020: Cabo Verde has lab facilities to test for COVID – 19.- March 16, 2020: Tests are being made in Cabo Verde rather than abroad, by the Laboratório de Virologia de Cabo Verde in Praia. -- The health system is prepared to isolate those displaying symptoms within hospital rooms specifically prepared to quarantine those with suspected cases of COVID-19.",2020-03-15,2020-03-16,,The policy’s end date is unknown or unreported,Cape Verde,CPV,CV,National,0,,,,Health Resources,,,"",,,,,,"","","","","","","","","","","",,,,"",No,All countries,All countries,,,,,,All Residents (Citizen Residents + Foreign Residents),,Outbound,"Flights,Cruises,Other (please specify)",Mandatory with Exceptions (Please list exceptions in the text entry),National Government,https://tummgmt.eu.qualtrics.com/Q/File.php?F=F_237zz9HOyx7KexJ,'-	https://cv.usembassy.gov/covid-19-information/ ; '-	https://www.larepublica.co/especial-covid-19/cabo-verde ; '-	https://caboverdeairlines.com/faqcovid19/ ; '-	http://spanish.xinhuanet.com/2020-03/20/c_138899126.htm ; '-	https://en.wikipedia.org/wiki/2020_coronavirus_pandemic_in_Cape_Verde ; '-	http://www.africafundacion.org/spip.php?article37082,CoronaNet (original),,2022-05-16,2022-05-16T23:59:59Z
R_DHJNn2Mn9yUPWSdNA,3159929,new_entry,,,"","In response to the dramatic increase in the number of confirmed COVID-19 cases in Boa Vista, the Prime Minister announced that the only exception to the current ban on inter-island movement of people is for those who are returning home to another island after being unable to travel due to the state of emergency.  Those requesting this exception to the travel ban also require testing to ensure they do not pose a risk to public health.",2020-04-21,2020-04-21,,The policy’s end date is unknown or unreported,Cape Verde,CPV,CV,National,1,,,,Internal Border Restrictions,,,"",,,,,,"","","","","","","","","","","",,,,"",Yes,Cabo Verde,"One or more countries, but not all countries",,,,,,All Residents (Citizen Residents + Foreign Residents),,,,Mandatory (Unspecified/Implied),National Government,https://tummgmt.eu.qualtrics.com/Q/File.php?F=F_2zMZHOro7lxAYgG,https://cv.usembassy.gov/health-alert-u-s-embassy-praia-cabo-verde-april-21-2020/,CoronaNet (original),,2021-06-04,2021-06-04T15:24:52Z
R_27qyLTIysyRnV9bNA,3159929,update,Change of Policy,Strengthening,timing of policy strengthening,"In response to the dramatic increase in the number of confirmed COVID-19 cases in Boa Vista, the Prime Minister announced that the only exception to the current ban on inter-island movement of people is for those who are returning home to another island after being unable to travel due to the state of emergency.  Those requesting this exception to the travel ban also require testing to ensure they do not pose a risk to public health.
On May 1, the Cabo Verdean government extended the State of Emergency for the islands of Santiago and Boa Vista through May 14, as well as nation-wide restrictions on inter-island movement of people to prevent the spread of the COVID-19 virus. UPDATE: Extension of restriction on inter-island travel",2020-04-21,2020-04-21,2020-05-14,The policy has a clear end date,Cape Verde,CPV,CV,National,1,,,,Internal Border Restrictions,,,"",,,,,,"","","","","","","","","","","",,,,"",Yes,Cabo Verde,"One or more countries, but not all countries",,,,,,All Residents (Citizen Residents + Foreign Residents),,,,Mandatory (Unspecified/Implied),National Government,https://tummgmt.eu.qualtrics.com/Q/File.php?F=F_2zMZHOro7lxAYgG ; https://tummgmt.eu.qualtrics.com/Q/File.php?F=F_3h0isS0YqD9ZcDn,NA ; https://cv.usembassy.gov/health-alert-u-s-embassy-praia-cabo-verde-april-21-2020/ ; https://cv.usembassy.gov/health-alert-u-s-embassy-praia-cabo-verde-may-2-2020/,CoronaNet (original),,2020-05-30,2020-05-30T01:06:54Z
