record_id,policy_id,entry_type,update_type,update_level,update_level_var,description,date_announced,date_start,date_end,date_end_spec,country,ISO_A3,ISO_A2,init_country_level,domestic_policy,province,ISO_L2,city,type,type_sub_cat,type_new_admin_coop,type_vac_cat,type_vac_mix,type_vac_reg,type_vac_purchase,type_vac_group,type_vac_group_rank,type_vac_who_pays,type_vac_dist_admin,type_vac_loc,type_vac_cost_num,type_vac_cost_scale,type_vac_cost_unit,type_vac_cost_gov_perc,type_vac_amt_num,type_vac_amt_scale,type_vac_amt_unit,type_vac_amt_gov_perc,type_text,institution_cat,institution_status,institution_conditions,target_init_same,target_country,target_geog_level,target_region,target_province,target_city,target_intl_org,target_other,target_who_what,target_who_gen,target_direction,travel_mechanism,compliance,enforcer,dist_index_high_est,dist_index_med_est,dist_index_low_est,dist_index_country_rank,pdf_link,link,date_updated,recorded_date
R_3np9ClsBpX7OECQGk,8991706,update,End of Policy,,"","In Kyrgyzstan authorities ""close the air borders to all countries except for Russia"" on March 19. UPDATE: Starting from September 20, Kyrgyzstan resumes flights with Kazakhstan according to Republican headquarters for the fight against coronavirus UPDATE: Starting from September 20 allows flights with Kazakhstan.",2020-09-15,2020-09-20,2020-09-20,The policy has a clear end date,Kyrgyzstan,KGZ,KG,National,0,,,,External Border Restrictions,Total border crossing ban,,"",,,,,,"","","","","","","","","","","",,,,"",No,"Afghanistan,Albania,Algeria,Andorra,Angola,Antigua and Barbuda,Argentina,Armenia,Australia,Austria,Azerbaijan,Bahamas,Bahrain,Bangladesh,Barbados,Belarus,Belgium,Belize,Benin,Bhutan,Bolivia,Bosnia and Herzegovina,Botswana,Brazil,Brunei,Bulgaria,Burkina Faso,Burundi,Cabo Verde,Cambodia,Cameroon,Canada,Central African Republic,Chad,Chile,China,Colombia,Comoros,Costa Rica,Croatia,Cuba,Cyprus,Czechia,Democratic Republic of the Congo,Denmark,Djibouti,Dominica,Dominican Republic,Ecuador,Egypt,El Salvador,Equatorial Guinea,Eritrea,Estonia,Eswatini,Ethiopia,Fiji,Finland,France,Gabon,Gambia,Georgia,Germany,Ghana,Greece,Grenada,Guatemala,Guinea,Guinea-Bissau,Guyana,Haiti,Honduras,Hong Kong,Hungary,Iceland,India,Indonesia,Iran,Iraq,Ireland,Israel,Italy,Ivory Coast,Jamaica,Japan,Jordan,Kazakhstan,Kenya,Kiribati,Kuwait,Kyrgyzstan,Laos,Latvia,Lebanon,Lesotho,Liberia,Libya,Liechtenstein,Lithuania,Luxembourg,Macau,Madagascar,Malawi,Malaysia,Maldives,Mali,Malta,Marshall Islands,Mauritania,Mauritius,Mexico,Micronesia,Moldova,Monaco,Mongolia,Montenegro,Morocco,Mozambique,Myanmar,Namibia,Nauru,Nepal,Netherlands,New Zealand,Nicaragua,Niger,Nigeria,North Korea,North Macedonia,Norway,Oman,Pakistan,Palau,Panama,Papua New Guinea,Paraguay,Peru,Philippines,Poland,Portugal,Qatar,Republic of the Congo,Romania,Rwanda,Saint Kitts and Nevis,Saint Lucia,Saint Vincent and the Grenadines,Samoa,San Marino,Sao Tome and Principe,Saudi Arabia,Senegal,Seychelles,Sierra Leone,Singapore,Slovakia,Slovenia,Solomon Islands,Somalia,South Africa,South Korea,South Sudan,Spain,Sri Lanka,Sudan,Suriname,Sweden,Switzerland,Syria,Taiwan,Tajikistan,Tanzania,Thailand,Timor Leste,Togo,Tonga,Trinidad and Tobago,Tunisia,Turkey,Turkmenistan,Tuvalu,Uganda,Ukraine,United Arab Emirates,United Kingdom,United States,Uruguay,Uzbekistan,Vanuatu,Vatican,Venezuela,Vietnam,Yemen,Zambia,Zimbabwe","One or more countries, but not all countries",,,,,,All (Travelers + Residents),,Inbound/Outbound,Flights,Mandatory (Unspecified/Implied),National Government,76.0306045127976,72.7470269815481,69.5955245315351,126,https://tummgmt.eu.qualtrics.com/Q/File.php?F=F_2SruFGwSRWwIaAX ; https://tummgmt.eu.qualtrics.com/Q/File.php?F=F_tGSuOSGXUT7181b,NA ; https://www.for.kg/news-666445-ru.html,2022-03-04,2022-03-04T16:46:17Z
R_1P6JjSv3vKH8VO1Dp,8418561,new_entry,,,"","From October 1 to October 4, 2020, checkpoints on the Kyrgyz-Chinese border will be closed, the Public Relations and Media Department of the State Border Service of the Kyrgyz Republic reported.",2020-09-28,2020-10-01,2020-10-04,The policy has a clear end date,Kyrgyzstan,KGZ,KG,National,0,,,,External Border Restrictions,Other External Border Restriction,,"",,,,,,"","","","","","","","","","","",,,,"",No,China,"One or more countries, but not all countries",,,,,,All (Travelers + Residents),No special population targeted,Inbound,Land Border,Mandatory (Unspecified/Implied),Other (Please specify in the text box),68.4503055885505,65.0928453301968,61.7268430679137,103,https://tummgmt.eu.qualtrics.com/Q/File.php?F=F_2pPpGweDYsx9OZM,https://24.kg/english/166681_Checkpoints_on_Kyrgyz-Chinese_border_to_be_temporarily_closed/,2022-04-25,2022-04-25T07:45:53Z
R_33DejyfrAhN2wd4Ca,5453464,new_entry,,,"","From October 2, 2020, sanitary requirements have been introduced at the checkpoints: the body temperature of all the arrivals is checked. In addition, they must have a certificate of a negative result of a test for COVID-19 according to the Deputy Minister of Health, Nurbolot Usenbaev.",2020-10-02,2020-10-02,,The policy’s end date is unknown or unreported,Kyrgyzstan,KGZ,KG,National,0,,,,External Border Restrictions,Health Screenings (e.g. temperature checks),,"",,,,,,"","","","","","","","","","","",,,,"",No,,All countries,,,,,,All (Travelers + Residents),No special population targeted,,Not Applicable,Mandatory (Unspecified/Implied),Ministry/Department of Health,67.6317264011061,64.5137010332465,61.3108607394892,102,https://tummgmt.eu.qualtrics.com/Q/File.php?F=F_28HdAbJ8tHPJUYY,https://24.kg/english/167246_Kyrgyzstan_tightens_sanitary_control_at_its_borders_____/,2022-04-25,2022-04-25T07:54:29Z
R_RQ4xetezS9zrfcBCa,7695237,new_entry,,,"","On September 26, 2020, the Republican Headquarters for Combating the Coronavirus Disease in Kyrgyzstan  approved a decree for crossing international borders, setting out requirements for international arrivals into the country. According to the decree, as of Monday, October 5, passengers on international and domestic flights will be required to wear face masks and social distancing must be adhered to",2020-10-03,2020-10-03,,The policy’s end date is unknown or unreported,Kyrgyzstan,KGZ,KG,National,0,,,,External Border Restrictions,Health Screenings (e.g. temperature checks),,"",,,,,,"","","","","","","","","","","",,,,"",No,,All countries,,,,,,All (Travelers + Residents),No special population targeted,Inbound/Outbound,Flights,Mandatory (Unspecified/Implied),Ministry/Department of Health,66.4174875792535,63.4951048381476,60.6405677698614,100,https://tummgmt.eu.qualtrics.com/Q/File.php?F=F_1f8lTOzeTaYYiRk,https://crisis24.garda.com/alerts/2020/10/kyrgyzstan-authorities-formalize-international-travel-restrictions-september-26-update-15,2022-06-28,2022-06-28T10:03:08Z
R_RQ4xetezS9zrfcBCx,7695237,new_entry,,,"","On September 26, 2020, the Republican Headquarters for Combating the Coronavirus Disease in Kyrgyzstan  approved a decree for crossing international borders, setting out requirements for international arrivals into the country. According to the decree, as of Monday, October 5, passengers on international and domestic flights will be required to wear face masks and social distancing must be adhered to",2020-10-03,2020-10-03,,The policy’s end date is unknown or unreported,Kyrgyzstan,KGZ,KG,National,0,,,,External Border Restrictions,Negative COVID-19 Test,,"",,,,,,"","","","","","","","","","","",,,,"",No,,All countries,,,,,,All (Travelers + Residents),No special population targeted,Inbound/Outbound,Flights,Mandatory (Unspecified/Implied),Ministry/Department of Health,66.4174875792535,63.4951048381476,60.6405677698614,100,https://tummgmt.eu.qualtrics.com/Q/File.php?F=F_1f8lTOzeTaYYiRk,https://crisis24.garda.com/alerts/2020/10/kyrgyzstan-authorities-formalize-international-travel-restrictions-september-26-update-15,2022-06-28,2022-06-28T10:03:08Z
R_3WAhn7gGPuZFlUlCx,1174760,new_entry,,,"","From October 13, 2020, Kyrgyzstan now requires travelers to have negative PCR test results dated no more than 72 hours before arrival in Kyrgyzstan. Travelers without valid PCR results will be denied entry.",2020-10-13,2020-10-13,,The policy’s end date is unknown or unreported,Kyrgyzstan,KGZ,KG,National,0,,,,External Border Restrictions,Negative COVID-19 Test,,"",,,,,,"","","","","","","","","","","",,,,"",No,,All countries,,,,,,All (Travelers + Residents),No special population targeted,,Flights,Mandatory (Unspecified/Implied),National Government,64.7283051995568,61.4879387121817,57.7655953854573,95,https://tummgmt.eu.qualtrics.com/Q/File.php?F=F_2YxMD7Ml2NZz8xX,https://web.archive.org/web/20201014082154/https://kg.usembassy.gov/covid-19-information/,2022-04-30,2022-04-30T10:06:08Z
R_1DpBgRlnqHLtiEfDp,4702345,new_entry,,,"","From November 30, 2020 at 18:00  until March 1, 2020, the Karkyra-avtodorozhny checkpoint will be closed, which is located on the border of Kyrgyzstan and Kazakhstan.",2020-11-30,2020-11-30,2021-03-01,The policy has a clear end date,Kyrgyzstan,KGZ,KG,National,0,,,,External Border Restrictions,Other External Border Restriction,,"",,,,,,"","","","","","","","","","","",,,,"",No,Kazakhstan,"One or more countries, but not all countries",,,,,,All (Travelers + Residents),No special population targeted,,Not Applicable,Mandatory (Unspecified/Implied),National Government,59.1907100496771,56.37008974918,52.8235699570078,63,https://tummgmt.eu.qualtrics.com/Q/File.php?F=F_2e846b1OdcDDe8j,https://rus.azattyk.org/a/30976012.html,2022-04-25,2022-04-25T08:15:26Z
R_12hHUjjdQv10ZMoCx,1934120,new_entry,,,"","On December 4, 2020, the Government of the Kyrgyz Republic lifted the entry ban on U.S. citizen travelers.",2020-12-04,2020-12-04,,The policy’s end date is unknown or unreported,Kyrgyzstan,KGZ,KG,National,0,,,,External Border Restrictions,Negative COVID-19 Test,,"",,,,,,"","","","","","","","","","","",,,,"",No,United States,"One or more countries, but not all countries",,,,,,All (Travelers + Residents),No special population targeted,,Flights,Mandatory (Unspecified/Implied),National Government,59.5180967956636,56.1981632966664,53.1172959088623,61,https://tummgmt.eu.qualtrics.com/Q/File.php?F=F_2sbgYBsk7hSb0xq,https://archive.ph/2021.03.07-133200/https://kg.usembassy.gov/covid-19-information/,2022-04-26,2022-04-26T18:59:38Z
R_3nrd3wOsGbP6SsxGk,8991706,update,End of Policy,,"","In Kyrgyzstan authorities ""close the air borders to all countries except for Russia"" on March 19, 2020. UPDATE: From December 4, 2020, foreign citizens and stateless persons can arrive in the Kyrgyz Republic by regular flights in accordance with the procedure established by the legislation of the Kyrgyz Republic. UPDATE: The original policy was a ban for all countries to enter Kyrgyzstan from March 19,2020, and now from December 4, 20220, the borders are open",2020-12-04,2020-12-04,2020-12-04,The policy has a clear end date,Kyrgyzstan,KGZ,KG,National,0,,,,External Border Restrictions,Total border crossing ban,,"",,,,,,"","","","","","","","","","","",,,,"",No,"Afghanistan,Albania,Algeria,Andorra,Angola,Antigua and Barbuda,Argentina,Armenia,Australia,Austria,Azerbaijan,Bahamas,Bahrain,Bangladesh,Barbados,Belarus,Belgium,Belize,Benin,Bhutan,Bolivia,Bosnia and Herzegovina,Botswana,Brazil,Brunei,Bulgaria,Burkina Faso,Burundi,Cabo Verde,Cambodia,Cameroon,Canada,Central African Republic,Chad,Chile,China,Colombia,Comoros,Costa Rica,Croatia,Cuba,Cyprus,Czechia,Democratic Republic of the Congo,Denmark,Djibouti,Dominica,Dominican Republic,Ecuador,Egypt,El Salvador,Equatorial Guinea,Eritrea,Estonia,Eswatini,Ethiopia,Fiji,Finland,France,Gabon,Gambia,Georgia,Germany,Ghana,Greece,Grenada,Guatemala,Guinea,Guinea-Bissau,Guyana,Haiti,Honduras,Hong Kong,Hungary,Iceland,India,Indonesia,Iran,Iraq,Ireland,Israel,Italy,Ivory Coast,Jamaica,Japan,Jordan,Kazakhstan,Kenya,Kiribati,Kuwait,Kyrgyzstan,Laos,Latvia,Lebanon,Lesotho,Liberia,Libya,Liechtenstein,Lithuania,Luxembourg,Macau,Madagascar,Malawi,Malaysia,Maldives,Mali,Malta,Marshall Islands,Mauritania,Mauritius,Mexico,Micronesia,Moldova,Monaco,Mongolia,Montenegro,Morocco,Mozambique,Myanmar,Namibia,Nauru,Nepal,Netherlands,New Zealand,Nicaragua,Niger,Nigeria,North Korea,North Macedonia,Norway,Oman,Pakistan,Palau,Panama,Papua New Guinea,Paraguay,Peru,Philippines,Poland,Portugal,Qatar,Republic of the Congo,Romania,Rwanda,Saint Kitts and Nevis,Saint Lucia,Saint Vincent and the Grenadines,Samoa,San Marino,Sao Tome and Principe,Saudi Arabia,Senegal,Seychelles,Sierra Leone,Singapore,Slovakia,Slovenia,Solomon Islands,Somalia,South Africa,South Korea,South Sudan,Spain,Sri Lanka,Sudan,Suriname,Sweden,Switzerland,Syria,Taiwan,Tajikistan,Tanzania,Thailand,Timor Leste,Togo,Tonga,Trinidad and Tobago,Tunisia,Turkey,Turkmenistan,Tuvalu,Uganda,Ukraine,United Arab Emirates,United Kingdom,United States,Uruguay,Uzbekistan,Vanuatu,Vatican,Venezuela,Vietnam,Yemen,Zambia,Zimbabwe","One or more countries, but not all countries",,,,,,All (Travelers + Residents),,Inbound/Outbound,Flights,Mandatory (Unspecified/Implied),National Government,59.5180967956636,56.1981632966664,53.1172959088623,61,https://tummgmt.eu.qualtrics.com/Q/File.php?F=F_2SruFGwSRWwIaAX ; https://tummgmt.eu.qualtrics.com/Q/File.php?F=F_31Yo6ZClAXKW96N,NA ; https://mfa.gov.kg/en/dm/belgiya/news/9946,2022-04-25,2022-04-25T11:45:29Z
R_1ITdkuTZalP8qviGk,9285734,update,End of Policy,,"","From September 10, 2020, Kyrgyzstan resumes regular flights with Uzbekistan according to the Republican Emergency Response Center. UPDATE: From December 14, 2020, Kyrgyzstan has resumed flights with Uzbekistan. UPDATE: The original policy suspended flights with Uzbekistan from September 20, 2020, from December 14, 2020, flights have been resumed.",2020-12-14,2020-12-14,2020-12-14,The policy has a clear end date,Kyrgyzstan,KGZ,KG,National,0,,,,External Border Restrictions,Total border crossing ban,,"",,,,,,"","","","","","","","","","","",,,,"",No,Uzbekistan,"One or more countries, but not all countries",,,,,,All (Travelers + Residents),No special population targeted,Inbound,Flights,Mandatory (Unspecified/Implied),National Government,58.923224827829,55.934238522026,52.7109602165544,60,https://tummgmt.eu.qualtrics.com/Q/File.php?F=F_2mlVdHfDD2EctbP ; https://tummgmt.eu.qualtrics.com/Q/File.php?F=F_1mCcyUt86GnKUKo,NA ; https://archive.ph/HMHmU,2022-04-26,2022-04-26T10:04:00Z
R_24woLFWjbIrbE6QGk,7742279,update,End of Policy,,"","On March 17, on the behalf of Deputy Prime Minister Altynai Omurbekova, Kyrgyzstan has banned entry to all foreigners. UPDATE: From April 5, 2021, according to the Kyrgyz government all passengers who want to enter Kyrgyzstan must present negative PCR test results. UPDATE: from April 26, United States citizen travelers may now enter the country via international airports in Bishkek, Osh, and Issyk Kul UPDATE: UPDATE: From 5 April, according to the Kyrgyz government passengers who want to enter Kyrgyzstan must present negative PCR test results. Update: From April 26, 2021, United States citizen travelers may now enter the country via international airports in Bishkek, Osh, and Issyk Kul",2021-04-26,2021-04-26,2021-04-26,The policy has a clear end date,Kyrgyzstan,KGZ,KG,National,0,,,,External Border Restrictions,Total border crossing ban,,"",,,,,,"","","","","","","","","","","",,,,"",No,"China,Iran,Italy,Japan,South Korea","One or more countries, but not all countries",,,,,,Foreign Travelers,No special population targeted,Inbound,All kinds of transport,Mandatory (Unspecified/Implied),National Government,,,,,https://tummgmt.eu.qualtrics.com/Q/File.php?F=F_24oc8nL1z8L9xEz ; https://tummgmt.eu.qualtrics.com/Q/File.php?F=F_PBChW4LT1FJ6Iet,NA ; https://web.archive.org/web/20210405233954/https://www.garda.com/crisis24/news-alerts/463696/kyrgyzstan-covid-19-related-restrictions-remain-largely-unchanged-as-of-april-5-by-comparison-with-early-february-update-17 ; http://web.archive.org/web/20210508035553/https://kg.usembassy.gov/covid-19-information/,2022-03-10,2022-03-10T13:04:06Z
R_31S4fCx4WO1F6NZCx,2902720,new_entry,,,"","From May 17, 2021, all persons entering Kyrgyzstan by air must produce proof of a negative COVID-19 polymerase chain reaction (PCR) test taken no more than 72 hours before arrival.",2021-05-17,2021-05-17,,The policy’s end date is unknown or unreported,Kyrgyzstan,KGZ,KG,National,0,,,,External Border Restrictions,Negative COVID-19 Test,,"",,,,,,"","","","","","","","","","","",,,,"",No,,All countries,,,,,,All (Travelers + Residents),No special population targeted,,Flights,Mandatory (Unspecified/Implied),National Government,,,,,https://tummgmt.eu.qualtrics.com/Q/File.php?F=F_3P4VjUptY0qpwnj,http://web.archive.org/web/20210530180725/https://www.garda.com/crisis24/news-alerts/479566/kyrgyzstan-authorities-maintaining-covid-19-related-restrictions-as-of-may-17-update-18,2022-04-26,2022-04-26T19:11:50Z
R_1C2aljUvA91I2tSEq,4281197,new_entry,,,"","From June 19, 2021, entry to Kyrgyzstan is possible also by presenting a vaccination certificate if the complete immunization against COVID-19 has taken place at least 21 days prior to arrival in Kyrgyzstan. Kyrgyz authorities currently accept all vaccines against COVID-19",2021-06-14,2021-06-19,,The policy’s end date is unknown or unreported,Kyrgyzstan,KGZ,KG,National,0,,,,External Border Restrictions,Proof of COVID-19 vaccination,,"",,,,,,"","","","","","","","","","","",,,,"",No,,All countries,,,,,,All (Travelers + Residents),No special population targeted,,Flights,Mandatory (Unspecified/Implied),Ministry/Department of Health,,,,,https://tummgmt.eu.qualtrics.com/Q/File.php?F=F_6tnCazZ7PRoUNdT,https://global-monitoring.com/gm/page/events/epidemic-0002141.1Y5yfgscqOa5.html?lang=en,2022-04-30,2022-04-30T09:57:30Z
R_1C2aljUvA91I2tSAc,4281197,new_entry,,,"","From June 19, 2021, entry to Kyrgyzstan is possible also by presenting a vaccination certificate if the complete immunization against COVID-19 has taken place at least 21 days prior to arrival in Kyrgyzstan. Kyrgyz authorities currently accept all vaccines against COVID-19",2021-06-14,2021-06-19,,The policy’s end date is unknown or unreported,Kyrgyzstan,KGZ,KG,National,0,,,,External Border Restrictions,2G: Must be (i) either vaccinated or (ii) recovered from COVID-19,,"",,,,,,"","","","","","","","","","","",,,,"",No,,All countries,,,,,,All (Travelers + Residents),No special population targeted,,Flights,Mandatory (Unspecified/Implied),Ministry/Department of Health,,,,,https://tummgmt.eu.qualtrics.com/Q/File.php?F=F_6tnCazZ7PRoUNdT,https://global-monitoring.com/gm/page/events/epidemic-0002141.1Y5yfgscqOa5.html?lang=en,2022-04-30,2022-04-30T09:57:30Z
R_1jd3mNPtt5VMO9uEq,221614,new_entry,,,"","From July 2, 2021, travelers to Kyrgyzstan may show their original vaccine card showing proof of vaccination against COVID-19 instead of a negative PCR test. Travelers without vaccination or valid PCR results will be denied entry.",2021-07-02,2021-07-02,,The policy’s end date is unknown or unreported,Kyrgyzstan,KGZ,KG,National,0,,,,External Border Restrictions,Proof of COVID-19 vaccination,,"",,,,,,"","","","","","","","","","","",,,,"",No,,All countries,,,,,,All (Travelers + Residents),No special population targeted,,Not Applicable,Mandatory (Unspecified/Implied),National Government,,,,,https://tummgmt.eu.qualtrics.com/Q/File.php?F=F_bsdPoTHKlaNelr3,https://web.archive.org/web/20210814180804/https://kg.usembassy.gov/covid-19-information/,2022-04-27,2022-04-27T08:39:23Z
R_3snr6zvQBr5hFf7Cx,8392602,new_entry,,,"","From December 1, 2021, The Cabinet of Ministers of Kyrgyzstan announced that foreigners and Kyrgyz citizens to enter the republic will be required to pass and carry a negative PCR test for coronavirus infection before arrival, regardless of vaccination status.",2021-11-29,2021-12-01,,The policy’s end date is unknown or unreported,Kyrgyzstan,KGZ,KG,National,0,,,,External Border Restrictions,Negative COVID-19 Test,,"",,,,,,"","","","","","","","","","","",,,,"",No,,All countries,,,,,,All (Travelers + Residents),No special population targeted,,Flights,Mandatory (Unspecified/Implied),National Government,,,,,https://tummgmt.eu.qualtrics.com/Q/File.php?F=F_2tmPqZaDpdC1JN4,https://24.kg/vlast/215406_vajno_s1dekabrya_ptsr-test_pri_vyezde_vkyirgyizstan_budet_obyazatelnyim_dlya_vseh_/,2022-03-25,2022-03-25T14:01:25Z
R_3snr6zvQBr5hFf7Eq,8392602,new_entry,,,"","From December 1, 2021, The Cabinet of Ministers of Kyrgyzstan announced that foreigners and Kyrgyz citizens to enter the republic will be required to pass and carry a negative PCR test for coronavirus infection before arrival, regardless of vaccination status.",2021-11-29,2021-12-01,,The policy’s end date is unknown or unreported,Kyrgyzstan,KGZ,KG,National,0,,,,External Border Restrictions,Proof of COVID-19 vaccination,,"",,,,,,"","","","","","","","","","","",,,,"",No,,All countries,,,,,,All (Travelers + Residents),No special population targeted,,Flights,Mandatory (Unspecified/Implied),National Government,,,,,https://tummgmt.eu.qualtrics.com/Q/File.php?F=F_2tmPqZaDpdC1JN4,https://24.kg/vlast/215406_vajno_s1dekabrya_ptsr-test_pri_vyezde_vkyirgyizstan_budet_obyazatelnyim_dlya_vseh_/,2022-03-25,2022-03-25T14:01:25Z
R_3snr6zvQBr5hFf7Ad,8392602,new_entry,,,"","From December 1, 2021, The Cabinet of Ministers of Kyrgyzstan announced that foreigners and Kyrgyz citizens to enter the republic will be required to pass and carry a negative PCR test for coronavirus infection before arrival, regardless of vaccination status.",2021-11-29,2021-12-01,,The policy’s end date is unknown or unreported,Kyrgyzstan,KGZ,KG,National,0,,,,External Border Restrictions,3G: Must be either (i) vaccinated (ii) have a valid COVID-19 negative test within a certain time frame or (iii) recovered from COVID-19,,"",,,,,,"","","","","","","","","","","",,,,"",No,,All countries,,,,,,All (Travelers + Residents),No special population targeted,,Flights,Mandatory (Unspecified/Implied),National Government,,,,,https://tummgmt.eu.qualtrics.com/Q/File.php?F=F_2tmPqZaDpdC1JN4,https://24.kg/vlast/215406_vajno_s1dekabrya_ptsr-test_pri_vyezde_vkyirgyizstan_budet_obyazatelnyim_dlya_vseh_/,2022-03-25,2022-03-25T14:01:25Z
R_1E6t96ZiuWCMydHCx,7286280,new_entry,,,"","From February 22, 2022, to enter the Kyrgyz Republic, foreign citizens and stateless persons must present the results of a PCR test conducted within the last 72 hours from the moment of selection to arrival in the country or a document (certificate) certifying the receipt of a vaccine against coronavirus infection COVID-19 recognized by the Kyrgyz Republic.",2022-02-22,2022-02-22,,The policy’s end date is unknown or unreported,Kyrgyzstan,KGZ,KG,National,0,,,,External Border Restrictions,Negative COVID-19 Test,,"",,,,,,"","","","","","","","","","","",,,,"",No,,All countries,,,,,,All (Travelers + Residents),No special population targeted,,Not Applicable,Mandatory (Unspecified/Implied),National Government,,,,,https://tummgmt.eu.qualtrics.com/Q/File.php?F=F_3G26AF3JLdaAD57,https://mfa.gov.kg/en/dm/Embassy-of-the-Kyrgyz-Republic-to-the-Republic-of-Korea/news/16849,2022-04-27,2022-04-27T08:48:26Z
R_1E6t96ZiuWCMydHEq,7286280,new_entry,,,"","From February 22, 2022, to enter the Kyrgyz Republic, foreign citizens and stateless persons must present the results of a PCR test conducted within the last 72 hours from the moment of selection to arrival in the country or a document (certificate) certifying the receipt of a vaccine against coronavirus infection COVID-19 recognized by the Kyrgyz Republic.",2022-02-22,2022-02-22,,The policy’s end date is unknown or unreported,Kyrgyzstan,KGZ,KG,National,0,,,,External Border Restrictions,Proof of COVID-19 vaccination,,"",,,,,,"","","","","","","","","","","",,,,"",No,,All countries,,,,,,All (Travelers + Residents),No special population targeted,,Not Applicable,Mandatory (Unspecified/Implied),National Government,,,,,https://tummgmt.eu.qualtrics.com/Q/File.php?F=F_3G26AF3JLdaAD57,https://mfa.gov.kg/en/dm/Embassy-of-the-Kyrgyz-Republic-to-the-Republic-of-Korea/news/16849,2022-04-27,2022-04-27T08:48:26Z
R_1op8AUwTZouaFg8Dp,851503,new_entry,,,"","Vice-minister of Kyrgystan offered to open up special transit sites for chinese-kyrgyz trucks with goods on March 26, 2020 since the total border ban was heavy on kyrgyzstan's wellbeing.",2022-03-26,2022-03-26,,The policy’s end date is unknown or unreported,Kyrgyzstan,KGZ,KG,National,0,,,,External Border Restrictions,Other External Border Restriction,,"",,,,,,"","","","","","","","","","","",,,,"",No,China,"One or more countries, but not all countries",,,,,,All Travelers (Citizen Travelers + Foreign Travelers ),Other population not specifed above,Inbound/Outbound,Other (please specify),Mandatory with Legal Penalties (Jail Time),National Government,,,,,https://tummgmt.eu.qualtrics.com/Q/File.php?F=F_3PMLbqe0mAdrjG9,https://www.gov.kg/ru/post/s/vitse-premer-ministr-erkin-asrandiev-kyrgyz-kytay-chek-arasy-arkyluu-zhk-tashuulardy-zhandandyruu-chn-dayardyktar-bashtaldy,2022-03-23,2022-03-23T19:03:58Z
