record_id,policy_id,entry_type,update_type,update_level,update_level_var,description,date_announced,date_start,date_end,date_end_spec,country,ISO_A3,ISO_A2,init_country_level,domestic_policy,province,ISO_L2,city,type,type_sub_cat,type_new_admin_coop,type_vac_cat,type_vac_mix,type_vac_reg,type_vac_purchase,type_vac_group,type_vac_group_rank,type_vac_who_pays,type_vac_dist_admin,type_vac_loc,type_vac_cost_num,type_vac_cost_scale,type_vac_cost_unit,type_vac_cost_gov_perc,type_vac_amt_num,type_vac_amt_scale,type_vac_amt_unit,type_vac_amt_gov_perc,type_text,institution_cat,institution_status,institution_conditions,target_init_same,target_country,target_geog_level,target_region,target_province,target_city,target_intl_org,target_other,target_who_what,target_who_gen,target_direction,travel_mechanism,compliance,enforcer,dist_index_high_est,dist_index_med_est,dist_index_low_est,dist_index_country_rank,pdf_link,link,date_updated,recorded_date
R_0dr8sPqikfIWHfjBx,5673546,new_entry,,,"","Doctors and medical assistants from ten districts in Moldova will receive masks, around 100,000 gloves and 760 liters of disinfectant from the Swiss Cooperation Office in the country on between March 25 and March 31.",2020-03-25,2020-03-25,2020-03-31,The policy has a clear end date,Moldova,MDA,MD,Provincial,0,,,,Health Resources,Hand Sanitizer,,"",,,,,,"","","","","","","","","","","",,,,"",No,Moldova,One or more provinces within one or more countries,,Fălești; Ungheni; Ștefan Vodă; Cahul; Orhei; Criuleni; Taraclia; Vulcănești; Edineț; Briceni,,,,Health Staff,,,Not Applicable,Mandatory (Unspecified/Implied),Ministry/Department of Health,72.2376978433629,68.7416437932876,65.2553878618187,104,https://tummgmt.eu.qualtrics.com/Q/File.php?F=F_1OP07eA5JGTnVIk,https://www.ipn.md/en/print/health-centers-receive-donation-of-masks-gloves-and-disinfectants--7967_1072451.html,2020-05-15,2020-05-15T20:06:43Z
R_pmAQtYzUb5GuQwhEh,7129292,update,End of Policy,,"","With a decree from March 28 2020, the Moldovan Ministry of Finance will allocate 19.5 million lei to the Ministry of Health for procurement of respirators. UPDATE: Procurement will take place through the Center for Centralized Public Procurement in Health.",2020-03-28,2020-03-28,2020-04-11,The policy has an imprecise natural end date (e.g. masks will be distributed until they run out),Moldova,MDA,MD,National,0,,,,Health Resources,Personal Protective Equipment,,"",,,,,,"","","","","","","","","","","",,,,"",Yes,Moldova,"One or more countries, but not all countries",,,,,,,,,,Mandatory (Unspecified/Implied),Ministry/Department of Health,76.4965376862739,73.1588302948361,69.7296651928022,115,https://tummgmt.eu.qualtrics.com/Q/File.php?F=F_3CGUxhYSz7g4YDS,http://tvrmoldova.md/actualitate/ministerul-finantelor-va-aloca-peste-19-milioane-de-lei-pentru-procurarea-respiratoarelor/,2021-06-05,2021-06-05T09:58:28Z
R_1P7VexBDCpKqC1HGi,5351803,new_entry,,,"","Moldova will purchase 100,000 COVID-19 test kits from China on March 30.",2020-03-30,2020-03-30,2020-03-30,The policy has a clear end date,Moldova,MDA,MD,National,0,,,,Health Resources,Test Kits,,"",,,,,,"","","","","","","","","","","",,,,"",No,China,"One or more countries, but not all countries",,,,,,Health-Related Supplies,,Inbound,Not Applicable,Mandatory (Unspecified/Implied),National Government,77.5953131092215,74.611285429654,70.9142205034339,119,https://tummgmt.eu.qualtrics.com/Q/File.php?F=F_3MKgWOWN8IyNx3z,https://www.ipn.md/en/print/authorities-purchase-100000-covid-19-test-kits-from-china--7967_1072541.html,2020-05-15,2020-05-15T20:26:26Z
R_tFZTWuEHLKrQ5nXDm,4828392,new_entry,,,"","Each housing stock manager in Chisinau, Moldova, is obliged to sanitize balustrades, stairs and elevators in apartments twice a day and playgrounds each morning from March 13, 2020. The workers are issued with protective face masks and gloves.",2020-03-13,2020-03-13,,The policy’s end date is unknown or unreported,Moldova,MDA,MD,Municipal,1,Chisinau Municipality,MD-CU,Chisinau,Hygiene,Other Areas Hygiene Measures Applied,,"",,,,,,"","","","","","","","","","","",,,,"",,Moldova,,,Chisinau Municipality,Chisinau,,,All Residents (Citizen Residents + Foreign Residents),,,,Mandatory (Unspecified/Implied),Municipal Government,51.4747805312556,48.0069551441525,44.1000473287961,105,https://tummgmt.eu.qualtrics.com/Q/File.php?F=F_3JDk4r84Q1frfvG,https://www.ipn.md/en/print/disinfection-works-performed-in-blocks-and-on-playgrounds-in-chisinau--7967_1072165.html,2021-05-01,2021-05-01T10:10:19Z
R_2wsfUs55U4vou5jCh,4067132,new_entry,,,"","The new parliamentary elections that will take place in Hincești, Moldova, on March 15 will be held in conditions of increased protection and sanitation. Antiseptics will be available in polling stations and the members of electoral bureaus will wear medical face masks. The number of voters inside a polling station will be limited.",2020-03-14,2020-03-15,2020-03-15,The policy has a clear end date,Moldova,MDA,MD,Municipal,1,Hincesti,MD-HI,Hincesti,Hygiene,Hygiene measures for public areas,,"",,,,,,"","","","","","","","","","","",,,,"",,Moldova,,,Hincesti,Hincesti,,,All Residents (Citizen Residents + Foreign Residents),,,,Mandatory (Unspecified/Implied),Municipal Government,52.7585429992965,49.554520637002,46.0022960100142,94,https://tummgmt.eu.qualtrics.com/Q/File.php?F=F_0fAD4tecD6gOPxT,https://www.ipn.md/en/print/elections-in-hancesti-pens-will-be-disinfected-after-each-voter-while-surfaces-o--8008_1072179.html,2020-05-15,2020-05-15T17:19:48Z
R_300LE9JsiBhJEP8Ci,4284073,new_entry,,,"","The Chisinau City Hall in Moldova said that as of March 20, 2020, hand sanitizer dispensers will be available in all the trolleybuses running on routes in the capital city.",2020-03-20,2020-03-20,2020-03-21,The policy is a one-time measure (e.g. publication of guidelines),Moldova,MDA,MD,Municipal,1,Chisinau Municipality,MD-CU,Chisinau,Hygiene,Hygiene measures for public transport,,"",,,,,,"","","","","","","","","","","",,,,"",,Moldova,,,Chisinau Municipality,Chisinau,,,All Residents (Citizen Residents + Foreign Residents),,,,Mandatory (Unspecified/Implied),Municipal Government,56.7787717819654,53.3049379978119,49.9854048814082,68,https://tummgmt.eu.qualtrics.com/Q/File.php?F=F_8jq9Qjna4AxpLNf,https://www.ipn.md/en/print/public-transport-in-chisinau-outfitted-with-hand-sanitizer-dispensers--7967_1072320.html,2021-05-01,2021-05-01T10:15:48Z
R_C3vlO5ZEkudNRgRNA,4896209,new_entry,,,"","Transnistria, Moldova, bans from March 17 the entrance of non-residents of the region, except for diplomats and those who transport food products and other essentials.",2020-03-17,2020-03-17,2020-04-05,The policy has a clear end date,Moldova,MDA,MD,Provincial,1,Transnistria,,,Internal Border Restrictions,,,"",,,,,,"","","","","","","","","","","",,,,"",No,Moldova,"One or more countries, but not all countries",,Transnistria,,,,Foreign Travelers,,,,Mandatory (Unspecified/Implied),Provincial/State Government,53.9852047885487,50.6440433775985,47.2808144342257,85,https://tummgmt.eu.qualtrics.com/Q/File.php?F=F_3lsOretGVD0WjlV,https://www.ipn.md/en/print/state-of-emergency-amid-covid-19-pandemic-declared-in-transnistria--7967_1072252.html,2020-05-15,2020-05-15T18:57:37Z
R_1HdYz1VXacC0msqNA,7562068,new_entry,,,"","From March 17, residents of the Transnistrian region in Moldova will be able to leave after filling out a mandatory form.",2020-03-17,2020-03-17,2020-04-05,The policy has a clear end date,Moldova,MDA,MD,Provincial,1,Transnistria,,,Internal Border Restrictions,,,"",,,,,,"","","","","","","","","","","",,,,"",No,Moldova,"One or more countries, but not all countries",,Transnistria,,,,Citizen Travelers,,,,Mandatory (Unspecified/Implied),Provincial/State Government,53.9852047885487,50.6440433775985,47.2808144342257,85,https://tummgmt.eu.qualtrics.com/Q/File.php?F=F_22Fy6UOW8NFq4TV,https://www.ipn.md/en/print/state-of-emergency-amid-covid-19-pandemic-declared-in-transnistria--7967_1072252.html,2020-05-15,2020-05-15T19:00:44Z
R_1HhRzOPur6EAZymNA,4020694,new_entry,,,"","On March 21 and 22, the public transport in the municipality of Chisinau, Moldova will run on routes from 7am until 10am and then from 4pm until 7:30pm only.",2020-03-21,2020-03-21,2020-03-22,The policy has a clear end date,Moldova,MDA,MD,Municipal,1,Chisinau Municipality,MD-CU,Chisinau,Internal Border Restrictions,,,"",,,,,,"","","","","","","","","","","",,,,"",Yes,Moldova,One or more cities within one or more countries,,Chisinau Municipality,Chisinau,,,All Residents (Citizen Residents + Foreign Residents),,,,Mandatory (Unspecified/Implied),Municipal Government,58.8607770433688,55.2004473188505,51.8255329735505,71,https://tummgmt.eu.qualtrics.com/Q/File.php?F=F_ehAyV2XeEpbcY9z,https://www.ipn.md/en/print/public-transport-in-chisinau-limited-on-weekend--7967_1072347.html,2020-05-15,2020-05-15T19:28:19Z
R_1i3xUvnEaUS0f4DNA,1364959,new_entry,,,"",The Commission for Exceptional Situations in Moldova decided that public transport in the municipalities of Chisinau and Bălți will not run on April 11 and 12.,2020-04-09,2020-04-11,2020-04-12,The policy has a clear end date,Moldova,MDA,MD,National,1,,,,Internal Border Restrictions,,,"",,,,,,"","","","","","","","","","","",,,,"",No,Moldova,One or more cities within one or more countries,,,Chisinau; Bălți,,,All (Travelers + Residents),,,,Mandatory (Unspecified/Implied),Municipal Government,79.4058415993677,75.9635361481707,72.7862904220116,115,https://tummgmt.eu.qualtrics.com/Q/File.php?F=F_DSGPbJX5UCDHVQt,https://www.ipn.md/en/print/public-transport-in-chisinau-and-balti-suspended-on-weekend--7967_1072783.html,2020-05-16,2020-05-16T09:23:55Z
R_umPfTcvpN1Y6NXPNA,8442614,new_entry,,,"","Access through the town of Sângerei, Moldova, is restricted between March 21 and April 1. Only the persons who need to make purchases and need the services of the Public Services Agency are an exception.",2020-03-21,2020-03-21,2020-04-01,The policy has a clear end date,Moldova,MDA,MD,Municipal,1,Singerei,MD-SI,Singerei,Lockdown,,,"",,,,,,"","","","","","","","","","","",,,,"",,Moldova,,,Singerei,Singerei,,,All Residents (Citizen Residents + Foreign Residents),,,,Mandatory (Unspecified/Implied),"Military,Municipal Government,Police",58.8607770433688,55.2004473188505,51.8255329735505,71,https://tummgmt.eu.qualtrics.com/Q/File.php?F=F_vZXCQrCnIa6LILT,https://www.ipn.md/en/print/sangerei-town-placed-under-quarantine--7967_1072353.html,2020-05-15,2020-05-15T19:36:57Z
R_2awwRpPDoQYgFbRFx,5176689,new_entry,,,"",The town Sângerei in Moldova will be in lockdown from March 21 until April 1.,2020-03-21,2020-03-21,2020-04-01,The policy has a clear end date,Moldova,MDA,MD,Municipal,1,Singerei,MD-SI,Singerei,Lockdown,,,"",,,,,,"","","","","","","","","","","",,,,"",Yes,Moldova,One or more cities within one or more countries,,Singerei,Singerei,,,All Residents (Citizen Residents + Foreign Residents),,,,Mandatory (Unspecified/Implied),"Military,Municipal Government,Police",58.8607770433688,55.2004473188505,51.8255329735505,71,https://tummgmt.eu.qualtrics.com/Q/File.php?F=F_2Vg2jQSP3nW0V6J,NA,2020-07-22,2020-07-22T14:03:15Z
R_2TMGIOCxQef6dXoNA,1886789,update,End of Policy,,"","The government of the Transnistria region in Moldova have suspended the operation of all public transport beginning March 24. 

As part of the gradual easing of lockdown restrictions, public transport will be permitted to operate freely within the Transnistrian region beginning June 27th. UPDATE: On March 24, authorities in the Transnistria region suspended all public transport. On June 25 the COVID 19 task force of the Interior Ministry of the Transnistrian region decided that as part of the gradual easing of COVID 19 related restrictions, public transport services would be resumed in full beginning June 27, 2020.",2020-03-23,2020-03-24,2020-06-27,The policy has a clear end date,Moldova,MDA,MD,Provincial,1,Transnistria,,,Lockdown,,,"",,,,,,"","","","","","","","","","","",,,,"",Yes,Moldova,One or more provinces within one or more countries,,Transnistria,,,,All Residents (Citizen Residents + Foreign Residents),No special population targeted,,,Mandatory (Unspecified/Implied),New (COVID-19 specific) Task Force,69.0611964910246,65.8523176879416,62.5342724070888,98,https://tummgmt.eu.qualtrics.com/Q/File.php?F=F_3jSQkWpe4msbz8r ; https://tummgmt.eu.qualtrics.com/Q/File.php?F=F_2E6MWQ52ZW78NBb,NA ; https://mvdpmr.org/novosti/resheniya-opershtaba/31844-reshenie-operativnogo-shtaba-ot-25-iunia-2020-goda.html,2020-08-20,2020-08-20T06:52:57Z
R_28GuI0EMHqoFGynBg,9977775,new_entry,,,"","On March 16, Monaco published, on social medias, a graphic sheet for the public to explain for who and how the remote working can be implemented.",2020-03-16,2020-03-16,2020-03-17,The policy is a one-time measure (e.g. publication of guidelines),Moldova,MDA,MD,National,1,,,,Public Awareness Measures,Disseminating information related to COVID-19 to the public that is reliable and factually accurate,,"",,,,,,"","","","","","","","","","","",,,,"",Yes,Moldova,"One or more countries, but not all countries",,,,,,All Residents (Citizen Residents + Foreign Residents),Other population not specifed above,,,Voluntary/Recommended but No Penalties,National Government,53.6191101947075,50.0647371329577,46.4150444558291,88,https://tummgmt.eu.qualtrics.com/Q/File.php?F=F_3lA12jmiN7HFV0f,Twitter,2021-06-04,2021-06-04T20:09:54Z
R_AKSSHrwhnUinXIRFx,2150579,update,End of Policy,,"","The health authorities of Moldova called on the population on March 10 who returned from countries affected by COVID-19 to remain at home for 14 days and not to go to health facilities, if they do not have health problems. From May 27, this is no longer valid for people transporting goods, students, and people traveling for professional or health interests. UPDATE: From May 27, the 14-day self-isolation regime for persons who enter the Republic of Moldova will no longer be mandatory for people transporting goods or travelling for health or humanitarian reasons, students studying at foreign education institutions, and persons who travel for professional interests.",2020-03-10,2020-03-10,2020-05-27,The policy has a clear end date,Moldova,MDA,MD,National,0,,,,Quarantine,Self-Quarantine (i.e. quarantine at home),,"",,,,,,"","","","","","","","","","","",,,,"",Yes,Moldova,"One or more countries, but not all countries",,,,,,All Travelers (Citizen Travelers + Foreign Travelers ),No special population targeted,,,Voluntary/Recommended but No Penalties,Ministry/Department of Health,46.7858369921739,42.2512359361698,37.6273043581155,105,https://tummgmt.eu.qualtrics.com/Q/File.php?F=F_115FnBngdI18CWf ; https://tummgmt.eu.qualtrics.com/Q/File.php?F=F_2v8MperWpJpR492,NA ; https://www.ipn.md/en/print/some-persons-no-longer-obliged-to-self-isolate-when-entering-moldova--7967_1073798.html,2020-05-27,2020-05-27T09:24:32Z
R_3hEm7b327ghVnpAFx,3368694,new_entry,,,"",Residents of the Transnistrian region in Moldova who are returning into the region are from March 17 obliged to stay in home quarantine for 14 days.,2020-03-17,2020-03-17,2020-04-05,The policy has a clear end date,Moldova,MDA,MD,Provincial,0,Transnistria,,,Quarantine,Self-Quarantine (i.e. quarantine at home),,"",,,,,,"","","","","","","","","","","",,,,"",No,All countries,All countries,,,,,,Citizen Travelers,,Inbound,All kinds of transport,Mandatory (Unspecified/Implied),Provincial/State Government,53.9852047885487,50.6440433775985,47.2808144342257,85,https://tummgmt.eu.qualtrics.com/Q/File.php?F=F_3oN5Ef0IYXZl8Fj,https://www.ipn.md/en/print/state-of-emergency-amid-covid-19-pandemic-declared-in-transnistria--7967_1072252.html,2020-05-15,2020-05-15T19:03:06Z
R_z1IRqgPEV3q5841Dn,8279625Dn,update,Change of Policy,Relaxing,timing of policy relaxing,"The Chisinau central market in Moldova will close from March 13 until May 15. UPDATE: Originally, the central market was closed until April 1 but from March 30 it is closed until May 15.",2020-03-13,2020-03-13,2020-05-15,The policy has a clear end date,Moldova,MDA,MD,Municipal,1,Chisinau Municipality,MD-CU,Chisinau,Restriction and Regulation of Businesses,Other Businesses,,"",,,,,,"","","","","","","","","","","",,Non-Essential Businesses,"This type of business  (""Other Businesses"") is closed/locked down","",Yes,Moldova,One or more cities within one or more countries,,Chisinau Municipality,Chisinau,,,All Residents (Citizen Residents + Foreign Residents),,,,Mandatory (Unspecified/Implied),Municipal Government,51.4747805312556,48.0069551441525,44.1000473287961,105,https://tummgmt.eu.qualtrics.com/Q/File.php?F=F_1CKnqoY30m3bNuE ; https://tummgmt.eu.qualtrics.com/Q/File.php?F=F_3r0QsZFAV0BPS7k,NA ; https://www.ipn.md/en/print/central-market-of-chisinau-remains-closed-until-may-15--7967_1072567.html,2020-05-16,2020-05-16T08:40:13Z
R_2S6pDfHqrhEFjgPDn,8279625Dn,update,End of Policy,,"","The Chisinau central market in Moldova will close from March 13 to May 15. UPDATE: It was decided on March 31 2020 that the Central Market of Chisinau, Moldova and all the trading areas situated at 63 Mitropolit Varlam St will remain closed for the duration of the state of emergency that will last until May 15. The previous order stipulated that the Central Market will not work between March 16 and April 1.",2020-03-13,2020-03-13,2020-05-15,The policy has a clear end date,Moldova,MDA,MD,Municipal,1,Chisinau Municipality,MD-CU,Chisinau,Restriction and Regulation of Businesses,Other Businesses,,"",,,,,,"","","","","","","","","","","",,Non-Essential Businesses,"This type of business  (""Other Businesses"") is closed/locked down","",Yes,Moldova,One or more cities within one or more countries,,Chisinau Municipality,Chisinau,,,All Residents (Citizen Residents + Foreign Residents),,,,Mandatory (Unspecified/Implied),Municipal Government,51.4747805312556,48.0069551441525,44.1000473287961,105,https://tummgmt.eu.qualtrics.com/Q/File.php?F=F_1CKnqoY30m3bNuE ; https://tummgmt.eu.qualtrics.com/Q/File.php?F=F_7VEnlixIcQyZNcd,NA ; https://www.ipn.md/en/central-market-of-chisinau-remains-closed-until-may-15-7967_1072567.html,2021-06-05,2021-06-05T08:46:26Z
R_W8PNHhmdQ1RUGwpEt,6141058Et,new_entry,,,"","Public access to theaters, concert halls, museums, libraries, homes of culture and recreation centers in Moldova is suspended from March 16 until April 1.",2020-03-16,2020-03-16,2020-04-01,The policy has a clear end date,Moldova,MDA,MD,National,1,,,,Restriction and Regulation of Government Services,Public libraries,,"",,,,,,"","","","","","","","","","","",,Non-Essential Government Services,This service is no longer provided by the government,"",,Moldova,,,,,,,All Residents (Citizen Residents + Foreign Residents),,,,Mandatory (Unspecified/Implied),National Government,53.6191101947075,50.0647371329577,46.4150444558291,88,https://tummgmt.eu.qualtrics.com/Q/File.php?F=F_2txmtYMRUXNL4NW,https://www.ipn.md/en/public-access-to-theaters-museums-and-libraries-suspended-until-april-7967_1072212.html,2020-05-15,2020-05-15T18:43:03Z
R_W8PNHhmdQ1RUGwpEu,6141058Eu,new_entry,,,"","Public access to theaters, concert halls, museums, libraries, homes of culture and recreation centers in Moldova is suspended from March 16 until April 1.",2020-03-16,2020-03-16,2020-04-01,The policy has a clear end date,Moldova,MDA,MD,National,1,,,,Restriction and Regulation of Government Services,Public museums/galleries,,"",,,,,,"","","","","","","","","","","",,Non-Essential Government Services,This service is no longer provided by the government,"",,Moldova,,,,,,,All Residents (Citizen Residents + Foreign Residents),,,,Mandatory (Unspecified/Implied),National Government,53.6191101947075,50.0647371329577,46.4150444558291,88,https://tummgmt.eu.qualtrics.com/Q/File.php?F=F_2txmtYMRUXNL4NW,https://www.ipn.md/en/public-access-to-theaters-museums-and-libraries-suspended-until-april-7967_1072212.html,2020-05-15,2020-05-15T18:43:03Z
R_2R8QVCfhprfWzDkEa,1988303Ea,new_entry,,,"","From March 27 the Moldovan Post will operate, temporarily, in a special regime and will provide only services of urgent need. The distribution of pensions, state social allowances and other social benefits will proceed at home.",2020-03-27,2020-03-27,,,Moldova,MDA,MD,National,1,,,,Restriction and Regulation of Government Services,Other public facilities,,"",,,,,,"","","","","","","","","","","",,Non-Essential Government Services,This service is no longer provided by the government,"",,Moldova,,,,,,,All Residents (Citizen Residents + Foreign Residents),,,,Mandatory (Unspecified/Implied),"National Government,Provincial/State Government,Municipal Government",75.578402681671,72.1184246560819,68.8456485480033,114,https://tummgmt.eu.qualtrics.com/Q/File.php?F=F_1F2jOdGRvygkTUx,http://www.posta.md/ro/news/2748.html,2020-05-01,2020-05-01T12:49:27Z
R_2WBk1kuZGpiC3EYAt,6232455,new_entry,,,"",The participation in religious activities in Moldova will be banned for two weeks starting March 13.,2020-03-13,2020-03-13,2020-03-27,The policy has a clear end date,Moldova,MDA,MD,National,1,,,,Restrictions of Mass Gatherings,Attendance at religious services restricted (e.g. mosque/church closings),,"",,,,,,"","","","","","","","","","","",,,,"",,Moldova,,,,,,,All Residents (Citizen Residents + Foreign Residents),,,,Mandatory (Unspecified/Implied),National Government,51.4747805312556,48.0069551441525,44.1000473287961,105,https://tummgmt.eu.qualtrics.com/Q/File.php?F=F_27WgD2qU89I2HKd,https://www.ipn.md/en/participation-in-religious-activities-to-be-banned-for-two-weeks-7967_1072162.html,2020-05-15,2020-05-15T16:50:21Z
R_1SypQXgV6aQUYpPAt,6232455,update,Change of Policy,Strengthening,timing of policy strengthening,The participation in religious activities in Moldova will be banned from March 13 until March 31. UPDATE: Religious services were suspended until March 27 but are suspended with a new decree until March 31.,2020-03-13,2020-03-13,2020-03-31,The policy has a clear end date,Moldova,MDA,MD,National,1,,,,Restrictions of Mass Gatherings,Attendance at religious services restricted (e.g. mosque/church closings),,"",,,,,,"","","","","","","","","","","",,,,"",,Moldova,,,,,,,All Residents (Citizen Residents + Foreign Residents),,,,Mandatory (Unspecified/Implied),National Government,51.4747805312556,48.0069551441525,44.1000473287961,105,https://tummgmt.eu.qualtrics.com/Q/File.php?F=F_27WgD2qU89I2HKd ; https://tummgmt.eu.qualtrics.com/Q/File.php?F=F_1l4DyM3ZrIL9gja,NA ; https://www.ipn.md/en/print/covid-19-nationwide-red-alert--7967_1072167.html,2020-05-15,2020-05-15T17:11:35Z
R_28Mtj5gkkgGvExuNA,9692723,update,End of Policy,,"","From March 24, access to parks and other recreational areas in Moldova is forbidden.

Access restrictions to parks and similar outdoor spaces have not been extended past August 31, 2020 UPDATE: Restrictions on access to parks have not been extended past August 31, 2020",2020-03-24,2020-04-25,2020-08-31,The policy has a clear end date,Moldova,MDA,MD,National,1,,,,Social Distancing,,,"",,,,,,"","","","","","","","","","","",,,,"",Yes,Moldova,"One or more countries, but not all countries",,,,,,All Residents (Citizen Residents + Foreign Residents),,,,Mandatory (Unspecified/Implied),"National Government,Military",79.427181321258,76.0839851104264,72.9183830954969,114,https://tummgmt.eu.qualtrics.com/Q/File.php?F=F_3gUaI8AAt8Ny0ZV ; https://tummgmt.eu.qualtrics.com/Q/File.php?F=F_1EXqTi1xGsK2phv,NA ; https://gov.md/sites/default/files/postanovlenie_nchkoz_no_21_ot_24.07.2020_1.pdf,2020-08-30,2020-08-30T01:17:39Z
R_2wTuDsXOdsRDAIrHd,8924457,new_entry,,,"","The wearing of masks in public transport, in commercial and closed public areas and in other places is mandatory in Moldova from May 16. The mask should cover both the mouth and nose.",2020-05-16,2020-05-16,2020-06-30,The policy has a clear end date,Moldova,MDA,MD,National,1,,,,Social Distancing,Wearing Masks in all public spaces/everywhere,,"",,,,,,"","","","","","","","","","","",,,,"",Yes,Moldova,"One or more countries, but not all countries",,,,,,All Residents (Citizen Residents + Foreign Residents),,,,Mandatory (Unspecified/Implied),National Government,75.7716812491018,72.6519627165645,69.3438096546847,101,https://tummgmt.eu.qualtrics.com/Q/File.php?F=F_1PSEyxGOWzImYI8,https://www.ipn.md/en/print/public-health-emergency-declared-in-moldova-until-june-30--7967_1073563.html,2020-05-16,2020-05-16T10:26:24Z
