record_id,policy_id,entry_type,correct_type,update_type,update_level,description,date_announced,date_start,date_end,country,ISO_A3,ISO_A2,init_country_level,domestic_policy,province,ISO_L2,city,type,type_sub_cat,type_text,institution_status,target_country,target_geog_level,target_region,target_province,target_city,target_other,target_who_what,target_direction,travel_mechanism,compliance,enforcer,dist_index_high_est,dist_index_med_est,dist_index_low_est,dist_index_country_rank,link,date_updated,recorded_date
R_2ylrCZze44VYRbyNA,2153708,new_entry,original,,,"The Government of Romania, through the Authority for the Digitization of Romania, and the non-governmental organization Code for Romania launched the online platform COVID-19 Official News (stirioficiale.ro) on Monday, 16.03.2020. The aim of this platform is to fight misinformation and fake news in order to rebuild trust with the state. The site only publishes reliable sources such as press releases from the Romanian government",2020-03-16,2020-03-16,,Romania,ROU,RO,National,1,,,,Anti-Disinformation Measures,,,,Romania,"One or more countries, but not all countries",,,,,All Residents (Citizen Residents + Foreign Residents),,,Voluntary/Recommended but No Penalties,"National Government,New (COVID-19 specific) Task Force",56.1228208897714,52.7985015293745,49.4118525185345,101,https://gov.ro/ro/print?modul=comunicate&link=lansarea-platformei-online-covid-19-stiri-oficiale,2021-01-06,2021-01-06T22:20:54Z
R_2BnZ1b9z8C9Td5sDy,8731531Dy,new_entry,original,,,"On March 9th, Romania announced that all schools would be closed until March 22nd. On March 16, the Education Minister announced that schools would remain closed until after Easter Break (which ends on April 21).",2020-03-09,2020-03-11,2020-04-21,Romania,ROU,RO,National,1,,,,Closure and Regulation of Schools,Preschool or childcare facilities (generally for children ages 5 and below),,Preschool or childcare facilities closed/locked down,Romania,,,,,,All Residents (Citizen Residents + Foreign Residents),,,Mandatory with Legal Penalties (Jail Time),National Government,51.8512987704965,47.9826514418198,44.2342144002926,118,https://www.reuters.com/article/us-health-coronavirus-romania/romania-shuts-schools-halts-italy-flights-to-ward-off-virus-idUSKBN20W2PR ; https://www.romania-insider.com/romania-closes-schools-coronavirus-march-2020 ; https://www.romania-insider.com/anisie-schools-closed-easter,2020-03-30,2020-03-30T22:52:47Z
R_2BnZ1b9z8C9Td5sEa,8731531Ea,new_entry,original,,,"On March 9th, Romania announced that all schools would be closed until March 22nd. On March 16, the Education Minister announced that schools would remain closed until after Easter Break (which ends on April 21).",2020-03-09,2020-03-11,2020-04-21,Romania,ROU,RO,National,1,,,,Closure and Regulation of Schools,Primary Schools (generally for children ages 10 and below),,Primary Schools closed/locked down,Romania,,,,,,All Residents (Citizen Residents + Foreign Residents),,,Mandatory with Legal Penalties (Jail Time),National Government,51.8512987704965,47.9826514418198,44.2342144002926,118,https://www.reuters.com/article/us-health-coronavirus-romania/romania-shuts-schools-halts-italy-flights-to-ward-off-virus-idUSKBN20W2PR ; https://www.romania-insider.com/romania-closes-schools-coronavirus-march-2020 ; https://www.romania-insider.com/anisie-schools-closed-easter,2020-03-30,2020-03-30T22:52:47Z
R_2BnZ1b9z8C9Td5sFj,8731531Fj,new_entry,original,,,"On March 9th, Romania announced that all schools would be closed until March 22nd. On March 16, the Education Minister announced that schools would remain closed until after Easter Break (which ends on April 21).",2020-03-09,2020-03-11,2020-04-21,Romania,ROU,RO,National,1,,,,Closure and Regulation of Schools,Secondary Schools (generally for children ages 10 to 18),,Secondary Schools closed/locked down,Romania,,,,,,All Residents (Citizen Residents + Foreign Residents),,,Mandatory with Legal Penalties (Jail Time),National Government,51.8512987704965,47.9826514418198,44.2342144002926,118,https://www.reuters.com/article/us-health-coronavirus-romania/romania-shuts-schools-halts-italy-flights-to-ward-off-virus-idUSKBN20W2PR ; https://www.romania-insider.com/romania-closes-schools-coronavirus-march-2020 ; https://www.romania-insider.com/anisie-schools-closed-easter,2020-03-30,2020-03-30T22:52:47Z
R_1od9G8xf4eOKkV0Dy,8730434Dy,new_entry,original,,,"On April 27th 2020, Romanian President Klaus Iohannis stated in a press release by the National Liberal Party that schools would remain closed for most students until the end of the school year- June 12th 2020. Online learning would continue for these students.

Students in the 8th and 12th grades could come into school from the period of June 2nd to June 12th to prepare for national exams for high school and university. Class sizes were restricted to a maximum of 10 students, and they would only be at school for 3 hours a day, maximum. Exams would continue with social distancing measures observed.",2020-04-27,2020-04-27,2020-06-12,Romania,ROU,RO,National,1,,,,Closure and Regulation of Schools,Preschool or childcare facilities (generally for children ages 5 and below),,Preschool or childcare facilities closed/locked down,Romania,"One or more countries, but not all countries",,,,,All Residents (Citizen Residents + Foreign Residents),,,Mandatory (Unspecified/Implied),"National Government,Ministry/Department of Education",80.8280588293111,78.0877577248637,74.7307173789817,125,https://www.romania-insider.com/schools-closed-romania-distance-learning ; https://www.news.ro/politic-intern/iohannis-acest-an-scolar-gradinitele-scolile-universitatile-redeschid-anul-scolar-incheie-12-iunie-persoanele-peste-65-ani-pot-iesi-casa-doua-intervale-dimineata-seara-ajutor-medical-r-moldova-video-1922400127002020041419345387,2021-01-11,2021-01-11T15:58:57Z
R_1od9G8xf4eOKkV0Ea,8730434Ea,new_entry,original,,,"On April 27th 2020, Romanian President Klaus Iohannis stated in a press release by the National Liberal Party that schools would remain closed for most students until the end of the school year- June 12th 2020. Online learning would continue for these students.

Students in the 8th and 12th grades could come into school from the period of June 2nd to June 12th to prepare for national exams for high school and university. Class sizes were restricted to a maximum of 10 students, and they would only be at school for 3 hours a day, maximum. Exams would continue with social distancing measures observed.",2020-04-27,2020-04-27,2020-06-12,Romania,ROU,RO,National,1,,,,Closure and Regulation of Schools,Primary Schools (generally for children ages 10 and below),,Primary Schools closed/locked down,Romania,"One or more countries, but not all countries",,,,,All Residents (Citizen Residents + Foreign Residents),,,Mandatory (Unspecified/Implied),"National Government,Ministry/Department of Education",80.8280588293111,78.0877577248637,74.7307173789817,125,https://www.romania-insider.com/schools-closed-romania-distance-learning ; https://www.news.ro/politic-intern/iohannis-acest-an-scolar-gradinitele-scolile-universitatile-redeschid-anul-scolar-incheie-12-iunie-persoanele-peste-65-ani-pot-iesi-casa-doua-intervale-dimineata-seara-ajutor-medical-r-moldova-video-1922400127002020041419345387,2021-01-11,2021-01-11T15:58:57Z
R_1od9G8xf4eOKkV0Fj,8730434Fj,new_entry,original,,,"On April 27th 2020, Romanian President Klaus Iohannis stated in a press release by the National Liberal Party that schools would remain closed for most students until the end of the school year- June 12th 2020. Online learning would continue for these students.

Students in the 8th and 12th grades could come into school from the period of June 2nd to June 12th to prepare for national exams for high school and university. Class sizes were restricted to a maximum of 10 students, and they would only be at school for 3 hours a day, maximum. Exams would continue with social distancing measures observed.",2020-04-27,2020-04-27,2020-06-12,Romania,ROU,RO,National,1,,,,Closure and Regulation of Schools,Secondary Schools (generally for children ages 10 to 18),,Secondary Schools allowed to open with conditions,Romania,"One or more countries, but not all countries",,,,,All Residents (Citizen Residents + Foreign Residents),,,Mandatory (Unspecified/Implied),"National Government,Ministry/Department of Education",80.8280588293111,78.0877577248637,74.7307173789817,125,https://www.romania-insider.com/schools-closed-romania-distance-learning ; https://www.news.ro/politic-intern/iohannis-acest-an-scolar-gradinitele-scolile-universitatile-redeschid-anul-scolar-incheie-12-iunie-persoanele-peste-65-ani-pot-iesi-casa-doua-intervale-dimineata-seara-ajutor-medical-r-moldova-video-1922400127002020041419345387,2021-01-11,2021-01-11T15:58:57Z
R_zciJN5uExcnyb8RNA,9136308,update,original,End of Policy,,"Romania imposed a curfew starting on the 21st of March 2020. 
In the time interval 22.00 - 06.00, the movement of persons outside the household is allowed only for medical purposes, work, acquiring goods to cover basic needs- including those of pets, caring for a child/elderly person, short physical activity trips including walking pets.

In order to verify the reason for traveling in the professional interest, the persons are obliged to present, at the request of the competent authorities staff, the service card, the certificate issued by the employer or a declaration on their own responsibility or a declaration on their own responsibility, completed in advance.

The declaration on one's own responsibility must include the name and surname, date of birth, residential address/ place of professional activity, reason for travel, date of completion and signature.

The exceptions to these provisions are the personnel within the Presidential Administration, the Romanian Parliament, the Romanian Government, the Public Ministry, the institutions of the national defense system, public order and national security, the diplomatic corps and the personnel providing public utility services.

 UPDATE: The curfew was lifted on May 15th 2020",2020-03-21,2020-03-22,2020-05-15,Romania,ROU,RO,National,1,,,,Curfew,,,,Romania,"One or more countries, but not all countries",,,,,All Residents (Citizen Residents + Foreign Residents),,,Mandatory with Legal Penalties (Jail Time),"National Government,Military,Police,Other (Please specify in the text box)",63.7836796078658,60.4088107783799,57.8408013391813,88,NA ; https://stirioficiale.ro/hotarari/anexa-hotarare-nr-24-din-14-05-2020,2021-03-22,2021-03-22T23:34:34Z
R_2Ys8IVYlAV9rSrANA,5914518,update,original,Change of Policy,Relaxing,"On March 24, 2020, Romania imposed a curfew on all over 65-year-olds, who are only allowed to leave home between 11:00am and 1:00pm for medical treatments, providing goods that cover the basic needs of persons and pets, and moving for justified reasons, such as caring for a minor, assisting other elderly, sick or disabled people, or in case of death of a family member.
 UPDATE: On April 27, 2020, Romania  imposed a curfew on all over 65-year-olds, who are only allowed to leave home between 7:00am and 11:00am, and 7:00pm and 10:00pm for provision of goods that cover the basic needs of persons and pets, and for justified reasons, such as caring for a minor, assisting other elderly, sick or disabled people, or in case of death of a family member. Travel for medical treatments, professional activities, and agricultural purposes are allowed irrespective of the time slots.",2020-04-27,2020-04-27,,Romania,ROU,RO,National,1,,,,Curfew,,,,Romania,,,,,,All Residents (Citizen Residents + Foreign Residents),,,Mandatory with Exceptions (Please list exceptions in the text entry),"National Government,Ministry/Department of Health,Police",80.8280588293111,78.0877577248637,74.7307173789817,125,NA ; https://stirioficiale.ro/hotarari/ordonanta-militara-nr-10-din-27-04-2020,2021-03-31,2021-03-31T12:39:31Z
R_1pzEkZDbbcaaYaGNA,5914518,update,original,Change of Policy,Relaxing,"On March 24, 2020, Romania imposed a curfew on all over 65-year-olds, who are only allowed to leave home between 11:00am and 1:00pm for medical treatments, providing goods that cover the basic needs of persons and pets / pets, and moving for justified reasons, such as caring for / accompanying a minor, assisting other elderly, sick or disabled people, or in case of death of a family member.
 UPDATE: On April 27, 2020, Romania posed a curfew on all over 65-year-olds, who are only allowed to leave home between 7:00am and 11:00am, and 7:00pm to 10:00pm for provision of goods that cover the basic needs of persons and pets, and justified reasons such as caring for / accompanying a minor, assisting other elderly, sick or disabled people, or in the event of the death of a family member. Travel for medical treatment, professional activities, and agricultural purposes are allowed irrespective of the time slots.",2020-04-27,2020-04-27,,Romania,ROU,RO,National,1,,,,Curfew,,,,Romania,,,,,,All Residents (Citizen Residents + Foreign Residents),,,Mandatory with Exceptions (Please list exceptions in the text entry),"National Government,Ministry/Department of Health,Police",80.8280588293111,78.0877577248637,74.7307173789817,125,NA ; https://stirioficiale.ro/hotarari/ordonanta-militara-nr-10-din-27-04-2020,2021-04-07,2021-04-07T12:28:51Z
R_eQhRGjaRCzk9bnrNA,9952364,new_entry,original,,,Romania declared a state of emergency on March 16th.,2020-03-16,2020-03-16,2020-04-15,Romania,ROU,RO,National,1,,,,Declaration of Emergency,,,,Romania,,,,,,All Residents (Citizen Residents + Foreign Residents),,,Mandatory with Legal Penalties (Jail Time),National Government,56.1228208897714,52.7985015293745,49.4118525185345,101,https://www.euronews.com/2020/03/16/romania-declares-state-of-emergency-over-covid-19-outbreak,2020-04-01,2020-04-01T13:56:45Z
R_r2Qbx6MCKTGHEANNA,4286076,new_entry,original,,,"Romania's President announced an extension to the state of emergency, that has been in place since March 16th.",2020-04-06,2020-04-16,2020-05-16,Romania,ROU,RO,National,1,,,,Declaration of Emergency,,,,Romania,,,,,,All Residents (Citizen Residents + Foreign Residents),,,Mandatory with Legal Penalties (Jail Time),"National Government,Ministry/Department of Health,Military,Police",81.090313721395,78.058009768576,75.2131408108467,124,https://www.romania-insider.com/coronavirus-romania-president-extend-state-emergency,2020-04-06,2020-04-06T14:59:05Z
R_1lahYLtV9aa1HYoNA,2173258,new_entry,original,,,"On 14 May 2020, the National Committee for Emergency Situation issued Decision no. 24 approving the state of alert on national level, as well as specific measures for controlling and preventing the spread of COVID-19.",2020-05-14,2020-05-15,2020-06-15,Romania,ROU,RO,National,1,,,,Declaration of Emergency,,,,Romania,"One or more countries, but not all countries",,,,,All Residents (Citizen Residents + Foreign Residents),,,Mandatory (Unspecified/Implied),National Government,70.8260547914728,66.7599212124355,63.0017682910202,76,https://www.cms-lawnow.com/ealerts/2020/05/romania-dials-down-restrictions-and-institutes-new-state-of-alert,2020-06-23,2020-06-23T20:24:14Z
R_ZEKVa9f6uZlXg3vNA,7496677,new_entry,correction,,,"Starting on March 9, 2020, Romania suspended all flights from and to Italy for 14 days.",2020-03-09,2020-03-09,2020-03-23,Romania,ROU,RO,National,1,,,,External Border Restrictions,,,,Italy,"One or more countries, but not all countries",,,,,All Residents (Citizen Residents + Foreign Residents),Inbound/Outbound,Flights,Mandatory with Legal Penalties (Jail Time),National Government,47.4117576005556,44.1629464608654,40.052108072534,119,https://www.euractiv.com/section/all/short_news/romania-suspends-flights-from-and-towards-italy/,2021-02-26,2021-02-26T14:05:06Z
R_1QtillYAZJwli93NA,1589628,new_entry,correction,,,"On March 17, 2020, Romania announced that ""All flights performed by economic operators to Spain and from Spain to Romania, for all airports in Romania, shall be suspended for a period of 14 days""starting on March 18, 2020.",2020-03-17,2020-03-18,2020-03-31,Romania,ROU,RO,National,1,,,,External Border Restrictions,,,,Spain,"One or more countries, but not all countries",,,,,All Residents (Citizen Residents + Foreign Residents),Inbound/Outbound,All kinds of transport,Mandatory with Legal Penalties (Jail Time),"National Government,Ministry/Department of Health,Military,Police",57.4196717040408,54.5759692662979,51.4127075552185,97,NA ; https://stirioficiale.ro/hotarari/ordonanta-militara-nr-1-din-17-martie-2020,2021-02-24,2021-02-24T14:12:02Z
R_2xWbcgDloBRp2jBNA,7496677,update,correction,,Strengthening,"On March 9, 2020, Romania suspended all flights from and to Italy for 14 days. 
 UPDATE: On March 17, 2020, Romania announced that ""The measure of suspension of flights performed by air economic operators to Italy and from Italy to Romania is extended for a period of 14 days, starting on March 23, 2020.""",2020-03-17,2020-03-23,2020-04-05,Romania,ROU,RO,National,1,,,,External Border Restrictions,,,,Italy,"One or more countries, but not all countries",,,,,All Residents (Citizen Residents + Foreign Residents),Inbound/Outbound,Flights,Mandatory with Legal Penalties (Jail Time),National Government,64.8549815346949,61.8638197637589,58.7703947291588,84,https://www.euractiv.com/section/all/short_news/romania-suspends-flights-from-and-towards-italy/,2021-03-01,2021-03-01T12:46:51Z
R_2pKrtFwkjuUKEPBNA,7232167,new_entry,correction,,,"On March 24, 2020, Romania announced that all flights to France and Germany and from France and Germany to Romania are suspended for all airports in Romania for a period of 14 days starting on March 25, 2020.",2020-03-24,2020-03-25,2020-04-07,Romania,ROU,RO,National,1,,,,External Border Restrictions,,,,"France,Germany","One or more countries, but not all countries",,,,,All Residents (Citizen Residents + Foreign Residents),Inbound/Outbound,Flights,Mandatory with Legal Penalties (Jail Time),"National Government,Military",67.4201887072314,64.5264113545729,61.2033648867318,89,NA ; https://stirioficiale.ro/hotarari/ordonanta-militara-nr-3-din-24-03-2020-privind-masuri-de-prevenire-a-raspandirii-covid-19,2021-02-24,2021-02-24T00:59:18Z
R_2BhuGpCh0PSm9MeNA,1589628,update,correction,,Strengthening,"On March 17, 2020, Romania announced that ""All flights performed by economic operators to Spain and from Spain to Romania, for all airports in Romania, shall be suspended for a period of 14 days""starting on March 18, 2020.
 UPDATE: On March 30, 2020, Romania announced that ""The measure of suspension of flights performed by air economic operators to Spain and from Spain to Romania is extended for a period of 14 days, starting on March 31, 2020 at 18.00.""",2020-03-30,2020-03-31,2020-04-13,Romania,ROU,RO,National,1,,,,External Border Restrictions,,,,Spain,"One or more countries, but not all countries",,,,,All Residents (Citizen Residents + Foreign Residents),Inbound/Outbound,All kinds of transport,Mandatory with Legal Penalties (Jail Time),"National Government,Ministry/Department of Health,Military,Police",76.315151920135,73.0680499617703,69.6347867899278,110,https://www.mai.gov.ro/wp-content/uploads/2020/03/MILITARY-ORDINANCE-no.-1-1.pdf,2021-03-01,2021-03-01T12:49:17Z
R_2U602KF6sWhC4gHNA,3230679,new_entry,correction,,,"Announced on April 4, 2020, Romania banned all flights to and from Austria, Belgium, the Swiss Confederation, the United States of America, the United Kingdom of Great Britain and Northern Ireland, the Kingdom of the Netherlands, Turkey and Iran for a period of 14 days, starting on April 5, 2020.",2020-04-04,2020-04-05,2020-04-18,Romania,ROU,RO,National,1,,,,External Border Restrictions,,,,"Austria,Belgium,Iran,Netherlands,Switzerland,Turkey,United Kingdom,United States","One or more countries, but not all countries",,,,,All Residents (Citizen Residents + Foreign Residents),Inbound/Outbound,Flights,Mandatory with Legal Penalties (Jail Time),"National Government,Military,Police",79.9349902731857,77.0791516114229,73.4666719186923,123,https://www.mai.gov.ro/wp-content/uploads/2019/01/ordonanta-militara-7-din-4-aprilie-2020-engl.pdf,2021-03-01,2021-03-01T13:17:51Z
R_3JK8YS29m6JuGRKNA,7496677,update,original,Change of Policy,Strengthening,"Starting on March 9, 2020, Romania suspended all flights from and to Italy for 14 days. UPDATE: On March 30, 2020, Romanian government announced that ""The measure of suspension of flights performed by air economic operators to Italy and from Italy to Romania is extended for a period of 14 days, starting on April 6, 2020.""",2020-03-30,2020-04-06,2020-04-19,Romania,ROU,RO,National,1,,,,External Border Restrictions,,,,Italy,"One or more countries, but not all countries",,,,,All Residents (Citizen Residents + Foreign Residents),Inbound/Outbound,Flights,Mandatory with Legal Penalties (Jail Time),National Government,80.343843686141,77.1395270240211,74.2661575181276,123,NA ; https://stirioficiale.ro/hotarari/ordonanta-militara-nr-5-din-30-03-2020,2021-03-01,2021-03-01T12:56:04Z
R_stGJgvTCeWaN0cNNA,7232167,update,original,Change of Policy,Strengthening,"On March 24, 2020, Romania announced that all flights to France and Germany and from France and Germany to Romania are suspended for all airports in Romania for a period of 14 days starting on March 25, 2020. UPDATE: On April 4, 2020, Romanian Minister of Interior announced that ""The measure of suspension of flights performed by air economic operators to France and Germany and from these countries to Romania is extended for a period of 14 days, starting on April 8, 2020.""",2020-04-04,2020-04-08,2020-04-21,Romania,ROU,RO,National,1,,,,External Border Restrictions,,,,"France,Germany","One or more countries, but not all countries",,,,,All Residents (Citizen Residents + Foreign Residents),Inbound/Outbound,Flights,Mandatory with Legal Penalties (Jail Time),"National Government,Military",80.6885628249054,77.3584844781227,74.0926004042367,123,NA ; https://stirioficiale.ro/hotarari/ordonanta-militara-nr-3-din-24-03-2020-privind-masuri-de-prevenire-a-raspandirii-covid-19 ; https://stirioficiale.ro/hotarari/ordonanta-militara-nr-7-din-04-04-2020,2021-03-01,2021-03-01T13:31:09Z
R_9HpF3t9QsYtmgeJFw,1322644,update,original,Change of Policy,Strengthening,"On March 21, 2020, the Romanian Minister of the Interior announced an external border restriction as follows: ""it is prohibited the entry on the Romanian territory, through the state border crossing points, of foreign citizens and stateless persons"" starting on March 22, 2020. UPDATE: On April 9, 2020, Romania announced that ""It is extended, according to annex no.1 to this military ordinance, for the entire period of the state of emergency, the temporary closure - total or partial - of the state border crossing points.""",2020-04-09,2020-04-09,,Romania,ROU,RO,National,1,,,,External Border Restrictions,Total border crossing ban,,,All countries,All countries,,,,,All Residents (Citizen Residents + Foreign Residents),Inbound,Land Border,Mandatory with Exceptions (Please list exceptions in the text entry),"National Government,Police",80.8110414152804,77.7690053433862,74.7865252723015,125,NA ; https://stirioficiale.ro/hotarari/ordonanta-militara-nr-8-din-09-04-2020,2021-03-01,2021-03-01T14:03:43Z
R_24IZeY9GslCfP0iNA,1589628,update,original,Change of Policy,Strengthening,"On March 17, 2020, Romania announced that ""All flights performed by economic operators to Spain and from Spain to Romania, for all airports in Romania, shall be suspended for a period of 14 days""starting on March 18, 2020. UPDATE: On April 9, 2020, The Romanian Minister of Interior announced that ""The measure of suspension of flights performed by air economic operators to Spain and from Spain to Romania is extended for a period of 14 days, starting from April 14, 2020.""",2020-04-09,2020-04-14,2020-04-27,Romania,ROU,RO,National,1,,,,External Border Restrictions,,,,Spain,"One or more countries, but not all countries",,,,,All Residents (Citizen Residents + Foreign Residents),Inbound/Outbound,All kinds of transport,Mandatory with Legal Penalties (Jail Time),"National Government,Ministry/Department of Health,Military,Police",81.0551036593912,78.2252037984847,75.205687665666,125,NA ; https://stirioficiale.ro/hotarari/ordonanta-militara-nr-1-din-17-martie-2020 ; https://stirioficiale.ro/hotarari/ordonanta-militara-nr-8-din-09-04-2020,2021-03-01,2021-03-01T13:54:13Z
R_1pWqo2Fq3RbHTyiNA,3230679,update,original,Change of Policy,Strengthening,"Romania banned all flights to and from Austria, Belgium, the Swiss
Confederation, the United States of America, the United Kingdom of Great Britain and Northern Ireland, the Kingdom of the Netherlands, Turkey and Iran for a period of 14 days. UPDATE: On April 16, 2020, Romania announced that ""The measure of suspension of flights to Austria, Belgium, the Swiss Confederation, the United States of America, the United Kingdom of Great Britain and Northern Ireland, the Kingdom of the Netherlands, Turkey and Iran and from these countries to Romania, for all airports in Romania, for a period of 14 days, starting with April 18, 2020.""",2020-04-16,2020-04-18,2020-05-01,Romania,ROU,RO,National,1,,,,External Border Restrictions,,,,"Austria,Belgium,Iran,Netherlands,Switzerland,Turkey,United Kingdom,United States","One or more countries, but not all countries",,,,,All Residents (Citizen Residents + Foreign Residents),Inbound/Outbound,Flights,Mandatory with Legal Penalties (Jail Time),"National Government,Military,Police",80.5283706687135,78.0889306007758,74.8474061016266,124,NA ; https://stirioficiale.ro/hotarari/ordonanta-militara-nr-9-din-16-aprilie-2020,2021-03-01,2021-03-01T14:11:44Z
