record_id,policy_id,entry_type,update_type,update_level,update_level_var,description,date_announced,date_start,date_end,date_end_spec,country,ISO_A3,ISO_A2,init_country_level,domestic_policy,province,ISO_L2,city,type,type_sub_cat,type_new_admin_coop,type_vac_cat,type_vac_mix,type_vac_reg,type_vac_purchase,type_vac_group,type_vac_group_rank,type_vac_who_pays,type_vac_dist_admin,type_vac_loc,type_vac_cost_num,type_vac_cost_scale,type_vac_cost_unit,type_vac_cost_gov_perc,type_vac_amt_num,type_vac_amt_scale,type_vac_amt_unit,type_vac_amt_gov_perc,type_text,institution_cat,institution_status,institution_conditions,target_init_same,target_country,target_geog_level,target_region,target_province,target_city,target_intl_org,target_other,target_who_what,target_who_gen,target_direction,travel_mechanism,compliance,enforcer,dist_index_high_est,dist_index_med_est,dist_index_low_est,dist_index_country_rank,pdf_link,link,collab,collab_id,date_updated,recorded_date
R_3MDTri23skRbxB7Dz,5337492,new_entry,,,"","Sarawak(Malaysia) will receive 380,000 doses of vaccine every week from 9th June till the end of  August. From there, continuous delivery of vaccines will be done weekly until the total amount of vaccines delivered reaches 4.4 million doses by the end of August.
National Covid-19 Immunisation Programme Coordinating Minister Khairy Jamaluddin said with the supply, Sarawak was expected to be the first state in Malaysia to complete the Covid-19 Immunisation Programme with the vaccination of 2.2 million people.
According to him, the commitment to deliver the vaccine supply had been agreed upon during his meeting with Sarawak Chief Minister Datuk Patinggi Abang Johari Tun Openg.
",2021-05-28,2021-06-09,2021-06-24,The policy has an imprecise natural end date (e.g. masks will be distributed until they run out),Malaysia,MYS,MY,National,0,,,,Health Resources,Other Health Materials,,"",,,,,,"","","","","","","","","","","",,,,"",No,Malaysia,One or more provinces within one or more countries,,Sarawak,,,,All Residents (Citizen Residents +Foreign Residents),Other population not specifed above,,Not Applicable,Mandatory (Unspecified/Implied),"National Government,Provincial/State Government,Other (Please specify in the text box)",,,,,https://tummgmt.eu.qualtrics.com/Q/File.php?F=F_8xdlYVQldD4VhAt,https://www.nst.com.my/news/nation/2021/05/694008/sarawak-receive-380000-vaccine-doses-week ; https://dayakdaily.com/sarawak-to-have-4-4-million-vaccine-doses-by-end-of-august-first-state-to-complete-immunisation/ ; https://www.bernama.com/en/general/news_covid-19.php?id=1969468,CoronaNet (original),,2021-09-16,2021-09-16T14:55:35Z
R_1n0C7SewrHwri88Bt,2218142,new_entry,,,"","March 13 - In Malaysia, health officials have been working round the clock conducting the Mass Screening of Covid-19 at Masjid Jamek Seri Petaling, Kuala Lumpur since the last two days. Health officers are supported by staff deployed from other states to trace and track all participants.The Health Ministry revealed that about 16,000 people attended the ‘Ijtima Tabligh’ (religious) gathering at Masjid Jamek Sri Petaling from Feb 27 to March 1. Of this, 14,500 of them were Malaysians, while the rest were international participants. To date, 40 of the Malaysian attendees have tested positive for Covid-19.",2020-03-13,2020-03-11,2020-03-13,The policy is a one-time measure (e.g. publication of guidelines),Malaysia,MYS,MY,National,0,,,,Health Testing,Fixed Health Testing stations (excluding drive-ins),,"",,,,,,"","","","","","","","","","","",,,,"",Yes,Malaysia,"One or more countries, but not all countries",,,,,,,Confirmed contact to a person infected with COVID-19,,,Mandatory (Unspecified/Implied),"National Government,Ministry/Department of Health",44.4671176278109,41.4521934729476,37.7586549655273,95,https://tummgmt.eu.qualtrics.com/Q/File.php?F=F_1DOPIifmYvYwQsd,https://www.channelnewsasia.com/news/asia/malaysia-mass-screening-covid-19-coronavirus-mosque-sri-petaling-12535358 ; https://www.nst.com.my/news/nation/2020/03/574484/14500-msians-tabligh-gathering-40-test-positive-covid-19,CoronaNet (original),,2022-06-27,2022-06-27T23:59:59Z
R_2B5KzOCooT97xgKBt,6017888,new_entry,,,"","April 5 — Health officials have opened a clinic to screen Rohingyas in Selayang for the coronavirus disease (Covid-19) said Health director-general Datuk Dr Noor Hisham Abdullah. Dr Noor Hisham said the ministry was actively screening high-risk and vulnerable groups such as the Rohingyas to break the chain of any possible Covid-19 infections in their ranks.“We have opened a clinic and have screened them and those who have come forward to do the screening. So we have done it, whether they are citizens or not, but we work with NGOs (non-governmental organisations) such as the UNHCR (United Nations High Commissioner for Refugees), Mercy (Medical Relief Society Malaysia ) and others for non-citizens. Our screening is free, the objective is to detect. Those who are positive or were exposed, we will quarantine,’’ he said.",2020-04-05,2020-04-05,,The policy’s end date is unknown or unreported,Malaysia,MYS,MY,National,0,,,,Health Testing,Fixed Health Testing stations (excluding drive-ins),,"",,,,,,"","","","","","","","","","","",,,,"",Yes,Malaysia,"One or more countries, but not all countries",,,,,,,Everyone (i.e. Asymptomatic and symptomatic people),,,Voluntary/Recommended but No Penalties,Ministry/Department of Health,61.4172160606496,58.5895446898895,55.4901153910546,25,https://tummgmt.eu.qualtrics.com/Q/File.php?F=F_3DpWk12yqNuUR6o,https://www.malaymail.com/news/malaysia/2020/04/05/new-clinic-to-screen-rohingya-for-covid-19-in-selayang-says-health-dg/1853818 ; https://www.sinarharian.com.my/article/77486/KHAS/Covid-19/Etnik-Rohingya-di-Pasar-Borong-Selayang-positif-Covid-19,CoronaNet (original),,2022-06-27,2022-06-27T23:59:59Z
R_3dPJp7zihGpN8RkBj,7416818,new_entry,,,"","In Malaysia, beginning April 8, Health Ministry officials carried out Covid-19 screening operations at the Selangor Mansion and Malayan Mansion buildings in Jalan Masjid India, Kuala Lumpur. 50 staff in full-body protection suits were taking samples from residents since morning, with most residents seen giving good cooperation. The two buildings have been placed under the Enhanced movement control order (EMCO) since April 7, following the discovery of 15 Covid-19 positive cases there.",2020-04-07,2020-04-08,2020-04-28,The policy has a clear end date,Malaysia,MYS,MY,National,0,,,,Health Testing,Door-to-door Testing,,"",,,,,,"","","","","","","","","","","",,,,"",No,Malaysia,One or more geographical or administrative units (other than provincial or city level units) within one or more countries,,Kuala Lumpur,,,"Selangor Mansion & Malayan Mansion, Jalan Masjid India (Kuala Lumpur)",All Residents (Citizen Residents +Foreign Residents),Everyone (i.e. Asymptomatic and symptomatic people),,Not Applicable,Mandatory (Unspecified/Implied),"National Government,Ministry/Department of Health,Military,Police",61.082895724804,58.3415070231098,55.6724562035075,21,https://tummgmt.eu.qualtrics.com/Q/File.php?F=F_1LS5o4G4Tn8Ki2s,https://www.thestar.com.my/news/nation/2020/04/07/covid-19-5k-residents-at-s039gor-malayan-mansion-to-be-tested-in-10-days ; https://www.malaymail.com/news/malaysia/2020/04/08/moh-officials-carry-out-sanitisation-covid-19-screenings-at-selangor-malaya/1854825,CoronaNet (original),,2021-01-03,2021-01-03T03:20:02Z
R_3g4TYMUKcUR8qqZCv,4972507,new_entry,,,"","In Malaysia, the Selangor government on Saturday (April 11) conducted a large-scale community screening test for Covid-19 at hotspots in Hulu Langat to help flatten the infection curve in the state. The screening tests were conducted by 48 medical personnel and targeting high-risk groups such as senior citizens. Between 400 and 500 targeted screening tests were carried out per day to allow more cases of infection to be identified.",2020-04-11,2020-04-11,2020-04-13,The policy is a one-time measure (e.g. publication of guidelines),Malaysia,MYS,MY,Provincial,0,Selangor,,,Health Testing,Mobile Health Testing Stations (excluding drive-ins),,"",,,,,,"","","","","","","","","","","",,,,"",Yes,Malaysia,One or more provinces within one or more countries,,Selangor,,,,,Asymptomatic people,,,Voluntary/Recommended but No Penalties,"Ministry/Department of Health,Provincial/State Government,Police",60.9213914351255,58.4089554711219,55.546977590763,20,https://tummgmt.eu.qualtrics.com/Q/File.php?F=F_OQiH3UsjmCoKbwR,https://www.thestar.com.my/news/nation/2020/04/11/covid-19-large-scale-community-screening-tests-conducted-in-hulu-langat ; https://www.hmetro.com.my/mutakhir/2020/04/565257/covid-19-saringan-besar-besaran-di-hulu-langat,CoronaNet (original),,2022-06-27,2022-06-27T23:59:59Z
R_1lz9eXzEciawaugCv,4972507,update,End of Policy,,"","In Malaysia, the Selangor government on Saturday (April 11) conducted a large-scale community screening test for Covid-19 at hotspots in Hulu Langat to help flatten the infection curve in the state. The screening tests were conducted by 48 medical personnel and targeting high-risk groups such as senior citizens. Between 400 and 500 targeted screening tests were carried out per day to allow more cases of infection to be identified. UPDATE: Coding the end of data",2020-04-11,2020-04-11,2020-04-13,The policy is a one-time measure (e.g. publication of guidelines),Malaysia,MYS,MY,Provincial,0,Selangor,,,Health Testing,Mobile Health Testing Stations (excluding drive-ins),,"",,,,,,"","","","","","","","","","","",,,,"",Yes,Malaysia,One or more provinces within one or more countries,,Selangor,,,,,Asymptomatic people,,,Voluntary/Recommended but No Penalties,"Ministry/Department of Health,Provincial/State Government,Police",60.9213914351255,58.4089554711219,55.546977590763,20,https://tummgmt.eu.qualtrics.com/Q/File.php?F=F_OQiH3UsjmCoKbwR,https://www.thestar.com.my/news/nation/2020/04/11/covid-19-large-scale-community-screening-tests-conducted-in-hulu-langat ; https://www.hmetro.com.my/mutakhir/2020/04/565257/covid-19-saringan-besar-besaran-di-hulu-langat,CoronaNet (original),,2021-06-05,2021-06-05T04:22:47Z
R_2bH75Hgvp967Y67Bj,1214289,new_entry,,,"","In Malaysia, the popular shopping streets in downtown Kuala Lumpur known as the Jalan Masjid India district have been placed under total lockdown after more than 40 people tested positive for Covid-19. Under the EMCO, health officials will screen and check the health status of every resident.  EMCO is slated for the area on Tuesday (April 14) until April 28.",2020-04-14,2020-04-14,2020-04-28,The policy has a clear end date,Malaysia,MYS,MY,National,0,,,,Health Testing,Door-to-door Testing,,"",,,,,,"","","","","","","","","","","",,,,"",No,Malaysia,One or more geographical or administrative units (other than provincial or city level units) within one or more countries,,Kuala Lumpur,,,Jalan Tuanku Abdul Rahman (Kuala Lumpur);  Jalan Dang Wangi (Kuala Lumpur); Jalan Tun Perak (Kuala Lumpur); Jalan Melaka (Kuala Lumpur); Jalan Ampang (Kuala Lumpur),All Residents (Citizen Residents +Foreign Residents),Everyone (i.e. Asymptomatic and symptomatic people),,Not Applicable,Mandatory (Unspecified/Implied),"National Government,Ministry/Department of Health,Military,Police",61.1445712410661,58.1246078713467,55.2547379724036,19,https://tummgmt.eu.qualtrics.com/Q/File.php?F=F_3iq9Uah0IKPxZjA,https://www.straitstimes.com/asia/se-asia/coronavirus-malaysias-popular-shopping-streets-jalan-masjid-india-under-total-lockdown ; https://www.malaymail.com/news/malaysia/2020/04/15/health-d-g-says-historic-jalan-masjid-india-under-lockdown-over-high-foreig/1856728,CoronaNet (original),,2021-01-05,2021-01-05T17:54:45Z
R_2aPLdfH0s8rBZYuCd,2753991,new_entry,,,"","In Malaysia, over 600 Kampung Baru residents underwent the compulsory Covid-19 screening test on April 17, following the classification of the area as one of the red zones and proximity to Selangor and Malayan Mansion. There will be other sessions held until April 21. The turnout numbers in the first screening session held at the Sekolah Rendah Agama Jalan Raja Muda Musa here were larger than 400 targeted, thanks to the effective communications by the Ministry of Health (MOH).",2020-04-17,2020-04-17,2020-04-21,The policy has a clear end date,Malaysia,MYS,MY,National,0,,,,Health Testing,Health testing of entire population under the government's jurisdiction,,"",,,,,,"","","","","","","","","","","",,,,"",No,Malaysia,One or more geographical or administrative units (other than provincial or city level units) within one or more countries,,Kuala Lumpur,,,Kampung Baru (Kuala Lumpur),All Residents (Citizen Residents +Foreign Residents),No special population targeted,,Not Applicable,Mandatory (Unspecified/Implied),"National Government,Ministry/Department of Health",60.8067190909351,57.9746819116797,55.1374577243201,20,https://tummgmt.eu.qualtrics.com/Q/File.php?F=F_1HnslBs1SBTRiLL,https://www.malaymail.com/news/malaysia/2020/04/17/over-600-kampung-baru-residents-undergo-compulsory-covid-19-screening-on-fi/1857754 ; https://www.freemalaysiatoday.com/category/bahasa/2020/04/17/lebih-600-penduduk-kg-baru-jalani-ujian-saringan-wajib-covid-19/,CoronaNet (original),,2021-01-05,2021-01-05T18:50:23Z
R_8rezho4xpaJzG2lBk,1424693,new_entry,,,"","In Malaysia, the Selangor government has conducted free Covid-19 drive-thru testing, open especially for senior citizens and those who have symptoms such as fever, cold, cough and sore throat. The operation hours are from 10am to 12pm, and 2pm to 6pm. Results from the testing will be available within 24 to 48 hours. The operation which began on April 18 at Dewan Raja Muda Musa in Shah Alam would be implemented in other areas based on the localised demand and the multipurpose hall that can be utilised for the purpose.",2020-04-18,2020-04-18,2020-04-19,The policy has a clear end date,Malaysia,MYS,MY,Provincial,0,Selangor,,,Health Testing,Drive-in Testing Centers,,"",,,,,,"","","","","","","","","","","",,,,"",Yes,Malaysia,One or more provinces within one or more countries,,Selangor,,,,,Symptomatic people,,,Voluntary/Recommended but No Penalties,"Ministry/Department of Health,Provincial/State Government",60.5383935221479,58.1338012959696,55.1157792387201,21,https://tummgmt.eu.qualtrics.com/Q/File.php?F=F_3KvzNDDA4MPajmC,https://selangorjournal.my/2020/04/mb-selangor-covid-19-drive-thru-testing-to-be-extended-in-other-hotspots/ ; https://www.hmetro.com.my/mutakhir/2020/04/568256/saringan-covid-19-percuma-untuk-warga-emas-individu-bersimptom,CoronaNet (original),,2021-01-05,2021-01-05T08:10:19Z
R_3MPvkakqkxRfw2IBt,4230022,new_entry,,,"","In Labuan, Malaysia, a free Covid-19 screening exercise for food delivery riders and drivers here will be held at the Membidai Health Clinic beginning April 21. The three-day free screening programme (April 21-23), from 10am to 3pm, is to ensure that food delivery riders and drivers are free from Covid-19.",2020-04-20,2020-04-21,2020-04-23,The policy has a clear end date,Malaysia,MYS,MY,Provincial,0,Labuan,,,Health Testing,Fixed Health Testing stations (excluding drive-ins),,"",,,,,,"","","","","","","","","","","",,,,"",Yes,Malaysia,One or more provinces within one or more countries,,Labuan,,,,,Everyone (i.e. Asymptomatic and symptomatic people),,,Voluntary/Recommended but No Penalties,"Ministry/Department of Health,Provincial/State Government",60.7642766073808,57.9304509596822,55.1060632735115,21,https://tummgmt.eu.qualtrics.com/Q/File.php?F=F_3koEHRuJf4EsgfL,https://www.malaymail.com/news/malaysia/2020/04/20/free-covid-19-screening-for-labuan-food-delivery-riders-drivers-begins-tomo/1858511 ; https://www.bernama.com/bm/am/news_covid-19.php?id=1833976,CoronaNet (original),,2021-01-03,2021-01-03T02:24:48Z
R_2w5lxeNlW9wGS78NA,5100721,new_entry,,,"","On May 23rd, the Health Ministry of Malaysia is looking into whether the Bukit Jalil immigration depot cluster of Covid-19 cases was caused by gaps in pre-entry screening procedures. So far, in the screening of 114 staff, all are tested negative. The depot had about 1400 detainees in total.",2020-05-23,2020-05-23,,The policy’s end date is unknown or unreported,Malaysia,MYS,MY,National,0,,,,Health Testing,,,"",,,,,,"","","","","","","","","","","",,,,"",No,Malaysia,One or more geographical or administrative units (other than provincial or city level units) within one or more countries,,,,,Bukit Jalil Immigration Depot,All (Travelers + Residents),,Inbound,All kinds of transport,Mandatory (Unspecified/Implied),Ministry/Department of Health,62.1356426612377,59.8402910109041,57.2476032504347,41,https://tummgmt.eu.qualtrics.com/Q/File.php?F=F_2ATsCC1XFRTOe0s,https://www.malaysiakini.com/news/527085,CoronaNet (original),,2022-06-27,2022-06-27T23:59:59Z
R_3rUucdBsUgC5EgsBk,9878391,new_entry,,,"","In Malaysia, the first drive-through Covid-19 screening centre was opened in Sibu, Sarawak since January 13 to complement the operation of three existing screening centres here. The drive-through screening centre is at the Sarawak State Library building, which is provided free of charge, is opened on Monday to Saturday from 8am to 4pm. The three existing screening centres here, which were opened last January 10,  are at Lanang Health Clinic, Sibu Jaya Health Clinic and Sibu Indoor Stadium.
The cost of screening at the four centres will be fully borne by the state government. Those who have symptoms or are in close contact with Covid-19 patients are urged to take the opportunity by going for the screening.",2021-01-13,2021-01-10,,The policy’s end date is unknown or unreported,Malaysia,MYS,MY,Provincial,0,Sarawak,,,Health Testing,Drive-in Testing Centers,,"",,,,,,"","","","","","","","","","","",,,,"",No,Malaysia,One or more geographical or administrative units (other than provincial or city level units) within one or more countries,,Sarawak,,,Sibu (Sarawak),Citizen Residents,"Symptomatic people,Confirmed contact to a person infected with COVID-19",,Not Applicable,Voluntary/Recommended but No Penalties,"Ministry/Department of Health,Provincial/State Government,Municipal Government,Police",64.0096387792652,61.4101897942296,58.8443627223819,112,https://tummgmt.eu.qualtrics.com/Q/File.php?F=F_1hSZnBgcMbXnGri,https://www.malaymail.com/news/malaysia/2021/01/13/first-drive-through-centre-opens-in-sibu-in-latest-effort-to-combat-covid-1/1939920 ; https://www.thestar.com.my/news/nation/2021/01/13/covid-19-only-get-tested-if-you039re-a-close-contact-or-have-symptoms-sibu-residents-told,CoronaNet (original),,2021-01-23,2021-01-23T10:08:55Z
R_3rUucdBsUgC5EgsBt,9878391,new_entry,,,"","In Malaysia, the first drive-through Covid-19 screening centre was opened in Sibu, Sarawak since January 13 to complement the operation of three existing screening centres here. The drive-through screening centre is at the Sarawak State Library building, which is provided free of charge, is opened on Monday to Saturday from 8am to 4pm. The three existing screening centres here, which were opened last January 10,  are at Lanang Health Clinic, Sibu Jaya Health Clinic and Sibu Indoor Stadium.
The cost of screening at the four centres will be fully borne by the state government. Those who have symptoms or are in close contact with Covid-19 patients are urged to take the opportunity by going for the screening.",2021-01-13,2021-01-10,,The policy’s end date is unknown or unreported,Malaysia,MYS,MY,Provincial,0,Sarawak,,,Health Testing,Fixed Health Testing stations (excluding drive-ins),,"",,,,,,"","","","","","","","","","","",,,,"",No,Malaysia,One or more geographical or administrative units (other than provincial or city level units) within one or more countries,,Sarawak,,,Sibu (Sarawak),Citizen Residents,"Symptomatic people,Confirmed contact to a person infected with COVID-19",,Not Applicable,Voluntary/Recommended but No Penalties,"Ministry/Department of Health,Provincial/State Government,Municipal Government,Police",64.0096387792652,61.4101897942296,58.8443627223819,112,https://tummgmt.eu.qualtrics.com/Q/File.php?F=F_1hSZnBgcMbXnGri,https://www.malaymail.com/news/malaysia/2021/01/13/first-drive-through-centre-opens-in-sibu-in-latest-effort-to-combat-covid-1/1939920 ; https://www.thestar.com.my/news/nation/2021/01/13/covid-19-only-get-tested-if-you039re-a-close-contact-or-have-symptoms-sibu-residents-told,CoronaNet (original),,2021-01-23,2021-01-23T10:08:55Z
R_QgIen8QiLlizEYxCi,554717,new_entry,,,"","The Ministry of Health would like to advise all devotees and visitors to always practice good personal hygiene, wash hands frequently with soap and water or sanitisers, wear a face mask, and avoid touching eyes, nose and mouth frequently, to reduce the risk of 2019- nCoV infection during during Thaipusam festival (religious festival).",2020-02-06,2020-02-06,2023-04-26,The policy has an unlimited time span (e.g. recommendation to wash one's hands; passing of a legal bill),Malaysia,MYS,MY,National,1,,,,Hygiene,Hygiene measures for public areas,,"",,,,,,"","","","","","","","","","","",,,,"",Yes,Malaysia,"One or more countries, but not all countries",,,,,,All Residents (Citizen Residents + Foreign Residents),No special population targeted,,,Voluntary/Recommended but No Penalties,National Government,22.6344058018824,17.6153713861633,13.3460990570686,117,https://tummgmt.eu.qualtrics.com/Q/File.php?F=F_3QMHX0Z9jqZJkGt,https://www.moh.gov.my/moh/resources/COVID-19/PRESS%20RELEASE/PR_6_Feb.pdf,CoronaNet (original),,2022-06-27,2022-06-27T23:59:59Z
R_2QyRQPSRTzXBlBKDo,2782184,new_entry,,,"","March 13 — Two tabligh homes at a housing estate on the island of Labuan, Malaysia are currently undergoing disinfection exercise by the Labuan Crisis Preparedness and Response Centre (CPRC) after members of a tabligh congregation from Brunei and Tawau, in Sabah were tested positive for Covid-19.",2020-03-13,2020-03-13,,The policy’s end date is unknown or unreported,Malaysia,MYS,MY,Provincial,1,Labuan,,,Hygiene,Other Areas Hygiene Measures Applied,,"",,,,,,"","","","","","","","","","","",,,,"",Yes,Malaysia,One or more provinces within one or more countries,,Labuan,,,,All Residents (Citizen Residents + Foreign Residents),Other population not specifed above,,,Mandatory (Unspecified/Implied),"Provincial/State Government,Other (Please specify in the text box)",46.8252268218051,44.1510977584927,40.5632634370613,85,https://tummgmt.eu.qualtrics.com/Q/File.php?F=F_1PS4mVi4VoLeDKL,https://www.malaymail.com/news/malaysia/2020/03/13/labuan-tabligh-homes-undergo-disinfection/1846246 ; https://www.sinarharian.com.my/article/73674/KHAS/Covid-19/Premis-kediaman-tabligh-di-Labuan-jalani-proses-disinfeksi,CoronaNet (original),,2022-06-27,2022-06-27T23:59:59Z
R_217mVJy5DcFt6YTDo,2782184,update,End of Policy,,"","March 13 — Two tabligh homes at a housing estate on the island of Labuan, Malaysia are currently undergoing disinfection exercise by the Labuan Crisis Preparedness and Response Centre (CPRC) after members of a tabligh congregation from Brunei and Tawau, in Sabah were tested positive for Covid-19. UPDATE: Coding the end of data",2020-03-13,2020-03-13,2020-03-28,The policy has an imprecise natural end date (e.g. masks will be distributed until they run out),Malaysia,MYS,MY,Provincial,1,Labuan,,,Hygiene,Other Areas Hygiene Measures Applied,,"",,,,,,"","","","","","","","","","","",,,,"",Yes,Malaysia,One or more provinces within one or more countries,,Labuan,,,,All Residents (Citizen Residents + Foreign Residents),Other population not specifed above,,,Mandatory (Unspecified/Implied),"Provincial/State Government,Other (Please specify in the text box)",46.8252268218051,44.1510977584927,40.5632634370613,85,https://tummgmt.eu.qualtrics.com/Q/File.php?F=F_1PS4mVi4VoLeDKL,https://www.malaymail.com/news/malaysia/2020/03/13/labuan-tabligh-homes-undergo-disinfection/1846246 ; https://www.sinarharian.com.my/article/73674/KHAS/Covid-19/Premis-kediaman-tabligh-di-Labuan-jalani-proses-disinfeksi,CoronaNet (original),,2021-06-05,2021-06-05T04:14:52Z
R_WxOjP8RZrxShVvjCi,9919852,new_entry,,,"","March 14 — Four ‘tabligh’ (religious outreach) premises in Sabah, Malaysia, namely Kota Kinabalu, Beaufort, Tawau and Sandakan, have been temporarily closed for disinfection. The measure is part of efforts by the Sabah government to curb the spread of Covid-19, besides ensuring virus transmission is minimised following the tabligh gathering at Sri Petaling Mosque in Kuala Lumpur (February 27 to March 1) which was attended by a Sabah tabligh congregation as well.Mosques and surau (prayer rooms) in Sabah which have been visited by members of the congregation are also closed temporarily for disinfection, coordinated by the state religious department (JHEAINS), state health department and municipal councils.",2020-03-14,2020-03-14,,The policy’s end date is unknown or unreported,Malaysia,MYS,MY,Provincial,1,Sabah,,,Hygiene,Hygiene measures for public areas,,"",,,,,,"","","","","","","","","","","",,,,"",Yes,Malaysia,One or more provinces within one or more countries,,Sabah,,,,All Residents (Citizen Residents + Foreign Residents),Other population not specifed above,,,Mandatory (Unspecified/Implied),"Ministry/Department of Health,Provincial/State Government,Municipal Government,Other (Please specify in the text box)",48.1654136568185,45.3173203709534,42.21992951764,79,https://tummgmt.eu.qualtrics.com/Q/File.php?F=F_3kBRKmGMi9pCPay,https://www.malaymail.com/news/malaysia/2020/03/14/covid-19-four-tabligh-premises-in-sabah-temporarily-closed-says-state-secre/1846643 ; https://www.sinarharian.com.my/article/73859/KHAS/Covid-19/Covid-19-Empat-markas-tabligh-di-Sabah-jalani-proses-disinfeksi,CoronaNet (original),,2022-06-27,2022-06-27T23:59:59Z
