record_id,policy_id,entry_type,correct_type,update_type,update_level,description,date_announced,date_start,date_end,country,ISO_A3,ISO_A2,init_country_level,domestic_policy,province,ISO_L2,city,type,type_sub_cat,type_text,institution_status,target_country,target_geog_level,target_region,target_province,target_city,target_other,target_who_what,target_direction,travel_mechanism,compliance,enforcer,dist_index_high_est,dist_index_med_est,dist_index_low_est,dist_index_country_rank,link,date_updated,recorded_date
R_1HeKEMgd0oSj8aJAi,3240873,new_entry,original,,,"From the 19th of June 2020, the Ministry of Transport, Infrastructure and Communications in Romania is launching an application in which travellers entering Henri Coanda Airport, Bucharest have to fill out a questionnaire. This includes contact details and residence of isolation- if necessary. Travellers must then isolate for 10 days. This is targeted towards people travelling from areas of high epidemiological risk, but not to those with similar or less infection rates than Romania. After 10 days of quarantine, travellers are free to leave isolation.",2020-06-19,2020-06-19,,Romania,ROU,RO,National,0,,,,Health Monitoring,A snapshot of a person’s health at a given point in time,,,"Afghanistan,Albania,Algeria,Andorra,Angola,Antigua and Barbuda,Argentina,Armenia,Australia,Azerbaijan,Bahamas,Bahrain,Bangladesh,Barbados,Belarus,Belgium,Belize,Benin,Bhutan,Bolivia,Bosnia and Herzegovina,Botswana,Brazil,Brunei,Burkina Faso,Burundi,Cabo Verde,Cambodia,Cameroon,Canada,Central African Republic,Chad,Chile,China,Colombia,Comoros,Costa Rica,Croatia,Cuba,Democratic Republic of the Congo,Denmark,Djibouti,Dominica,Dominican Republic,Ecuador,Egypt,El Salvador,Equatorial Guinea,Eritrea,Eswatini,Ethiopia,Fiji,Gabon,Gambia,Georgia,Ghana,Grenada,Guatemala,Guinea,Guinea-Bissau,Guyana,Haiti,Honduras,Hong Kong,India,Indonesia,Iran,Iraq,Israel,Ivory Coast,Jamaica,Japan,Jordan,Kazakhstan,Kenya,Kiribati,Kosovo,Kuwait,Kyrgyzstan,Laos,Lebanon,Lesotho,Liberia,Libya,Luxembourg,Macau,Madagascar,Malawi,Malaysia,Maldives,Mali,Marshall Islands,Mauritania,Mauritius,Mexico,Micronesia,Moldova,Monaco,Mongolia,Montenegro,Morocco,Mozambique,Myanmar,Namibia,Nauru,Nepal,Netherlands,New Zealand,Nicaragua,Niger,Nigeria,North Korea,North Macedonia,Northern Cyprus,Oman,Pakistan,Palau,Palestine,Panama,Papua New Guinea,Paraguay,Peru,Philippines,Poland,Portugal,Qatar,Republic of the Congo,Romania,Russia,Rwanda,Saint Kitts and Nevis,Saint Lucia,Saint Vincent and the Grenadines,Samoa,San Marino,Sao Tome and Principe,Saudi Arabia,Senegal,Serbia,Seychelles,Sierra Leone,Singapore,Solomon Islands,Somalia,South Africa,South Korea,South Sudan,Spain,Sri Lanka,Sudan,Suriname,Sweden,Syria,Taiwan,Tajikistan,Tanzania,Thailand,Timor Leste,Togo,Tonga,Trinidad and Tobago,Tunisia,Turkey,Turkmenistan,Tuvalu,Uganda,Ukraine,United Arab Emirates,United Kingdom,United States,Uruguay,Uzbekistan,Vanuatu,Vatican,Venezuela,Vietnam,Yemen,Zambia,Zimbabwe","One or more countries, but not all countries",,,,,All Travelers (Citizen Travelers + Foreign Travelers ),Inbound,Flights,Voluntary/Recommended but No Penalties,"National Government,Ministry/Department of Health",51.4528916330495,48.1731894148085,45.1101972869288,20,https://www.sts.ro/ro/comunicate-de-presa//o-noua-aplicatie-dezvoltata-pentru-fluidizarea-traficului-aerian-de-calatori ; https://ro.usembassy.gov/covid-19-information/ ; http://www.cnscbt.ro/index.php/liste-zone-afectate-covid-19/1823-lista-statelor-exceptate-de-la-masura-de-carantina-22-06-2020/file,2020-12-02,2020-12-02T21:30:08Z
R_6VwpjPRru9gCnL3Co,6270396,new_entry,original,,,"On the 21st of January 2020, the Technical-Scientific Support Group for the Management of Highly Contagious Diseases in Romania decided with the Ministry of Internal Affairs to order 1,750,000 protective resources, including PPE, single use gloves and protective masks. They also allocated 110 isolation rooms with negative pressure, 200 cardio respirator machines- 3 sets for the 57 emergency hospitals plus 9 Regional Centres of Infectious diseases, and 2 reserves. They also ordered 150 sets of filters for the isolated rooms, 9000 litres of disinfectant TP1, 9000 litres of TP 2, 5,100 kg of disinfectant for semicritical surfaces, and 5,100 kg of disinfectant for noncritical surfaces.",2020-01-21,2020-01-21,,Romania,ROU,RO,National,1,,,,Health Resources,Masks,,,Romania,"One or more countries, but not all countries",,,,,All Residents (Citizen Residents + Foreign Residents),,,Voluntary/Recommended but No Penalties,"Ministry/Department of Health,Other (Please specify in the text box)",18.697443684568,13.2019694228147,9.01337037323704,79,"https://gov.ro/fisiere/pagini_fisiere/HOT%C4%82R%C3%82RILE_nr._1_%C8%99i_2_ale_Grupului_de_suport_tehnico-%C8%99tiintific,_aprobate_prin_Hotararea_nr._1_a_CNSSU_din_data_de_2.02.2020.pdf",2020-12-14,2020-12-14T20:55:21Z
R_6VwpjPRru9gCnL3Gg,6270396,new_entry,original,,,"On the 21st of January 2020, the Technical-Scientific Support Group for the Management of Highly Contagious Diseases in Romania decided with the Ministry of Internal Affairs to order 1,750,000 protective resources, including PPE, single use gloves and protective masks. They also allocated 110 isolation rooms with negative pressure, 200 cardio respirator machines- 3 sets for the 57 emergency hospitals plus 9 Regional Centres of Infectious diseases, and 2 reserves. They also ordered 150 sets of filters for the isolated rooms, 9000 litres of disinfectant TP1, 9000 litres of TP 2, 5,100 kg of disinfectant for semicritical surfaces, and 5,100 kg of disinfectant for noncritical surfaces.",2020-01-21,2020-01-21,,Romania,ROU,RO,National,1,,,,Health Resources,Ventilators,,,Romania,"One or more countries, but not all countries",,,,,All Residents (Citizen Residents + Foreign Residents),,,Voluntary/Recommended but No Penalties,"Ministry/Department of Health,Other (Please specify in the text box)",18.697443684568,13.2019694228147,9.01337037323704,79,"https://gov.ro/fisiere/pagini_fisiere/HOT%C4%82R%C3%82RILE_nr._1_%C8%99i_2_ale_Grupului_de_suport_tehnico-%C8%99tiintific,_aprobate_prin_Hotararea_nr._1_a_CNSSU_din_data_de_2.02.2020.pdf",2020-12-14,2020-12-14T20:55:21Z
R_6VwpjPRru9gCnL3Dr,6270396,new_entry,original,,,"On the 21st of January 2020, the Technical-Scientific Support Group for the Management of Highly Contagious Diseases in Romania decided with the Ministry of Internal Affairs to order 1,750,000 protective resources, including PPE, single use gloves and protective masks. They also allocated 110 isolation rooms with negative pressure, 200 cardio respirator machines- 3 sets for the 57 emergency hospitals plus 9 Regional Centres of Infectious diseases, and 2 reserves. They also ordered 150 sets of filters for the isolated rooms, 9000 litres of disinfectant TP1, 9000 litres of TP 2, 5,100 kg of disinfectant for semicritical surfaces, and 5,100 kg of disinfectant for noncritical surfaces.",2020-01-21,2020-01-21,,Romania,ROU,RO,National,1,,,,Health Resources,Personal Protective Equipment,,,Romania,"One or more countries, but not all countries",,,,,All Residents (Citizen Residents + Foreign Residents),,,Voluntary/Recommended but No Penalties,"Ministry/Department of Health,Other (Please specify in the text box)",18.697443684568,13.2019694228147,9.01337037323704,79,"https://gov.ro/fisiere/pagini_fisiere/HOT%C4%82R%C3%82RILE_nr._1_%C8%99i_2_ale_Grupului_de_suport_tehnico-%C8%99tiintific,_aprobate_prin_Hotararea_nr._1_a_CNSSU_din_data_de_2.02.2020.pdf",2020-12-14,2020-12-14T20:55:21Z
R_6VwpjPRru9gCnL3Bw,6270396,new_entry,original,,,"On the 21st of January 2020, the Technical-Scientific Support Group for the Management of Highly Contagious Diseases in Romania decided with the Ministry of Internal Affairs to order 1,750,000 protective resources, including PPE, single use gloves and protective masks. They also allocated 110 isolation rooms with negative pressure, 200 cardio respirator machines- 3 sets for the 57 emergency hospitals plus 9 Regional Centres of Infectious diseases, and 2 reserves. They also ordered 150 sets of filters for the isolated rooms, 9000 litres of disinfectant TP1, 9000 litres of TP 2, 5,100 kg of disinfectant for semicritical surfaces, and 5,100 kg of disinfectant for noncritical surfaces.",2020-01-21,2020-01-21,,Romania,ROU,RO,National,1,,,,Health Resources,Hand Sanitizer,,,Romania,"One or more countries, but not all countries",,,,,All Residents (Citizen Residents + Foreign Residents),,,Voluntary/Recommended but No Penalties,"Ministry/Department of Health,Other (Please specify in the text box)",18.697443684568,13.2019694228147,9.01337037323704,79,"https://gov.ro/fisiere/pagini_fisiere/HOT%C4%82R%C3%82RILE_nr._1_%C8%99i_2_ale_Grupului_de_suport_tehnico-%C8%99tiintific,_aprobate_prin_Hotararea_nr._1_a_CNSSU_din_data_de_2.02.2020.pdf",2020-12-14,2020-12-14T20:55:21Z
R_6VwpjPRru9gCnL3Ft,6270396,new_entry,original,,,"On the 21st of January 2020, the Technical-Scientific Support Group for the Management of Highly Contagious Diseases in Romania decided with the Ministry of Internal Affairs to order 1,750,000 protective resources, including PPE, single use gloves and protective masks. They also allocated 110 isolation rooms with negative pressure, 200 cardio respirator machines- 3 sets for the 57 emergency hospitals plus 9 Regional Centres of Infectious diseases, and 2 reserves. They also ordered 150 sets of filters for the isolated rooms, 9000 litres of disinfectant TP1, 9000 litres of TP 2, 5,100 kg of disinfectant for semicritical surfaces, and 5,100 kg of disinfectant for noncritical surfaces.",2020-01-21,2020-01-21,,Romania,ROU,RO,National,1,,,,Health Resources,Temporary Quarantine Centers,,,Romania,"One or more countries, but not all countries",,,,,All Residents (Citizen Residents + Foreign Residents),,,Voluntary/Recommended but No Penalties,"Ministry/Department of Health,Other (Please specify in the text box)",18.697443684568,13.2019694228147,9.01337037323704,79,"https://gov.ro/fisiere/pagini_fisiere/HOT%C4%82R%C3%82RILE_nr._1_%C8%99i_2_ale_Grupului_de_suport_tehnico-%C8%99tiintific,_aprobate_prin_Hotararea_nr._1_a_CNSSU_din_data_de_2.02.2020.pdf",2020-12-14,2020-12-14T20:55:21Z
R_sAshSDMoymudvfrGb,5318905,new_entry,original,,,"Romania banned the export of relevant medical devices and sanitary materials that ""ensure the prevention and treatment of COVID-19 associated diseases, as well as of the drugs included in the National Catalog of the prices of authorized medical products for marketing in Romania.""",2020-03-17,2020-03-18,,Romania,ROU,RO,National,0,,,,Health Resources,Unspecified Health Materials,,,All countries,All countries,,,,,Health-Related Supplies,Outbound,All kinds of transport,Mandatory with Legal Penalties (Jail Time),"National Government,Ministry/Department of Health,Military,Police",57.4196717040408,54.5759692662979,51.4127075552185,97,https://www.mai.gov.ro/wp-content/uploads/2020/03/MILITARY-ORDINANCE-no.-1-1.pdf,2020-04-02,2020-04-02T19:51:04Z
R_sAshSDMoymudvfrGa,5318905,new_entry,original,,,"Romania banned the export of relevant medical devices and sanitary materials that ""ensure the prevention and treatment of COVID-19 associated diseases, as well as of the drugs included in the National Catalog of the prices of authorized medical products for marketing in Romania.""",2020-03-17,2020-03-18,,Romania,ROU,RO,National,0,,,,Health Resources,Unspecified Health Infrastructure,,,All countries,All countries,,,,,Health-Related Supplies,Outbound,All kinds of transport,Mandatory with Legal Penalties (Jail Time),"National Government,Ministry/Department of Health,Military,Police",57.4196717040408,54.5759692662979,51.4127075552185,97,https://www.mai.gov.ro/wp-content/uploads/2020/03/MILITARY-ORDINANCE-no.-1-1.pdf,2020-04-02,2020-04-02T19:51:04Z
R_sAshSDMoymudvfrGc,5318905,new_entry,original,,,"Romania banned the export of relevant medical devices and sanitary materials that ""ensure the prevention and treatment of COVID-19 associated diseases, as well as of the drugs included in the National Catalog of the prices of authorized medical products for marketing in Romania.""",2020-03-17,2020-03-18,,Romania,ROU,RO,National,0,,,,Health Resources,Unspecified Health Staff,,,All countries,All countries,,,,,Health-Related Supplies,Outbound,All kinds of transport,Mandatory with Legal Penalties (Jail Time),"National Government,Ministry/Department of Health,Military,Police",57.4196717040408,54.5759692662979,51.4127075552185,97,https://www.mai.gov.ro/wp-content/uploads/2020/03/MILITARY-ORDINANCE-no.-1-1.pdf,2020-04-02,2020-04-02T19:51:04Z
R_2q9iH56F0uXGkwVDf,7327819,new_entry,original,,,"Romania asked all local authorities to place disinfectant solutions in all housing societies and to disinfect elevators, stairwells and other common areas.",2020-03-29,2020-03-31,,Romania,ROU,RO,National,0,,,,Health Resources,Other Health Materials,,,All countries,All countries,,,,,All Residents (Citizen Residents +Foreign Residents),Inbound/Outbound,All kinds of transport,Mandatory with Legal Penalties (Jail Time),"Provincial/State Government,Municipal Government,Police",76.315151920135,73.0680499617703,69.6347867899278,110,https://www.mai.gov.ro/wp-content/uploads/2019/01/ordinance-4-2020-EN.pdf,2020-04-03,2020-04-03T11:07:16Z
R_3NCfbIsKfIrBU8YGb,9221927,new_entry,original,,,"Romania empowered the Center for Medical-Military Scientific
Research, the Center for CBRN (Chemical, Biological, Radiological and Scientific), Scientific Research for Defense and Ecology, the Agency for  Research of Military Technique and Technologies and the National Institute for Medical-Military Research and Development ""Cantacuzino"" to   to approve/authorize medical materials, components, equipment and devices necessary for the prevention and control of the spread, as well as for the treatment of the infection with the SARS-CoV-2 virus, and also
biocides.",2020-03-29,2020-03-31,,Romania,ROU,RO,National,0,,,,Health Resources,Unspecified Health Materials,,,All countries,All countries,,,,,Health-Related Supplies,Inbound/Outbound,All kinds of transport,Mandatory with Legal Penalties (Jail Time),"National Government,Ministry/Department of Health,Military,Police",76.315151920135,73.0680499617703,69.6347867899278,110,https://www.mai.gov.ro/wp-content/uploads/2019/01/ordinance-4-2020-EN.pdf,2020-04-03,2020-04-03T11:21:22Z
R_1lt0dHCHLAKcISaNA,8400712,new_entry,correction,,,"On April 4, 2020, Romania placed internal border restrictions with regards to the city of Tandarei, with entry and exit banned except for the transport of goods and essential personnel.
",2020-04-04,2020-04-04,,Romania,ROU,RO,National,1,,,,Internal Border Restrictions,,,,Romania,One or more geographical or administrative units within one or more countries,,,Tandarei,,All Residents (Citizen Residents + Foreign Residents),,,Mandatory with Exceptions (Please list exceptions in the text entry),"National Government,Ministry/Department of Health,Military,Municipal Government,Police",79.6026537476674,76.6784678622306,73.1952092907548,123,https://www.mai.gov.ro/wp-content/uploads/2019/01/ordonanta-militara-7-din-4-aprilie-2020-engl.pdf,2021-03-01,2021-03-01T13:07:36Z
R_b2Do8sJBv1W8fQtNA,8400712,update,correction,,,"On April 4, 2020, Romania placed internal border restrictions with regards to the city of Tandarei, with entry and exit banned except for the transport of goods and essential personnel.
 UPDATE: The origial policy has no end date. It has been announced that ""the quarantine measure is lifted in Țăndărei city, Ialomița county"" on May 11, 2020 by the Romanian Minister of Interior.",2020-05-11,2020-05-11,2020-05-11,Romania,ROU,RO,National,1,,,,Internal Border Restrictions,,,,Romania,One or more geographical or administrative units within one or more countries,,,Tandarei,,All Residents (Citizen Residents + Foreign Residents),,,Mandatory with Exceptions (Please list exceptions in the text entry),"National Government,Ministry/Department of Health,Military,Municipal Government,Police",75.1657057575018,71.7758935403198,67.9060025269404,102,https://www.mai.gov.ro/wp-content/uploads/2019/01/ordonanta-militara-7-din-4-aprilie-2020-engl.pdf,2021-03-01,2021-03-01T13:11:39Z
R_2ZJGVStGpoXO0PyNA,1632992,new_entry,original,,,"On May 14, 2020, the Romanian government ""established the interdiction of the movement of persons outside the metropolitan locality/area.""",2020-05-14,2020-05-14,,Romania,ROU,RO,National,1,,,,Internal Border Restrictions,,,,Romania,"One or more countries, but not all countries",,,,,All Residents (Citizen Residents + Foreign Residents),,,Mandatory with Exceptions (Please list exceptions in the text entry),"National Government,Provincial/State Government,Police",71.3165385510766,68.0384422125424,63.9160782180488,80,https://stirioficiale.ro/hotarari/anexa-hotarare-nr-24-din-14-05-2020,2021-03-03,2021-03-03T15:08:55Z
R_2xRaXFcrzEvVU5JNA,1632992,update,original,End of Policy,,"On May 14, 2020, the Romanian government ""established the interdiction of the movement of persons outside the metropolitan locality/area."" UPDATE: Starting on June 1, 2020, Romania lifted ""the restrictions / interdictions regarding the movement of persons outside the locality / metropolitan area.""",2020-05-28,2020-06-01,2020-06-01,Romania,ROU,RO,National,1,,,,Internal Border Restrictions,,,,Romania,"One or more countries, but not all countries",,,,,All Residents (Citizen Residents + Foreign Residents),,,Mandatory with Exceptions (Please list exceptions in the text entry),"National Government,Provincial/State Government,Police",60.0960609159328,56.4892520502184,53.3810892308719,32,NA ; https://stirioficiale.ro/hotarari/hotarare-nr-26-din-28-05-2020,2021-03-03,2021-03-03T15:27:20Z
R_1qV6qW58uPZWg3cFk,5717661,update,original,End of Policy,,"On April 4, Romania established a quarantine in the city of Tandarei, with entry and exit banned except for the transport of goods and essential personnel. 
On 11 May, an eleventh Military Ordinance lifted the Țăndărei quarantine UPDATE: On 11 May, an eleventh Military Ordinance lifted the Țăndărei quaratine",2020-04-04,2020-04-04,2020-05-11,Romania,ROU,RO,National,1,,,,Lockdown,,,,Romania,One or more geographical or administrative units within one or more countries,,,Tandarei,,All Residents (Citizen Residents + Foreign Residents),Inbound/Outbound,All kinds of transport,Mandatory with Legal Penalties (Jail Time),"National Government,Ministry/Department of Health,Military,Municipal Government,Police",79.6026537476674,76.6784678622306,73.1952092907548,123,NA ; https://en.wikipedia.org/wiki/COVID-19_pandemic_in_Romania#cite_note-MO11-91,2020-07-23,2020-07-23T05:39:42Z
R_1mrvPcY9inFjH73Fk,3578067,update,original,End of Policy,,"Romania issued a military ordinance, to enforce a lockdown, as all citizens were forbidden from traveling outside of their homes unless it is for professional purposes or the purchase of essential goods (with several other smaller exceptions). UPDATE: from May 15th, citizens could leave their homes but only travel within their localities. UPDATE: From May 15th 2020, Romania went from a state of emergency to a state of alert, and self-declaration forms will no longer be needed to leave the house",2020-03-24,2020-05-15,2020-06-15,Romania,ROU,RO,National,1,,,,Lockdown,,,,Romania,"One or more countries, but not all countries",,,,,All Residents (Citizen Residents + Foreign Residents),Inbound/Outbound,All kinds of transport,Mandatory with Legal Penalties (Jail Time),"National Government,Ministry/Department of Health,Military,Provincial/State Government,Police",70.8260547914728,66.7599212124355,63.0017682910202,76,NA ; https://www.romania-insider.com/president-restrictions-lifted-may-15,2021-01-20,2021-01-20T17:27:34Z
R_2QhML0JgRuZKvrnNA,4622793,new_entry,original,,,Romania banned the export of agricultural food products.,2020-04-09,2020-04-09,,Romania,ROU,RO,National,0,,,,Other Policy Not Listed Above,,Romania banned the export of agricultural food products.,,All countries,All countries,,,,,Other,Outbound,All kinds of transport,Mandatory with Legal Penalties (Jail Time),"National Government,Ministry/Department of Health,Military,Police",80.8110414152804,77.7690053433862,74.7865252723015,125,https://www.mai.gov.ro/wp-content/uploads/2020/04/Military-Ordinance-no-8.pdf,2020-04-16,2020-04-16T19:49:15Z
R_3ESz5Y20iLkRBkvNA,3973209,new_entry,original,,,Romania (supported by the World Health Organization) expanded its national hotline to provide up-to-date information on COVID-19 from medical and health experts.,2020-02-27,2020-02-27,,Romania,ROU,RO,National,1,,,,Public Awareness Measures,,,,Romania,,,,,,All Residents (Citizen Residents + Foreign Residents),,,Voluntary/Recommended but No Penalties,"National Government,Ministry/Department of Health,Other (Please specify in the text box)",29.057842325308,23.8532380108235,18.3205747555088,102,http://www.euro.who.int/en/countries/romania/news/news/2020/4/covid-19-hotline-in-romania-provides-up-to-date-public-advice-with-who-support,2020-04-15,2020-04-15T12:28:11Z
R_1cVedKoeeU3IWmvNA,2803252,new_entry,original,,,"All medical alerts, press releases, texts, photo/video/audio materials of public interests and public service announcements were to be broadcast free of charge in advertising slots.",2020-03-29,2020-03-29,,Romania,ROU,RO,National,1,,,,Public Awareness Measures,,,,Romania,,,,,,All Residents (Citizen Residents + Foreign Residents),,,Mandatory with Legal Penalties (Jail Time),"National Government,Ministry/Department of Health,Military,Police",72.3765799851753,69.1223980994473,65.8001220892771,101,https://www.mai.gov.ro/wp-content/uploads/2019/01/ordinance-4-2020-EN.pdf,2020-04-03,2020-04-03T11:14:12Z
R_2qq3uHAWhqEMtoBBv,5458181,new_entry,original,,,"On February 24, Romania announced that any visitors from northern Italy would be placed in isolation for 14 days.",2020-02-24,2020-02-24,,Romania,ROU,RO,National,0,,,,Quarantine,Government Quarantine (i.e. quarantine at a government hotel or facility),,,Italy,One or more provinces within one or more countries,,northern Italy,,,All Travelers (Citizen Travelers + Foreign Travelers ),Inbound,All kinds of transport,Mandatory with Legal Penalties (Jail Time),National Government,27.5008878835019,21.3998283725462,15.7278612637701,98,https://www.rri.ro/en_gb/measures_against_the_coronavirus-2612485,2020-04-01,2020-04-01T21:16:42Z
R_2V3nGKJ6lyYLrMJBv,8114150,new_entry,original,,,"Romania is enforcing a two-week quarantine on all passengers, including Romanian nationals arriving from or having visited the Hubei region, 11 localities in Italy and the Diamond Princess Cruise Ship.",2020-02-25,2020-02-25,,Romania,ROU,RO,National,0,,,,Quarantine,Government Quarantine (i.e. quarantine at a government hotel or facility),,,"China,Italy","One or more countries, but not all countries",,,,,All Travelers (Citizen Travelers + Foreign Travelers ),Inbound,All kinds of transport,Mandatory with Legal Penalties (Jail Time),National Government,28.1868030162343,22.2054271132019,16.7222604491074,98,http://www.ms.ro/2020/02/25/continuarea-masurile-de-prevenire-si-limitare-a-eventualelor-imbolnaviri-cu-noul-coronavirus/,2020-04-02,2020-04-02T09:55:57Z
R_ah0Cgb1obpWiuydFk,656785,new_entry,original,,,"Romania is enforcing a two-week quarantine on people coming from China-Hubei Province (including Wuhan City), Wenzhou, Hangzhou, Ningbo, Taizhou in Zhejiang Province or from one of the 12 localities in Italy are quarantined for 14 days in specially designated areas.

People from other provinces / cities in mainland China and other localities in the Lombardy and Veneto Regions enter self-isolation at home, for 14 days, immediately after returning to Romania.",2020-02-26,2020-02-26,,Romania,ROU,RO,National,0,,,,Quarantine,Self-Quarantine (i.e. quarantine at home),,,"China,Italy",One or more provinces within one or more countries,,,,,All (Travelers + Residents),Inbound,All kinds of transport,Mandatory with Exceptions (Please list exceptions in the text entry),"National Government,Ministry/Department of Health",28.5750374040962,23.1112694727654,17.6920877674621,101,https://www.mai.gov.ro/informare-de-presa-2/,2021-01-09,2021-01-09T13:31:20Z
R_ah0Cgb1obpWiuydBv,656785,new_entry,original,,,"Romania is enforcing a two-week quarantine on people coming from China-Hubei Province (including Wuhan City), Wenzhou, Hangzhou, Ningbo, Taizhou in Zhejiang Province or from one of the 12 localities in Italy are quarantined for 14 days in specially designated areas.

People from other provinces / cities in mainland China and other localities in the Lombardy and Veneto Regions enter self-isolation at home, for 14 days, immediately after returning to Romania.",2020-02-26,2020-02-26,,Romania,ROU,RO,National,0,,,,Quarantine,Government Quarantine (i.e. quarantine at a government hotel or facility),,,"China,Italy",One or more provinces within one or more countries,,,,,All (Travelers + Residents),Inbound,All kinds of transport,Mandatory with Exceptions (Please list exceptions in the text entry),"National Government,Ministry/Department of Health",28.5750374040962,23.1112694727654,17.6920877674621,101,https://www.mai.gov.ro/informare-de-presa-2/,2021-01-09,2021-01-09T13:31:20Z
