record_id,policy_id,entry_type,update_type,update_level,update_level_var,description,date_announced,date_start,date_end,date_end_spec,country,ISO_A3,ISO_A2,init_country_level,domestic_policy,province,ISO_L2,city,type,type_sub_cat,type_new_admin_coop,type_vac_cat,type_vac_mix,type_vac_reg,type_vac_purchase,type_vac_group,type_vac_group_rank,type_vac_who_pays,type_vac_dist_admin,type_vac_loc,type_vac_cost_num,type_vac_cost_scale,type_vac_cost_unit,type_vac_cost_gov_perc,type_vac_amt_num,type_vac_amt_scale,type_vac_amt_unit,type_vac_amt_gov_perc,type_text,institution_cat,institution_status,institution_conditions,target_init_same,target_country,target_geog_level,target_region,target_province,target_city,target_intl_org,target_other,target_who_what,target_who_gen,target_direction,travel_mechanism,compliance,enforcer,pdf_link,link,collab,collab_id,date_updated,recorded_date
R_31ElD7AnllN19bsNA,1883431,new_entry,,,"",Barbados issued a warning against spreading false information on social media about the Government’s workplace policy in respect of Covid-19. Spreading false information about Government policies is prohibited under the Computer Misuse Act.,2020-03-05,2020-03-05,2023-07-05,The policy has an unlimited time span (e.g. recommendation to wash one's hands; passing of a legal bill),Barbados,BRB,BB,,1,,,,Anti-Disinformation Measures,,,"",,,,,,"","","","","","","","","","","",,,,"",,Barbados,,,,,,,All Residents (Citizen Residents + Foreign Residents),,,,,,https://tummgmt.eu.qualtrics.com/Q/File.php?F=F_1EjwW37j8tJip3q,https://gisbarbados.gov.bb/blog/government-warns-against-misuse-of-social-media/,CoronaNet (original),,2021-07-14,2021-07-14T17:41:14Z
R_1NcHJh4LTS7uGQNNA,4950893,new_entry,,,"","Barbados's Queen Elizabeth Hospital is restricting visiting hours. The new interim visiting hours across all general and surgical wards are 12:00 noon to 1:00 p.m. and 5:00 p.m. to 6:00 p.m. daily. Visits to the hospital’s Intensive Care Units – Medical Intensive Care Unit, Surgical Intensive Care Unit, Paediatric Intensive Care Unit, and Neonatal Intensive Care Unit – will be facilitated between 11:00 and 11:30 a.m.; 4:00 and 4:30 p.m.; and 5:30 and 6:00 p.m. Patients are only allowed 2 visitors at the time and visits cannot be longe than 2 hours. All visitors will be required to go through temperature tests at entrance.",2020-03-18,2020-03-18,,The policy’s end date is unknown or unreported,Barbados,BRB,BB,National,1,,,,Curfew,,,"",,,,,,"","","","","","","","","","","",,,,"",No,Barbados,One or more provinces within one or more countries,,,,,,All Residents (Citizen Residents + Foreign Residents),,,,Mandatory (Unspecified/Implied),"Ministry/Department of Health,Other (Please specify in the text box)",https://tummgmt.eu.qualtrics.com/Q/File.php?F=F_2rG8dsKvHPGyXxM,https://gisbarbados.gov.bb/blog/reduced-visiting-hours-at-qeh/,CoronaNet (original),,2021-07-14,2021-07-14T17:42:25Z
R_1hAOP3uZOHpQ8tKNA,7608185,new_entry,,,"","Barbados enacts the Emergency Management (COVID-19) Curfew Directive, 2020. Under the Order, a curfew is in effect from Saturday, March 28, until Tuesday, April 14, while all businesses, except essential services and those identified, were ordered close as Government seeks to contain the spread of COVID-19. The curfew is between 8 pm and 6 am. Attorney General Dale Marshall announced that there will be a fine of $50,000, or one year in prison, or both, for anyone found guilty of breaking the curfew.",2020-03-27,2020-03-28,2020-04-14,The policy has a clear end date,Barbados,BRB,BB,National,1,,,,Curfew,,,"",,,,,,"","","","","","","","","","","",,,,"",No,Barbados,"One or more countries, but not all countries",,,,,,All Residents (Citizen Residents + Foreign Residents),,,,"Mandatory with Legal Penalties (Jail Time),Mandatory with Fines","National Government,Police",https://tummgmt.eu.qualtrics.com/Q/File.php?F=F_DFQrZ1UeOllWaRj,https://gisbarbados.gov.bb/blog/exemptions-will-be-granted-for-emergency-situations/ ; https://gisbarbados.gov.bb/blog/heavy-fine-for-anyone-breaking-curfew/,CoronaNet (original),,2022-06-19,2022-06-19T23:59:59Z
R_3OdWtKCtcDlHWbONA,7608185,update,,Strengthening,"","The original curfew was from 8 pm until 6 am. Now it is a full on 24-hours curfew beginning on April 3rd, 8 pm. UPDATE: From April 3rd, 2020 the curfew is going to be 24-hour",2020-04-02,2020-04-03,2020-05-04,The policy has a clear end date,Barbados,BRB,BB,National,1,,,,Curfew,,,"",,,,,,"","","","","","","","","","","",,,,"",No,Barbados,"One or more countries, but not all countries",,,,,,All Residents (Citizen Residents + Foreign Residents),,,,"Mandatory with Legal Penalties (Jail Time),Mandatory with Fines","National Government,Police",https://tummgmt.eu.qualtrics.com/Q/File.php?F=F_6xOx6v4p6PFYhk5,https://gisbarbados.gov.bb/blog/24-hour-curfew-for-barbados-from-friday/,CoronaNet (original),CDC-ITF-BD-00019_1,2022-06-19,2022-06-19T23:59:59Z
R_6DLFYrl9TxwKTRfNA,7608185,update,,,"","Barbadians will remain under curfew until midnight May 3, 2020, but new measures are in place for them to get essential goods. UPDATE: The original curfew was extended to April 5. Now it has been extended to May 3, 2020",2020-04-11,2020-04-11,2020-05-04,The policy has a clear end date,Barbados,BRB,BB,National,1,,,,Curfew,,,"",,,,,,"","","","","","","","","","","",,,,"",No,Barbados,"One or more countries, but not all countries",,,,,,All Residents (Citizen Residents + Foreign Residents),,,,"Mandatory with Legal Penalties (Jail Time),Mandatory with Fines","National Government,Police",https://tummgmt.eu.qualtrics.com/Q/File.php?F=F_1DU3LZAC2GfRfT8,https://www.nationnews.com/nationnews/news/244948/curfew-extended,CoronaNet (original),CDC-ITF-BD-00019_1,2022-06-19,2022-06-19T23:59:59Z
R_8euQS62rXR56LAZNA,4365135,new_entry,,,"","Prime Minister Mia Amor Mottley has announced that Government will be putting measures in place to facilitate fruit and vegetable vendors during the curfew period, which has been extended until May 3.",2020-04-12,2020-04-12,2020-05-03,The policy has a clear end date,Barbados,BRB,BB,National,1,,,,Curfew,,,"",,,,,,"","","","","","","","","","","",,,,"",,Barbados,,,,,,,All Residents (Citizen Residents + Foreign Residents),,,,Voluntary/Recommended but No Penalties,National Government,https://tummgmt.eu.qualtrics.com/Q/File.php?F=F_2OUscCEuGCfoilH,https://gisbarbados.gov.bb/blog/produce-vendors-can-ply-their-trade/,CoronaNet (original),,2020-04-23,2020-04-23T08:10:58Z
R_TiuPfLPCEkP23YZNA,6355890,new_entry,,,"","Members of the public are advised that from tomorrow, Tuesday, April 14, essential cargo deliveries will be done through an appointment system at the Bridgetown Port, between 7:00 a.m. and 4:00 p.m.",2020-04-13,2020-04-13,,The policy’s end date is unknown or unreported,Barbados,BRB,BB,National,1,,,,Curfew,,,"",,,,,,"","","","","","","","","","","",,,,"",,Barbados,,,,,,,All Residents (Citizen Residents + Foreign Residents),,,,Mandatory (Unspecified/Implied),National Government,https://tummgmt.eu.qualtrics.com/Q/File.php?F=F_C2na6UsPsgsx20N,https://gisbarbados.gov.bb/blog/essential-cargo-delivery-by-appointment/,CoronaNet (original),,2021-07-14,2021-07-14T17:43:21Z
R_2czQlq15KoQrXLKNA,7608185,update,,Strengthening,timing of policy strengthening,"Barbados enacts the Emergency Management (COVID-19) Curfew Directive, 2020. Under the Order, a curfew is in effect from Saturday, March 28, until Tuesday, April 14, while all businesses, except essential services and those identified, were ordered close as Government seeks to contain the spread of COVID-19. The curfew is between 8 pm and 6 am. then, the curfew was 24-hours. Now, the 24-hour curfew is also extended to May 4th. UPDATE: Barbados’ Prime Minister Mia Mottley announced that the curfew that was supposed to end on April 14th, will be extended to May 4th.",2020-04-12,2020-04-14,2020-05-04,The policy has a clear end date,Barbados,BRB,BB,National,1,,,,Curfew,,,"",,,,,,"","","","","","","","","","","",,,,"",No,Barbados,"One or more countries, but not all countries",,,,,,All Residents (Citizen Residents + Foreign Residents),,,,"Mandatory with Legal Penalties (Jail Time),Mandatory with Fines","National Government,Police",https://tummgmt.eu.qualtrics.com/Q/File.php?F=F_3M5Ww7HNMF2a1qq,https://caribbeanbusinessreport.com/news/breaking-barbados-expands-curfew-until-may-4/,CoronaNet (original),CDC-ITF-BD-00019_1,2022-06-19,2022-06-19T23:59:59Z
R_1rlj9pqBHJdVSvwNA,865669,new_entry,,,"","Barbados declares that it is currently in Stage 1 after the island recorded the first cases of COVID-19 on March 17th. Activation of National Emergency Operations Centre and Isolation Centre. Preparation of severe treatment facility and Paragon, St. Lucy District Hospital or Field Medical Hospital for screening, quarantine and isolation. Reconfiguring of polyclinics to facilitate local screening. Advice on limiting mass gathering to reduce risk for local spread. Suspension Of Visits & Closure Of Public Health Institutions.",2020-03-17,2020-03-17,,The policy’s end date is unknown or unreported,Barbados,BRB,BB,National,1,,,,Declaration of Emergency,,,"",,,,,,"","","","","","","","","","","",,,,"",,Barbados,,,,,,,All Residents (Citizen Residents + Foreign Residents),,,,Mandatory (Unspecified/Implied),National Government,https://tummgmt.eu.qualtrics.com/Q/File.php?F=F_2ALnGizsWSeQpYG,https://www.nationnews.com/print_article/nationnews/news/244445/covid-19-management-response-plans-stage?print=true ; https://gisbarbados.gov.bb/blog/suspension-of-visits-closures-of-public-health-institutions/,CoronaNet (original),,2021-07-14,2021-07-14T17:44:40Z
R_3EosKRJRGjPv1TqNA,865669,update,Change of Policy,,"","the Parliament of Barbados, by a majority Resolution and in fact, by unanimous support in the House of Assembly, agreed to extend the State of Emergency in Barbados until the 30th of June. UPDATE: the Parliament of Barbados, by a majority Resolution and in fact, by unanimous support in the House of Assembly, agreed to extend the State of Emergency in Barbados until the 30th of June.",2020-04-24,2020-04-24,2020-06-30,The policy has a clear end date,Barbados,BRB,BB,National,1,,,,Declaration of Emergency,,,"",,,,,,"","","","","","","","","","","",,,,"",,Barbados,,,,,,,All Residents (Citizen Residents + Foreign Residents),,,,Mandatory (Unspecified/Implied),National Government,https://tummgmt.eu.qualtrics.com/Q/File.php?F=F_31cMxNw4r4GAHZm,https://gisbarbados.gov.bb/blog/attorney-general-explains-state-of-emergency-extension/,CoronaNet (original),,2020-05-06,2020-05-06T08:14:02Z
R_1OPSKrDVGcX4HbfCc,3823820,new_entry,,,"","January 22, 2020, Travelers arriving at ports of entry from high risk areas to be screened by health officers",2020-01-22,2020-01-22,,The policy’s end date is unknown or unreported,Barbados,BRB,BB,National,0,,,,External Border Restrictions,Health Screenings (e.g. temperature checks),,"",,,,,,"","","","","","","","","","","",,,,"",No,All countries,All countries,,,,,,All Travelers (Citizen Travelers + Foreign Travelers ),No special population targeted,Inbound,All kinds of transport,Mandatory (Unspecified/Implied),National Government,https://tummgmt.eu.qualtrics.com/Q/File.php?F=F_3kcRNwpTetpr2zt,https://gisbarbados.gov.bb/blog/health-ministry-on-alert-for-new-coronavirus/,ACAPS,ACAPS_1434,2022-07-25,2022-07-25T22:07:12Z
R_24kqSJADeVAgVjlGr,8920668,new_entry,,,"","January 27, 2020, MoH advises against non-essential travel to Hubei Province in China",2020-01-27,2020-01-27,,The policy’s end date is unknown or unreported,Barbados,BRB,BB,National,0,,,,External Border Restrictions,Total border crossing ban,,"",,,,,,"","","","","","","","","","","",,,,"",No,China,"One or more countries, but not all countries",,,,,,All (Travelers + Residents),No special population targeted,Outbound,All kinds of transport,Mandatory (Unspecified/Implied),Ministry/Department of Health,https://tummgmt.eu.qualtrics.com/Q/File.php?F=F_1OxIGuPEZTbTru2,https://gisbarbados.gov.bb/blog/avoid-non-essential-travel-to-hubei-province/,ACAPS,ACAPS_1435,2022-07-25,2022-07-25T22:11:59Z
R_2bNT9YVqUsR2x5RGr,3025016,new_entry,,,"","February 14, 2020, travel ban restricting any non-residents who have visited mainland China within the last 20 days from entering the country.",2020-02-14,2020-02-14,,The policy’s end date is unknown or unreported,Barbados,BRB,BB,National,0,,,,External Border Restrictions,Total border crossing ban,,"",,,,,,"","","","","","","","","","","",,,,"",No,China,"One or more countries, but not all countries",,,,,,Foreign Travelers,No special population targeted,Inbound,All kinds of transport,Mandatory (Unspecified/Implied),National Government,https://tummgmt.eu.qualtrics.com/Q/File.php?F=F_1eK6N585AHIBIrN,https://crisis24.garda.com/alerts/2020/02/bahamas-new-entry-restrictions-amid-coronavirus-outbreak-february-14,ACAPS,ACAPS_118482,2022-07-25,2022-07-25T22:17:10Z
R_3MSaOBOpJs7JwSCGr,8091673,new_entry,,,"","February 27, 2020, The Ministry of Health and Wellness has advised residents of Barbados against travelling to China and South Korea, unless absolutely necessary. Further advised persons travelling to Italy and Iran, which have both reported clusters of COVID-19 cases, to take all necessary precautions related to respiratory etiquette and hand hygiene.",2020-02-27,2020-02-27,,The policy’s end date is unknown or unreported,Barbados,BRB,BB,National,0,,,,External Border Restrictions,Total border crossing ban,,"",,,,,,"","","","","","","","","","","",,,,"",No,"China,Iran,Italy,South Korea","One or more countries, but not all countries",,,,,,All Residents (Citizen Residents +Foreign Residents),No special population targeted,Outbound,All kinds of transport,Mandatory (Unspecified/Implied),Ministry/Department of Health,https://tummgmt.eu.qualtrics.com/Q/File.php?F=F_2YCVorYKhvUnGpI,https://gisbarbados.gov.bb/blog/warning-against-non-essential-travel-to-china-south-korea/,ACAPS,ACAPS_1526,2022-07-25,2022-07-25T22:23:19Z
R_2V4GbID4jAeHkO7NA,4531019,new_entry,,,"","With immediate effect, all arriving passengers who have been in Iran, or Lombardy, Emilia-Romagna or Veneto in Italy in the previous 14 days will be required to report to Port Health at the points of entry.",2020-03-04,2020-03-04,,The policy’s end date is unknown or unreported,Barbados,BRB,BB,National,0,,,,Health Monitoring,,,"",,,,,,"","","","","","","","","","","",,,,"",No,"Barbados,China,Iran,Italy,South Korea","One or more countries, but not all countries",,,,,,All (Travelers + Residents),,Inbound,All kinds of transport,Mandatory (Unspecified/Implied),Ministry/Department of Health,https://tummgmt.eu.qualtrics.com/Q/File.php?F=F_Z2brkYbQEJsjxXr,https://gisbarbados.gov.bb/blog/health-ministry-expands-list-of-countries-facing-quarantine/,CoronaNet (original),,2021-07-14,2021-07-14T17:45:32Z
R_1gwDuORvFvWvIdDNA,586091,new_entry,,,"","Bolstered screening capacity. Assistance from the Barbados Defence Force from their medical personnel to join with port health in order to give more numbers at ports of entry, particularly at the airport",2020-02-05,2020-02-05,,The policy’s end date is unknown or unreported,Barbados,BRB,BB,National,0,,,,Health Testing,,,"",,,,,,"","","","","","","","","","","",,,,"",No,Barbados,"One or more countries, but not all countries",,,,,,All (Travelers + Residents),,Inbound,"Flights,Seaports",Mandatory (Unspecified/Implied),Ministry/Department of Health,https://tummgmt.eu.qualtrics.com/Q/File.php?F=F_10NvuxUEyr8vSb5,https://gisbarbados.gov.bb/blog/bdf-to-help-assist-port-health-officers-combat-coronavirus/,CoronaNet (original),,2021-07-14,2021-07-14T17:47:18Z
R_1QKQ72T8AnCW6jrNA,3969966,new_entry,,,"","Minister of Health and Wellness, Lt. Col. Jeffrey Bostic, has announced that there will be an escalation in the numbers of people being tested for COVID-19 “in short order”.",2020-04-21,2020-04-21,,The policy’s end date is unknown or unreported,Barbados,BRB,BB,National,0,,,,Health Testing,,,"",,,,,,"","","","","","","","","","","",,,,"",No,Barbados,"One or more countries, but not all countries",,,,,,All (Travelers + Residents),,,Not Applicable,Mandatory (Unspecified/Implied),National Government,https://tummgmt.eu.qualtrics.com/Q/File.php?F=F_usT9tCYhvBQ27iF,https://gisbarbados.gov.bb/blog/scope-of-testing-for-covid-19-to-be-widened/,CoronaNet (original),,2021-07-14,2021-07-14T17:50:39Z
R_2X5o4xSTwj5JokkNA,1022356,new_entry,,,"","The Central Bank of Barbados has implemented new protocols for all persons visiting its headquarters: all visitors must wear a mask and have their temperature taken. Persons with temperature over 37.5 degrees Celsius (99.5 degrees Fahrenheit), will not be allowed to enter the bank.",2020-05-15,2020-05-15,,The policy’s end date is unknown or unreported,Barbados,BRB,BB,"Other (e.g., county)",0,Saint Michael,,,Health Testing,,,"",,,,,,"","","","","","","","","","","",,,,"",Yes,Barbados,One or more geographical or administrative units (other than provincial or city level units) within one or more countries,,Saint Michael,,,Central Bank of Barbados,,,,,Mandatory (Unspecified/Implied),Other (Please specify in the text box),https://tummgmt.eu.qualtrics.com/Q/File.php?F=F_10TrxDIbERQMEz5,https://gisbarbados.gov.bb/blog/new-protocols-for-visiting-central-bank/,CoronaNet (original),,2021-07-14,2021-07-14T17:54:36Z
R_2dhJoD4krsIqEkECh,1715549,new_entry,,,"","In accordance with the country's Health Services Act Cap 44, all food delivery workers are required to pass health report at the beginning of the shift. Temperature test upon entering the workplace. They are also required to follow social distance in case if they need to communicate with other employees, they must be provided medical masks and discard the disposal ones after 4 hours of wear/or wash reusable ones after each shift. They need wash their hands after each food delivery, sanitize all surfaces and all utensils must be sealed.",2020-05-07,2020-05-07,,The policy’s end date is unknown or unreported,Barbados,BRB,BB,National,1,,,,Hygiene,Hygiene measures for commercial areas,,"",,,,,,"","","","","","","","","","","",,,,"",,Barbados,,,,,,,All Residents (Citizen Residents + Foreign Residents),,,,Mandatory (Unspecified/Implied),Ministry/Department of Health,https://tummgmt.eu.qualtrics.com/Q/File.php?F=F_3oNNFUieGX49rtJ,https://gisbarbados.gov.bb/blog/covid-19-protocols-for-food-service-employees/,CoronaNet (original),,2021-07-14,2021-07-14T17:54:24Z
R_2dhJoD4krsIqEkECi,1715549,new_entry,,,"","In accordance with the country's Health Services Act Cap 44, all food delivery workers are required to pass health report at the beginning of the shift. Temperature test upon entering the workplace. They are also required to follow social distance in case if they need to communicate with other employees, they must be provided medical masks and discard the disposal ones after 4 hours of wear/or wash reusable ones after each shift. They need wash their hands after each food delivery, sanitize all surfaces and all utensils must be sealed.",2020-05-07,2020-05-07,,The policy’s end date is unknown or unreported,Barbados,BRB,BB,National,1,,,,Hygiene,Hygiene measures for public areas,,"",,,,,,"","","","","","","","","","","",,,,"",,Barbados,,,,,,,All Residents (Citizen Residents + Foreign Residents),,,,Mandatory (Unspecified/Implied),Ministry/Department of Health,https://tummgmt.eu.qualtrics.com/Q/File.php?F=F_3oNNFUieGX49rtJ,https://gisbarbados.gov.bb/blog/covid-19-protocols-for-food-service-employees/,CoronaNet (original),,2021-07-14,2021-07-14T17:54:24Z
R_1obbTCkCehHPoY4Ch,3204560,new_entry,,,"","Barbados: The Environmental Health Department, in the Ministry of Health and Wellness, has developed a framework geared towards ensuring the safe management of food service establishments during the COVID-19 crisis. This is designed to work in conjunction with the domestic health regulations,Health Services Act Cap 44, and the purpose is to increase the safety in the light of COVID-19 crisis. Under this new framework, all food service establishments are required to clean and sanitize their premises before and after work hours and food service workers are required to wear masks and sanitize after each food delivery.",2020-05-07,2020-05-07,,The policy’s end date is unknown or unreported,Barbados,BRB,BB,National,1,,,,Hygiene,Hygiene measures for commercial areas,,"",,,,,,"","","","","","","","","","","",,,,"",,Barbados,,,,,,,All Residents (Citizen Residents + Foreign Residents),,,,Voluntary/Recommended but No Penalties,Ministry/Department of Health,https://tummgmt.eu.qualtrics.com/Q/File.php?F=F_3kvrh2lAzUVWtCI,https://gisbarbados.gov.bb/blog/covid-19-protocols-for-food-service-establishments/,CoronaNet (original),,2021-07-14,2021-07-14T17:55:42Z
R_1myKWUEHqMRHHiHCh,4580722,new_entry,,,"","Barbados recommends contractors to consider staggered work hours for their employees in accordance with the COVID-19 Framework for the Recommencement of the Construction Industry. Workers should go home right after the work to avoid crowing in public transport and observe social distancing while using toilets. Contractors should sanitize surfaces and provide their employees with separate towels, closed bins and a separate water.",2020-05-09,2020-05-07,,The policy’s end date is unknown or unreported,Barbados,BRB,BB,National,1,,,,Hygiene,Hygiene measures for commercial areas,,"",,,,,,"","","","","","","","","","","",,,,"",,Barbados,,,,,,,All Residents (Citizen Residents + Foreign Residents),,,,Voluntary/Recommended but No Penalties,Other (Please specify in the text box),https://tummgmt.eu.qualtrics.com/Q/File.php?F=F_3R8YcjfRrYAvX85,https://gisbarbados.gov.bb/blog/contractors-should-consider-staggered-work-hours/,CoronaNet (original),,2021-07-14,2021-07-14T17:56:49Z
R_1myKWUEHqMRHHiHCj,4580722,new_entry,,,"","Barbados recommends contractors to consider staggered work hours for their employees in accordance with the COVID-19 Framework for the Recommencement of the Construction Industry. Workers should go home right after the work to avoid crowing in public transport and observe social distancing while using toilets. Contractors should sanitize surfaces and provide their employees with separate towels, closed bins and a separate water.",2020-05-09,2020-05-07,,The policy’s end date is unknown or unreported,Barbados,BRB,BB,National,1,,,,Hygiene,Hygiene measures for public transport,,"",,,,,,"","","","","","","","","","","",,,,"",,Barbados,,,,,,,All Residents (Citizen Residents + Foreign Residents),,,,Voluntary/Recommended but No Penalties,Other (Please specify in the text box),https://tummgmt.eu.qualtrics.com/Q/File.php?F=F_3R8YcjfRrYAvX85,https://gisbarbados.gov.bb/blog/contractors-should-consider-staggered-work-hours/,CoronaNet (original),,2021-07-14,2021-07-14T17:56:49Z
R_3DwGzcY4BbpTbw2Ch,9173833,new_entry,,,"","As a part of Phase 3 (May 18-31) of re-opening the country, new protocol for hairdressing salons is established in The Health Services Act CAP.44 (Hairdressers) Regulations 1970 and further enhanced in the light of COVID-19 crisis. New protocol has provisions on: face shields on service providers and customers, cleaning & sanitizing work stations and restrooms, making appointments with clients, social distancing in salons, as well as more detailed instructions on cleaning/discarding shampoo and pedicure bowls after each client.",2020-05-16,2020-05-18,2020-05-31,The policy has a clear end date,Barbados,BRB,BB,National,1,,,,Hygiene,Hygiene measures for commercial areas,,"",,,,,,"","","","","","","","","","","",,,,"",,Barbados,,,,,,,All Residents (Citizen Residents + Foreign Residents),,,,Mandatory with Exceptions (Please list exceptions in the text entry),Ministry/Department of Health,https://tummgmt.eu.qualtrics.com/Q/File.php?F=F_2WAU7FbdR4xaHbe,https://gisbarbados.gov.bb/blog/covid-19-protocols-for-hairdressing-salons/,CoronaNet (original),,2020-05-23,2020-05-23T18:56:04Z
R_1PUFt9eHAJUdpWdCi,8477930,new_entry,,,"","Barbados: Director General, Human Resource, Ministry of Public Service, Gail Atkins, made a presentation on ""Safe Work; Safe Environment; Safe People"", during the Learning and Development Directorate’s Webinar, where she announced that there was a protocol on cleaning public service areas. Ministry of Public Service wants to review workplace hygiene standards as some public officers will be returning to work. This protocol utilized recommendations from World Health Organization and the Ministry of Health and Wellness.",2020-05-21,2020-05-21,,The policy’s end date is unknown or unreported,Barbados,BRB,BB,National,1,,,,Hygiene,Hygiene measures for public areas,,"",,,,,,"","","","","","","","","","","",,,,"",,Barbados,,,,,,,All Residents (Citizen Residents + Foreign Residents),,,,Mandatory (Unspecified/Implied),Other (Please specify in the text box),https://tummgmt.eu.qualtrics.com/Q/File.php?F=F_2q8xqgPrJtxDS5s,https://gisbarbados.gov.bb/blog/covid-19-protocol-developed-on-public-service-cleaning/,CoronaNet (original),,2021-07-14,2021-07-14T18:04:25Z
R_RwvLMJRjbhsnvjPNA,2408864,new_entry,,,"","MoH of Barbados met in press conference to discuss readiness to respond and prepped meetings with local hospitals, Ministry of Tourism, Ministry of Maritime Affairs, and Blue Economy. Have protocols they are prepared to mobilize from past Ebola and SARS outbreaks",2020-01-22,2020-01-22,2020-01-24,The policy is a one-time measure (e.g. publication of guidelines),Barbados,BRB,BB,National,1,,,,Public Awareness Measures,,,"",,,,,,"","","","","","","","","","","",,,,"",,Barbados,,,,,,,All Residents (Citizen Residents + Foreign Residents),,,,Mandatory (Unspecified/Implied),Ministry/Department of Health,https://tummgmt.eu.qualtrics.com/Q/File.php?F=F_sdnnBgUpPj65OmZ,https://gisbarbados.gov.bb/blog/health-ministry-on-alert-for-new-coronavirus/,CoronaNet (original),,2021-07-19,2021-07-19T16:51:44Z
