record_id,policy_id,entry_type,update_type,update_level,update_level_var,description,date_announced,date_start,date_end,date_end_spec,country,ISO_A3,ISO_A2,init_country_level,domestic_policy,province,ISO_L2,city,type,type_sub_cat,type_new_admin_coop,type_vac_cat,type_vac_mix,type_vac_reg,type_vac_purchase,type_vac_group,type_vac_group_rank,type_vac_who_pays,type_vac_dist_admin,type_vac_loc,type_vac_cost_num,type_vac_cost_scale,type_vac_cost_unit,type_vac_cost_gov_perc,type_vac_amt_num,type_vac_amt_scale,type_vac_amt_unit,type_vac_amt_gov_perc,type_text,institution_cat,institution_status,institution_conditions,target_init_same,target_country,target_geog_level,target_region,target_province,target_city,target_intl_org,target_other,target_who_what,target_who_gen,target_direction,travel_mechanism,compliance,enforcer,dist_index_high_est,dist_index_med_est,dist_index_low_est,dist_index_country_rank,pdf_link,link,collab,collab_id,date_updated,recorded_date
R_3fjTw2gKazROhLNFp,9045410Fp,new_entry,,,"","North Macedonia will allow the participation of hired musicians in restaurants only for weddings, while respecting the necessary hygiene rules and social distancing measures, starting June 1, 2021.",2021-05-31,2021-06-01,,The policy’s end date is unknown or unreported,North Macedonia,MKD,MK,National,1,,,,Restriction and Regulation of Businesses,Restaurants,,"",,,,,,"","","","","","","","","","","",,Non-Essential Businesses,"This type of business  (""Restaurants"") is allowed to open with conditions",Hygiene and sanitation measures required,Yes,North Macedonia,"One or more countries, but not all countries",,,,,,All Residents (Citizen Residents + Foreign Residents),No special population targeted,,,Mandatory (Unspecified/Implied),"National Government,Ministry/Department of Health",,,,,https://tummgmt.eu.qualtrics.com/Q/File.php?F=F_2xWUQvyXhvQeiNz,http://zdravstvo.gov.mk/sq/shtabi-i-krizave-pranoi-rekomandimet-e-komisionit-per-semundjet-infektive-per-lehtesimin-e-masave-duke-filluar-nga-1-qershori/?cn-reloaded=1 ; https://vlada.mk/node/25452?fbclid=IwAR00VPP73RTmYXw2rBqcDtemSA_-ZtQ2eJyNlvFvEgz6vpy9KdxXW3E1tsM&ln=sq,CoronaNet (original),,2021-07-03,2021-07-03T21:31:42Z
R_28FFKHaf5UNi4GqFp,825663Fp,new_entry,,,"","North Macedonia will only allow bars and restaurants to serve in the open air, except for drinking services inside the casinos and slot machine spots, starting June 16, 2021.",2021-06-16,2021-06-16,,The policy’s end date is unknown or unreported,North Macedonia,MKD,MK,National,1,,,,Restriction and Regulation of Businesses,Restaurants,,"",,,,,,"","","","","","","","","","","",,Non-Essential Businesses,"This type of business  (""Restaurants"") is allowed to open with conditions",Other condition not specified above (please provide detail in the text entry),Yes,North Macedonia,"One or more countries, but not all countries",,,,,,All Residents (Citizen Residents + Foreign Residents),No special population targeted,,,Mandatory (Unspecified/Implied),"National Government,Ministry/Department of Health",,,,,https://tummgmt.eu.qualtrics.com/Q/File.php?F=F_Cay4RA2WpcgmUDf,http://zdravstvo.gov.mk/sq/shfuqizohet-ndalesa-per-levizje-kufizimi-i-orarit-te-punes-ne-ambientet-e-hotelierise-numri-i-te-ftuarve-ne-festime-dhe-ndalimi-i-koncerteve-dhe-ahengjeve/?cn-reloaded=1,CoronaNet (original),,2021-06-21,2021-06-21T02:09:11Z
R_28FFKHaf5UNi4GqAt,825663At,new_entry,,,"","North Macedonia will only allow bars and restaurants to serve in the open air, except for drinking services inside the casinos and slot machine spots, starting June 16, 2021.",2021-06-16,2021-06-16,,The policy’s end date is unknown or unreported,North Macedonia,MKD,MK,National,1,,,,Restriction and Regulation of Businesses,Bars,,"",,,,,,"","","","","","","","","","","",,Non-Essential Businesses,"This type of business  (""Bars"") is allowed to open with conditions",Other condition not specified above (please provide detail in the text entry),Yes,North Macedonia,"One or more countries, but not all countries",,,,,,All Residents (Citizen Residents + Foreign Residents),No special population targeted,,,Mandatory (Unspecified/Implied),"National Government,Ministry/Department of Health",,,,,https://tummgmt.eu.qualtrics.com/Q/File.php?F=F_Cay4RA2WpcgmUDf,http://zdravstvo.gov.mk/sq/shfuqizohet-ndalesa-per-levizje-kufizimi-i-orarit-te-punes-ne-ambientet-e-hotelierise-numri-i-te-ftuarve-ne-festime-dhe-ndalimi-i-koncerteve-dhe-ahengjeve/?cn-reloaded=1,CoronaNet (original),,2021-06-21,2021-06-21T02:09:11Z
R_28FFKHaf5UNi4GqDp,825663Dp,new_entry,,,"","North Macedonia will only allow bars and restaurants to serve in the open air, except for drinking services inside the casinos and slot machine spots, starting June 16, 2021.",2021-06-16,2021-06-16,,The policy’s end date is unknown or unreported,North Macedonia,MKD,MK,National,1,,,,Restriction and Regulation of Businesses,Other Businesses,,"",,,,,,"","","","","","","","","","","",,Non-Essential Businesses,"This type of business (""Other Businesses"") is allowed to open with no conditions attached","",Yes,North Macedonia,"One or more countries, but not all countries",,,,,,All Residents (Citizen Residents + Foreign Residents),No special population targeted,,,Mandatory (Unspecified/Implied),"National Government,Ministry/Department of Health",,,,,https://tummgmt.eu.qualtrics.com/Q/File.php?F=F_Cay4RA2WpcgmUDf,http://zdravstvo.gov.mk/sq/shfuqizohet-ndalesa-per-levizje-kufizimi-i-orarit-te-punes-ne-ambientet-e-hotelierise-numri-i-te-ftuarve-ne-festime-dhe-ndalimi-i-koncerteve-dhe-ahengjeve/?cn-reloaded=1,CoronaNet (original),,2021-06-21,2021-06-21T02:09:11Z
R_3DteHE9hLwWFbxuEj,3466122Ej,new_entry,,,"","The government of North Macedonia removed the obligation for hotels to keep records and register activities organized by them and later present them to the National Chamber of Hotels starting from June 16, 2021.",2021-06-16,2021-06-16,2021-06-18,The policy is a one-time measure (e.g. publication of guidelines),North Macedonia,MKD,MK,National,1,,,,Restriction and Regulation of Businesses,Paid lodgings (e.g. hotels; motels),,"",,,,,,"","","","","","","","","","","",,Non-Essential Businesses,"This type of business (""Paid lodgings (e.g. hotels; motels)"") is allowed to open with no conditions attached","",Yes,North Macedonia,"One or more countries, but not all countries",,,,,,All Residents (Citizen Residents + Foreign Residents),No special population targeted,,,Voluntary/Recommended but No Penalties,"National Government,Ministry/Department of Health",,,,,https://tummgmt.eu.qualtrics.com/Q/File.php?F=F_1hBc08FGvTMxvNh,http://zdravstvo.gov.mk/sq/shfuqizohet-ndalesa-per-levizje-kufizimi-i-orarit-te-punes-ne-ambientet-e-hotelierise-numri-i-te-ftuarve-ne-festime-dhe-ndalimi-i-koncerteve-dhe-ahengjeve/?cn-reloaded=1,CoronaNet (original),,2021-07-01,2021-07-01T14:41:47Z
R_1g5xn7IcJSC6dS1Ap,3998054,new_entry,,,"","Officials in North Macedonia announced on Wednesday, March 4, that gatherings of more than 500 people would be prohibited until further notice due to the ongoing coronavirus (COVID-19) outbreak.",2020-03-04,2020-03-04,2020-03-10,The policy has a clear end date,North Macedonia,MKD,MK,National,1,,,,Restrictions of Mass Gatherings,All/Unspecified mass gatherings restricted,,"",,,,,,"","","","","","","","","","","",,,,"",Yes,North Macedonia,"One or more countries, but not all countries",,,,,,All Residents (Citizen Residents + Foreign Residents),No special population targeted,,,Mandatory (Unspecified/Implied),National Government,17.374407702861,12.3588212878317,8.24339232262656,3,https://tummgmt.eu.qualtrics.com/Q/File.php?F=F_10o2a6iyVYrfOlH,https://www.garda.com/crisis24/news-alerts/319851/north-macedonia-officials-institute-new-measures-against-covid-19-march-4-update-1,CoronaNet (original),,2020-09-25,2020-09-25T01:57:44Z
R_21AihLVWjctIGofNA,8836719,new_entry,,,"","North Macedonia banned all concerts, performances, and movie showings on March 12th.",2020-03-12,2020-03-12,2020-03-24,The policy has a clear end date,North Macedonia,MKD,MK,National,1,,,,Restrictions of Mass Gatherings,,,"",,,,,,"","","","","","","","","","","",,,,"",,North Macedonia,,,,,,,All Residents (Citizen Residents + Foreign Residents),,,,Mandatory (Unspecified/Implied),Ministry/Department of Health,17.6464060325653,12.8667027688604,8.84262795014043,3,https://tummgmt.eu.qualtrics.com/Q/File.php?F=F_VJVGYc65OWRFjqh,https://vlada.mk/sites/default/files/dokumenti/17_vrsm_izvadok_od_zaklucoci_t-1_korona_.pdf,CoronaNet (original),,2020-04-02,2020-04-02T10:43:05Z
R_2Eb34nc1h0lz756Ap,5496630,new_entry,,,"","From Apr 7, groups larger than two people are prohibited in public places, excepting children under age 14 with their parents in North Macedonia.",2020-04-07,2020-04-07,,The policy’s end date is unknown or unreported,North Macedonia,MKD,MK,National,1,,,,Restrictions of Mass Gatherings,All/Unspecified mass gatherings restricted,,"",,,,,,"","","","","","","","","","","",,,,"",Yes,North Macedonia,"One or more countries, but not all countries",,,,,,All Residents (Citizen Residents + Foreign Residents),No special population targeted,,,Mandatory (Unspecified/Implied),National Government,23.1539880257486,16.4855799259108,11.3326418481375,3,https://tummgmt.eu.qualtrics.com/Q/File.php?F=F_1hFLu36zSXYjsab,https://pandemic.internationalsos.com/2019-ncov/ncov-travel-restrictions-flight-operations-and-screening#MYS,CoronaNet (original),,2021-04-30,2021-04-30T11:16:29Z
R_3fltHNMMtZibQ37Ee,7395714,new_entry,,,"",The Government of North Macedonia has prohibited visits to all cemeteries in the country from 9:00 pm June 4 to 5:00 am June 8 except for funerals.,2020-06-04,2020-06-04,2020-06-08,The policy has a clear end date,North Macedonia,MKD,MK,National,1,,,,Restrictions of Mass Gatherings,Other mass gatherings not specified above restricted,,"",,,,,,"","","","","","","","","","","",,,,"",Yes,North Macedonia,"One or more countries, but not all countries",,,,,,All Residents (Citizen Residents + Foreign Residents),No special population targeted,,,Mandatory (Unspecified/Implied),National Government,56.3134471706933,47.511497579147,37.8723598596459,9,https://tummgmt.eu.qualtrics.com/Q/File.php?F=F_6DsCotdDRMg1jPj,https://mk.usembassy.gov/u-s-citizen-services/covid-19-information/,CoronaNet (original),,2020-09-25,2020-09-25T02:07:00Z
R_2flDA6cJ83AM6BfAp,273837,new_entry,,,"",Gathering in public places is permitted while practicing social distancing and wearing protective masks.,2020-07-20,2020-07-20,,The policy’s end date is unknown or unreported,North Macedonia,MKD,MK,National,1,,,,Restrictions of Mass Gatherings,All/Unspecified mass gatherings restricted,,"",,,,,,"","","","","","","","","","","",,,,"",Yes,North Macedonia,"One or more countries, but not all countries",,,,,,All Residents (Citizen Residents + Foreign Residents),No special population targeted,,,Mandatory (Unspecified/Implied),National Government,60.5723092808552,51.5616339881098,42.0787754589898,37,https://tummgmt.eu.qualtrics.com/Q/File.php?F=F_UKPrxfVnClKslQB,https://www.osac.gov/Country/NorthMacedonia/Content/Detail/Report/4a920039-dba8-415b-b560-1936b6de3190,CoronaNet (original),,2021-06-04,2021-06-04T12:08:45Z
R_RyoSGsFPtAbJZoBAp,8062719,new_entry,,,"","North Macedonia will lift the ban on meetings for groups of over four people in public spaces starting June 1, 2021.",2021-05-31,2021-06-01,,The policy’s end date is unknown or unreported,North Macedonia,MKD,MK,National,1,,,,Restrictions of Mass Gatherings,All/Unspecified mass gatherings restricted,,"",,,,,,"","","","","","","","","","","",,,,"",Yes,North Macedonia,"One or more countries, but not all countries",,,,,,All Residents (Citizen Residents + Foreign Residents),No special population targeted,,,Mandatory (Unspecified/Implied),"National Government,Ministry/Department of Health",,,,,https://tummgmt.eu.qualtrics.com/Q/File.php?F=F_21oE6tjdjxEeIOe,http://zdravstvo.gov.mk/sq/shtabi-i-krizave-pranoi-rekomandimet-e-komisionit-per-semundjet-infektive-per-lehtesimin-e-masave-duke-filluar-nga-1-qershori/?cn-reloaded=1 ; https://vlada.mk/node/25452?fbclid=IwAR00VPP73RTmYXw2rBqcDtemSA_-ZtQ2eJyNlvFvEgz6vpy9KdxXW3E1tsM&ln=sq,CoronaNet (original),,2021-07-01,2021-07-01T20:28:42Z
R_T7wbcLfVgkBg1eVAp,1407830,new_entry,,,"","North Macedonia will allow open-air events and mass gatherings, with a maximum 50% capacity, for a maximum of 1000 people, starting June 16, 2021.",2021-06-16,2021-06-16,2023-04-18,The policy has an unlimited time span (e.g. recommendation to wash one's hands; passing of a legal bill),North Macedonia,MKD,MK,National,1,,,,Restrictions of Mass Gatherings,All/Unspecified mass gatherings restricted,,"",,,,,,"","","","","","","","","","","",,,,"",Yes,North Macedonia,"One or more countries, but not all countries",,,,,,All Residents (Citizen Residents + Foreign Residents),No special population targeted,,,Mandatory (Unspecified/Implied),"National Government,Ministry/Department of Health",,,,,https://tummgmt.eu.qualtrics.com/Q/File.php?F=F_4JCKKemDNohBWk9,http://zdravstvo.gov.mk/sq/shfuqizohet-ndalesa-per-levizje-kufizimi-i-orarit-te-punes-ne-ambientet-e-hotelierise-numri-i-te-ftuarve-ne-festime-dhe-ndalimi-i-koncerteve-dhe-ahengjeve/?cn-reloaded=1,CoronaNet (original),,2021-06-21,2021-06-21T01:40:45Z
R_Dvl462z3GtkMKvnHu,9407732,new_entry,,,"","North Macedonia will allow all weddings, events, open-air weddings, open-air events or similar activities at 50% capacity starting June 16, 2021.",2021-06-16,2021-06-16,2023-04-18,The policy has an unlimited time span (e.g. recommendation to wash one's hands; passing of a legal bill),North Macedonia,MKD,MK,National,1,,,,Restrictions of Mass Gatherings,Weddings and marriage rituals,,"",,,,,,"","","","","","","","","","","",,,,"",Yes,North Macedonia,"One or more countries, but not all countries",,,,,,All Residents (Citizen Residents + Foreign Residents),No special population targeted,,,Mandatory (Unspecified/Implied),"National Government,Ministry/Department of Health",,,,,https://tummgmt.eu.qualtrics.com/Q/File.php?F=F_3pnAhp4el9dl6yj,http://zdravstvo.gov.mk/sq/shfuqizohet-ndalesa-per-levizje-kufizimi-i-orarit-te-punes-ne-ambientet-e-hotelierise-numri-i-te-ftuarve-ne-festime-dhe-ndalimi-i-koncerteve-dhe-ahengjeve/?cn-reloaded=1,CoronaNet (original),,2021-06-21,2021-06-21T01:49:57Z
R_RKRwm1ZMJUTRrRDFt,8138749,new_entry,,,"","In North Macedonia, public transport will be suspended during the curfew from March 22.",2020-03-22,2020-03-22,2020-05-27,The policy has a clear end date,North Macedonia,MKD,MK,National,1,,,,Social Distancing,Restrictions on ridership of subways and trams,,"",,,,,,"","","","","","","","","","","",,,,"",Yes,North Macedonia,"One or more countries, but not all countries",,,,,,All Residents (Citizen Residents + Foreign Residents),No special population targeted,,,Mandatory (Unspecified/Implied),National Government,19.7284269620018,13.4291270297644,9.55240850987855,3,https://tummgmt.eu.qualtrics.com/Q/File.php?F=F_1gGYGsQTlgEd23l,https://pandemic.internationalsos.com/login?returnUrl=/2019-ncov/ncov-travel-restrictions-flight-operations-and-screening#MYS ; https://mk.usembassy.gov/u-s-citizen-services/covid-19-information/,CoronaNet (original),,2021-07-13,2021-07-13T14:57:40Z
R_RKRwm1ZMJUTRrRDFu,8138749,new_entry,,,"","In North Macedonia, public transport will be suspended during the curfew from March 22.",2020-03-22,2020-03-22,2020-05-27,The policy has a clear end date,North Macedonia,MKD,MK,National,1,,,,Social Distancing,Restrictions on ridership of trains,,"",,,,,,"","","","","","","","","","","",,,,"",Yes,North Macedonia,"One or more countries, but not all countries",,,,,,All Residents (Citizen Residents + Foreign Residents),No special population targeted,,,Mandatory (Unspecified/Implied),National Government,19.7284269620018,13.4291270297644,9.55240850987855,3,https://tummgmt.eu.qualtrics.com/Q/File.php?F=F_1gGYGsQTlgEd23l,https://pandemic.internationalsos.com/login?returnUrl=/2019-ncov/ncov-travel-restrictions-flight-operations-and-screening#MYS ; https://mk.usembassy.gov/u-s-citizen-services/covid-19-information/,CoronaNet (original),,2021-07-13,2021-07-13T14:57:40Z
R_RKRwm1ZMJUTRrRDFs,8138749,new_entry,,,"","In North Macedonia, public transport will be suspended during the curfew from March 22.",2020-03-22,2020-03-22,2020-05-27,The policy has a clear end date,North Macedonia,MKD,MK,National,1,,,,Social Distancing,Restrictions on ridership of buses,,"",,,,,,"","","","","","","","","","","",,,,"",Yes,North Macedonia,"One or more countries, but not all countries",,,,,,All Residents (Citizen Residents + Foreign Residents),No special population targeted,,,Mandatory (Unspecified/Implied),National Government,19.7284269620018,13.4291270297644,9.55240850987855,3,https://tummgmt.eu.qualtrics.com/Q/File.php?F=F_1gGYGsQTlgEd23l,https://pandemic.internationalsos.com/login?returnUrl=/2019-ncov/ncov-travel-restrictions-flight-operations-and-screening#MYS ; https://mk.usembassy.gov/u-s-citizen-services/covid-19-information/,CoronaNet (original),,2021-07-13,2021-07-13T14:57:40Z
R_RKRwm1ZMJUTRrRDGb,8138749,new_entry,,,"","In North Macedonia, public transport will be suspended during the curfew from March 22.",2020-03-22,2020-03-22,2020-05-27,The policy has a clear end date,North Macedonia,MKD,MK,National,1,,,,Social Distancing,Restrictions ridership of other forms of public transportation (please include details in the text entry),,"",,,,,,"","","","","","","","","","","",,,,"",Yes,North Macedonia,"One or more countries, but not all countries",,,,,,All Residents (Citizen Residents + Foreign Residents),No special population targeted,,,Mandatory (Unspecified/Implied),National Government,19.7284269620018,13.4291270297644,9.55240850987855,3,https://tummgmt.eu.qualtrics.com/Q/File.php?F=F_1gGYGsQTlgEd23l,https://pandemic.internationalsos.com/login?returnUrl=/2019-ncov/ncov-travel-restrictions-flight-operations-and-screening#MYS ; https://mk.usembassy.gov/u-s-citizen-services/covid-19-information/,CoronaNet (original),,2021-07-13,2021-07-13T14:57:40Z
R_3nOgEFMCkqKTZrIHm,59591,new_entry,,,"","In North Macedonia, Government introduces mandatory face mask measure for public spaces as of April 23.",2020-04-23,2020-04-23,,The policy’s end date is unknown or unreported,North Macedonia,MKD,MK,National,1,,,,Social Distancing,Wearing Masks in all public spaces/everywhere,,"",,,,,,"","","","","","","","","","","",,,,"",Yes,North Macedonia,"One or more countries, but not all countries",,,,,,All Residents (Citizen Residents + Foreign Residents),No special population targeted,,,Mandatory (Unspecified/Implied),National Government,31.2184318393534,23.7845780062922,17.065058652557,3,https://tummgmt.eu.qualtrics.com/Q/File.php?F=F_3iVbpFuQfzk7ARa,https://pandemic.internationalsos.com/login?returnUrl=/2019-ncov/ncov-travel-restrictions-flight-operations-and-screening#MYS,CoronaNet (original),,2021-06-04,2021-06-04T12:28:36Z
R_3jZMXwdNuHkCT1PHm,1814620,new_entry,,,"",North Macedonia is mandating that all residents wear masks when they are outside their homes and cannot maintain a 2 meter social distance.,2020-04-27,2020-04-27,,The policy’s end date is unknown or unreported,North Macedonia,MKD,MK,National,1,,,,Social Distancing,Wearing Masks in all public spaces/everywhere,,"",,,,,,"","","","","","","","","","","",,,,"",No,North Macedonia,"One or more countries, but not all countries",,,,,,Health-Related Supplies,No special population targeted,,,Mandatory with Fines,Police,35.4793860791071,26.976381022484,20.0167151979887,3,https://tummgmt.eu.qualtrics.com/Q/File.php?F=F_2v1aUQDa4azKiDL,https://meta.mk/en/starting-from-tuesday-citizens-in-macedonia-will-be-fined-for-failing-to-wear-protective-gear/,CoronaNet (original),,2021-04-30,2021-04-30T11:03:43Z
R_rco6lXEMScXPapzCq,1521126,new_entry,,,"","In North Macedonia, from May 1, 2020 until May 3, 2020, individuals must practice two-meter social distancing in public and wear a protective face covering in closed public spaces, including markets, shops, banks, post offices, health facilities, and public transport, as well as in open spaces where it is not possible to maintain a two-meter distance.",2020-04-29,2020-05-01,2020-05-03,The policy has a clear end date,North Macedonia,MKD,MK,National,1,,,,Social Distancing,Keeping a distance of at least 6 feet or 1.5 meters apart,,"",,,,,,"","","","","","","","","","","",,,,"",Yes,North Macedonia,"One or more countries, but not all countries",,,,,,All Residents (Citizen Residents + Foreign Residents),No special population targeted,,,Mandatory with Fines,National Government,41.2339802882289,30.7204433016217,23.4408300608661,3,https://tummgmt.eu.qualtrics.com/Q/File.php?F=F_1gI46CHLKDkChgW,https://www.osac.gov/Country/NorthMacedonia/Content/Detail/Report/32ac10b7-ea24-490d-a13c-188fdf2c38ef,CoronaNet (original),,2021-06-04,2021-06-04T11:58:40Z
R_rco6lXEMScXPapzHt,1521126,new_entry,,,"","In North Macedonia, from May 1, 2020 until May 3, 2020, individuals must practice two-meter social distancing in public and wear a protective face covering in closed public spaces, including markets, shops, banks, post offices, health facilities, and public transport, as well as in open spaces where it is not possible to maintain a two-meter distance.",2020-04-29,2020-05-01,2020-05-03,The policy has a clear end date,North Macedonia,MKD,MK,National,1,,,,Social Distancing,Wearing Masks inside Unspecified public facilities,,"",,,,,,"","","","","","","","","","","",,,,"",Yes,North Macedonia,"One or more countries, but not all countries",,,,,,All Residents (Citizen Residents + Foreign Residents),No special population targeted,,,Mandatory with Fines,National Government,41.2339802882289,30.7204433016217,23.4408300608661,3,https://tummgmt.eu.qualtrics.com/Q/File.php?F=F_1gI46CHLKDkChgW,https://www.osac.gov/Country/NorthMacedonia/Content/Detail/Report/32ac10b7-ea24-490d-a13c-188fdf2c38ef,CoronaNet (original),,2021-06-04,2021-06-04T11:58:40Z
R_rco6lXEMScXPapzHn,1521126,new_entry,,,"","In North Macedonia, from May 1, 2020 until May 3, 2020, individuals must practice two-meter social distancing in public and wear a protective face covering in closed public spaces, including markets, shops, banks, post offices, health facilities, and public transport, as well as in open spaces where it is not possible to maintain a two-meter distance.",2020-04-29,2020-05-01,2020-05-03,The policy has a clear end date,North Macedonia,MKD,MK,National,1,,,,Social Distancing,Wearing Masks inside All or unspecified businesses,,"",,,,,,"","","","","","","","","","","",,,,"",Yes,North Macedonia,"One or more countries, but not all countries",,,,,,All Residents (Citizen Residents + Foreign Residents),No special population targeted,,,Mandatory with Fines,National Government,41.2339802882289,30.7204433016217,23.4408300608661,3,https://tummgmt.eu.qualtrics.com/Q/File.php?F=F_1gI46CHLKDkChgW,https://www.osac.gov/Country/NorthMacedonia/Content/Detail/Report/32ac10b7-ea24-490d-a13c-188fdf2c38ef,CoronaNet (original),,2021-06-04,2021-06-04T11:58:40Z
R_rco6lXEMScXPapzHr,1521126,new_entry,,,"","In North Macedonia, from May 1, 2020 until May 3, 2020, individuals must practice two-meter social distancing in public and wear a protective face covering in closed public spaces, including markets, shops, banks, post offices, health facilities, and public transport, as well as in open spaces where it is not possible to maintain a two-meter distance.",2020-04-29,2020-05-01,2020-05-03,The policy has a clear end date,North Macedonia,MKD,MK,National,1,,,,Social Distancing,Wearing Masks inside Public transportation,,"",,,,,,"","","","","","","","","","","",,,,"",Yes,North Macedonia,"One or more countries, but not all countries",,,,,,All Residents (Citizen Residents + Foreign Residents),No special population targeted,,,Mandatory with Fines,National Government,41.2339802882289,30.7204433016217,23.4408300608661,3,https://tummgmt.eu.qualtrics.com/Q/File.php?F=F_1gI46CHLKDkChgW,https://www.osac.gov/Country/NorthMacedonia/Content/Detail/Report/32ac10b7-ea24-490d-a13c-188fdf2c38ef,CoronaNet (original),,2021-06-04,2021-06-04T11:58:40Z
R_rco6lXEMScXPapzEd,1521126,new_entry,,,"","In North Macedonia, from May 1, 2020 until May 3, 2020, individuals must practice two-meter social distancing in public and wear a protective face covering in closed public spaces, including markets, shops, banks, post offices, health facilities, and public transport, as well as in open spaces where it is not possible to maintain a two-meter distance.",2020-04-29,2020-05-01,2020-05-03,The policy has a clear end date,North Macedonia,MKD,MK,National,1,,,,Social Distancing,Other Mask Wearing Policy,,"",,,,,,"","","","","","","","","","","",,,,"",Yes,North Macedonia,"One or more countries, but not all countries",,,,,,All Residents (Citizen Residents + Foreign Residents),No special population targeted,,,Mandatory with Fines,National Government,41.2339802882289,30.7204433016217,23.4408300608661,3,https://tummgmt.eu.qualtrics.com/Q/File.php?F=F_1gI46CHLKDkChgW,https://www.osac.gov/Country/NorthMacedonia/Content/Detail/Report/32ac10b7-ea24-490d-a13c-188fdf2c38ef,CoronaNet (original),,2021-06-04,2021-06-04T11:58:40Z
