record_id,policy_id,entry_type,update_type,update_level,update_level_var,description,date_announced,date_start,date_end,date_end_spec,country,ISO_A3,ISO_A2,init_country_level,domestic_policy,province,ISO_L2,city,type,type_sub_cat,type_new_admin_coop,type_vac_cat,type_vac_mix,type_vac_reg,type_vac_purchase,type_vac_group,type_vac_group_rank,type_vac_who_pays,type_vac_dist_admin,type_vac_loc,type_vac_cost_num,type_vac_cost_scale,type_vac_cost_unit,type_vac_cost_gov_perc,type_vac_amt_num,type_vac_amt_scale,type_vac_amt_unit,type_vac_amt_gov_perc,type_text,institution_cat,institution_status,institution_conditions,target_init_same,target_country,target_geog_level,target_region,target_province,target_city,target_intl_org,target_other,target_who_what,target_who_gen,target_direction,travel_mechanism,compliance,enforcer,dist_index_high_est,dist_index_med_est,dist_index_low_est,dist_index_country_rank,pdf_link,link,collab,collab_id,date_updated,recorded_date
R_1LUMHChPSjPtwZ5Be,141874,new_entry,,,"","On April 7, New Zealand government announced the country will enter into transit arrangements with a range of countries to make it easier for each other’s citizens to get home.",2020-04-07,2020-04-07,,The policy’s end date is unknown or unreported,"Argentina,Austria,Belgium,Brazil,Bulgaria,Canada,China,Croatia,Czechia,Denmark,Ecuador,Finland,France,Germany,Italy,Japan,Malaysia,Mexico,Netherlands,North Macedonia,Norway,Philippines,Poland,Qatar,Singapore,Slovakia,Slovenia,South Korea,Spain,Sweden,Switzerland,United Kingdom,United States,Uruguay",,,National,1,,,,"New Task Force, Bureau or Administrative Configuration",Cooperation among different jurisdictional entities (e.g. treaties or agreements among countries or provinces),,"",,,,,,"","","","","","","","","","","",,,,"",No,"Argentina,Australia,Austria,Belgium,Brazil,Bulgaria,Canada,China,Croatia,Czechia,Denmark,Ecuador,Finland,France,Germany,Italy,Japan,Malaysia,Mexico,Netherlands,North Macedonia,Norway,Philippines,Poland,Qatar,Singapore,Slovakia,Slovenia,South Korea,Spain,Sweden,Switzerland,United Kingdom,United States,Uruguay","One or more countries, but not all countries",,,,,,All Residents (Citizen Residents + Foreign Residents),,,,Mandatory (Unspecified/Implied),National Government,,,,,https://tummgmt.eu.qualtrics.com/Q/File.php?F=F_1K88XO2d5rw6LMP,https://www.immigration.govt.nz/about-us/covid-19/coronavirus-update-inz-response,CoronaNet (original),,2022-07-11,2022-07-11T23:59:59Z
R_3nwoHMSdhwyBJyMNA,8846279,new_entry,,,"","March 9 - As an anti-disinformation measure, state of Johor police in Malaysia have opened six investigation papers in connection with false reports on the Covid-19 infection after police received six reports on the matter between January and March 7 this year. Four of the cases were being investigated under Sections 203 and 505 of the Penal Code and the other two under Section 233 of the Communications and Multimedia Act 1998 (CMA). Sections 203 and 505 of the Penal Code deal with giving false information and statements conducing to public mischief, while Section 233 of the CMA is regarding improper use of network facilities or network service.",2020-03-09,2020-03-09,,The policy’s end date is unknown or unreported,Malaysia,MYS,MY,Provincial,1,Johor,,,Anti-Disinformation Measures,,,"",,,,,,"","","","","","","","","","","",,,,"",Yes,Malaysia,One or more provinces within one or more countries,,Johor,,,,All Residents (Citizen Residents + Foreign Residents),No special population targeted,,,"Mandatory with Legal Penalties (Jail Time),Mandatory with Fines","Provincial/State Government,Police",42.2498480757111,38.8671684817672,35.4778694774576,102,https://tummgmt.eu.qualtrics.com/Q/File.php?F=F_2dzpo77GYeX67Vu,https://www.malaymail.com/news/malaysia/2020/03/09/johor-police-probing-six-cases-of-false-reports-on-covid-19/1844738 ; https://www.astroawani.com/berita-malaysia/polis-johor-siasat-enam-kes-berita-palsu-covid19-232997,CoronaNet (original),,2022-06-27,2022-06-27T23:59:59Z
R_2dtknSaTDKf03KzNA,8846279,update,End of Policy,,"","March 9 - As an anti-disinformation measure, state of Johor police in Malaysia have opened six investigation papers in connection with false reports on the Covid-19 infection after police received six reports on the matter between January and March 7 this year. Four of the cases were being investigated under Sections 203 and 505 of the Penal Code and the other two under Section 233 of the Communications and Multimedia Act 1998 (CMA). Sections 203 and 505 of the Penal Code deal with giving false information and statements conducing to public mischief, while Section 233 of the CMA is regarding improper use of network facilities or network service.

 UPDATE: Coding the end of date",2020-03-09,2020-03-09,2020-03-11,The policy is a one-time measure (e.g. publication of guidelines),Malaysia,MYS,MY,Provincial,1,Johor,,,Anti-Disinformation Measures,,,"",,,,,,"","","","","","","","","","","",,,,"",Yes,Malaysia,One or more provinces within one or more countries,,Johor,,,,All Residents (Citizen Residents + Foreign Residents),No special population targeted,,,"Mandatory with Legal Penalties (Jail Time),Mandatory with Fines","Provincial/State Government,Police",42.2498480757111,38.8671684817672,35.4778694774576,102,https://tummgmt.eu.qualtrics.com/Q/File.php?F=F_2dzpo77GYeX67Vu,https://www.malaymail.com/news/malaysia/2020/03/09/johor-police-probing-six-cases-of-false-reports-on-covid-19/1844738 ; https://www.astroawani.com/berita-malaysia/polis-johor-siasat-enam-kes-berita-palsu-covid19-232997,CoronaNet (original),,2021-06-05,2021-06-05T03:42:36Z
R_32UTkUIeNZ68snqNA,7728029,new_entry,,,"","On March 16, Malaysian State Government of Sarawak warns against spreading fake or unverified news on the social media/ social messenger platforms, referring to Section 233 of the Communications and Multimedia Act (CMA) 1998",2020-03-16,2020-03-16,2023-04-26,The policy has an unlimited time span (e.g. recommendation to wash one's hands; passing of a legal bill),Malaysia,MYS,MY,Provincial,1,Sarawak,,,Anti-Disinformation Measures,,,"",,,,,,"","","","","","","","","","","",,,,"",Yes,Malaysia,One or more provinces within one or more countries,,Sarawak,,,,All Residents (Citizen Residents + Foreign Residents),No special population targeted,,,"Mandatory with Legal Penalties (Jail Time),Mandatory with Fines","National Government,Provincial/State Government",51.0889502133912,47.9378013248841,45.1410876539258,78,https://tummgmt.eu.qualtrics.com/Q/File.php?F=F_3n2TirhvbuL4NUM,https://www.malaymail.com/news/malaysia/2020/03/16/covid-19-sarawak-imposes-14-day-stay-home-notice-on-travellers-school-holid/1847056,CoronaNet (original),,2021-02-21,2021-02-21T11:32:52Z
R_2THOiPaIeqQ0ZOmNA,4960503,new_entry,,,"",March 16 - The Malaysia Communications and Multimedia Commission (MCMC) has launched an official Telegram channel for the Sebenarnya.my news portal as part of a measure to curb the spread of fake news regarding Covid-19 on social media. Members of the public can join the Telegram channel through https://t.me/sebenarnyamy and receive the latest and most accurate information about Covid-19 verified by authorities such as the Ministry of Health.,2020-03-16,2020-03-16,,The policy’s end date is unknown or unreported,Malaysia,MYS,MY,National,1,,,,Anti-Disinformation Measures,,,"",,,,,,"","","","","","","","","","","",,,,"",Yes,Malaysia,"One or more countries, but not all countries",,,,,,All Residents (Citizen Residents + Foreign Residents),No special population targeted,,,Voluntary/Recommended but No Penalties,"National Government,Other (Please specify in the text box)",51.0889502133912,47.9378013248841,45.1410876539258,78,https://tummgmt.eu.qualtrics.com/Q/File.php?F=F_1hPRf7j7jjHrRxB,https://www.hmetro.com.my/mutakhir/2020/03/555244/covid-19-sertai-telegram-skmm-tangani-berita-palsu ; https://www.thestar.com.my/tech/tech-news/2020/03/16/covid-19-mcmc-launches-telegram-channel-for-anti-fake-news-portal-sebenarnyamy,CoronaNet (original),,2022-06-27,2022-06-27T23:59:59Z
R_eL0h0gTRMkabNuxNA,8177235,new_entry,,,"","March 23 - The Malaysian Communications and Multimedia Commission (MCMC), with the cooperation of the police, is investigating the cases of individuals alleged to have spread fake news about COVID-19. The commission said the investigations are being conducted under section 233 of the Communications and Multimedia Act 1988 which carries a maximum fine of RM50,000 or one year of imprisonment or both, upon conviction. To date, the MCMC has received 43 reports from members of the public, with 18 suspects identified. Six of them, including a celebrity, have been charged in court under Section 505 (b) of the Penal Code which carries a maximum jail term of two years or a fine or both, if found guilty.",2020-01-25,2020-03-18,,The policy’s end date is unknown or unreported,Malaysia,MYS,MY,National,1,,,,Anti-Disinformation Measures,,,"",,,,,,"","","","","","","","","","","",,,,"",Yes,Malaysia,"One or more countries, but not all countries",,,,,,All Residents (Citizen Residents + Foreign Residents),No special population targeted,,,"Mandatory with Legal Penalties (Jail Time),Mandatory with Fines","National Government,Police,Other (Please specify in the text box)",55.1607626783182,52.173188322986,48.8877727586685,84,https://tummgmt.eu.qualtrics.com/Q/File.php?F=F_1i9T6VoyzA7stvi,https://www.mcmc.gov.my/en/media/press-clippings/covid-19-fake-news-mcmc-police-investigating-five ; https://www.malaymail.com/news/malaysia/2020/03/22/communications-ministry-probes-42-cases-of-fake-news-on-covid-19-and-mco/1849028 ; https://www.malaymail.com/news/malaysia/2020/03/18/police-say-already-opened-40-cases-on-covid-19-fake-news-since-january-25/1847756,CoronaNet (original),,2022-06-27,2022-06-27T23:59:59Z
R_viqGXijPmp6ytnXNA,7220675,new_entry,,,"","Malaysian government's Quick Response Team (PRP) was set up on March 24 to counter fake news pertaining to the movement control order (MCO), Bantuan Prihatin Nasional (BPN), Welfare Department aid, and other hotly debated topics in the wake of the Covid-19 pandemic. The focus of PRP is to monitor and clarify suspicious news as well as announcements and to obtain clarification from those involved so as not to cause concern and apprehension among the public. PRP which comprised of department and agency officers under the Ministry of Communications and Multimedia in cooperation with the National Security Council (NSC) would continue to function throughout the MCO.",2020-04-21,2020-03-24,,The policy’s end date is unknown or unreported,Malaysia,MYS,MY,National,1,,,,Anti-Disinformation Measures,,,"",,,,,,"","","","","","","","","","","",,,,"",Yes,Malaysia,"One or more countries, but not all countries",,,,,,All Residents (Citizen Residents + Foreign Residents),No special population targeted,,,Voluntary/Recommended but No Penalties,"National Government,Other (Please specify in the text box)",60.3219173796904,57.3611820234563,54.7628429329994,57,https://tummgmt.eu.qualtrics.com/Q/File.php?F=F_22QYiQvg4nO8XTm,https://www.malaysiakini.com/news/521875 ; https://www.mcmc.gov.my/en/media/press-clippings/saifuddin-205-fake-news-items-%E2%80%98busted%E2%80%99-by-communic,CoronaNet (original),,2022-06-27,2022-06-27T23:59:59Z
R_2CUr0XLtxkOOpyCNA,9807429,new_entry,,,"","March 24 — Individuals who deliberately conceal important information about Covid-19 from hospital authorities, and thereby pose a risk to staff and medical facilities, are liable to be charged under Section 22 (d) of the Prevention and Control of Infectious Diseases Act 1988. The penalty comprises a fine or imprisonment of up to two years or both.Doctors, nurses and other hospital personnel who are the front liners, have a higher risk of contracting the infection, so they should report to the police if they encounter individuals concealing important information about their contact history with individuals infected with Covid-19.",2020-03-24,2020-03-24,,The policy’s end date is unknown or unreported,Malaysia,MYS,MY,National,1,,,,Anti-Disinformation Measures,,,"",,,,,,"","","","","","","","","","","",,,,"",Yes,Malaysia,"One or more countries, but not all countries",,,,,,All Residents (Citizen Residents + Foreign Residents),No special population targeted,,,"Mandatory with Legal Penalties (Jail Time),Mandatory with Fines","National Government,Police",60.3219173796904,57.3611820234563,54.7628429329994,57,https://tummgmt.eu.qualtrics.com/Q/File.php?F=F_50jQ5El8QZkX6U1,https://www.malaymail.com/news/malaysia/2020/03/24/malaysian-bar-those-who-withhold-information-from-hospitals-could-be-fined/1849661 ; https://www.hmetro.com.my/mutakhir/2020/03/557872/covid-19-denda-penjara-jika-sembunyi-maklumat,CoronaNet (original),,2022-06-27,2022-06-27T23:59:59Z
R_XBzZXzlQEbWHlKhEt,7987370Et,new_entry,,,"","On March 16, Malaysian State Government of Sarawak enforces that all schools (primary and secondary) extend their school holidays for another week until March 29",2020-03-16,2020-03-16,2020-03-29,The policy has a clear end date,Malaysia,MYS,MY,Provincial,1,Sarawak,,,Closure and Regulation of Schools,Primary Schools (generally for children ages 10 and below),,"",,,,,,"","","","","","","","","","","",,,Primary Schools closed/locked down,"",Yes,Malaysia,One or more provinces within one or more countries,,Sarawak,,,,All Residents (Citizen Residents + Foreign Residents),No special population targeted,,,Mandatory (Unspecified/Implied),Provincial/State Government,51.0889502133912,47.9378013248841,45.1410876539258,78,https://tummgmt.eu.qualtrics.com/Q/File.php?F=F_1BWySWLW8v96uyk,https://www.thestar.com.my/news/nation/2020/03/16/s039wak-to-impose-two-week-stay-at-home-order-from-wednesday-march-18-for-everyone-entering-the-state ; https://www.malaymail.com/news/malaysia/2020/03/16/covid-19-sarawak-imposes-14-day-stay-home-notice-on-travellers-school-holid/1847056,CoronaNet (original),,2021-02-21,2021-02-21T11:12:12Z
R_XBzZXzlQEbWHlKhGe,7987370Ge,new_entry,,,"","On March 16, Malaysian State Government of Sarawak enforces that all schools (primary and secondary) extend their school holidays for another week until March 29",2020-03-16,2020-03-16,2020-03-29,The policy has a clear end date,Malaysia,MYS,MY,Provincial,1,Sarawak,,,Closure and Regulation of Schools,Secondary Schools (generally for children ages 10 to 18),,"",,,,,,"","","","","","","","","","","",,,Secondary Schools closed/locked down,"",Yes,Malaysia,One or more provinces within one or more countries,,Sarawak,,,,All Residents (Citizen Residents + Foreign Residents),No special population targeted,,,Mandatory (Unspecified/Implied),Provincial/State Government,51.0889502133912,47.9378013248841,45.1410876539258,78,https://tummgmt.eu.qualtrics.com/Q/File.php?F=F_1BWySWLW8v96uyk,https://www.thestar.com.my/news/nation/2020/03/16/s039wak-to-impose-two-week-stay-at-home-order-from-wednesday-march-18-for-everyone-entering-the-state ; https://www.malaymail.com/news/malaysia/2020/03/16/covid-19-sarawak-imposes-14-day-stay-home-notice-on-travellers-school-holid/1847056,CoronaNet (original),,2021-02-21,2021-02-21T11:12:12Z
R_2Eh1ne6a8k8uaPNEs,3925224Es,new_entry,,,"","Beginning March 17, Malaysian State Government of Sarawak enforces all kindergartens, childcare centres and tahfiz schools in Sarawak to close for two weeks.",2020-03-16,2020-03-17,2020-03-31,The policy has a clear end date,Malaysia,MYS,MY,Provincial,1,Sarawak,,,Closure and Regulation of Schools,Preschool or childcare facilities (generally for children ages 5 and below),,"",,,,,,"","","","","","","","","","","",,,Preschool or childcare facilities closed/locked down,"",Yes,Malaysia,One or more provinces within one or more countries,,Sarawak,,,,All Residents (Citizen Residents + Foreign Residents),No special population targeted,,,Mandatory (Unspecified/Implied),Provincial/State Government,52.7739874946395,49.673889774491,46.7694554628749,79,https://tummgmt.eu.qualtrics.com/Q/File.php?F=F_3CHqVH7kBDzaLbS,https://www.thestar.com.my/news/nation/2020/03/16/s039wak-to-impose-two-week-stay-at-home-order-from-wednesday-march-18-for-everyone-entering-the-state ; https://www.malaymail.com/news/malaysia/2020/03/16/covid-19-sarawak-imposes-14-day-stay-home-notice-on-travellers-school-holid/1847056,CoronaNet (original),,2021-02-21,2021-02-21T10:49:00Z
R_DFSOK8TwRdvV8HvEs,995151Es,new_entry,,,"","Muhyiddin added that all nurseries, government and private schools, including boarding schools, international schools, tahfiz centres as well as primary, secondary and pre-university education institutions will be closed. This also includes all public and private universities as well as vocational training centres.

",2020-03-16,2020-03-18,2020-03-31,The policy has a clear end date,Malaysia,MYS,MY,National,1,,,,Closure and Regulation of Schools,Preschool or childcare facilities (generally for children ages 5 and below),,"",,,,,,"","","","","","","","","","","",,,Preschool or childcare facilities closed/locked down,"",Yes,Malaysia,"One or more countries, but not all countries",,,,,,All Residents (Citizen Residents + Foreign Residents),No special population targeted,,,Mandatory (Unspecified/Implied),National Government,55.1607626783182,52.173188322986,48.8877727586685,84,https://tummgmt.eu.qualtrics.com/Q/File.php?F=F_ywpMw3nDCYXReE1,https://www.thestar.com.my/news/nation/2020/03/16/malaysia-announces-restricted-movement-measure-after-spike-in-covid-19-cases?utm_source=outbreak.my,CoronaNet (original),,2020-09-23,2020-09-23T12:59:18Z
R_DFSOK8TwRdvV8HvEt,995151Et,new_entry,,,"","Muhyiddin added that all nurseries, government and private schools, including boarding schools, international schools, tahfiz centres as well as primary, secondary and pre-university education institutions will be closed. This also includes all public and private universities as well as vocational training centres.

",2020-03-16,2020-03-18,2020-03-31,The policy has a clear end date,Malaysia,MYS,MY,National,1,,,,Closure and Regulation of Schools,Primary Schools (generally for children ages 10 and below),,"",,,,,,"","","","","","","","","","","",,,Primary Schools closed/locked down,"",Yes,Malaysia,"One or more countries, but not all countries",,,,,,All Residents (Citizen Residents + Foreign Residents),No special population targeted,,,Mandatory (Unspecified/Implied),National Government,55.1607626783182,52.173188322986,48.8877727586685,84,https://tummgmt.eu.qualtrics.com/Q/File.php?F=F_ywpMw3nDCYXReE1,https://www.thestar.com.my/news/nation/2020/03/16/malaysia-announces-restricted-movement-measure-after-spike-in-covid-19-cases?utm_source=outbreak.my,CoronaNet (original),,2020-09-23,2020-09-23T12:59:18Z
R_DFSOK8TwRdvV8HvGe,995151Ge,new_entry,,,"","Muhyiddin added that all nurseries, government and private schools, including boarding schools, international schools, tahfiz centres as well as primary, secondary and pre-university education institutions will be closed. This also includes all public and private universities as well as vocational training centres.

",2020-03-16,2020-03-18,2020-03-31,The policy has a clear end date,Malaysia,MYS,MY,National,1,,,,Closure and Regulation of Schools,Secondary Schools (generally for children ages 10 to 18),,"",,,,,,"","","","","","","","","","","",,,Secondary Schools closed/locked down,"",Yes,Malaysia,"One or more countries, but not all countries",,,,,,All Residents (Citizen Residents + Foreign Residents),No special population targeted,,,Mandatory (Unspecified/Implied),National Government,55.1607626783182,52.173188322986,48.8877727586685,84,https://tummgmt.eu.qualtrics.com/Q/File.php?F=F_ywpMw3nDCYXReE1,https://www.thestar.com.my/news/nation/2020/03/16/malaysia-announces-restricted-movement-measure-after-spike-in-covid-19-cases?utm_source=outbreak.my,CoronaNet (original),,2020-09-23,2020-09-23T12:59:18Z
R_DFSOK8TwRdvV8HvCf,995151Cf,new_entry,,,"","Muhyiddin added that all nurseries, government and private schools, including boarding schools, international schools, tahfiz centres as well as primary, secondary and pre-university education institutions will be closed. This also includes all public and private universities as well as vocational training centres.

",2020-03-16,2020-03-18,2020-03-31,The policy has a clear end date,Malaysia,MYS,MY,National,1,,,,Closure and Regulation of Schools,Higher education institutions (i.e. degree granting institutions),,"",,,,,,"","","","","","","","","","","",,,Higher education institutions closed/locked down,"",Yes,Malaysia,"One or more countries, but not all countries",,,,,,All Residents (Citizen Residents + Foreign Residents),No special population targeted,,,Mandatory (Unspecified/Implied),National Government,55.1607626783182,52.173188322986,48.8877727586685,84,https://tummgmt.eu.qualtrics.com/Q/File.php?F=F_ywpMw3nDCYXReE1,https://www.thestar.com.my/news/nation/2020/03/16/malaysia-announces-restricted-movement-measure-after-spike-in-covid-19-cases?utm_source=outbreak.my,CoronaNet (original),,2020-09-23,2020-09-23T12:59:18Z
R_1odSRqwKcXtZbu5Cf,5235701Cf,new_entry,,,"","On March 16, Malaysian State Government of Sarawak enforces institutions of higher education, both government and private, to defer their new academic session by two weeks",2020-03-16,2021-03-16,,The policy’s end date is unknown or unreported,Malaysia,MYS,MY,Provincial,1,Sarawak,,,Closure and Regulation of Schools,Higher education institutions (i.e. degree granting institutions),,"",,,,,,"","","","","","","","","","","",,,Higher education institutions closed/locked down,"",Yes,Malaysia,One or more provinces within one or more countries,,Sarawak,,,,All Residents (Citizen Residents + Foreign Residents),No special population targeted,,,Mandatory (Unspecified/Implied),Provincial/State Government,,,,,https://tummgmt.eu.qualtrics.com/Q/File.php?F=F_Op734q4QfdadeEN,https://www.thestar.com.my/news/nation/2020/03/16/s039wak-to-impose-two-week-stay-at-home-order-from-wednesday-march-18-for-everyone-entering-the-state ; https://www.malaymail.com/news/malaysia/2020/03/16/covid-19-sarawak-imposes-14-day-stay-home-notice-on-travellers-school-holid/1847056,CoronaNet (original),,2021-02-21,2021-02-21T11:07:02Z
R_2V7lvTF6kxaI9dYFf,7819670,new_entry,,,"","Dec 22, 2020 - The Malaysian government has signed an agreement with pharmaceutical company AstraZeneca for the procurement of 6.4 million doses of the Covid-19 vaccine, Prime Minister Tan Sri Muhyiddin Yassin announced.",2020-12-22,2020-12-22,,The policy has an imprecise natural end date (e.g. masks will be distributed until they run out),Malaysia,MYS,MY,National,0,,,,COVID-19 Vaccines,Purchase of COVID-19 vaccines,,"Oxford University and AstraZeneca vaccine (AZD1222; also known as the Jenner Institute/University of Oxford vaccine, ChAdOx1)",,,Regular order of vaccines,,,"","","","",billion,rm,100,6.4,millions,doses,100,,,,"",Yes,Malaysia,"One or more countries, but not all countries",,,,,,,No special population targeted,,,Voluntary/Recommended but No Penalties,"National Government,Other (Please specify in the text box)",62.7539915326609,59.9350561856939,57.0475145195263,82,https://tummgmt.eu.qualtrics.com/Q/File.php?F=F_3kjhEHeGcg0iNha,https://www.straitstimes.com/asia/se-asia/malaysia-procures-64m-doses-of-astrazenecas-coronavirus-vaccine-pm-muhyiddin ; https://www.theborneopost.com/2020/12/22/malaysia-inks-agreement-with-astrazeneca-to-procure-6-4-mln-doses-of-covid-19-vaccine/ ; https://www.malaymail.com/news/malaysia/2020/12/22/pm-muhyiddin-malaysia-in-deal-for-6.4m-doses-of-covid-19-vaccine-from-astra/1934070 ; https://www.cnbc.com/2020/12/22/malaysia-procures-6point4-million-doses-astrazeneca-coronavirus-vaccine.html ; https://www.nst.com.my/news/government-public-policy/2020/12/651769/khairy-rm205-billion-purchase-covid-19-vaccines,CoronaNet (original),,2021-09-20,2021-09-20T20:05:35Z
R_2zU5WGBWMxBw017Ff,3380360,new_entry,,,"",Malaysian Government plan to obtains and vaccinates 12.8 million doses of Covid 19 Vaccine in January 2021.,2020-11-27,2021-01-01,,The policy’s end date is unknown or unreported,Malaysia,MYS,MY,National,0,,,,COVID-19 Vaccines,Purchase of COVID-19 vaccines,,Pfizer/BioNTech vaccine (BNT162b2 or Tozinameran),,,Preorder without option of expanding the order,,,"","","","","","",100,12.8,millions,doses,100,,,,"",No,All countries,All countries,,,,,,Citizen Residents,No special population targeted,,Not Applicable,Mandatory (Unspecified/Implied),National Government,62.7101581586118,59.9516307515469,57.5439474263783,83,https://tummgmt.eu.qualtrics.com/Q/File.php?F=F_1OwZzidkCZx5MfO,https://www.thestar.com.my/news/nation/2020/11/27/pm-covid-19-vaccines-for-64mil-malaysians-next-year,CoronaNet (original),,2021-07-27,2021-07-27T09:04:02Z
R_qQweWKcyKba9GKJAh,2819055,new_entry,,,"",Malaysian citizens and non Malaysian citizens started to receive astraZeneca vaccines on 5/5 2021,2021-05-03,2021-05-05,,The policy’s end date is unknown or unreported,Malaysia,MYS,MY,National,0,,,,COVID-19 Vaccines,Administering of the vaccine (i.e. giving people the vaccine shot),,"Oxford University and AstraZeneca vaccine (AZD1222; also known as the Jenner Institute/University of Oxford vaccine, ChAdOx1)",This distribution policy is not about mixing and matching of different vaccines.,,,Mass vaccinations (e.g. first-come first serve),,Vaccine is free for the individual,National government entity,Other vaccination location,"","","","","","","","",,,,"",No,All countries,All countries,,,,,,All Residents (Citizen Residents +Foreign Residents),No special population targeted,Inbound,Not Applicable,Voluntary/Recommended but No Penalties,"National Government,Ministry/Department of Health",,,,,https://tummgmt.eu.qualtrics.com/Q/File.php?F=F_31mVugyTrcRFm82,https://www.antaranews.com/berita/2139910/vaksinasi-astrazeneca-di-malaysia-dimulai,CoronaNet (original),,2021-07-21,2021-07-21T15:56:42Z
