record_id,policy_id,entry_type,correct_type,update_type,update_level,description,date_announced,date_start,date_end,country,ISO_A3,ISO_A2,init_country_level,domestic_policy,province,ISO_L2,city,type,type_sub_cat,type_text,institution_status,target_country,target_geog_level,target_region,target_province,target_city,target_other,target_who_what,target_direction,travel_mechanism,compliance,enforcer,dist_index_high_est,dist_index_med_est,dist_index_low_est,dist_index_country_rank,link,date_updated,recorded_date
R_2YbJhq7saQYJmneNA,7496677,update,original,Change of Policy,Strengthening,"Starting on March 9, 2020, Romania suspended all flights from and to Italy for 14 days. UPDATE: On April16, 2020, Romania announced that ""The measure of suspension of flights to Italy and from this country to Romania is extended for all airports in Romania, for a period of 14 days, starting with April 19, 2020.""",2020-04-16,2020-04-19,2020-05-02,Romania,ROU,RO,National,1,,,,External Border Restrictions,,,,Italy,"One or more countries, but not all countries",,,,,All Residents (Citizen Residents + Foreign Residents),Inbound/Outbound,Flights,Mandatory with Legal Penalties (Jail Time),National Government,80.7593690220316,77.9649421005705,74.5345518409374,125,NA ; https://stirioficiale.ro/hotarari/ordonanta-militara-nr-9-din-16-aprilie-2020,2021-03-01,2021-03-01T14:17:41Z
R_2fJ24sHZer1hPzZNA,7232167,update,original,Change of Policy,Strengthening,"On March 24, 2020, Romania announced that all flights to France and Germany and from France and Germany to Romania are suspended for all airports in Romania for a period of 14 days starting on March 25, 2020. UPDATE: On April 16, 2020, Romania announced that ""The measure of suspension of flights to France and Germany and from these countries to Romania, for all airports in Romania, is extended for a period of 14 days, starting with April 21, 2020.""",2020-04-16,2020-04-21,2020-05-04,Romania,ROU,RO,National,1,,,,External Border Restrictions,,,,"France,Germany","One or more countries, but not all countries",,,,,All Residents (Citizen Residents + Foreign Residents),Inbound/Outbound,Flights,Mandatory with Legal Penalties (Jail Time),"National Government,Military",80.7673903251314,78.1098586561699,74.9091205697264,124,NA ; https://stirioficiale.ro/hotarari/ordonanta-militara-nr-3-din-24-03-2020-privind-masuri-de-prevenire-a-raspandirii-covid-19 ; https://stirioficiale.ro/hotarari/ordonanta-militara-nr-9-din-16-aprilie-2020,2021-03-01,2021-03-01T14:23:23Z
R_VUnItgnx4klNge5NA,1589628,update,original,Change of Policy,Strengthening,"On March 17, 2020, Romania announced that ""All flights performed by economic operators to Spain and from Spain to Romania, for all airports in Romania, shall be suspended for a period of 14 days"" starting on March 18, 2020. UPDATE: On April 27, 2020, Romania announced that ""The measure of suspension of flights performed by economic operators to Spain and from Spain to Romania, for all airports in Romania, is extended for a period of 14 days, starting with April 28, 2020, until May 11, 2020.""",2020-04-27,2020-04-28,2020-05-11,Romania,ROU,RO,National,1,,,,External Border Restrictions,,,,Spain,"One or more countries, but not all countries",,,,,All Residents (Citizen Residents + Foreign Residents),Inbound/Outbound,All kinds of transport,Mandatory with Legal Penalties (Jail Time),"National Government,Ministry/Department of Health,Military,Police",80.7302545615228,77.9604590837287,74.8681600039685,125,NA ; https://stirioficiale.ro/hotarari/ordonanta-militara-nr-1-din-17-martie-2020 ; https://stirioficiale.ro/hotarari/ordonanta-militara-nr-10-din-27-04-2020,2021-03-01,2021-03-01T14:31:22Z
R_1lgbrI81IcdnaIdNA,3230679,update,original,Change of Policy,Strengthening,"Announced on April 4, 2020, Romania banned all flights to and from Austria, Belgium, the Swiss Confederation, the United States of America, the United Kingdom of Great Britain and Northern Ireland, the Kingdom of the Netherlands, Turkey and Iran for a period of 14 days starting on April 5, 2020. UPDATE: On April 27, 2020, Romania announced that ""The measure of suspension of flights to Austria, Belgium, the Swiss Confederation, the United States of America, the United Kingdom of Great Britain and Northern Ireland, the Kingdom of the Netherlands, Turkey and Iran and from these countries to Romania, for all airports from Romania, for a period of 13 days, starting with May 2, 2020, until May 14, 2020.""",2020-04-27,2020-05-02,2020-05-14,Romania,ROU,RO,National,1,,,,External Border Restrictions,,,,"Austria,Belgium,Iran,Netherlands,Switzerland,Turkey,United Kingdom,United States","One or more countries, but not all countries",,,,,All Residents (Citizen Residents + Foreign Residents),Inbound/Outbound,Flights,Mandatory with Legal Penalties (Jail Time),"National Government,Military,Police",80.3894167749023,77.4849567176081,74.8716076641069,124,NA ; https://stirioficiale.ro/hotarari/ordonanta-militara-nr-10-din-27-04-2020,2021-03-01,2021-03-01T14:37:53Z
R_1q9aAnN8rt7JUaCNA,7496677,update,original,Change of Policy,Strengthening,"Starting on March 9, 2020, Romania suspended all flights from and to Italy for 14 days. UPDATE: On April 27, 2020, Romania announced that ""The measure of suspension of flights to Italy and from this country to Romania is extended for all airports in Romania, for a period of 12 days, starting with May 3, 2020, until May 14, 2020.""",2020-04-27,2020-05-03,2020-05-14,Romania,ROU,RO,National,1,,,,External Border Restrictions,,,,Italy,"One or more countries, but not all countries",,,,,All Residents (Citizen Residents + Foreign Residents),Inbound/Outbound,Flights,Mandatory with Legal Penalties (Jail Time),National Government,80.5424793575999,77.4056343593647,74.4233552666636,122,NA ; https://stirioficiale.ro/hotarari/ordonanta-militara-nr-10-din-27-04-2020,2021-03-01,2021-03-01T14:47:03Z
R_3qlhWy9lvqV6rF1NA,7232167,update,original,Change of Policy,Strengthening,"On March 24, 2020, Romania announced that all flights to France and Germany and from France and Germany to Romania are suspended for all airports in Romania for a period of 14 days starting on March 25, 2020. UPDATE: On April 27, 2020, Romania announced that ""The measure of suspension of flights to France and Germany and from these countries to Romania, for all airports in Romania, is extended for a period of 10 days, starting with May 5, 2020, until May 14, 2020.""",2020-04-27,2020-05-05,2020-05-14,Romania,ROU,RO,National,1,,,,External Border Restrictions,,,,"France,Germany","One or more countries, but not all countries",,,,,All Residents (Citizen Residents + Foreign Residents),Inbound/Outbound,Flights,Mandatory with Legal Penalties (Jail Time),"National Government,Military",80.2014208482777,76.9099551039694,73.9664336005492,121,NA ; https://stirioficiale.ro/hotarari/ordonanta-militara-nr-3-din-24-03-2020-privind-masuri-de-prevenire-a-raspandirii-covid-19 ; https://stirioficiale.ro/hotarari/ordonanta-militara-nr-10-din-27-04-2020,2021-03-01,2021-03-01T14:50:54Z
R_2RPRMGMcMoqtSH3NA,1589628,update,original,Change of Policy,Strengthening,"On March 17, 2020, Romania announced that ""All flights performed by economic operators to Spain and from Spain to Romania, for all airports in Romania, shall be suspended for a period of 14 days""starting on March 18, 2020. UPDATE: On May 11, 2020, the Romanian Minister of Interior announced that ""The measure of suspension of flights performed by economic operators to Spain and from Spain to Romania is extended for all airports in Romania, starting with May 12, 2020, until May 14, 2020.""",2020-05-11,2020-05-12,2020-05-14,Romania,ROU,RO,National,1,,,,External Border Restrictions,,,,Spain,"One or more countries, but not all countries",,,,,All Residents (Citizen Residents + Foreign Residents),Inbound/Outbound,All kinds of transport,Mandatory with Legal Penalties (Jail Time),"National Government,Ministry/Department of Health,Military,Police",73.6453961783756,70.3677534508117,66.5387233933872,94,NA ; https://stirioficiale.ro/hotarari/ordonanta-militara-nr-1-din-17-martie-2020 ; https://stirioficiale.ro/hotarari/ordonanta-militara-nr-11-din-11-05-2020,2021-03-02,2021-03-02T14:22:57Z
R_30747Pa6TMbAfukFw,1550921,new_entry,correction,,,"On May 14, 2020, the Romanian government announced that ""The temporary closure, in whole or in part, of some state border crossing points is maintained"" at the Romanian-Hungarian border, the Romanian-Bulgarian border, the Romanian-Ukrainian border, and the Romanian-Moldovan border.",2020-05-14,2020-05-14,,Romania,ROU,RO,National,0,,,,External Border Restrictions,Total border crossing ban,,,"Bulgaria,Hungary,Moldova,Romania",One or more geographical or administrative units within one or more countries,,,Turnu (Arad county); Salonta (Bihor county); Săcuieni (Bihor County); Valea lui Mihai (Bihor county); Carei (Satu Mare County); Negru Vodă (Constanța County); Lipnița (Constanța county); Dobromir (Constanța County); Zimnicea (Teleorman county); Turnu Măgurele (Teleorman County); Bechet (Dolj County); Sighetu Marmației (Maramureș County); Isaccea (Tulcea County); Rădăuți-Prut (Botoșani county); Oancea (Galati county); Iron Gates II (Mehedinți County); Drobeta-Turnu Severin (Mehedinți County) ; Orșova (Mehedinți county); Moldova Nouă (Caraş-Severin County); Naidăș (Caraș-Severin County); Vălcani (Timiș County); Stamora-Moravița (Timiș County);  Lunga (Timiș County); Foeni (Timiș County); Jimbolia (Timiș County),,All Travelers (Citizen Travelers + Foreign Travelers ),Inbound/Outbound,Land Border,Mandatory with Exceptions (Please list exceptions in the text entry),"National Government,Police",71.3165385510766,68.0384422125424,63.9160782180488,80,https://stirioficiale.ro/hotarari/anexa-hotarare-nr-24-din-14-05-2020,2021-03-03,2021-03-03T15:21:41Z
R_YYdfFwfmNUy93yhNA,6170171,update,original,Change of Policy,Strengthening,"On April 4, 2020, Romania banned all road transportation for all routes performed by operators to Italy, Spain, France, Germany, Austria, Belgium,
Swiss Confederation, United Kingdom and Northern Ireland, the Netherlands and Turkey UPDATE: On May 14, 2020, Romania announced that ""International road transport of persons shall be suspended  for all journeys by transport operators to Italy, Spain, France, Germany, Austria, Belgium, the Swiss Confederation. , The United Kingdom of Great Britain and Northern Ireland, the Kingdom of the Netherlands and Turkey and from these countries to Romania, until 1 June 2020.""",2020-05-14,2020-05-14,2020-06-01,Romania,ROU,RO,National,1,,,,External Border Restrictions,,,,"Austria,Belgium,France,Germany,Italy,Netherlands,Spain,Switzerland,Turkey,United Kingdom","One or more countries, but not all countries",,,,,All Residents (Citizen Residents + Foreign Residents),Inbound/Outbound,"Land Border,Trains,Buses",Mandatory with Legal Penalties (Jail Time),"National Government,Ministry/Department of Health,Military,Municipal Government,Police",71.3165385510766,68.0384422125424,63.9160782180488,80,NA ; https://stirioficiale.ro/hotarari/anexa-hotarare-nr-24-din-14-05-2020,2021-03-02,2021-03-02T14:45:33Z
R_0kO7NvWoKuyzIRzFw,299583,new_entry,original,,,"On May 14, 2020, Romania announced ""The suspension of flights by aviation operators to Austria, Belgium, the Swiss Confederation, France, Germany, Italy, the United Kingdom of Great Britain and Northern Ireland, the Kingdom of the Netherlands, Spain, the United States of America, Turkey and Iran, and from these countries to Romania for all airports in Romania, for a period of 14 days, starting on 15.05.2020.""",2020-05-14,2020-05-15,2020-05-28,Romania,ROU,RO,National,0,,,,External Border Restrictions,Total border crossing ban,,,"Austria,Belgium,France,Germany,Iran,Italy,Netherlands,Spain,Switzerland,Turkey,United Kingdom,United States","One or more countries, but not all countries",,,,,All Travelers (Citizen Travelers + Foreign Travelers ),Inbound/Outbound,Flights,Mandatory with Exceptions (Please list exceptions in the text entry),National Government,70.8260547914728,66.7599212124355,63.0017682910202,76,https://stirioficiale.ro/hotarari/anexa-hotarare-nr-24-din-14-05-2020,2021-03-03,2021-03-03T14:04:13Z
R_OHJShyFlW3WivhDFw,1322644,update,original,Change of Policy,Strengthening,"On March 21, 2020, the Romanian Minister of the Interior announced an external border restriction as follows: ""it is prohibited the entry on the Romanian territory, through the state border crossing points, of foreign citizens and stateless persons"" starting on March 22, 2020. UPDATE: On May 14, 2020, the Romanian Minister of Interior reinforced that ""The entry on the territory of Romania, through the state border crossing points, of foreign citizens and stateless persons is prohibited.""",2020-05-14,2020-05-15,,Romania,ROU,RO,National,1,,,,External Border Restrictions,Total border crossing ban,,,All countries,All countries,,,,,All Residents (Citizen Residents + Foreign Residents),Inbound,Land Border,Mandatory with Exceptions (Please list exceptions in the text entry),"National Government,Police",70.8260547914728,66.7599212124355,63.0017682910202,76,NA ; https://stirioficiale.ro/hotarari/anexa-hotarare-nr-24-din-14-05-2020,2021-03-03,2021-03-03T14:12:21Z
R_RK3iCs7sUsvvCdXFw,7628073,new_entry,original,,,"On June 16, 2020, Romania announced the temporary closure, total or partial, of several state border crossing points at the Romanian-Hungarian border, Romanian-Bulgarian border, Romanian-Ukrainian border, Romanian-Serbian border, and Romanian-Moldovan border.",2020-06-16,2020-06-16,,Romania,ROU,RO,National,0,,,,External Border Restrictions,Total border crossing ban,,,"Bulgaria,Hungary,Moldova,Romania,Serbia,Ukraine",One or more geographical or administrative units within one or more countries,,,"Săcuieni (Bihor County); Carei (Satu Mare county);  Lipnița, (Constanța county); Dobromir (Constanța County); Bechet (Dolj County); Isaccea (Tulcea County); Rădăuți-Prut (Botoșani county); Oancea (Galati county); Drobeta-Turnu Severin (Mehedinți county); Orșova (Mehedinți county); Moldova Nouă (Caraş-Severin County); Naidăș (Caraș-Severin County); Vălcani (Timiș County); Stamora-Moravița (Timiș County); Lunga (Timiș County); Foeni (Timiș County)",,All (Travelers + Residents),Inbound/Outbound,Land Border,Mandatory with Exceptions (Please list exceptions in the text entry),"National Government,Provincial/State Government,Police",53.0164708688283,49.8909682097591,46.7192325111921,25,https://stirioficiale.ro/hotarari/hotarare-nr-476-din-16-iunie-2020,2021-03-05,2021-03-05T00:29:22Z
R_USDR8dxqDKh47PbFw,8266669,new_entry,correction,,,"On June 16, 2020, Romania announced the suspension of flights to and from Belgium, the Netherlands, the United Kingdom of Great Britain and Northern Ireland, and Spain.",2020-06-16,2020-06-16,,Romania,ROU,RO,National,0,,,,External Border Restrictions,Total border crossing ban,,,"Belgium,Netherlands,Spain,United Kingdom","One or more countries, but not all countries",,,,,All Travelers (Citizen Travelers + Foreign Travelers ),Inbound/Outbound,Flights,Mandatory with Exceptions (Please list exceptions in the text entry),National Government,53.0164708688283,49.8909682097591,46.7192325111921,25,https://stirioficiale.ro/hotarari/hotarare-nr-476-din-16-iunie-2020,2021-03-05,2021-03-05T12:29:43Z
R_2e5qQXS0SUZrwCjFw,1550921,update,original,End of Policy,,"On May 14, 2020, the Romanian government announced that ""The temporary closure, in whole or in part, of some state border crossing points is maintained"" at the Romanian-Hungarian border, the Romanian-Bulgarian border, the Romanian-Ukrainian border, and the Romanian-Moldovan border. UPDATE: The geographical target of the policy has changed on June 16, 2020.",2020-06-16,2020-06-16,2020-06-16,Romania,ROU,RO,National,1,,,,External Border Restrictions,Total border crossing ban,,,"Bulgaria,Hungary,Moldova,Romania",One or more geographical or administrative units within one or more countries,,,Turnu (Arad county); Salonta (Bihor county); Săcuieni (Bihor County); Valea lui Mihai (Bihor county); Carei (Satu Mare County); Negru Vodă (Constanța County); Lipnița (Constanța county); Dobromir (Constanța County); Zimnicea (Teleorman county); Turnu Măgurele (Teleorman County); Bechet (Dolj County); Sighetu Marmației (Maramureș County); Isaccea (Tulcea County); Rădăuți-Prut (Botoșani county); Oancea (Galati county); Iron Gates II (Mehedinți County); Drobeta-Turnu Severin (Mehedinți County) ; Orșova (Mehedinți county); Moldova Nouă (Caraş-Severin County); Naidăș (Caraș-Severin County); Vălcani (Timiș County); Stamora-Moravița (Timiș County);  Lunga (Timiș County); Foeni (Timiș County); Jimbolia (Timiș County),,All Residents (Citizen Residents + Foreign Residents),Inbound/Outbound,Land Border,Mandatory with Exceptions (Please list exceptions in the text entry),"National Government,Police",53.0164708688283,49.8909682097591,46.7192325111921,25,https://stirioficiale.ro/hotarari/anexa-hotarare-nr-24-din-14-05-2020,2021-03-05,2021-03-05T00:13:36Z
R_20ZFstGkh3bRYXWFw,1709425,update,correction,,,"On June 16, 2020, Romania announced the ""suspension of flights by aviation economic operators to France and Italy, and from these countries to Romania for all airports in Romania."" UPDATE: On June 22, 2020, Romania announced that the flight suspension to and from France and Italy has been lifted starting on June 23, 2020.",2020-06-22,2020-06-23,2020-06-23,Romania,ROU,RO,National,1,,,,External Border Restrictions,Total border crossing ban,,,"France,Italy","One or more countries, but not all countries",,,,,All Residents (Citizen Residents + Foreign Residents),Inbound/Outbound,Flights,Mandatory with Exceptions (Please list exceptions in the text entry),National Government,50.6439053241232,47.5314816963241,43.8947114346987,19,https://stirioficiale.ro/hotarari/hotarare-nr-476-din-16-iunie-2020,2021-03-05,2021-03-05T12:02:10Z
R_2rxD3uhIoGVuVfrFw,8266669,update,correction,,,"On June 16, 2020, Romania announced the suspension of flights to and from Belgium, the Netherlands, the United Kingdom of Great Britain and Northern Ireland, and Spain. UPDATE: On July 6, 2020, Romania announced that the suspension of flights to and from Belgium, the Netherlands, the United Kingdom of Great Britain and Northern Ireland, and Spain will be lifted on July 7, 2020.",2020-07-06,2020-07-07,2020-07-07,Romania,ROU,RO,National,0,,,,External Border Restrictions,Total border crossing ban,,,"Belgium,Netherlands,Spain,United Kingdom","One or more countries, but not all countries",,,,,All Residents (Citizen Residents + Foreign Residents),Inbound/Outbound,Flights,Mandatory with Exceptions (Please list exceptions in the text entry),National Government,52.2117920646356,48.8468530649436,45.1861802480912,24,https://stirioficiale.ro/hotarari/hotarare-nr-476-din-16-iunie-2020,2021-03-05,2021-03-05T12:32:34Z
R_21uIYGyxGFCxqTEFw,2009918,new_entry,original,,,"On August 16, 2020, Romania closed its border with Hungary, Bulgaria, Serbia, Ukraine, and Moldova.",2020-08-14,2020-08-16,,Romania,ROU,RO,National,0,,,,External Border Restrictions,Total border crossing ban,,,"Bulgaria,Hungary,Moldova,Romania,Serbia,Ukraine,Romania",One or more geographical or administrative units within one or more countries,,,Carei (Satu Mare county); Lipniţa (Constanţa County); Dobromir (Constanţa County); Bechet (Dolj County); Isaccea (Tulcea County); Rădăuţi-Prut (Botoşani County); Oancea (Galati county); Moldova Nouă (Caraş-Severin County); Naidăş (Caraş-Severin county); Vălcani (Timiş County); Stamora-Moraviţa (Timiş county); Lunga (Timiş County); Foeni (Timiş County),,All (Travelers + Residents),Inbound/Outbound,Land Border,Mandatory with Exceptions (Please list exceptions in the text entry),"National Government,Police",53.8785376546558,50.5830277199812,47.3394767134031,31,https://stirioficiale.ro/hotarari/hotarare-privind-prelungirea-starii-de-alerta-pe-teritoriul-romaniei,2021-03-18,2021-03-18T21:15:41Z
R_2qgF1rv5dkcRSkzFw,4272583,new_entry,original,,,"On August 14, 2020, Romania announced the temporary closure, total or partial, of the Romanian - Hungarian, Romanian -Bulgarian, Romanian - Ukranian, Romanian - Moldovan, and Romanian - Serbian borders starting on August 16, 2020.",2020-08-14,2020-08-16,,Romania,ROU,RO,National,0,,,,External Border Restrictions,Total border crossing ban,,,"Bulgaria,Hungary,Moldova,Romania,Serbia,Ukraine",One or more countries and one or more regional groupings,,,,,All (Travelers + Residents),Inbound/Outbound,Land Border,Mandatory with Exceptions (Please list exceptions in the text entry),"National Government,Police",53.8785376546558,50.5830277199812,47.3394767134031,31,https://stirioficiale.ro/hotarari/hotarare-privind-prelungirea-starii-de-alerta-pe-teritoriul-romaniei,2021-03-25,2021-03-25T21:02:27Z
R_2sYkndZzYAjh0TNFw,7628073,update,original,End of Policy,,"On June 16, 2020, Romania announced the temporary closure, total or partial, of several state border crossing points at the Romanian-Hungarian border, Romanian-Bulgarian border, Romanian-Ukrainian border, Romanian-Serbian border, and Romanian-Moldovan border. UPDATE: The geographical target of the policy has changed starting August 16, 2020.",2020-08-14,2020-08-16,2020-08-16,Romania,ROU,RO,National,1,,,,External Border Restrictions,Total border crossing ban,,,"Bulgaria,Hungary,Moldova,Romania,Serbia,Ukraine",One or more geographical or administrative units within one or more countries,,,"Săcuieni (Bihor County); Carei (Satu Mare county);  Lipnița, (Constanța county); Dobromir (Constanța County); Bechet (Dolj County); Isaccea (Tulcea County); Rădăuți-Prut (Botoșani county); Oancea (Galati county); Drobeta-Turnu Severin (Mehedinți county); Orșova (Mehedinți county); Moldova Nouă (Caraş-Severin County); Naidăș (Caraș-Severin County); Vălcani (Timiș County); Stamora-Moravița (Timiș County); Lunga (Timiș County); Foeni (Timiș County)",,All Residents (Citizen Residents + Foreign Residents),Inbound/Outbound,Land Border,Mandatory with Exceptions (Please list exceptions in the text entry),"National Government,Provincial/State Government,Police",53.8785376546558,50.5830277199812,47.3394767134031,31,NA ; https://stirioficiale.ro/hotarari/hotarare-privind-prelungirea-starii-de-alerta-pe-teritoriul-romaniei,2021-03-18,2021-03-18T20:40:11Z
R_1l5BwlKE2RIkMmrFw,1322644,new_entry,original,,,"On March 21, 2020, the Romanian Minister of the Interior announced an external border restriction as follows: ""it is prohibited the entry on the Romanian territory, through the state border crossing points, of foreign citizens and stateless persons"" starting on March 22, 2020.",2020-03-21,2021-02-22,,Romania,ROU,RO,National,0,,,,External Border Restrictions,Total border crossing ban,,,All countries,All countries,,,,,Foreign Travelers,Inbound,Land Border,Mandatory with Exceptions (Please list exceptions in the text entry),"National Government,Police",,,,,https://stirioficiale.ro/hotarari/ordonanta-militara-nr-2-din-21-03-2020-privind-masuri-de-prevenire-a-raspandirii-covid-19,2021-02-19,2021-02-19T14:05:56Z
R_3UcJmWngvgO1iORNA,8873655,new_entry,original,,,Romania began monitoring all passengers arriving from China on January 27th.,2020-01-27,2020-01-27,,Romania,ROU,RO,National,0,,,,Health Monitoring,,,,China,"One or more countries, but not all countries",,,,,All Travelers (Citizen Travelers + Foreign Travelers ),Inbound,All kinds of transport,Mandatory with Legal Penalties (Jail Time),National Government,18.9675774857417,13.9249822208508,9.35728101412315,89,https://www.rri.ro/en_gb/romanian_authorities_on_alert_for_coronavirus-2610924,2020-04-01,2020-04-01T21:40:09Z
