record_id,policy_id,entry_type,correct_type,update_type,update_level,description,date_announced,date_start,date_end,country,ISO_A3,ISO_A2,init_country_level,domestic_policy,province,ISO_L2,city,type,type_sub_cat,type_text,institution_status,target_country,target_geog_level,target_region,target_province,target_city,target_other,target_who_what,target_direction,travel_mechanism,compliance,enforcer,dist_index_high_est,dist_index_med_est,dist_index_low_est,dist_index_country_rank,link,date_updated,recorded_date,confirmed_cases,deaths,recovered,new_tests,total_tests,total_tests_per_thousand,tests_units,total_vaccinations,daily_vaccinations,total_vaccinations_per_hundred,daily_vaccinations_per_million,Rank_FP,Score_FP,state_IDC,muni_IDC,dispersive_IDC,constraining_IDC,inclusive_IDC,sfi_SFI,ti_cpi_TI,pop_WDI_PW,gdp_WDI_PW,gdppc_WDI_PW,growth_WDI_PW,lnpop_WDI_PW,lngdp_WDI_PW,lngdppc_WDI_PW,disap_FA,polpris_FA,latentmean_FA,transparencyindex_HR,EmigrantStock_EMS,v2x_polyarchy_VDEM
R_1GDm1FtDh7wBUmyDy,2981323Dy,new_entry,original,,,Mozambique Government announces the closing of schools.,2020-03-20,2020-03-23,2020-04-21,Mozambique,MOZ,MZ,National,1,,,,Closure and Regulation of Schools,Preschool or childcare facilities (generally for children ages 5 and below),,Preschool or childcare facilities closed/locked down,Mozambique,,,,,,All Residents (Citizen Residents + Foreign Residents),,,Mandatory with Legal Penalties (Jail Time),National Government,,,,,https://clubofmozambique.com/news/coronavirus-mozambique-closes-schools-suspends-visa-issuance-president-155819/,2020-04-02,2020-04-02T01:33:02Z,1,0,0,,,,,,,,,93,3105,1,1,-0.43567043,,-0.20141026,11,27,27977863,14309762881,511.467329,6.609723214,17.1469241,23.3842078,6.23728371,2,2,0.050589167,1.190615723,797355,0.48019858
R_1GDm1FtDh7wBUmyEa,2981323Ea,new_entry,original,,,Mozambique Government announces the closing of schools.,2020-03-20,2020-03-23,2020-04-21,Mozambique,MOZ,MZ,National,1,,,,Closure and Regulation of Schools,Primary Schools (generally for children ages 10 and below),,Primary Schools closed/locked down,Mozambique,,,,,,All Residents (Citizen Residents + Foreign Residents),,,Mandatory with Legal Penalties (Jail Time),National Government,,,,,https://clubofmozambique.com/news/coronavirus-mozambique-closes-schools-suspends-visa-issuance-president-155819/,2020-04-02,2020-04-02T01:33:02Z,1,0,0,,,,,,,,,93,3105,1,1,-0.43567043,,-0.20141026,11,27,27977863,14309762881,511.467329,6.609723214,17.1469241,23.3842078,6.23728371,2,2,0.050589167,1.190615723,797355,0.48019858
R_1GDm1FtDh7wBUmyFj,2981323Fj,new_entry,original,,,Mozambique Government announces the closing of schools.,2020-03-20,2020-03-23,2020-04-21,Mozambique,MOZ,MZ,National,1,,,,Closure and Regulation of Schools,Secondary Schools (generally for children ages 10 to 18),,Secondary Schools closed/locked down,Mozambique,,,,,,All Residents (Citizen Residents + Foreign Residents),,,Mandatory with Legal Penalties (Jail Time),National Government,,,,,https://clubofmozambique.com/news/coronavirus-mozambique-closes-schools-suspends-visa-issuance-president-155819/,2020-04-02,2020-04-02T01:33:02Z,1,0,0,,,,,,,,,93,3105,1,1,-0.43567043,,-0.20141026,11,27,27977863,14309762881,511.467329,6.609723214,17.1469241,23.3842078,6.23728371,2,2,0.050589167,1.190615723,797355,0.48019858
R_1GDm1FtDh7wBUmyCe,2981323Ce,new_entry,original,,,Mozambique Government announces the closing of schools.,2020-03-20,2020-03-23,2020-04-21,Mozambique,MOZ,MZ,National,1,,,,Closure and Regulation of Schools,Higher education institutions (i.e. degree granting institutions),,Higher education institutions closed/locked down,Mozambique,,,,,,All Residents (Citizen Residents + Foreign Residents),,,Mandatory with Legal Penalties (Jail Time),National Government,,,,,https://clubofmozambique.com/news/coronavirus-mozambique-closes-schools-suspends-visa-issuance-president-155819/,2020-04-02,2020-04-02T01:33:02Z,1,0,0,,,,,,,,,93,3105,1,1,-0.43567043,,-0.20141026,11,27,27977863,14309762881,511.467329,6.609723214,17.1469241,23.3842078,6.23728371,2,2,0.050589167,1.190615723,797355,0.48019858
R_3fTV0704biLayuhNA,7325916,new_entry,original,,,"The President of Mozambique declares State of Emergency for 30 days, counting from the 1st of April.",2020-03-30,2020-04-01,2020-04-30,Mozambique,MOZ,MZ,National,1,,,,Declaration of Emergency,,,,Mozambique,,,,,,All Residents (Citizen Residents + Foreign Residents),,,Mandatory with Legal Penalties (Jail Time),National Government,,,,,https://clubofmozambique.com/news/mozambique-nyusi-declares-state-of-emergency-156530/ ; https://www.voaportugues.com/a/covid-19-parlamento-mo%C3%A7ambicano-ratifica-estado-de-emerg%C3%AAncia/5354192.html,2020-04-04,2020-04-04T00:37:29Z,10,0,0,19,288,0.009,,,,,,93,3105,1,1,-0.43567043,,-0.20141026,11,27,27977863,14309762881,511.467329,6.609723214,17.1469241,23.3842078,6.23728371,2,2,0.050589167,1.190615723,797355,0.48019858
R_1FswwcKkwoOeJ2WNA,7524446,new_entry,original,,,Mozambique is extending state of emergency for another 30 days for the second time starting on June 1.,2020-05-28,2020-06-01,2020-06-29,Mozambique,MOZ,MZ,National,1,,,,Declaration of Emergency,,,,Mozambique,,,,,,All Residents (Citizen Residents + Foreign Residents),,,Mandatory (Unspecified/Implied),Police,,,,,http://www.xinhuanet.com/english/2020-05/29/c_139096955.htm ; https://www.macaubusiness.com/mozambique-president-extends-state-of-emergency-for-another-30-days/,2020-05-29,2020-05-29T23:29:08Z,254,2,97,92,10970,0.351,,,,,,93,3105,1,1,-0.43567043,,-0.20141026,11,27,27977863,14309762881,511.467329,6.609723214,17.1469241,23.3842078,6.23728371,2,2,0.050589167,1.190615723,797355,0.48019858
R_1hyjwRnHoGDpfK8Gi,824686,new_entry,correction,,,Mozambique suspends new visas for Chinese nationals as of January 28.,2020-01-28,2020-01-28,,Mozambique,MOZ,MZ,National,1,,,,External Border Restrictions,Visa restrictions (e.g. suspend issuance of visa),,,China,"One or more countries, but not all countries",,,,,All Residents (Citizen Residents + Foreign Residents),Inbound,,Mandatory with Legal Penalties (Jail Time),National Government,,,,,https://www.thinkglobalhealth.org/article/travel-restrictions-china-due-covid-19 ; http://apanews.net/en/news/mozambique-suspends-new-visas-for-chinese-nationals-over-coronavirus-fears,2020-05-12,2020-05-12T23:08:29Z,0,0,0,,,,,,,,,93,3105,1,1,-0.43567043,,-0.20141026,11,27,27977863,14309762881,511.467329,6.609723214,17.1469241,23.3842078,6.23728371,2,2,0.050589167,1.190615723,797355,0.48019858
R_12hHNzryJge1AwGNA,3018096,new_entry,original,,,"Mozambique announces mandatory home quarantine for travellers arriving from countries with more than 1000 confirmed cases of COVID-19 (China, Italy, South Korea, Iran, Germany and France)",2020-03-12,2020-03-12,,Mozambique,MOZ,MZ,National,0,,,,External Border Restrictions,,,,"China,France,Germany,Iran,Italy,South Korea","One or more countries, but not all countries",,,,,All (Travelers + Residents),Inbound,All kinds of transport,Mandatory (Unspecified/Implied),National Government,,,,,https://www.voaportugues.com/a/governo-de-mo%C3%A7ambique-colocar%C3%A1-em-quarentena-pessoas-provenientes-de-seis-pa%C3%ADses/5325818.html ; http://www.rfi.fr/pt/mo%C3%A7ambique/20200312-mo%C3%A7ambique-medidas-de-preven%C3%A7%C3%A3o-contra-o-covid-19,2020-04-04,2020-04-04T04:00:35Z,0,0,0,,,,,,,,,93,3105,1,1,-0.43567043,,-0.20141026,11,27,27977863,14309762881,511.467329,6.609723214,17.1469241,23.3842078,6.23728371,2,2,0.050589167,1.190615723,797355,0.48019858
R_r3HjwQGNxfwDDWxGi,824686,update,original,,,"Mozambique bans the issuing of entry visas, and cancel visas that have already been issued, measure takes place for 30 days as from March 23 UPDATE: The previous visa restrictions applied only on Chinese nationals, now apply for any new entry visas and cancels the ones already issued.",2020-03-20,2020-03-23,2020-04-21,Mozambique,MOZ,MZ,National,0,,,,External Border Restrictions,Visa restrictions (e.g. suspend issuance of visa),,,All countries,All countries,,,,,All Foreign Nationals (Foreign Residents + Foreign Travelers),Inbound,,Mandatory with Legal Penalties (Jail Time),National Government,,,,,https://clubofmozambique.com/news/coronavirus-mozambique-closes-schools-suspends-visa-issuance-president-155819/,2020-04-03,2020-04-03T22:23:10Z,1,0,0,,,,,,,,,93,3105,1,1,-0.43567043,,-0.20141026,11,27,27977863,14309762881,511.467329,6.609723214,17.1469241,23.3842078,6.23728371,2,2,0.050589167,1.190615723,797355,0.48019858
R_1q8kndzjkxVedX3NA,2356836,new_entry,original,,,Mozambique extends lockdown for another 30 days.,2020-04-30,2020-05-01,2020-05-30,Mozambique,MOZ,MZ,National,1,,,,Lockdown,,,,Mozambique,"One or more countries, but not all countries",,,,,All Residents (Citizen Residents + Foreign Residents),,,Mandatory (Unspecified/Implied),National Government,,,,,https://www.aa.com.tr/en/africa/mozambique-extends-lockdown-for-another-30-days/1824358,2020-06-08,2020-06-08T21:59:43Z,79,0,12,170,2246,0.072,,,,,,93,3105,1,1,-0.43567043,,-0.20141026,11,27,27977863,14309762881,511.467329,6.609723214,17.1469241,23.3842078,6.23728371,2,2,0.050589167,1.190615723,797355,0.48019858
R_3hayUebc4VWFGaJNA,256773,new_entry,original,,,"Mozambique extends state of emergency for 3rd time, for another 30 days, with some restrictions relaxed, starting from June 30.",2020-06-29,2020-06-30,2020-07-30,Mozambique,MOZ,MZ,National,1,,,,Lockdown,,,,Mozambique,"One or more countries, but not all countries",,,,,All Residents (Citizen Residents + Foreign Residents),,,Mandatory (Unspecified/Implied),National Government,,,,,http://www.xinhuanet.com/english/2020-06/29/c_139174465.htm,2020-07-01,2020-07-01T00:22:50Z,889,6,232,173,29577,0.946,,,,,,93,3105,1,1,-0.43567043,,-0.20141026,11,27,27977863,14309762881,511.467329,6.609723214,17.1469241,23.3842078,6.23728371,2,2,0.050589167,1.190615723,797355,0.48019858
R_3pm7lTXQSpWMeDSFk,3018096,update,original,,,"Mozambique announces that from March 23 on all travellers, Mozambicans or foreigners, entering the country must go into quarantine for 14 days.. UPDATE: The mandatory home quarantine was previously applied only for citizens, Mozambicans or foreigners,  arriving  from designated countries but it  now applies to any traveller entering the country.",2020-03-20,2020-03-23,2020-04-21,Mozambique,MOZ,MZ,National,0,,,,Quarantine,Self-Quarantine (i.e. quarantine at home),,,All countries,All countries,,,,,All (Travelers + Residents),Inbound,All kinds of transport,Mandatory (Unspecified/Implied),National Government,,,,,https://clubofmozambique.com/news/coronavirus-mozambique-closes-schools-suspends-visa-issuance-president-155819/,2020-04-04,2020-04-04T05:03:59Z,1,0,0,,,,,,,,,93,3105,1,1,-0.43567043,,-0.20141026,11,27,27977863,14309762881,511.467329,6.609723214,17.1469241,23.3842078,6.23728371,2,2,0.050589167,1.190615723,797355,0.48019858
R_Q61yJaAvXEBYI8xFk,3018096,update,original,,,"Mozambique imposes a mandatory two-week quarantine as of April 1 to everyone who has recently been to another country or has had contact to someone who tested positive for the virus. UPDATE: The two-week mandatory quarantine now applies to everyone who has recently travelled outside the country or has had contact to someone who tested positive for the COVID-19, and not only to incoming passengers.",2020-03-31,2020-04-01,2020-04-30,Mozambique,MOZ,MZ,National,0,,,,Quarantine,Self-Quarantine (i.e. quarantine at home),,,All countries,All countries,,,,,All (Travelers + Residents),Inbound,All kinds of transport,Mandatory (Unspecified/Implied),National Government,,,,,https://www.dw.com/pt-002/covid-19-mo%C3%A7ambique-entra-em-estado-de-emerg%C3%AAncia/a-52977310,2020-04-04,2020-04-04T05:21:16Z,10,0,0,19,288,0.009,,,,,,93,3105,1,1,-0.43567043,,-0.20141026,11,27,27977863,14309762881,511.467329,6.609723214,17.1469241,23.3842078,6.23728371,2,2,0.050589167,1.190615723,797355,0.48019858
R_2e99n1lu2g336F4NA,7494478,update,original,,,"Mozambique bans public or private gatherings of more than 50 people (except those of national interest, such as parliament sessions). UPDATE: The allowed number of people in gatherings has been reduced from 300 to 50 people.",2020-03-20,2020-03-23,2020-04-21,Mozambique,MOZ,MZ,National,1,,,,Restrictions of Mass Gatherings,,,,Mozambique,,,,,,All Residents (Citizen Residents + Foreign Residents),,,Mandatory (Unspecified/Implied),National Government,,,,,https://clubofmozambique.com/news/coronavirus-mozambique-closes-schools-suspends-visa-issuance-president-155819/,2020-04-03,2020-04-03T03:47:33Z,1,0,0,,,,,,,,,93,3105,1,1,-0.43567043,,-0.20141026,11,27,27977863,14309762881,511.467329,6.609723214,17.1469241,23.3842078,6.23728371,2,2,0.050589167,1.190615723,797355,0.48019858
R_5cdvhSh0L8CP1RfNA,7494478,update,original,,,"Mozambique prohibits all kinds of events, public or private, including religious services, for 30 days from April 1st. UPDATE: All events, public or private, are suspended until April 30",2020-03-31,2020-04-01,2020-04-30,Mozambique,MOZ,MZ,National,1,,,,Restrictions of Mass Gatherings,,,,Mozambique,,,,,,All Residents (Citizen Residents + Foreign Residents),,,Mandatory with Legal Penalties (Jail Time),National Government,,,,,https://www.dw.com/pt-002/covid-19-mo%C3%A7ambique-entra-em-estado-de-emerg%C3%AAncia/a-52977310,2020-04-04,2020-04-04T01:24:30Z,10,0,0,19,288,0.009,,,,,,93,3105,1,1,-0.43567043,,-0.20141026,11,27,27977863,14309762881,511.467329,6.609723214,17.1469241,23.3842078,6.23728371,2,2,0.050589167,1.190615723,797355,0.48019858
R_1roYjvg5Zue6w2MNA,7494478,new_entry,original,,,Mozambique bans public and private events with more than 300 people.,2020-03-14,2020-04-14,,Mozambique,MOZ,MZ,National,1,,,,Restrictions of Mass Gatherings,,,,Mozambique,,,,,,All Residents (Citizen Residents + Foreign Residents),,,Mandatory (Unspecified/Implied),National Government,,,,,https://www.voaportugues.com/a/mo%C3%A7ambique-coloca-em-quarentena-obrigat%C3%B3ria-a-todos-os-provenientes-de-pa%C3%ADses-com-transmiss%C3%A3o-activa-de-coronav%C3%ADrus/5329073.html,2020-04-03,2020-04-03T02:04:51Z,28,0,2,79,762,0.024,,,,,,93,3105,1,1,-0.43567043,,-0.20141026,11,27,27977863,14309762881,511.467329,6.609723214,17.1469241,23.3842078,6.23728371,2,2,0.050589167,1.190615723,797355,0.48019858
